index,url,valid,domain,title,description,image,published,archive,content,quote,language,keyword
https://orf.at/stories/3341484/,https://orf.at/stories/3341484/,0,orf.at,Branche fordert Besserungen für Windenergie,,https://orf.at/mojo/1_4_1/storyserver//news/common/images/og-fallback-news.png,2023-12-01T07:15:14Z,https://web.archive.org/web/20231202151331/https://orf.at/stories/3341484/,"Zu Beginn der Weltklimakonferenz hat die Windbranche in St. Pölten skizziert, wie eine Verdreifachung der Windstromerzeugung bis 2030 gelingen könnte. Die IG Windkraft forderte dazu eine Änderung der… [+69 chars]",,de,'Windenergie'
https://www.golem.de/sonstiges/zustimmung/auswahl.html?from=https://www.golem.de/news/winter-update-gta-5-online-wird-tierisch-2312-179937.html&referer=https://t.co/4d896cfca8,https://www.golem.de/sonstiges/zustimmung/auswahl.html?from=https://www.golem.de/news/winter-update-gta-5-online-wird-tierisch-2312-179937.html&referer=https://t.co/4d896cfca8,0,www.golem.de,Winter-Update: GTA 5 Online wird tierisch,"Das nächste Update für den Multiplayermodus von GTA 5 enthält Wildtiere sowie weitere Verbesserungen und Inhalte. (GTA Online, Rennspiel)",,2023-12-01T11:15:02Z,,"Besuchen Sie Golem.de wie gewohnt mit Werbung und Tracking,
 indem Sie der Nutzung aller Cookies zustimmen.
 Details zum Tracking finden Sie im Privacy Center.
Skript wurde nicht geladen. Informat… [+607 chars]",,de,'Winter'
https://www.zeit.de/news/2023-12/01/dwd-der-winter-ist-im-suedwesten-angekommen,https://www.zeit.de/news/2023-12/01/dwd-der-winter-ist-im-suedwesten-angekommen,0,www.zeit.de,Wetter: DWD: Der Winter ist im Südwesten angekommen,Hier finden Sie Informationen zu dem Thema „Wetter“. Lesen Sie jetzt „DWD: Der Winter ist im Südwesten angekommen“.,https://img.zeit.de/news/2023-12/01/dwd-der-winter-ist-im-suedwesten-angekommen-image-group/wide__1300x731,2023-12-01T13:03:51Z,https://web.archive.org/web/20231201212653/https://www.zeit.de/news/2023-12/01/dwd-der-winter-ist-im-suedwesten-angekommen,"Eine Schneelandschaft wie aus dem Bilderbuch - das können die Menschen im Südwesten zu Beginn der Adventszeit erwarten. «Das Wochenende wird sehr winterlich», sagte Peter Crouse, Meteorologe beim Deu… [+2601 chars]",,de,'Winter'
https://www.zeit.de/news/2023-12/02/winter-in-nrw-mit-wolken-temperaturen-um-den-gefrierpunkt,https://www.zeit.de/news/2023-12/02/winter-in-nrw-mit-wolken-temperaturen-um-den-gefrierpunkt,0,www.zeit.de,Wetter: Winter in NRW mit Wolken - Temperaturen um den Gefrierpunkt,Hier finden Sie Informationen zu dem Thema „Wetter“. Lesen Sie jetzt „Winter in NRW mit Wolken - Temperaturen um den Gefrierpunkt“.,https://img.zeit.de/news/2023-12/02/winter-in-nrw-mit-wolken-temperaturen-um-den-gefrierpunkt-image-group/wide__1300x731,2023-12-02T09:22:12Z,,Das Winterwetter in Nordrhein-Westfalen hält bis in die neue Woche an. Der Deutsche Wetterdienst (DWD) rechnet am Sonntag mit Tagestemperaturen zwischen null und plus drei Grad und wechselnd bis star… [+671 chars],,de,'Winter'
https://www.zeit.de/news/2023-12/02/land-zahlt-kaeltehilfen-fuer-schutz-von-obdachlosen-im-winter,https://www.zeit.de/news/2023-12/02/land-zahlt-kaeltehilfen-fuer-schutz-von-obdachlosen-im-winter,0,www.zeit.de,Soziales: Land zahlt Kältehilfen für Schutz von Obdachlosen im Winter,Hier finden Sie Informationen zu dem Thema „Soziales“. Lesen Sie jetzt „Land zahlt Kältehilfen für Schutz von Obdachlosen im Winter“.,https://img.zeit.de/news/2023-12/02/land-zahlt-kaeltehilfen-fuer-schutz-von-obdachlosen-im-winter-image-group/wide__1300x731,2023-12-02T10:49:14Z,,Die Landesregierung zahlt Hilfsorganisationen in Nordrhein-Westfalen in diesem Winter bis zu 900.000 Euro für den Schutz von Obdachlosen vor der Kälte. Von dem Geld können etwa Schlafsäcke und Isomat… [+742 chars],,de,'Winter'
https://www.stern.de/gesellschaft/regional/nordrhein-westfalen/soziales--land-zahlt-kaeltehilfen-fuer-schutz-von-obdachlosen-im-winter-34252410.html,https://www.stern.de/gesellschaft/regional/nordrhein-westfalen/soziales--land-zahlt-kaeltehilfen-fuer-schutz-von-obdachlosen-im-winter-34252410.html,0,www.stern.de,Soziales: Land zahlt Kältehilfen für Schutz von Obdachlosen im Winter,"Die Landesregierung zahlt Hilfsorganisationen in Nordrhein-Westfalen in diesem Winter bis zu 900.000 Euro für den Schutz von Obdachlosen vor der Kälte. Von dem Geld können etwa Schlafsäcke und Isomatten, Hygienemittel oder haltbare Lebensmittel angeschafft un…",https://image.stern.de/34252412/t/TJ/v1/w1440/r1.7778/-/02--urnnewsmldpacom2009010123120299155976v3w800h600l640t422r1920b1272jpeg---c506fd0bf7152ffb.jpg,2023-12-02T10:49:14Z,https://web.archive.org/web/20231204011124/https://www.stern.de/gesellschaft/regional/nordrhein-westfalen/soziales--land-zahlt-kaeltehilfen-fuer-schutz-von-obdachlosen-im-winter-34252410.html,Die Landesregierung zahlt Hilfsorganisationen in Nordrhein-Westfalen in diesem Winter bis zu 900.000 Euro für den Schutz von Obdachlosen vor der Kälte. Von dem Geld können etwa Schlafsäcke und Isomat… [+1170 chars],,de,'Winter'
https://sport.orf.at/stories/3119635/,https://sport.orf.at/stories/3119635/,0,sport.orf.at,Wintereinbruch sorgt für zwei Absagen,Der Winter hat in Österreich Einzug gehalten und nicht nur im Straßenverkehr für große Probleme gesorgt. Auch in der Admiral Bundesliga sind am Samstag zwei Spiele dem Wetterchaos zum Opfer gefallen. Wegen „massiver Schneefälle“ und der „Nicht-Bespielbarkeit …,https://ibs.orf.at/sport?image=https%3A%2F%2Fassets.orf.at%2Fmims%2F2023%2F48%2F43%2Fcrops%2Fw%3D1200%2Ch%3D630%2Cq%3D75%2F2028007_master_764543_764531_dsc07449.jpg%3Fs%3D359fc28994547b3120a7842b81d05cefe1af903a,2023-12-02T10:51:34Z,https://web.archive.org/web/20231204011027/https://sport.orf.at/stories/3119635/,"Leider musste das heutige Spiel wegen des starken Schneefalls abgesagt werden. Wir arbeiten nun mit der Bundesliga und dem SK Rapid an einer ehestmöglichen Neuansetzung des Spieles, sagte Julian Heis… [+929 chars]",,de,'Winter'
https://orf.at/stories/3341606/,https://orf.at/stories/3341606/,0,orf.at,Wintereinbruch sorgt für zwei Absagen in Bundesliga,,https://orf.at/mojo/1_4_1/storyserver//news/common/images/og-fallback-news.png,2023-12-02T10:53:25Z,,Der Winter hat in Österreich Einzug gehalten und nicht nur im Straßenverkehr für große Probleme gesorgt. Auch in der Admiral Bundesliga sind heute zwei Spiele dem Wetterchaos zum Opfer gefallen. Wege… [+280 chars],,de,'Winter'
https://www.zeit.de/news/2023-12/02/windkraft-auf-see-von-der-pionierarbeit-zur-boom-branche,https://www.zeit.de/news/2023-12/02/windkraft-auf-see-von-der-pionierarbeit-zur-boom-branche,0,www.zeit.de,Energiewende: Windkraft auf See - Von der Pionierarbeit zur Boom-Branche?,Hier finden Sie Informationen zu dem Thema „Energiewende“. Lesen Sie jetzt „Windkraft auf See - Von der Pionierarbeit zur Boom-Branche?“.,https://img.zeit.de/news/2023-12/02/windkraft-auf-see-von-der-pionierarbeit-zur-boom-branche-image-group/wide__1300x731,2023-12-02T10:53:44Z,https://web.archive.org/web/20231203223939/https://www.zeit.de/news/2023-12/02/windkraft-auf-see-von-der-pionierarbeit-zur-boom-branche,"Sicher steuert Pilot Falko Baguhl seinen Hubschrauber auf sein Ziel mitten auf der Nordsee zu, rund 15 Kilometer nördlich der Insel Borkum: Anflug auf den Offshore-Windpark Riffgat. Durch die geöffne… [+6709 chars]",,de,'Windenergie'
https://www.tagesschau.de/ausland/europa/wintereinbruch-europa-100.html,https://www.tagesschau.de/ausland/europa/wintereinbruch-europa-100.html,0,www.tagesschau.de,"Wintereinbruch in Europa: Lawinengefahr, Stromausfälle, Verkehrschaos","Nicht nur in Deutschland hat es heftig geschneit - ein halber Meter Schnee fiel in der Nacht auch in der Alpenregion. Es kam zu Staus und Unfällen, Behörden warnen vor Lawinen. In Schottland war der Flugverkehr zeitweise unterbrochen.",https://images.tagesschau.de/image/61d2555a-b02d-4d43-ab03-9a9dfc5f6331/AAABjCpChnE/AAABibBxqrQ/16x9-1280/oesterreich-schnee-104.jpg,2023-12-02T11:20:52Z,,"Stand: 02.12.2023 12:20 Uhr
Nicht nur in Deutschland hat es heftig geschneit - ein halber Meter Schnee fiel in der Nacht auch in der Alpenregion. Es kam zu Staus und Unfällen, Behörden warnen vor La… [+2995 chars]",,de,'Winter'
https://www.bild.de/video/clip/leute/mutprobe-im-bikini-influencerin-versinkt-im-schnee-86300226.bild.html,https://www.bild.de/video/clip/leute/mutprobe-im-bikini-influencerin-versinkt-im-schnee-86300226.bild.html,0,www.bild.de,Mutprobe im Bikini - Influencerin versinkt im Schnee,"Schneemutprobe bei Cathy Hummels.
Im Bikini zeigt sie nach dem Winter-Wumms in Bayern, wie hart sie ist - geht SCHNEEBADEN. Und freut sich.
Schon einen T...","https://images.bild.de/656b211b834e2f74ccd2025a/2ec233a6c58feb773c22457cb12d5982,742f814d?w=1280",2023-12-02T12:43:20Z,https://web.archive.org/web/20231204010458/https://www.bild.de/video/clip/leute/mutprobe-im-bikini-influencerin-versinkt-im-schnee-86300226.bild.html,"Mehr zum Video anzeigen
Schneemutprobe bei Cathy Hummels.
Im Bikini zeigt sie nach dem Winter-Wumms in Bayern, wie hart sie ist - geht SCHNEEBADEN. Und freut sich.
Schon einen Tag zuvor bringt sie… [+645 chars]",,de,'Winter'
https://www.sueddeutsche.de/muenchen/muenchen-schnee-tollwood-tierpark-feuerwehr-1.6313087,https://www.sueddeutsche.de/muenchen/muenchen-schnee-tollwood-tierpark-feuerwehr-1.6313087,0,www.sueddeutsche.de,Winter in der Stadt: München im Schnee,"Das Tollwood öffnet später, Fußballer und Busfahrer bleiben zu Hause: Der Wintereinbruch bringt in und um München fast alles zum Stillstand. Die Feuerwehr aber meldet mehr als 400 Einsätze. Wie die Stadt sich durch den Tiefschnee kämpft.",https://www.sueddeutsche.de/image/sz.1.6313088/1200x675?v=1701521883,2023-12-02T12:58:12Z,,"Der Winter ist da, und er wirbelt das Leben in der Stadt gehörig durcheinander. Am Münchner Hauptbahnhof sind Reisende gestrandet, warten auf Informationen und geben die Hoffnung nicht auf, dass doch… [+2929 chars]",,de,'Winter'
https://www.faz.net/aktuell/gesellschaft/menschen/was-passiert-am-ballermann-im-winter-ein-besuch-mit-peter-wackel-19353806.html,https://www.faz.net/aktuell/gesellschaft/menschen/was-passiert-am-ballermann-im-winter-ein-besuch-mit-peter-wackel-19353806.html,0,www.faz.net,Ein Besuch mit Peter Wackel: Was passiert am Ballermann im Winter?,­Mallorca ist auch im ­Winter geöffnet und Schlagersänger Peter Wackel tritt immer auf – nur die ­Partyurlauber machen ­Pause. Ein Spaziergang über die deutsche Partymeile mit einem ihrer beliebtesten Stars.,https://media1.faz.net/ppmedia/aktuell/1156939904/1.9353805/facebook_teaser_fplus/im-ausnahmezustand-in-den.jpg,2023-12-02T12:59:43Z,https://web.archive.org/web/20231203013417/https://www.faz.net/aktuell/gesellschaft/menschen/was-passiert-am-ballermann-im-winter-ein-besuch-mit-peter-wackel-19353806.html,Im November ist der Bierkönig auf Mallorca ein ganz normaler Biergarten. Vereinzelt sind Tische mit Menschen besetzt; sie tanzen nicht und liegen sich auch nicht in den Armen. Statt vor Bierkrügen un… [+1251 chars],,de,'Winter'
https://www.bild.de/sport/fussball/bayern-muenchen/fc-bayern-nachholspiel-erst-im-neuen-jahr-platzt-jetzt-tuchels-trainingslager-86300162.bild.html,https://www.bild.de/sport/fussball/bayern-muenchen/fc-bayern-nachholspiel-erst-im-neuen-jahr-platzt-jetzt-tuchels-trainingslager-86300162.bild.html,0,www.bild.de,Nachholspiel erst 2024 - Platzt jetzt Tuchels Trainingslager?,Wie geht es nach der Spielabsage des FC Bayern am Samstag weiter? Ein neuer Termin könnte auch Auswirkungen auf den Winterplan der Bayern haben.,"https://images.bild.de/656b1f69b4aa0913bb448360/dbeafd34d367ac5b3e0bf7995841b1e5,7e613140?w=1280",2023-12-02T13:30:31Z,,"Wie geht es nach der Spielabsage des 
FC Bayern am Samstag weiter?
Wegen der starken Schneefälle in und um München ist das 
Bundesliga-Spiel zwischen dem deutschen Rekordmeister und Union Berlin (… [+2119 chars]",,de,'Winter'
https://www.bild.de/video/clip/news-inland/monster-blechlawine-schnee-chaos-sorgt-fuer-xxl-staus-86301036.bild.html,https://www.bild.de/video/clip/news-inland/monster-blechlawine-schnee-chaos-sorgt-fuer-xxl-staus-86301036.bild.html,0,www.bild.de,Autobahn-Chaos - XXL-Staus nach Winter-Wumms,Nach den Schneemassen kommen die Staulawinen. Wie hier auf der A9 geht es an vielen Stellen in Bayern nicht mehr weiter. Über viele Kilometer kommt es zu...,"https://images.bild.de/656b2fe3cd09813c13aba9df/4538a06bb6222856712ddd55595d1ae0,e107f175?w=1280",2023-12-02T14:27:00Z,,"Sieg im Elfmeter-Krimi! Deutsche U17 ist Weltmeister 
 Sieg im Elfmeter-Krimi! Deutsche U17 ist Weltmeister 
 Sieg im Elfmeter-Krimi! Deutsche U17 ist Weltmeister 
 Sieg im Elfmeter-Krimi! Deutsch… [+356 chars]",,de,'Winter'
https://www.diepresse.com/17883015/erster-einkaufssamstag-warten-auf-kunden-im-schneegestoeber,https://www.diepresse.com/17883015/erster-einkaufssamstag-warten-auf-kunden-im-schneegestoeber,0,www.diepresse.com,Erster Einkaufssamstag: Warten auf Kunden im Schneegestöber,"Der Wintereinbruch machte dem Weihnachtsgeschäft in Oberösterreich einen Strich durch die Rechnung, die Betreiber klagen über halbvolle Center. Die Hoffnung liegt auf dem 8. Dezember.",https://img.diepresse.com/public/incoming/td1gd6-kein-Titel/alternates/DPR_SOCIAL_NACHRICHTEN/%28kein%20Titel%29,2023-12-02T14:49:31Z,,"Der Wintereinbruch machte dem Weihnachtsgeschäft in Oberösterreich einen Strich durch die Rechnung, die Betreiber klagen über halbvolle Center. Die Hoffnung liegt auf dem 8. Dezember. 
Das Weihnacht… [+4070 chars]",,de,'Winter'
https://sport.orf.at/stories/3119624/,https://sport.orf.at/stories/3119624/,0,sport.orf.at,Stand im ersten Lillehammer-Springen,"In Lillehammer findet am Samstag der dritte Weltcup-Bewerb der Herren in diesem Winter statt. Die ersten beiden im finnischen Ruka hat Stefan Kraft überlegen für sich entschieden. Der erste Durchgang ist derzeit im Gang, er wird live in ORF1 und im Livestream…",https://ibs.orf.at/sport?image=https%3A%2F%2Fassets.orf.at%2Fmims%2F2023%2F48%2F82%2Fcrops%2Fw%3D1200%2Ch%3D630%2Cq%3D75%2F2027680_master_764382_skispringen_herren_lillehammer_i_g.jpg%3Fs%3Da0029fff2efa9dee7c84eb77ce75e2994e3a127f,2023-12-02T15:10:31Z,https://web.archive.org/web/20231203064314/https://sport.orf.at/stories/3119624/,In Lillehammer findet am Samstag der dritte Weltcup-Bewerb der Herren in diesem Winter statt. Die ersten beiden im finnischen Ruka hat Stefan Kraft überlegen für sich entschieden. Der erste Durchgang… [+101 chars],,de,'Winter'
https://salzburg.orf.at/stories/3234996/,https://salzburg.orf.at/stories/3234996/,0,salzburg.orf.at,Freizeitsportler können Wild „Hungertod“ bringen,"Unbedachte Freizeitsportler wie Skitourengeher können im Winter für das Wild in den heimischen Wäldern den „Hungertod“ bedeuten. Denn da „zu jeder Tages- und Nachtzeit“ mittlerweile Sportler auch nahe der Futterplätze unterwegs seien, werde das Wild von seine…",https://ibs.orf.at/sbg?image=https%3A%2F%2Foekastatic.orf.at%2Fmims%2F2023%2F48%2F95%2Fcrops%2Fw%3D1200%2Ch%3D627%2Cq%3D75%2F2028409_master_764695_wild3.jpg%3Fs%3D33ad63eb11059703a54e42a2bd2ac4e509fb60e1,2023-12-02T16:30:00Z,,"Immer mehr Skitourengeher, Schneeschuh- oder Mondscheinwanderer sind im Winter in den Salzburger Bergwäldern unterwegs. Die ungewohnten Menschen können die Wildtiere in ihren Revieren verschrecken un… [+1334 chars]",,de,'Winter'
https://www.googlewatchblog.de/?p=215474,https://www.googlewatchblog.de/?p=215474,0,www.googlewatchblog.de,"Chromecast & Google TV: Tausende kostenlose Serien, Filme und Sender streamen; Pluto TV macht es möglich","Wer es noch nicht kennt, sollte es in diesem Winter kennenlernen: Pluto TV hält unzählige kostenlose Sender, Serien, Filme und sonstige mediale Inhalte bereit.Chromecast & Google TV: Tausende kostenlose Serien, Filme und Sender streamen; Pluto TV macht es mög…",https://www.googlewatchblog.de/wp-content/uploads/android-tv-ambient-photos.jpg,2023-12-02T16:30:18Z,,"Es gibt zahlreiche größere und auch kleinere Streamingdienste, mit denen ihr auf allen Plattformen Filme, Serien und andere Inhalte konsumieren könnt. Neben den großen Namen wie Amazon Prime, Netflix… [+3088 chars]",,de,'Winter'
https://www.kicker.de/schnee-chaos-bbl-topspiel-zwischen-berlin-und-muenchen-abgesagt-982412/artikel,https://www.kicker.de/schnee-chaos-bbl-topspiel-zwischen-berlin-und-muenchen-abgesagt-982412/artikel,0,www.kicker.de,Schnee-Chaos: BBL-Topspiel zwischen Berlin und München abgesagt,Das BBL-Topspiel zwischen Alba Berlin und Bayern München wurde abgesagt. Der FCBB sitzt aufgrund des Wintereinbruchs in Bayern fest.,"https://derivates.kicker.de/image/upload/w_4000,h_2250,c_fill,g_auto:subject/w_1200,q_auto/v1/2023/12/02/f12e3054-cd5a-49b2-8696-034fad97e49c.jpeg",2023-12-02T16:52:22Z,,"Das BBL-Topspiel zwischen Alba Berlin und Bayern München wurde abgesagt. Der FCBB sitzt aufgrund des Wintereinbruchs in Bayern fest. 
 Das Spiel der beiden Tabellennachbarn Berlin und München hätte … [+1587 chars]",,de,'Winter'
https://www.stern.de/sport/weltcup-in-lillehammer--skispringer-wellinger-in-lillehammer-zweiter-hinter-kraft-34253018.html,https://www.stern.de/sport/weltcup-in-lillehammer--skispringer-wellinger-in-lillehammer-zweiter-hinter-kraft-34253018.html,0,www.stern.de,Weltcup in Lillehammer: Skispringer Wellinger in Lillehammer Zweiter hinter Kraft,Die deutschen Skispringer sind stark in den Winter gestartet. Auf der Normalschanze von Lillehammer wiederholt sich das am vergangenen Wochenende gesehene Muster.,https://image.stern.de/34253020/t/cN/v1/w1440/r1.7778/-/02--urnnewsmldpacom2009010123120299159014v3w800h600l640t327r1920b1180jpeg---f8e5147125e6bfc9.jpg,2023-12-02T17:05:27Z,,"Die deutschen Skispringer sind stark in den Winter gestartet. Auf der Normalschanze von Lillehammer wiederholt sich das am vergangenen Wochenende gesehene Muster.
Olympiasieger Andreas Wellinger hat… [+1390 chars]",,de,'Winter'
https://www.n-tv.de/panorama/Heftige-Schneefaelle-legen-Bayern-lahm-article24574302.html,https://www.n-tv.de/panorama/Heftige-Schneefaelle-legen-Bayern-lahm-article24574302.html,0,www.n-tv.de,Lawinengefahr in den Alpen: Heftige Schneefälle legen Bayern lahm,"Das erste Schneechaos in diesem Winter hält den Süden Deutschlands fest im Griff. An Flughäfen geht nichts mehr, die Polizei meldet zahlreiche Glätte-Unfälle. In den bayerischen Alpen herrscht Lawinengefahr. ""Bleiben Sie möglichst zu Hause!"", lautet der eindr…",https://bilder3.n-tv.de/img/incoming/crop24574342/2511328506-cImg_16_9-w1200/437099431.jpg,2023-12-02T17:16:57Z,,"Das erste Schneechaos in diesem Winter hält den Süden Deutschlands fest im Griff. An Flughäfen geht nichts mehr, die Polizei meldet zahlreiche Glätte-Unfälle. In den bayerischen Alpen herrscht Lawine… [+5721 chars]",,de,'Winter'
https://www.bild.de/regional/muenchen/muenchen-aktuell/winterchaos-in-muenchen-dieser-cessna-geht-der-ar-auf-grundeis-86303424.bild.html,https://www.bild.de/regional/muenchen/muenchen-aktuell/winterchaos-in-muenchen-dieser-cessna-geht-der-ar-auf-grundeis-86303424.bild.html,0,www.bild.de,Winterchaos in München - Dieser Cessna geht der Ar... auf Grundeis!,Dieser hochnäsige Flieger (Typ Cessna Citation X) hat auf dem Münchner Flughafen offenbar ein wenig zu viel Schnee geschnupft.,"https://images.bild.de/656b692d834e2f74ccd20302/174a1a04b25229a7d89bcc5f59cd88a5,84ae7f64?w=1280",2023-12-02T18:08:59Z,https://web.archive.org/web/20231203041255/https://www.bild.de/regional/muenchen/muenchen-aktuell/winterchaos-in-muenchen-dieser-cessna-geht-der-ar-auf-grundeis-86303424.bild.html,"München Wer wird denn bei so ein paar Flocken gleich in die Luft gehen?
Dieser hochnäsige Flieger (Typ Cessna Citation X) hat auf dem Münchner Flughafen offenbar ein wenig zu viel Schnee geschnupft … [+1075 chars]",,de,'Winter'
https://www.zeit.de/news/2023-12/03/bitterer-winter-fuer-die-ukraine-durchbruch-in-weiter-ferne,https://www.zeit.de/news/2023-12/03/bitterer-winter-fuer-die-ukraine-durchbruch-in-weiter-ferne,0,www.zeit.de,Krieg: Bitterer Winter für die Ukraine: Durchbruch in weiter Ferne,Hier finden Sie Informationen zu dem Thema „Krieg“. Lesen Sie jetzt „Bitterer Winter für die Ukraine: Durchbruch in weiter Ferne“.,https://img.zeit.de/news/2023-12/03/bitterer-winter-fuer-die-ukraine-durchbruch-in-weiter-ferne-image-group/wide__1300x731,2023-12-03T09:47:28Z,https://web.archive.org/web/20231203122546/https://www.zeit.de/news/2023-12/03/bitterer-winter-fuer-die-ukraine-durchbruch-in-weiter-ferne,Der ukrainische Versuch einer Gegenoffensive bis weit in das von Russland besetzte Gebiet ist vorerst gescheitert. Ein militärisch wichtiger Durchbruch zum Asowschen Meer - quer durch den von Kreml-T… [+7618 chars],,de,'Winter'
https://www.zeit.de/news/2023-12/03/fc-bayern-schaut-bei-winter-transfers-auf-defensivbereich,https://www.zeit.de/news/2023-12/03/fc-bayern-schaut-bei-winter-transfers-auf-defensivbereich,0,www.zeit.de,Bundesliga: FC Bayern schaut bei Winter-Transfers auf Defensivbereich,Hier finden Sie Informationen zu dem Thema „Bundesliga“. Lesen Sie jetzt „FC Bayern schaut bei Winter-Transfers auf Defensivbereich“.,https://img.zeit.de/news/2023-12/03/fc-bayern-schaut-bei-winter-transfers-auf-defensivbereich-image-group/wide__1300x731,2023-12-03T10:41:02Z,,Vereinspräsident Herbert Hainer hat sich mit Blick auf die bevorstehende Wintertransfer-Periode zurückhaltend zu möglichen Aktivitäten des FC Bayern München geäußert. Trainer Thomas Tuchel sieht vor … [+2158 chars],,de,'Winter'
https://www.golem.de/sonstiges/zustimmung/auswahl.html?from=https://www.golem.de/news/schweiz-vertikale-solaranlage-an-umgehungsstrasse-installiert-2312-179977.html&referer=https://t.co/c562d5cd00,https://www.golem.de/sonstiges/zustimmung/auswahl.html?from=https://www.golem.de/news/schweiz-vertikale-solaranlage-an-umgehungsstrasse-installiert-2312-179977.html&referer=https://t.co/c562d5cd00,0,www.golem.de,Schweiz: Vertikale Solaranlage an Umgehungsstraße installiert,"Entlang der Stützmauer einer Umgehungsstraße in der Schweiz ist eine vertikale Solaranlage installiert worden, was insbesondere im Winter einen guten Ertrag liefern soll. (Solarenergie, Smart Meter)",,2023-12-03T13:10:02Z,,"Besuchen Sie Golem.de wie gewohnt mit Werbung und Tracking,
 indem Sie der Nutzung aller Cookies zustimmen.
 Details zum Tracking finden Sie im Privacy Center.
Skript wurde nicht geladen. Informat… [+607 chars]",,de,'Solar'
https://www.faz.net/aktuell/wirtschaft/energiewende-milliarden-fuer-die-deutschen-haefen-19357931.html,https://www.faz.net/aktuell/wirtschaft/energiewende-milliarden-fuer-die-deutschen-haefen-19357931.html,0,www.faz.net,Drehkreuze der Energiewende: Milliarden für die deutschen Häfen,"Die Offshore-Windbranche hat errechnet, wie viel zusätzliche Fläche der nötige Ausbau der Windparks braucht. Einen Vorschlag für die Finanzierung gibt es auch.",https://media1.faz.net/ppmedia/aktuell/wirtschaft/3247981199/1.9358121/facebook_teaser_fplus/brauchen-viel-flaeche.jpg,2023-12-03T17:51:55Z,https://web.archive.org/web/20231204021747/https://www.faz.net/aktuell/wirtschaft/energiewende-milliarden-fuer-die-deutschen-haefen-19357931.html,"Die deutschen Seehäfen werden für die geplanten Offshore-Windparks in Nord- und Ostsee eine wichtige Rolle spielen. Ob als Basishäfen für den Bau der Windparks, als Servicehäfen für den Betrieb und d… [+1011 chars]",,de,'Energiewende'
https://www.bild.de/ratgeber/2023/ratgeber/kaelte-und-heftige-schneefaelle-wird-das-der-jahrhundert-winter-86301890.bild.html,https://www.bild.de/ratgeber/2023/ratgeber/kaelte-und-heftige-schneefaelle-wird-das-der-jahrhundert-winter-86301890.bild.html,0,www.bild.de,Heftige Schneefälle - Wird das ein Jahrhundert-Winter?,"Glitzerschnee, Glatteis und mehrere Grad unter null – der Winter hat in dieser Woche von Nord bis Süd ein erstes Gastspiel gegeben.","https://images.bild.de/656b4178834e2f74ccd202b6/79bb0287ab8b96461493b324c8362d7e,422cee28?w=1280",2023-12-03T20:18:46Z,,"Glitzerschnee, Glatteis und mehrere Grad unter null der Winter hat in dieser Woche von Nord bis Süd ein erstes Gastspiel gegeben. In Bayern sogar eins mit heftigen Folgen: Mega-Staus, Zug- und Stroma… [+3898 chars]",,de,'Heizkosten'
https://www.faz.net/aktuell/rhein-main/wirtschaft/heizen-im-winter-wie-sie-noch-an-brennholz-kommen-19358178.html,https://www.faz.net/aktuell/rhein-main/wirtschaft/heizen-im-winter-wie-sie-noch-an-brennholz-kommen-19358178.html,0,www.faz.net,Heizen im Winter: So kommen Sie noch an Brennholz,"Nach dem Wintereinbruch fragen sich viele Verbraucher, wie sie noch schnell und günstig gutes Brennholz finden. Hier sind die wichtigsten Fragen und Antworten.",https://media1.faz.net/ppmedia/aktuell/wirtschaft/904963389/1.9358173/facebook_teaser_fplus/sorgt-fuer-gemuetlichkeit-ein.jpg,2023-12-04T07:30:00Z,https://web.archive.org/web/20231205053054/https://www.faz.net/aktuell/rhein-main/wirtschaft/heizen-im-winter-wie-sie-noch-an-brennholz-kommen-19358178.html,"Wie schön ein gut gefüllter Traktoranhänger aussieht. Fast bis zum Rand stapelt sich das in 30-Zentimeter-Stücke gesägte und sauber gespaltene Brennholz auf dem grünen Hänger, auf den wir es neulich … [+564 chars]",,de,'Heizen'
