index,url,valid,domain,title,description,image,published,archive,content,quote,language,keyword
https://www.zeit.de/news/2025-03/10/branche-wehrt-sich-gegen-aiwanger-plaene-zu-wind-ertraegen,https://www.zeit.de/news/2025-03/10/branche-wehrt-sich-gegen-aiwanger-plaene-zu-wind-ertraegen,0,www.zeit.de,Erträge aus Erneuerbaren: Branche wehrt sich gegen Aiwanger-Pläne zu Wind-Erträgen,Hier finden Sie Informationen zu dem Thema „Erträge aus Erneuerbaren“. Lesen Sie jetzt „Branche wehrt sich gegen Aiwanger-Pläne zu Wind-Erträgen“.,https://img.zeit.de/news/2025-03/10/branche-wehrt-sich-gegen-aiwanger-plaene-zu-wind-ertraegen-image-group/wide__1300x731,2025-03-10T15:53:10Z,,Ein Gesetzentwurf von Wirtschaftsminister Hubert Aiwanger (Freie Wähler) zur Beteiligung von Bürgern an den Erträgen etwa aus Windkraftanlagen könnte zum Rohrkrepierer werden. In einem internen Schre… [+909 chars],,de,'Erneuerbare'
https://www.diepresse.com/19458124/us-energieminister-zu-klimawandel-alles-im-leben-ist-mit-kompromissen-verbunden,https://www.diepresse.com/19458124/us-energieminister-zu-klimawandel-alles-im-leben-ist-mit-kompromissen-verbunden,0,www.diepresse.com,US-Energieminister zu Klimawandel: „Alles im Leben ist mit Kompromissen verbunden“,"Die globale Erderwärmung sei „eine Nebenwirkung des Aufbaus der modernen Welt“, sagt US-Energieminister Chris Wright. Von Förderungen für emissionsfreie Solar- und Windenergie hält er nichts.",https://img.diepresse.com/public/incoming/mcbf8m-imago-images-0806994609/alternates/DPR_SOCIAL_NACHRICHTEN/imago%20images%200806994609,2025-03-10T17:26:11Z,,"Die globale Erderwärmung sei eine Nebenwirkung des Aufbaus der modernen Welt, sagt US-Energieminister Chris Wright. Von Förderungen für emissionsfreie Solar- und Windenergie hält er nichts.
Die glob… [+1581 chars]",,de,'Windenergie'
https://www.transfermarkt.de/marktwerte-saudi-arabien-kaio-cesar-grosster-gewinner-duran-vorn/view/news/451148,https://www.transfermarkt.de/marktwerte-saudi-arabien-kaio-cesar-grosster-gewinner-duran-vorn/view/news/451148,0,www.transfermarkt.de,"Marktwerte Saudi-Arabien: Kaio César größter Gewinner, Durán vorn",Transfermarkt hat die Marktwerte der Saudi Pro League aktualisiert. Der im Winter von Aston Villa zu Al-Nassr gewechselte Jhon Durán behält seinen Status als wertvollster Profi....,https://tmssl.akamaized.net/images/foto/big/kaio-cesar-vitoria-guimaraes-sc-2024-1737529601-159109.jpg?lm=1737529613,2025-03-10T19:19:52Z,,Transfermarkt hat die Marktwerte der Saudi Pro League aktualisiert. Der im Winter von Aston Villa zu Al-Nassr gewechselte Jhon Durán behält seinen Status als wertvollster Profi. Insgesamt 52 Spieler … [+2846 chars],,de,'Winter'
https://www.zeit.de/news/2025-03/11/winter-ade-skigebiete-zufrieden-mit-saison,https://www.zeit.de/news/2025-03/11/winter-ade-skigebiete-zufrieden-mit-saison,0,www.zeit.de,Wintersport: Winter ade? Skigebiete zufrieden mit Saison,Hier finden Sie Informationen zu dem Thema „Wintersport“. Lesen Sie jetzt „Winter ade? Skigebiete zufrieden mit Saison“.,https://img.zeit.de/news/2025-03/11/winter-ade-skigebiete-zufrieden-mit-saison-image-group/wide__1300x731,2025-03-11T03:00:45Z,,"Der Frühling hat zwar laut Kalender offiziell noch nicht begonnen, doch die beiden wichtigsten Wintersportgebiete in Hessen haben bereits eine positive Bilanz der zu Ende gehenden Saison gezogen. In … [+5766 chars]",,de,'Winter'
https://www.stern.de/gesellschaft/regional/hessen/wintersport--winter-ade--skigebiete-zufrieden-mit-saison-35539668.html,https://www.stern.de/gesellschaft/regional/hessen/wintersport--winter-ade--skigebiete-zufrieden-mit-saison-35539668.html,0,www.stern.de,Wintersport: Winter ade? Skigebiete zufrieden mit Saison,"Die Wintersportsaison in Hessen ist so gut wie zu Ende. Und die war gar nicht schlecht, heißt es auf der Wasserkuppe und in Willingen. Doch hat Skifahren und Rodeln dort eine Zukunft?",https://image.stern.de/35539670/t/Yu/v1/w1440/r1.7778/-/11--g4jo64a4iyv13axs2048jpeg---e626097ebc98eb45.jpg,2025-03-11T03:00:45Z,,"Kopiere den aktuellen Link
Zur Merkliste hinzufügen
Die Wintersportsaison in Hessen ist so gut wie zu Ende. Und die war gar nicht schlecht, heißt es auf der Wasserkuppe und in Willingen. Doch hat S… [+5966 chars]",,de,'Winter'
https://www.focus.de/gesundheit/schluss-mit-fruehjahrsmuedigkeit-7-tipps-machen-sie-ihren-koerper-jetzt-fit_id_259707353.html,https://www.focus.de/gesundheit/schluss-mit-fruehjahrsmuedigkeit-7-tipps-machen-sie-ihren-koerper-jetzt-fit_id_259707353.html,0,www.focus.de,Schluss mit Frühjahrsmüdigkeit - 7 Tipps machen Sie Ihren Körper jetzt richtig fit,"Nach dem langen Winter braucht nicht nur die Wohnung eine Generalüberholung, auch Ihr Körper ist dankbar für einen Frühjahrsputz. Lesen Sie hier, wie Sie Ihren Körper jetzt stärken.",https://p6.focus.de/img/fotos/id_259709077/eine-frau-trinkt-ein-getraenk-mit-zitrone-symbolbild-..jpg?im=Crop%3D%280%2C106%2C2120%2C1061%29%3BResize%3D%281200%2C627%29&impolicy=perceptual&quality=mediumHigh&hash=0a8ae35c4d7b42d4d9a54f14d46054e73488c0c6120b6e97b58d02c5af6f2bbf,2025-03-11T08:15:26Z,,"Nach dem langen Winter braucht nicht nur die Wohnung eine Generalüberholung, auch Ihr Körper ist dankbar für einen Frühjahrsputz. Lesen Sie hier, wie Sie Ihren Körper jetzt stärken.Die Krokusse schie… [+4752 chars]",,de,'Winter'
https://www.transfermarkt.de/-sky-quot-frimpong-plant-bayer-abschied-barca-amp-real-als-ziel-premier-league-kein-thema/view/news/451174,https://www.transfermarkt.de/-sky-quot-frimpong-plant-bayer-abschied-barca-amp-real-als-ziel-premier-league-kein-thema/view/news/451174,0,www.transfermarkt.de,Bayer 04: Frimpong plant Abschied – Barça & Real Madrid als Ziel,"Seit nunmehr vier Jahren trägt Jeremie Frimpong das Trikot von Bayer 04 Leverkusen. Der 24-Jährige war im Winter 2021 für 11 Millionen Euro von Celtic Glasgow gekommen,...",https://tmssl.akamaized.net/images/foto/big/jeremie-frimpong-bayer-leverkusen-2024-2025-1048865975h-1728467237-150810.jpg?lm=1728467249,2025-03-11T08:28:09Z,,"Seit nunmehr vier Jahren trägt Jeremie Frimpong das Trikot von Bayer 04 Leverkusen. Der 24-Jährige war im Winter 2021 für 11 Millionen Euro von Celtic Glasgow gekommen, seitdem erreichte er 28 Tore u… [+1578 chars]",,de,'Winter'
https://stadt-bremerhaven.de/nuki-smart-lock-go-und-smart-lock-pro-vorgestellt-aliro-zubehoer-angeteasert/,https://stadt-bremerhaven.de/nuki-smart-lock-go-und-smart-lock-pro-vorgestellt-aliro-zubehoer-angeteasert/,0,stadt-bremerhaven.de,Nuki: Smart Lock Go und Smart Lock Pro vorgestellt & Aliro-Zubehör angeteasert,Im Winter hatte Nuki mit dem Smart Lock Ultra ein neues Modell vorgestellt. (hier Caschys Ersteindruck). Jenes ist schneller und kompakter als die Vorgänger-Modelle und setzt auf eine native Matter-Anbindung per Thread-Funk. Für einige aber ein Kritikpunkt: E…,https://stadt-bremerhaven.de/wp-content/uploads/2025/03/Nuki-Smart-Lock-Pro-black-basering-on-door.jpg,2025-03-11T08:59:22Z,,Im Winter hatte Nuki mit dem Smart Lock Ultra ein neues Modell vorgestellt. (hier Caschys Ersteindruck). Jenes ist schneller und kompakter als die Vorgänger-Modelle und setzt auf eine native Matter-A… [+3825 chars],,de,'Winter'
https://www.bild.de/leben-wissen/beauty-kosmetik/trockene-haut-die-besten-tipps-und-tricks-zur-behandlung-65cb3c415df37923f003bab9,https://www.bild.de/leben-wissen/beauty-kosmetik/trockene-haut-die-besten-tipps-und-tricks-zur-behandlung-65cb3c415df37923f003bab9,0,www.bild.de,Tipps und Tricks - Die richtige Pflege für trockene Haut,"Viele Umweltfaktoren stressen die Haut, machen sie trocken und spröde. Vor allem im Winter sind besonders viele betroffen. Alles zur Pflege trockener Haut.","https://images.bild.de/65cb3c415df37923f003bab9/86a2f4c86f0f276af2a9b8d163894c0e,56de9b00?w=1280",2025-03-11T09:00:31Z,,"Trockene Haut ist schnell zu identifizieren: Spannungen, gerötete und schuppige Stellen stehen auf der Tagesordnung. 
Menschen mit einem trockenen Hauttyp leiden dann vor allem in den Wintermonaten … [+4918 chars]",,de,'Winter'
https://www.photoscala.de/2025/03/11/bildband-minus-30-von-angela-boehm-poetische-winterlandschaften/,https://www.photoscala.de/2025/03/11/bildband-minus-30-von-angela-boehm-poetische-winterlandschaften/,0,www.photoscala.de,Bildband Minus 30 von Angela Boehm: Poetische Winterlandschaften,"Seit 2021 fotografiert Angela Boehm Schneestürme und hat es sich zur Regel gemacht, nur bei minus 30 Grad Celsius oder kälter zu arbeiten. 
Der Beitrag Bildband Minus 30 von Angela Boehm: Poetische Winterlandschaften erschien zuerst auf photoscala.",https://www.photoscala.de/wp-content/uploads/2025/03/14_AngelaBoehm_DSCF5133.jpg,2025-03-11T09:00:40Z,,"Die Fotografin Angela Boehm ist im kanadischen Saskatchewan aufgewachsen und weiß daher, wie sich lange, kalte Winter anfühlen. Diese Erfahrungen in der Natur haben sich ihr tief eingeprägt. Deshalb … [+1410 chars]",,de,'Winter'
https://www.visions.de/news/danko-jones-winter-tour-2025-angekuendigt/,https://www.visions.de/news/danko-jones-winter-tour-2025-angekuendigt/,0,www.visions.de,Danko Jones kündigen Winter-Tour 2025 an,"Bereits im November und Dezember kommen die dauertourenden Danko Jones wieder nach Deutschland – für sechs Shows.
Der Beitrag Winter-Tour angekündigt erschien zuerst auf VISIONS.de.",https://www.visions.de/wp-content/uploads/Danko_Jones_Copyright_Daniel_Berbig-scaled.jpg,2025-03-11T10:00:08Z,,"Schon seit einigen Jahren kommen die kanadischen Hardrocker Danko Jones im Herbst/Winter nach Deutschland. Dieses Jahr im November und Dezember für jeweils eine Show in Osnabrück, Mannheim, München, … [+798 chars]",,de,'Winter'
https://hallespektrum.de/aktuelles/energiewende-international-deutschland-und-suedkorea-buendeln-kraefte/469831/,https://hallespektrum.de/aktuelles/energiewende-international-deutschland-und-suedkorea-buendeln-kraefte/469831/,0,hallespektrum.de,Energiewende international: Deutschland und Südkorea bündeln Kräfte,"Im globalen Wettlauf um eine klimaneutrale Zukunft bündeln Deutschland und Südkorea ihre Kräfte. Die Nationale Akademie der Wissenschaften Leopoldina und die Korean Academy of Science and Technology (KAST) haben gemeinsam Handlungsempfehlungen erarbeitet, um …",https://hallespektrum.de/wp-content/uploads/2025/01/leopoldina1.png,2025-03-11T10:56:45Z,,Im globalen Wettlauf um eine klimaneutrale Zukunft bündeln Deutschland und Südkorea ihre Kräfte. Die Nationale Akademie der Wissenschaften Leopoldina und die Korean Academy of Science and Technology … [+3063 chars],,de,'Energiewende'
https://kaernten.orf.at/stories/3296531/,https://kaernten.orf.at/stories/3296531/,0,kaernten.orf.at,Ausbau Erneuerbarer Energien für Gewerbe,"Das Land Kärnten wird weiterhin den Ausbau von Erneuerbaren Energien fördern. Die Regierung beschloss am Dienstag die Förderrichtlinie, die aber nur für Gewerbetreibende, Industrie, Vereine und öffentliche Institutionen gilt. Bis zu 45 Prozent der Investition…",https://ibs.orf.at/ktn?image=https%3A%2F%2Foekastatic.orf.at%2Fmojo%2F1_4_1%2Fstoryserver%2Foeka%2Fcommon%2Fimages%2Fog-fallback-ktn.png%3Fs%3Dd1ef40bef2ffd65644b4df37900c0e4d80e97249,2025-03-11T12:25:21Z,https://web.archive.org/web/20250315084613/https://kaernten.orf.at/stories/3296531/,"Energiereferent Landesrat Sebastian Schuschnig (ÖVP) brachte den Antrag auf die Förderrichtlinie Erneuerbare Wärme 2025 ein, die in der Regierungssitzung beschlossen wurde. Damit werden heuer insgesa… [+1254 chars]",,de,'Ausbau'
https://orf.at/stories/3387331/,https://orf.at/stories/3387331/,0,orf.at,Regierungspläne: Erneuerbare-Energie-Branche verunsichert,,https://orf.at/mojo/1_4_1/storyserver//news/common/images/og-fallback-news.png,2025-03-11T13:59:18Z,https://web.archive.org/web/20250311194158/https://orf.at/stories/3387331/,"In der Branche der erneuerbaren Energie herrscht Verunsicherung. Zwar sehen Vertreter und Vertreterinnen von Photovoltaik-, Geothermie-, Pellets- und Windkraftverbänden positive Punkte im neuen Regie… [+1630 chars]",,de,'Photovoltaik'
https://www.diepresse.com/19460419/nachhaltig-verunsichert-oekostrom-erzeuger-beklagen-ueberfall-der-regierung,https://www.diepresse.com/19460419/nachhaltig-verunsichert-oekostrom-erzeuger-beklagen-ueberfall-der-regierung,0,www.diepresse.com,Nachhaltig verunsichert: Ökostrom-Erzeuger beklagen „Überfall“ der Regierung,"Der Staat will plötzlich mehr Geld von bestehenden Kraftwerken, streicht Förderungen oder lässt Förderwerber im Unklaren. Diese abrupten Eingriffe in den Markt seien Gift für Energiewende und Investitionen, sagt die Branche.",https://img.diepresse.com/public/incoming/nqbnqj-imago-images-0260334389/alternates/DPR_SOCIAL_NACHRICHTEN/imago%20images%200260334389,2025-03-11T14:01:40Z,,"Der Staat will plötzlich mehr Geld von bestehenden Kraftwerken, streicht Förderungen oder lässt Förderwerber im Unklaren. Diese abrupten Eingriffe in den Markt seien Gift für Energiewende und Investi… [+2596 chars]",,de,'Erneuerbare'
https://www.focus.de/earth/pariser-metro-macht-es-vor-die-grosse-heiz-chance-fuer-deutsche-staedte_e5dd531f-a5df-4997-a1a2-679e9cb3b2ef.html,https://www.focus.de/earth/pariser-metro-macht-es-vor-die-grosse-heiz-chance-fuer-deutsche-staedte_e5dd531f-a5df-4997-a1a2-679e9cb3b2ef.html,0,www.focus.de,Abwärme nutzen - Pariser Metro macht es vor: Die große Heiz-Chance für deutsche Städte,"Beim Bremsen und Beschleunigen entsteht in U-Bahn-Tunneln jede Menge Wärme – bislang meist ungenutzt. Doch Städte wie Paris zeigen, wie sich diese Abwärme clever zum Heizen einsetzen lässt. Forschende sehen darin großes Potenzial – auch für Deutschland. Kann …",https://quadro.burda-forward.de/ctf/fe79ea03-7eb2-447c-a70e-d25f802f4c07.8a347deb-d803-445d-a5ad-6b25ebd837d5.jpg?im=RegionOfInterestCrop%3D%281200%2C630%29%2CregionOfInterest%3D%28497%2C363%29&hash=28b41abda2b8ae92bca4c4450657f839cc9d6b6a2fef18b6338ca4446767242d,2025-03-11T16:39:00Z,https://web.archive.org/web/20250312151037/https://www.focus.de/earth/pariser-metro-macht-es-vor-die-grosse-heiz-chance-fuer-deutsche-staedte_e5dd531f-a5df-4997-a1a2-679e9cb3b2ef.html,"Im Minutentakt sausen U-Bahnen durch die Tunnel im Land - und mit ihnen jede Menge Wärme. Im Normalfall geht diese Wärme über Lüftungsschächte verloren. Dass sie auch genutzt werden kann, haben Forsc… [+5297 chars]",,de,'Heizen'
https://www.focus.de/earth/abwaerme-nutzen-aus-pariser-u-bahn-projekt-ergibt-sich-grosse-heiz-chance-fuer-deutsche-staedte_e5dd531f-a5df-4997-a1a2-679e9cb3b2ef.html,https://www.focus.de/earth/abwaerme-nutzen-aus-pariser-u-bahn-projekt-ergibt-sich-grosse-heiz-chance-fuer-deutsche-staedte_e5dd531f-a5df-4997-a1a2-679e9cb3b2ef.html,0,www.focus.de,Abwärme nutzen - Aus Pariser U-Bahn-Projekt ergibt sich große Heiz-Chance für deutsche Städte,"Beim Bremsen und Beschleunigen entsteht in U-Bahn-Tunneln jede Menge Wärme – bislang meist ungenutzt. Doch Städte wie Paris zeigen, wie sich diese Abwärme clever zum Heizen einsetzen lässt. Forschende sehen darin großes Potenzial – auch für Deutschland. Kann …",https://quadro.burda-forward.de/ctf/fe79ea03-7eb2-447c-a70e-d25f802f4c07.8a347deb-d803-445d-a5ad-6b25ebd837d5.jpg?im=RegionOfInterestCrop%3D%281200%2C630%29%2CregionOfInterest%3D%28497%2C363%29&hash=28b41abda2b8ae92bca4c4450657f839cc9d6b6a2fef18b6338ca4446767242d,2025-03-11T16:39:00Z,https://web.archive.org/web/20250311193943/https://www.focus.de/earth/abwaerme-nutzen-aus-pariser-u-bahn-projekt-ergibt-sich-grosse-heiz-chance-fuer-deutsche-staedte_e5dd531f-a5df-4997-a1a2-679e9cb3b2ef.html,"Im Minutentakt sausen U-Bahnen durch die Tunnel im Land - und mit ihnen jede Menge Wärme. Im Normalfall geht diese Wärme über Lüftungsschächte verloren. Dass sie auch genutzt werden kann, haben Forsc… [+5297 chars]",,de,'Heizen'
https://www.stern.de/wirtschaft/news/stromquellen--studie--solar--und-windenergie-uebertreffen-in-den-usa-kohle-35543742.html,https://www.stern.de/wirtschaft/news/stromquellen--studie--solar--und-windenergie-uebertreffen-in-den-usa-kohle-35543742.html,0,www.stern.de,Stromquellen: Studie: Solar- und Windenergie übertreffen in den USA Kohle,New York - Trotz der Begeisterung von US-Präsident Donald Trump für fossile Energien wächst in den USA der Anteil erneuerbarer Energien. Der Anteil von,https://image.stern.de/35543744/t/9u/v1/w1440/r1.7778/-/12--b6jt5foz7gv7axs2048jpeg---3535a417b4254a88.jpg,2025-03-12T05:01:36Z,,"Kopiere den aktuellen Link
Zur Merkliste hinzufügen
In den USA steigt die Nachfrage nach Strom. Eine alte Energiequelle spielt dabei nur noch eine kleinere Rolle.
Trotz der Begeisterung von US-Prä… [+971 chars]",,de,'Solar'
https://www.zeit.de/news/2025-03/12/studie-solar-und-windenergie-uebertreffen-in-den-usa-kohle,https://www.zeit.de/news/2025-03/12/studie-solar-und-windenergie-uebertreffen-in-den-usa-kohle,0,www.zeit.de,Stromquellen: Studie: Solar- und Windenergie übertreffen in den USA Kohle,Hier finden Sie Informationen zu dem Thema „Stromquellen“. Lesen Sie jetzt „Studie: Solar- und Windenergie übertreffen in den USA Kohle“.,https://img.zeit.de/news/2025-03/12/studie-solar-und-windenergie-uebertreffen-in-den-usa-kohle-image-group/wide__1300x731,2025-03-12T05:01:36Z,,Trotz der Begeisterung von US-Präsident Donald Trump für fossile Energien wächst in den USA der Anteil erneuerbarer Energien. Der Anteil von Wind und Sonne an der Stromversorgung habe 2024 mit zusamm… [+845 chars],,de,'Windenergie'
https://www.tagesspiegel.de/wirtschaft/stromquellen-studie-solar-und-windenergie-ubertreffen-in-den-usa-kohle-13352185.html,https://www.tagesspiegel.de/wirtschaft/stromquellen-studie-solar-und-windenergie-ubertreffen-in-den-usa-kohle-13352185.html,0,www.tagesspiegel.de,Stromquellen: Studie: Solar- und Windenergie übertreffen in den USA Kohle,In den USA steigt die Nachfrage nach Strom. Eine alte Energiequelle spielt dabei nur noch eine kleinere Rolle.,https://www.tagesspiegel.de/images/13352182/alternates/BASE_16_9_W1400/1741755749000/ausbau-der-alternativen-energien-in-den-usa.jpeg,2025-03-12T05:02:29Z,,Trotz der Begeisterung von US-Präsident Donald Trump für fossile Energien wächst in den USA der Anteil erneuerbarer Energien. Der Anteil von Wind und Sonne an der Stromversorgung habe 2024 mit zusamm… [+1566 chars],,de,'Windenergie'
https://www.tagesschau.de/wirtschaft/weltwirtschaft/usa-windkraft-solarenergie-kohlekraft-100.html,https://www.tagesschau.de/wirtschaft/weltwirtschaft/usa-windkraft-solarenergie-kohlekraft-100.html,0,www.tagesschau.de,US-Energiemix: Solar- und Windenergie übertreffen Kohle,"2024 sind Stromverbrauch und -nachfrage in den USA gestiegen. Trotzdem spielten fossile Energiequellen eine geringere Rolle, die Erneuerbaren sind auf dem Vormarsch.",https://images.tagesschau.de/image/76ae7744-a97a-4c9f-823b-1675f8d9f948/AAABlYkehog/AAABkZLhkrw/16x9-1280/usa-windpark-100.jpg,2025-03-12T07:29:46Z,,"Stand: 12.03.2025 08:29 Uhr
2024 sind Stromverbrauch und -nachfrage in den USA gestiegen. Trotzdem spielten fossile Energiequellen eine geringere Rolle, die Erneuerbaren sind auf dem Vormarsch.
Tro… [+1364 chars]",,de,'Solar'
https://www.stern.de/wirtschaft/news/oekostrom--fast-60-prozent-strom-aus-erneuerbaren-energien-35544038.html,https://www.stern.de/wirtschaft/news/oekostrom--fast-60-prozent-strom-aus-erneuerbaren-energien-35544038.html,0,www.stern.de,Ökostrom: Fast 60 Prozent Strom aus erneuerbaren Energien,"Wind, Sonne, Wasser: Erneuerbare Energien sind Deutschlands wichtigste Quellen bei der Stromerzeugung. Im vergangenen Jahr wuchs der Anteil sogar noch.",https://image.stern.de/35544040/t/nm/v1/w1440/r1.7778/-/12--zr7ruttym3v11axs2048jpeg---7e9e2bd64769f58b.jpg,2025-03-12T08:14:27Z,,"Kopiere den aktuellen Link
Zur Merkliste hinzufügen
Wind, Sonne, Wasser: Erneuerbare Energien sind Deutschlands wichtigste Quellen bei der Stromerzeugung. Im vergangenen Jahr wuchs der Anteil sogar… [+2113 chars]",,de,'Erneuerbare'
https://www.tagesspiegel.de/wirtschaft/okostrom-fast-60-prozent-strom-aus-erneuerbaren-energien-13352662.html,https://www.tagesspiegel.de/wirtschaft/okostrom-fast-60-prozent-strom-aus-erneuerbaren-energien-13352662.html,0,www.tagesspiegel.de,Ökostrom: Fast 60 Prozent Strom aus erneuerbaren Energien,"Wind, Sonne, Wasser: Erneuerbare Energien sind Deutschlands wichtigste Quellen bei der Stromerzeugung. Im vergangenen Jahr wuchs der Anteil sogar noch.",https://www.tagesspiegel.de/images/13352659/alternates/BASE_16_9_W1400/1741767324000/windrad-hinter-solarkraftanlage.jpeg,2025-03-12T08:15:24Z,,"Rekord für die Ökostrom-Produktion in Deutschland: 59,4 Prozent des Stroms, der im vergangenen Jahr hierzulande erzeugt und ins Netz eingespeist wurde, stammte aus erneuerbaren Energiequellen wie Win… [+2626 chars]",,de,'Erneuerbare'
https://www.stern.de/news/oekostromanteil-steigt-2024-auf-knapp-60-prozent-35544842.html,https://www.stern.de/news/oekostromanteil-steigt-2024-auf-knapp-60-prozent-35544842.html,0,www.stern.de,Ökostromanteil steigt 2024 auf knapp 60 Prozent,"So viel Strom wie nie stammte im vergangenen Jahr in Deutschland aus erneuerbaren Energiequellen: Windkraft-, Solar-, Biogas- und Wasserkraftanlagen lieferten 256,4 Milliarden Kilowattstunden Strom, das waren 2,3 Prozent mehr als im Vorjahr, wie das Statistis…",https://image.stern.de/35544844/t/_5/v1/w1440/r1.7778/-/12--windkraftanlage-nahe-neurath-in-nordrheinwestfalen---8b2b712cfe2347bc.jpg,2025-03-12T10:57:37Z,,"Kopiere den aktuellen Link
Zur Merkliste hinzufügen
So viel Strom wie nie stammte im vergangenen Jahr in Deutschland aus erneuerbaren Energiequellen: Windkraft-, Solar-, Biogas- und Wasserkraftanla… [+2102 chars]",,de,'Wasserkraft'
https://www.golem.de/sonstiges/zustimmung/auswahl.html?from=https://www.golem.de/news/automatisierung-mobile-fabrik-installiert-solarpanels-eigenstaendig-2503-194224.html&referer=https://t.co/014add91b1,https://www.golem.de/sonstiges/zustimmung/auswahl.html?from=https://www.golem.de/news/automatisierung-mobile-fabrik-installiert-solarpanels-eigenstaendig-2503-194224.html&referer=https://t.co/014add91b1,0,www.golem.de,Automatisierung: Mobile Fabrik installiert Solarpanels eigenständig,"Um den Solarausbau zu beschleunigen und gleichzeitig die Kosten zu senken, soll die Montage großer Flächen automatisch erfolgen. (Energiewende, Roboter)",,2025-03-12T13:45:01Z,,"Besuchen Sie Golem.de wie gewohnt mit Werbung und Tracking,
 indem Sie der Nutzung aller Cookies zustimmen.
 Details zum Tracking finden Sie im Privacy Center.
Skript wurde nicht geladen. Informat… [+607 chars]",,de,'Energiewende'
https://www.n-tv.de/wirtschaft/Wir-vervier-oder-verfuenffachen-die-Produktion-eines-Windparks-article25621026.html,https://www.n-tv.de/wirtschaft/Wir-vervier-oder-verfuenffachen-die-Produktion-eines-Windparks-article25621026.html,0,www.n-tv.de,"Mehr Strom durch Repowering: ""Wir vervier- oder verfünffachen die Produktion eines Windparks""",Lange Genehmigungsverfahren waren das Nadelöhr der Energiewende. Dank der Ampel erhalten Windkraft-Projekte ihre Genehmigungen inzwischen deutlicher schneller. Auch durch das sogenannte Repowering erzeugt Deutschland mehr grünen Strom.,https://www.n-tv.de/img/incoming/crop25621024/1781324360-cImg_16_9-w1200/506103533.jpg,2025-03-12T14:00:00Z,,Lange Genehmigungsverfahren waren das Nadelöhr der Energiewende. Dank der Ampel erhalten Windkraft-Projekte ihre Genehmigungen inzwischen deutlicher schneller. Auch durch das sogenannte Repowering er… [+2982 chars],,de,'Energiewende'
https://www.faz.net/aktuell/wirtschaft/unternehmen/katastrophale-entwicklung-firmen-befinden-sich-im-investitionsstreik-110351282.html,https://www.faz.net/aktuell/wirtschaft/unternehmen/katastrophale-entwicklung-firmen-befinden-sich-im-investitionsstreik-110351282.html,0,www.faz.net,Katastrophale Entwicklung: Firmen befinden sich im Investitionsstreik,Fast jedes zweite Auto ist geleast. Doch die mit Leasing finanzierten Investitionen in Maschinen und IT knicken ein. Deutschlands Kapitalstock veraltet. Lässt er sich erneuern?,https://media1.faz.net/ppmedia/aktuell/wirtschaft/1492717277/1.10351383/facebook_teaser/hoher-finanzbedarf-mehr-als.jpg,2025-03-12T14:05:21Z,,"Die von Transformation und weltpolitischer Unsicherheit erschütterte deutsche Wirtschaft erlebt eine Investitionskrise. Wir sind mittlerweile eine kapitalschwache Volkswirtschaft geworden, sagte der … [+3647 chars]",,de,'Investitionen'
https://www.n-tv.de/ratgeber/PV-Kosten-absetzen-Wann-der-Einspruch-beim-Finanzamt-lohnt-article25623240.html,https://www.n-tv.de/ratgeber/PV-Kosten-absetzen-Wann-der-Einspruch-beim-Finanzamt-lohnt-article25623240.html,0,www.n-tv.de,Nachträglich profitieren: PV-Kosten absetzen: Wann der Einspruch beim Finanzamt lohnt,"Seit 2022 sind Einnahmen vieler privater Photovoltaik-Anlagen von der Steuer befreit. Unklar ist aber, ob damit auch die Kosten nicht mehr steuerlich abzugsfähig sind. Das können Sie tun.",https://www.n-tv.de/img/incoming/crop25622709/2621323057-cImg_16_9-w1200/Ausgaben-fur-Photovoltaik-Anlagen-steuerlich-geltend-machen-Seit-2022-ist-das-eigentlich-nicht-mehr-moglich-aber-eben-auch-nur-eigentlich.jpg,2025-03-12T14:24:48Z,,"Seit 2022 sind Einnahmen vieler privater Photovoltaik-Anlagen von der Steuer befreit. Unklar ist aber, ob damit auch die Kosten nicht mehr steuerlich abzugsfähig sind. Das können Sie tun.
Seit 2022 … [+2130 chars]",,de,'Photovoltaik'
