index,url,valid,domain,title,description,image,published,archive,content,quote,language,keyword
https://www.tagesspiegel.de/wirtschaft/hochststand-im-sommer-erreicht-fast-zwei-drittel-der-stromerzeugung-stammten-aus-erneuerbaren-energien-12829925.html,https://www.tagesspiegel.de/wirtschaft/hochststand-im-sommer-erreicht-fast-zwei-drittel-der-stromerzeugung-stammten-aus-erneuerbaren-energien-12829925.html,0,www.tagesspiegel.de,Höchststand im Sommer erreicht: Fast zwei Drittel der Stromerzeugung stammten aus erneuerbaren Energien,Zu diesem Ergebnis kommt das Statistische Bundesamt. Wind - und Solarenergie erreichten einen neuen Bestwert für ein drittes Quartal. Das stärkste Wachstum zeigte die Photovoltaik.,https://www.tagesspiegel.de/images/12830114/alternates/BASE_16_9_W1400/1733477308000/solar-und-windkraft.jpeg,2024-12-06T09:53:57Z,,"Fast zwei Drittel der deutschen Stromerzeugung stammten wegen des Solarbooms im Sommer aus erneuerbarer Energie. Von Juli bis September wurden insgesamt 96,3 Milliarden Kilowattstunden Strom erzeugt … [+2553 chars]",,de,'Solar'
https://www.stern.de/gesellschaft/regional/baden-wuerttemberg/energiewende--erneut-nur-wenige-neue-windraeder-im-suedwesten-gebaut-35288418.html,https://www.stern.de/gesellschaft/regional/baden-wuerttemberg/energiewende--erneut-nur-wenige-neue-windraeder-im-suedwesten-gebaut-35288418.html,0,www.stern.de,Energiewende: Erneut nur wenige neue Windräder im Südwesten gebaut,"Das von ihm ausgegebene Ziel, 2024 einhundert neue Windräder zu bauen, hat Ministerpräsident Kretschmann schon Anfang des Jahres kassiert. Nun zeigt sich: Davon ist man noch weit entfernt.",https://image.stern.de/35288420/t/1L/v1/w1440/r1.7778/-/06--byomcg5dnev3axs2048jpeg---72f0accb70fe2561.jpg,2024-12-06T10:03:44Z,,"Kopiere den aktuellen Link
Das von ihm ausgegebene Ziel, 2024 einhundert neue Windräder zu bauen, hat Ministerpräsident Kretschmann schon Anfang des Jahres kassiert. Nun zeigt sich: Davon ist man no… [+1894 chars]",,de,'Energiewende'
https://t3n.de/news/kernenergie-und-kohle-zur-stromversorgung-noetig-was-eine-studie-zu-grundlastkraftwerken-ermittelt-hat-1661856/,https://t3n.de/news/kernenergie-und-kohle-zur-stromversorgung-noetig-was-eine-studie-zu-grundlastkraftwerken-ermittelt-hat-1661856/,0,t3n.de,Kernenergie und Kohle zur Stromversorgung nötig? Was eine Studie zu Grundlastkraftwerken ermittelt hat,"Brauchen wir angesichts schwankender Einspeisung von Wind- und Solarstrom weiterhin Grundlastkraftwerke, um die Stromversorgung zu sichern? Eine neue Studie ist dieser Frage nachgegangen.
weiterlesen auf t3n.de",https://t3n.de/news/wp-content/uploads/2024/09/openai-kraftwerke.jpg,2024-12-06T10:15:05Z,,"Im Großen und Ganzen liefern die erneuerbaren Energien zuverlässig Strom, aber manchmal eben auch nicht. Ihr Anteil an der Last schwankte 2024 zwischen knapp elf und mehr als 137 Prozent.
Vielen Leu… [+3934 chars]",,de,'Solar'
https://www.faz.net/aktuell/wirtschaft/unternehmen/solarunternehmen-meyer-burger-sichert-sich-frisches-geld-110157917.html,https://www.faz.net/aktuell/wirtschaft/unternehmen/solarunternehmen-meyer-burger-sichert-sich-frisches-geld-110157917.html,0,www.faz.net,Solarunternehmen: Meyer Burger sichert sich frisches Geld,Dank frischer Gelder könnte der Solarmodulhersteller seinen wichtigsten Kunden vielleicht doch noch halten. Allerings klafft weiterhin eine Lücke in der Finanzierung.,https://media0.faz.net/ppmedia/aktuell/wirtschaft/2187030585/1.10157934/facebook_teaser/in-der-produktion-von-meyer.jpg,2024-12-06T10:18:00Z,http://archive.md/20241206172106/https://www.faz.net/aktuell/wirtschaft/unternehmen/solarunternehmen-meyer-burger-sichert-sich-frisches-geld-110157917.html,"Zieht der hochdefizitäre Solarmodulhersteller Meyer Burger doch noch den Kopf aus der Schlinge? Glaubt man dem Verwaltungsratspräsidenten Franz Richter, der seit dem Abgang von Gunter Erfurt auch den… [+3789 chars]",,de,'Ausbau'
https://www.stern.de/politik/deutschland/protestaktion--greenpeace-will-superreiche-fuers-klima-besteuern-35288502.html,https://www.stern.de/politik/deutschland/protestaktion--greenpeace-will-superreiche-fuers-klima-besteuern-35288502.html,0,www.stern.de,Protestaktion: Greenpeace will Superreiche fürs Klima besteuern,Berlin - Eine neue Vermögensteuer könnte nach einem Greenpeace-Konzept in wenigen Jahren bis zu 200 Milliarden Euro für Investitionen in Klimaschutz,https://image.stern.de/35288504/t/DI/v1/w1440/r1.7778/-/06--22wlwdyysjv8axs2048jpeg---00ec5f6bb472a78d.jpg,2024-12-06T10:22:48Z,,"Kopiere den aktuellen Link
Multimillionäre haben oft einen besonders schlechten ökologischen Fußabdruck. Greenpeace will sie daher zur Kasse bitten.
Eine neue Vermögensteuer könnte nach einem Green… [+1167 chars]",,de,'Ausbau'
https://www.focus.de/finanzen/aufgestockte-rente-empfaengerin-sagt-warum-buergergeld-kaum-zum-leben-reicht-friere-bin-einsam_id_260522881.html,https://www.focus.de/finanzen/aufgestockte-rente-empfaengerin-sagt-warum-buergergeld-kaum-zum-leben-reicht-friere-bin-einsam_id_260522881.html,0,www.focus.de,"Erwerbsminderungsrente mit Aufstockung - „Friere, bin einsam“: Empfängerin erklärt, warum Bürgergeld kaum zum Leben reicht","Heike Bracht bezieht Erwerbsminderungsrente mit Aufstockung durch Bürgergeld. Den ganzen Winter über friert sie, die Heizung hochzudrehen wäre zu teuer. Dabei dachte sie mal: Wenn ich alles richtig mache, bleibe ich vom Schicksal verschont.Von FOCUS-online-Au…",https://p6.focus.de/img/regional/mecklenburg-vorpommern/id_260301134/beduerftige-rentner-mit-entfallenen-anspruechen-aus-ddr-zeiten-koennen-antraege-auf-einen-haertefallfonds-stellen.-archivbild-.jpg?im=Crop%3D%280%2C138%2C2048%2C1024%29%3BResize%3D%281200%2C627%29&impolicy=perceptual&quality=mediumHigh&hash=712eb82f6e66b5d6ed09692049c642820cff866c893836a9a7f253b9238ca286,2024-12-06T12:37:07Z,,"Heike Bracht bezieht Erwerbsminderungsrente mit Aufstockung durch Bürgergeld. Den ganzen Winter über friert sie, die Heizung hochzudrehen wäre zu teuer. Dabei dachte sie mal: Wenn ich alles richtig m… [+11668 chars]",,de,'Winter'
https://www.focus.de/finanzen/aufgestockte-rente-grundsicherungs-empfaengerin-muss-frieren-und-rechnet-vor_id_260522881.html,https://www.focus.de/finanzen/aufgestockte-rente-grundsicherungs-empfaengerin-muss-frieren-und-rechnet-vor_id_260522881.html,0,www.focus.de,"Aufgestockte Rente - „Friere, bin einsam“: Empfängerin erklärt, warum Grundsicherung kaum zum Leben reicht","Heike Bracht bezieht Erwerbsminderungsrente mit Aufstockung. Den ganzen Winter über friert sie, die Heizung hochzudrehen wäre zu teuer. Dabei dachte sie mal: Wenn ich alles richtig mache, bleibe ich verschont.Von FOCUS-online-Autorin Elisabeth Hussendörfer",https://p6.focus.de/img/regional/mecklenburg-vorpommern/id_260301134/beduerftige-rentner-mit-entfallenen-anspruechen-aus-ddr-zeiten-koennen-antraege-auf-einen-haertefallfonds-stellen.-archivbild-.jpg?im=Crop%3D%280%2C138%2C2048%2C1024%29%3BResize%3D%281200%2C627%29&impolicy=perceptual&quality=mediumHigh&hash=712eb82f6e66b5d6ed09692049c642820cff866c893836a9a7f253b9238ca286,2024-12-06T12:37:07Z,,"Heike Bracht bezieht Erwerbsminderungsrente mit Aufstockung. Den ganzen Winter über friert sie, die Heizung hochzudrehen wäre zu teuer. Dabei dachte sie mal: Wenn ich alles richtig mache, bleibe ich … [+11631 chars]",,de,'Heizen'
https://www.focus.de/finanzen/grundsicherung_id_260522881.html,https://www.focus.de/finanzen/grundsicherung_id_260522881.html,0,www.focus.de,"Erwerbsminderungsrente mit Aufstockung - „Friere, bin einsam“: Empfängerin erklärt, warum Bürgergeld kaum zum Leben reicht","Heike Bracht* bezieht Erwerbsminderungsrente mit Aufstockung durch Bürgergeld. Den ganzen Winter über friert sie, die Heizung hochzudrehen wäre zu teuer. Die 50-jährige findet: Schicksale wie ihres gehören mehr in die Öffentlichkeit. Schließlich hätte auch si…",https://p6.focus.de/img/regional/mecklenburg-vorpommern/id_260301134/beduerftige-rentner-mit-entfallenen-anspruechen-aus-ddr-zeiten-koennen-antraege-auf-einen-haertefallfonds-stellen.-archivbild-.jpg?im=Crop%3D%280%2C138%2C2048%2C1024%29%3BResize%3D%281200%2C627%29&impolicy=perceptual&quality=mediumHigh&hash=712eb82f6e66b5d6ed09692049c642820cff866c893836a9a7f253b9238ca286,2024-12-06T12:37:07Z,,"Heike Bracht* bezieht Erwerbsminderungsrente mit Aufstockung durch Bürgergeld. Den ganzen Winter über friert sie, die Heizung hochzudrehen wäre zu teuer. Die 50-jährige findet: Schicksale wie ihres g… [+11767 chars]",,de,'Winter'
https://www.golem.de/sonstiges/zustimmung/auswahl.html?from=https://www.golem.de/news/windkraft-und-solar-stromerzeugung-aus-erneuerbaren-energien-erreicht-rekord-2412-191491.html&referer=https://t.co/cfe02a008a,https://www.golem.de/sonstiges/zustimmung/auswahl.html?from=https://www.golem.de/news/windkraft-und-solar-stromerzeugung-aus-erneuerbaren-energien-erreicht-rekord-2412-191491.html&referer=https://t.co/cfe02a008a,0,www.golem.de,Windkraft und Solar: Stromerzeugung aus erneuerbaren Energien erreicht Rekord,"Windkraft und Photovoltaik sind im dritten Quartal wichtigste Quellen für die Stromerzeugung vor Kohle gewesen. Ein Grund: das Wetter. (Erneuerbare Energien, Solarenergie)",,2024-12-06T12:55:08Z,,"Besuchen Sie Golem.de wie gewohnt mit Werbung und Tracking,
 indem Sie der Nutzung aller Cookies zustimmen.
 Details zum Tracking finden Sie im Privacy Center.
Skript wurde nicht geladen. Informat… [+607 chars]",,de,'Erneuerbare'
https://www.focus.de/earth/analyse/grundlast-nicht-notwendig-neue-studie-raeumt-mit-dem-groessten-mythos-der-energiewende-auf_id_260540456.html,https://www.focus.de/earth/analyse/grundlast-nicht-notwendig-neue-studie-raeumt-mit-dem-groessten-mythos-der-energiewende-auf_id_260540456.html,0,www.focus.de,Grundlast „nicht notwendig“ - Neue Studie räumt mit dem größten Mythos der Energiewende auf,"Ist die Energiewende unmöglich, solange es keine „Grundlast“-fähigen Kraftwerke gibt? Nein, zeigt jetzt eine neue Studie: Ein Energiesystem braucht keine Kraftwerke, die 24 Stunden am Tag laufen. Wichtig sei stattdessen etwas anderes.Von Tim Gabel",https://p6.focus.de/img/politik/deutschland/id_260540455/experten-zufolge-werden-grundlasttechnologien-wie-kernkraftwerke-fuer-die-energieversorgung-in-zukunft-nicht-mehr-gebraucht.-unverzichtbar-sei-dagegen-eine-kombination-aus-solar-und-windenergieanlagen..jpg?im=Crop%3D%280%2C0%2C1920%2C960%29%3BResize%3D%281200%2C627%29&impolicy=perceptual&quality=mediumHigh&hash=0a1ab2bda2f68f147fc82f733a8d98c31f36fb945c58ad563ed73955d701da6d,2024-12-06T13:40:15Z,,"<ul><li>
Kommentare</li><li>
E-Mail</li><li>
Teilen</li><li>
Mehr</li><li>
Twitter</li><li>
Drucken</li><li>
Feedback</li><li>
Fehler meldenSie haben einen Fehler gefunden?
Bitte markieren S… [+3452 chars]",,de,'Ausbau'
https://www.telepolis.de/features/Politiker-verschlafen-Speicher-Revolution-Energiewende-vor-dem-Aus-10190821.html,https://www.telepolis.de/features/Politiker-verschlafen-Speicher-Revolution-Energiewende-vor-dem-Aus-10190821.html,0,www.telepolis.de,Politiker verschlafen Speicher-Revolution – Energiewende vor dem Aus?,Deutschland benötigt mehr Stromspeicher. Doch die Politik verschläft den Ausbau. Droht damit das Ende der Energiewende?,https://heise.cloudimg.io/bound/1200x1200/q85.png-lossy-85.webp-lossy-85.foil1/_www-heise-de_/imgs/18/4/7/5/8/6/4/3/Dunkelflaute-Speicher-2_Zeichenfla__che_1-1bdee37f4eade9ad.png,2024-12-06T15:00:00Z,https://web.archive.org/web/20241207183055/https://www.telepolis.de/features/Politiker-verschlafen-Speicher-Revolution-Energiewende-vor-dem-Aus-10190821.html,"Deutschland benötigt mehr Stromspeicher. Doch die Politik verschläft den Ausbau. Droht damit das Ende der Energiewende?
Während Deutschland mit Hochdruck an der Energiewende arbeitet, könnte ein ent… [+5821 chars]",,de,'Ausbau'
https://www.n-tv.de/wirtschaft/Zwei-Drittel-des-Stroms-im-Sommer-aus-Erneuerbaren-article25414985.html,https://www.n-tv.de/wirtschaft/Zwei-Drittel-des-Stroms-im-Sommer-aus-Erneuerbaren-article25414985.html,0,www.n-tv.de,Höchster Wert jemals: Zwei Drittel des Stroms im Sommer aus Erneuerbaren,Der Sommer dieses Jahres brachte einen neuen Rekord beim Anteil Erneuerbarer an der Stromerzeugung. Vor allem die Solarstrom-Produktion legte deutlich zu. Wichtigster Energieträger war jedoch einmal mehr die Windkraft.,https://bilder2.n-tv.de/img/incoming/crop25415265/6301326549-cImg_16_9-w1200/479621989.jpg,2024-12-06T15:37:45Z,https://web.archive.org/web/20241207072120/https://www.n-tv.de/wirtschaft/Zwei-Drittel-des-Stroms-im-Sommer-aus-Erneuerbaren-article25414985.html,Der Sommer dieses Jahres brachte einen neuen Rekord beim Anteil Erneuerbarer an der Stromerzeugung. Vor allem die Solarstrom-Produktion legte deutlich zu. Wichtigster Energieträger war jedoch einmal … [+2289 chars],,de,'Photovoltaik'
https://www.kicker.de/wintersport-live/biathlon/co1211/kontiolahti/ma10272446/live-ticker/,https://www.kicker.de/wintersport-live/biathlon/co1211/kontiolahti/ma10272446/live-ticker/,0,www.kicker.de,Nawrath im Sprint auf dem Podium,Die deutschen Biathleten haben sich im Sprint von Kontiolahti voll rehabilitiert. Drei Tage nach dem Debakel im Einzel hat Philipp Nawrath für die erste Podiumsplatzierung der DSV-Männer in diesem Winter gesorgt.,,2024-12-06T16:33:03Z,,"Werbung und Tracking: Um dir relevante Inhalte und personalisierte Werbung anzubieten, setzen wir Cookies und andere Technologien ein. Damit messen wir, wie und womit du unsere Angebote nutzt. Diese … [+1979 chars]",,de,'Winter'
https://www.n-tv.de/politik/IAEA-meldet-drastischen-iranischen-Ausbau-der-Uran-Produktion-article25415820.html,https://www.n-tv.de/politik/IAEA-meldet-drastischen-iranischen-Ausbau-der-Uran-Produktion-article25415820.html,0,www.n-tv.de,Fast atomwaffenfähig: IAEA meldet drastischen iranischen Ausbau der Uran-Produktion,Die Regierung in Teheran strebt nach eigenen Angaben nicht nach Nuklearwaffen. Doch das Regime steigert die Herstellung von fast atomwaffentauglichem Uran deutlich. Ein Sprengkopf ließe sich damit wohl in kurzer Zeit herstellen.,https://bilder1.n-tv.de/img/incoming/crop25397452/3151323825-cImg_16_9-w1200/214534765.jpg,2024-12-06T18:44:49Z,,Die Regierung in Teheran strebt nach eigenen Angaben nicht nach Nuklearwaffen. Doch das Regime steigert die Herstellung von fast atomwaffentauglichem Uran deutlich. Ein Sprengkopf ließe sich damit wo… [+1865 chars],,de,'Ausbau'
https://www.bild.de/politik/ausland-und-internationales/ukraine-krieg-kaelte-bomben-angst-so-ist-die-lage-vor-dem-winter-67498d246ee5aa76f748d2fa,https://www.bild.de/politik/ausland-und-internationales/ukraine-krieg-kaelte-bomben-angst-so-ist-die-lage-vor-dem-winter-67498d246ee5aa76f748d2fa,0,www.bild.de,Noch ein Kriegs-Winter! - So schlimm steht es wirklich um die Ukraine,Im dritten Kriegswinter will Russland die Menschen in der Ukraine zermürben. Auf wem nun vage Hoffnungen beruhen.,"https://images.bild.de/67498d246ee5aa76f748d2fa/598b23d3d54b000dfba01e5fa2c2a129,1da8f694?w=1280",2024-12-06T18:49:14Z,http://archive.md/20241206195800/https://www.bild.de/politik/ausland-und-internationales/ukraine-krieg-kaelte-bomben-angst-so-ist-die-lage-vor-dem-winter-67498d246ee5aa76f748d2fa,"Kälte, Schnee, Dunkelheit Millionen Menschen in der Ukraine werden diesen Winter in seiner ganzen Härte zu spüren bekommen. Russlands Armee attackiert seit Wochen gezielt die kritische Infrastruktur … [+278 chars]",,de,'Winter'
https://www.bild.de/news/ausland/alpen-150-winter-urlauber-sitzen-fest-seilbahn-ausgefallen-675347d1e2def37e766ce0a4,https://www.bild.de/news/ausland/alpen-150-winter-urlauber-sitzen-fest-seilbahn-ausgefallen-675347d1e2def37e766ce0a4,0,www.bild.de,Seilbahn ausgefallen! - 150 Winter-Urlauber sitzen in den Alpen fest,"Für das Gebiet herrscht eine Windwarnung, es wird mit Temperaturen von minus 4 Grad gerechnet.","https://images.bild.de/675347d1e2def37e766ce0a4/cfca4af168f15af69792d6ab088138ff,875dbef5?w=1280",2024-12-06T19:01:50Z,,In den italienischen Alpen sitzen wegen wetterbedingter Seilbahnausfälle etwa 150 Menschen an verschiedenen Bergstationen fest. In dem Skigebiet Alagna Valsesia im Piemont an der Grenze zur Schweiz s… [+971 chars],,de,'Winter'
https://www.zeit.de/politik/deutschland/2024-12/fdp-gesetzentwurf-kalte-progression-absage,https://www.zeit.de/politik/deutschland/2024-12/fdp-gesetzentwurf-kalte-progression-absage,0,www.zeit.de,Inflationsausgleich: FDP will Gesetzentwurf zur Kalten Progression nicht mehr unterstützen,Neben der Union will auch die FDP steuerliche Entlastungen angesichts der Inflation nicht in der vorliegenden Form mittragen. Einem Ampel-Gesetzentwurf droht nun das Aus.,https://img.zeit.de/politik/deutschland/2024-12/gesetzentwurf-kalte-progression-fdp-absage-bild/wide__1300x731,2024-12-07T00:35:54Z,,"Beim Gesetzesentwurf zur Eindämmung der sogenannten Kalten Progression in der Besteuerung will die FDP
 so nicht mehr mitziehen. Nachdem auch die Union angekündigt hatte, das Vorhaben der zerbrochen… [+1415 chars]",,de,'Inflation'
https://www.stern.de/gesellschaft/regional/sachsen/skifahren--wintersportler-brauchen-geduld---wann-oeffnen-die-pisten--35290670.html,https://www.stern.de/gesellschaft/regional/sachsen/skifahren--wintersportler-brauchen-geduld---wann-oeffnen-die-pisten--35290670.html,0,www.stern.de,Skifahren: Wintersportler brauchen Geduld - Wann öffnen die Pisten?,"Mancherorts zeigt sich das Erzgebirge weiß. Die Stadt Oberwiesenthal will in den nächsten Tagen die Wintersaison einläuten. Doch reicht der Schnee, um auch erste Pisten zu öffnen?",https://image.stern.de/35290672/t/DZ/v1/w1440/r1.7778/-/07--xzobjlkh74v14axs2048jpeg---c9674d52a0f4622d.jpg,2024-12-07T04:00:38Z,,"Kopiere den aktuellen Link
Mancherorts zeigt sich das Erzgebirge weiß. Die Stadt Oberwiesenthal will in den nächsten Tagen die Wintersaison einläuten. Doch reicht der Schnee, um auch erste Pisten zu… [+2440 chars]",,de,'Winter'
https://www.zeit.de/news/2024-12/07/wintersportler-brauchen-geduld-wann-oeffnen-die-pisten,https://www.zeit.de/news/2024-12/07/wintersportler-brauchen-geduld-wann-oeffnen-die-pisten,0,www.zeit.de,Skifahren: Wintersportler brauchen Geduld - Wann öffnen die Pisten?,Hier finden Sie Informationen zu dem Thema „Skifahren“. Lesen Sie jetzt „Wintersportler brauchen Geduld - Wann öffnen die Pisten?“.,https://img.zeit.de/news/2024-12/07/wintersportler-brauchen-geduld-wann-oeffnen-die-pisten-image-group/wide__1300x731,2024-12-07T04:00:38Z,,"Vor einem Jahr konnten Skifahrer im Erzgebirge bereits vielerorts dem Wintersport frönen, dieses Jahr müssen sie sich noch gedulden. In den nächsten Tagen gehen die Temperaturen zurück, wie es beim D… [+2271 chars]",,de,'Winter'
https://www.globenewswire.com/news-release/2024/12/07/2993320/0/de/Modernisiertes-historisches-Live-Drama-wird-zur-Hauptattraktion-des-Wintertourismus-in-Nordchina.html,https://www.globenewswire.com/news-release/2024/12/07/2993320/0/de/Modernisiertes-historisches-Live-Drama-wird-zur-Hauptattraktion-des-Wintertourismus-in-Nordchina.html,0,www.globenewswire.com,Modernisiertes historisches Live-Drama wird zur Hauptattraktion des Wintertourismus in Nordchina,"XI'AN, China, Dec. 07, 2024 (GLOBE NEWSWIRE) -- Auf einer Bühne am Fuße des Lishan-Bergs in der nordwestchinesischen Stadt Xi'an vermischen sich Eis und Schnee mit Flammen, während Licht und Schatten mit Musik verschmelzen. Am 1. Dezember wurde vor der Kuliss…",,2024-12-07T06:25:00Z,,"XI'AN, China, Dec. 07, 2024 (GLOBE NEWSWIRE) -- Auf einer Bühne am Fuße des Lishan-Bergs in der nordwestchinesischen Stadt Xi'an vermischen sich Eis und Schnee mit Flammen, während Licht und Schatten… [+2674 chars]",,de,'Winter'
https://www.brigitte.de/rezepte/-schuemli-pfluemi---mit-diesem-winter-cocktail-feiern-die-schweizer-beim-apr%C3%A8s-ski-13145504.html,https://www.brigitte.de/rezepte/-schuemli-pfluemi---mit-diesem-winter-cocktail-feiern-die-schweizer-beim-apr%C3%A8s-ski-13145504.html,0,www.brigitte.de,"""Schümli Pflümi"": Mit diesem Cocktail feiern die Schweizer beim Après-Ski","Die Schweizer wissen wie kein anderes Volk, wie man den Winter in vollen Zügen genießt – zum Beispiel mit diesem leckeren Heißgetränk.",https://image.brigitte.de/13145498/t/11/v4/w1440/r1.7778/-/bildschirmfoto-2022-01-21-um-11-45-01.jpg,2024-12-07T07:00:00Z,,"Die Schweizer wissen wie kein anderes Volk, wie man den Winter in vollen Zügen genießt  zum Beispiel mit diesem leckeren Heißgetränk.
Zugegen, der Name erinnert vielleicht ein wenig an eine Kinderse… [+446 chars]",,de,'Winter'
https://www.bild.de/news/wetter/winter-wie-entsteht-schnee-und-ab-wann-bleibt-er-liegen-675024ee42045965872d17d3,https://www.bild.de/news/wetter/winter-wie-entsteht-schnee-und-ab-wann-bleibt-er-liegen-675024ee42045965872d17d3,0,www.bild.de,Winter - Wie entsteht eigentlich Schnee?,"Mal ist er fein, mal nass und pappig. Mal bleibt er liegen und dann schmilzt er wieder sofort. Wovon das abhängt und wie Schnee überhaupt entsteht, hier.","https://images.bild.de/675024ee42045965872d17d3/1720e6314a3bc5dad16779620855d29d,5e7fe863?w=1280",2024-12-07T07:00:44Z,,"Schneeflöckchen, Weißröckchen frischer, unberührter Schnee, der lautlos über Nacht gefallen ist und alles weiß überzieht.
Auch wenn man dadurch vielleicht länger für den Weg zur Arbeit braucht: Die … [+4886 chars]",,de,'Winter'
https://www.bild.de/news/ausland/influenzer-im-liebeswahn-da-schmilzt-sogar-der-schnee-6752276315647c4221e54e2c,https://www.bild.de/news/ausland/influenzer-im-liebeswahn-da-schmilzt-sogar-der-schnee-6752276315647c4221e54e2c,0,www.bild.de,Influenzer machen Lust auf Winter - Da schmilzt sogar der Schnee,"Heißer Winterzauber
Kaylee Killion und Cody Nelson – das perfekte Reise-Influencer-Paar!
Mitten im Schneeparadies machen sie ihren Followern Lust auf Win...","https://images.bild.de/6752276315647c4221e54e2c/eee6d20e9237df660133731d2ae79dcf,f4b3d1d8?w=1280",2024-12-07T07:42:51Z,,"Mehr zum Video anzeigen 
Heißer Winterzauber
Kaylee Killion und Cody Nelson das perfekte Reise-Influencer-Paar!
Mitten im Schneeparadies machen sie ihren Followern Lust auf Winterträume.
Quelle: … [+30 chars]",,de,'Winter'
https://www.faz.net/aktuell/wirtschaft/argentinien-mileis-kreuzzug-gegen-die-krise-110159215.html,https://www.faz.net/aktuell/wirtschaft/argentinien-mileis-kreuzzug-gegen-die-krise-110159215.html,0,www.faz.net,Mileis Kreuzzug gegen die Krise,Argentinien hat sich unter Präsident Javier Milei stark verändert. Die Inflation sinkt und nun auch die Armut. Doch der Prozess ist fragil und unberechenbar.,https://media0.faz.net/ppmedia/aktuell/wirtschaft/3929682905/1.10159212/facebook_teaser_fplus/protest-gegen-argentiniens-praesidenten.jpg,2024-12-07T09:31:23Z,http://archive.md/20241207093946/https://www.faz.net/aktuell/wirtschaft/argentinien-mileis-kreuzzug-gegen-die-krise-110159215.html,"In einer Hotellobby in Buenos Aires jammert eine Gruppe von Brasilianern. Wie teuer doch alles geworden sei seit dem letzten Mal in Argentinien, bemerken sie. Auf ihren Handys suchen sie nach einem a… [+767 chars]",,de,'Inflation'
https://www.nzz.ch/meinung/die-stromversorgung-darf-nicht-vom-wetterbericht-abhaengen-ld.1861217,https://www.nzz.ch/meinung/die-stromversorgung-darf-nicht-vom-wetterbericht-abhaengen-ld.1861217,0,www.nzz.ch,KOMMENTAR - Die Stromversorgung darf nicht vom Wetterbericht abhängen,Mit der Abschaltung des Kernkraftwerks Beznau bricht der Schweiz ein bedeutender Teil der Stromproduktion weg. Die Solarkraft allein kann die Versorgungslücke nicht schliessen.,"https://img.nzz.ch/2022/09/16/af8b0bc5-7d8f-47c3-b42a-1ddf55c6b8bc.jpeg?width=1200&height=674&fit=bounds&quality=75&auto=webp&crop=5000,2812,x0,y261&wmark=nzz",2024-12-07T17:16:13Z,http://archive.md/20241208074428/https://www.nzz.ch/meinung/die-stromversorgung-darf-nicht-vom-wetterbericht-abhaengen-ld.1861217,"In neun Jahren ist Schluss: Dach des Reaktorgebäudes in Beznau.
Energieminister Albert Rösti hätte die beiden Reaktoren gerne noch lange laufen lassen. Doch die Axpo hat diese Pläne nun durchkreuzt;… [+3445 chars]",,de,'Solar'
https://www.zeit.de/news/2024-12/08/krise-zieht-voraussichtlich-winterurlaub-in-mitleidenschaft,https://www.zeit.de/news/2024-12/08/krise-zieht-voraussichtlich-winterurlaub-in-mitleidenschaft,0,www.zeit.de,Tourismus: Krise zieht voraussichtlich Winterurlaub in Mitleidenschaft,Hier finden Sie Informationen zu dem Thema „Tourismus“. Lesen Sie jetzt „Krise zieht voraussichtlich Winterurlaub in Mitleidenschaft“.,https://img.zeit.de/news/2024-12/08/krise-zieht-voraussichtlich-winterurlaub-in-mitleidenschaft-image-group/wide__1300x731,2024-12-08T03:30:37Z,https://web.archive.org/web/20241209101054/https://www.zeit.de/news/2024-12/08/krise-zieht-voraussichtlich-winterurlaub-in-mitleidenschaft,Die anhaltende Wirtschaftskrise könnte in diesem Winter den bislang florierenden Tourismus in den Alpen bremsen. Eine Hauptursache ist nach Einschätzung von Ökonomen und Fachleuten die Verunsicherung… [+1280 chars],,de,'Winter'
