index,url,valid,domain,title,description,image,published,archive,content,quote,language,keyword
https://t3n.de/news/photovoltaik-sucht-dach-warum-nicht-auf-gewerbegebaeuden-1671404/,https://t3n.de/news/photovoltaik-sucht-dach-warum-nicht-auf-gewerbegebaeuden-1671404/,0,t3n.de,Photovoltaik sucht Dach: Warum nicht auf Gewerbegebäuden?,Gewerbedächer sind in vielerlei Hinsicht der ideale Standort für Photovoltaik-Anlagen. Doch genutzt wird das kaum. Der Grund ist allerdings keine technische Hürde.weiterlesen auf t3n.de,https://t3n.de/news/wp-content/uploads/2022/07/shutterstock-2070531506.jpg,2025-02-08T07:30:33Z,,Deutschland will bis 2023 seine Photovoltaikleistung mehr als verdreifachen. Gewerbedächer wären in vielerlei Hinsicht der ideale Standort für Solaranlagen. Oft bieten sie mehrere Tausend Quadratmete… [+15534 chars],,de,'Photovoltaik'
https://futurezone.at/digital-life/trump-streicht-plaene-e-ladestationen-usa-tesla/403008227,https://futurezone.at/digital-life/trump-streicht-plaene-e-ladestationen-usa-tesla/403008227,0,futurezone.at,Trump stoppt Pläne für Ausbau von E-Ladestationen,Auch Tesla bekam Geld für neue Ladestationen. Nun wird das Programm der Biden-Regierung auf Eis gelegt.,https://image.futurezone.at/images/facebook/8924365/46-198664786.jpg,2025-02-08T09:25:18Z,,Auch Tesla bekam Geld für neue Ladestationen. Nun wird das Programm der Biden-Regierung auf Eis gelegt.,,de,'Ausbau'
https://noe.orf.at/stories/3292393/,https://noe.orf.at/stories/3292393/,0,noe.orf.at,Strecke des Reblaus Express wird saniert,Die Strecke des Reblaus Express zwischen Retz (Bezirk Hollabrunn) und Drosendorf (Bezirk Horn) wird saniert. Das Land investiert 650.000 Euro. Zudem wollen die ÖBB die Pendlerinnen und Pendler bei Terminen über den Ausbau der Regionalbahnen informieren.,https://ibs.orf.at/noe?image=https%3A%2F%2Foekastatic.orf.at%2Fmims%2F2020%2F27%2F34%2Fcrops%2Fw%3D1200%2Ch%3D627%2Cq%3D75%2F611893_master_209734_48187773852_55d7d32f20_o.jpg%3Fs%3Ded89ee1d6b35d8ffe5decfa0568a8c94a923105e,2025-02-08T09:28:53Z,https://web.archive.org/web/20250209145819/https://noe.orf.at/stories/3292393/,Im Zuge der Maßnahmen wird die Thumeritzbachbrücke umfassend saniert. Dabei werden das bestehende Stahltragwerk sowie der Beton im Bereich der beiden Widerlager erneuert. Auch die Brückenhölzer und d… [+2330 chars],,de,'Ausbau'
https://t3n.de/news/us-regierung-bremst-den-ausbau-der-e-mobilitaet-und-bringt-tesla-in-eine-zwickmuehle-1672079/,https://t3n.de/news/us-regierung-bremst-den-ausbau-der-e-mobilitaet-und-bringt-tesla-in-eine-zwickmuehle-1672079/,0,t3n.de,US-Regierung bremst den Ausbau der E-Mobilität – und bringt Tesla in eine Zwickmühle,"Die Trump-Regierung setzt die milliardenschwere Förderung für den Ausbau der Elektroauto-Infrastruktur aus – ein harter Schlag für Tesla und die gesamte Branche. Doch was bedeutet das für Elon Musk und seine politische Strategie?
weiterlesen auf t3n.de",https://t3n.de/news/wp-content/uploads/2023/12/shutterstock_2318800313-1.jpg,2025-02-08T10:45:19Z,https://web.archive.org/web/20250209071638/https://t3n.de/news/us-regierung-bremst-den-ausbau-der-e-mobilitaet-und-bringt-tesla-in-eine-zwickmuehle-1672079,Das sogenannte NEVI-Programm (National Electric Vehicle Infrastructure) sollte den Ausbau der Infrastruktur für Elektroautos in den gesamten USA beschleunigen. Von den Fördergeldern hat auch Tesla er… [+2745 chars],,de,'Ausbau'
https://www.zeit.de/news/2025-02/08/weltmeisterin-laura-nolte-holt-em-titel-im-monobob,https://www.zeit.de/news/2025-02/08/weltmeisterin-laura-nolte-holt-em-titel-im-monobob,0,www.zeit.de,Wintersport: Weltmeisterin Laura Nolte holt EM-Titel im Monobob,Hier finden Sie Informationen zu dem Thema „Wintersport“. Lesen Sie jetzt „Weltmeisterin Laura Nolte holt EM-Titel im Monobob“.,https://img.zeit.de/news/2025-02/08/weltmeisterin-laura-nolte-holt-em-titel-im-monobob-image-group/wide__1300x731,2025-02-08T10:50:31Z,,Weltmeisterin Laura Nolte ist in Lillehammer zum zweiten Mal Europameisterin im Monobob geworden. Die Zweierbob-Olympiasiegerin von Peking konnte ihre Führung nach dem ersten Lauf im parallel ausgetr… [+1170 chars],,de,'Winter'
https://taz.de/Klima--und-Demokratiebewegung/!6068003/,https://taz.de/Klima--und-Demokratiebewegung/!6068003/,0,taz.de,Klima- und Demokratiebewegung: Jetzt schreiten sie Seit' an Seit',Fridays For Future ruft für den 14. Februar zum bundesweiten Klimastreik auf. Und kündigt den Ausbau der Kooperation mit der Demokratiebewegung an.,https://taz.de/picture/7517688/1200/36998916-1.jpeg,2025-02-08T12:42:00Z,https://web.archive.org/web/20250209012725/https://taz.de/Klima--und-Demokratiebewegung/!6068003/,Fridays For Future ruft für den 14. Februar zum bundesweiten Klimastreik auf. Und kündigt den Ausbau der Kooperation mit der Demokratiebewegung an. mehr...,,de,'Ausbau'
https://orf.at/stories/3383987/,https://orf.at/stories/3383987/,0,orf.at,Ecuador sucht Ausbruch aus Abwärtsspirale,"Wie ein „Phönix aus der Asche“ sollte Ecuador auferstehen – so zumindest der Plan des Präsidenten Daniel Noboa. Doch mit der umgreifenden Drogenkriminalität, explodierenden Mordraten, stagnierender Wirtschaft und nicht zuletzt einer umfassenden Energiekrise s…",https://ibs.orf.at/news?image=https%3A%2F%2Fassets.orf.at%2Fmims%2F2025%2F06%2F07%2Fcrops%2Fw%3D1200%2Ch%3D630%2Cq%3D75%2F2511196_master_961907_ecuador_wahlen_vorschau_im.jpg%3Fs%3D379f5e890455856e7051e9d83e5c91e9b87df461,2025-02-09T09:45:14Z,http://archive.md/20250209122439/https://orf.at/stories/3383987/,"Dass er Ecuador mit harter Hand regiert, zeigte der rechtsgerichtete Noboa von der Partei Accion Democratica Nacional (Nationaldemokratische Aktion) erneut, als er ankündigte, die Landesgrenzen von S… [+5489 chars]",,de,'Energiekrise'
https://www.zeit.de/2025/06/polarlichter-schweden-skandinavien-aurora-borealis,https://www.zeit.de/2025/06/polarlichter-schweden-skandinavien-aurora-borealis,0,www.zeit.de,Polarlichter: Das Licht ist mit den Glücklichen,Polarlichter sind nicht buchbar. Oder? In Nordschweden sind die Chancen auf das Spektakel in diesem Winter besonders hoch. Unsere Autorin hat sich auf die Suche gemacht.,https://img.zeit.de/2025/06/das-licht-ist-mit-den-gluecklichen-bild-5/wide__1300x731,2025-02-09T16:59:38Z,https://web.archive.org/web/20250210022425/https://www.zeit.de/2025/06/polarlichter-schweden-skandinavien-aurora-borealis,"Dieser Artikel ist Teil von ZEIT am Wochenende, Ausgabe 06/2025.
Da stehe ich nun, mitten im nordschwedischen Trostlosigkeitswinter, und versuche, Glück zu haben. Ringsum strecken strauchhohe Birken… [+781 chars]",,de,'Winter'
https://www.tagesspiegel.de/wirtschaft/zinsen-zuletzt-leicht-gefallen-banken-beobachten-steigende-immobilienpreise--rechnen-aber-nicht-mit-neuem-boom-13173610.html,https://www.tagesspiegel.de/wirtschaft/zinsen-zuletzt-leicht-gefallen-banken-beobachten-steigende-immobilienpreise--rechnen-aber-nicht-mit-neuem-boom-13173610.html,0,www.tagesspiegel.de,Zinsen zuletzt leicht gefallen: Banken beobachten steigende Immobilienpreise – rechnen aber nicht mit neuem Boom,"Menschen, die eine Wohnung oder ein Haus kaufen wollen, bezahlen etwas mehr als vor einem Jahr. Rasante Preisanstiege sind vorerst aber aus Sicht von Banken nicht zu erwarten.",https://www.tagesspiegel.de/images/11878847/alternates/BASE_16_9_W1400/1720772579000/neue-moderne-haeuser-wohnhaeuser-einfamilienhaus-einfamilienhaeuser-doppelhaus-doppelhaeuser-mit-photovoltaik-anlagen.jpeg,2025-02-10T08:10:09Z,,"Immobilienkäufer müssen wieder tiefer in die Tasche greifen, aus Sicht von Banken aber vorerst keine rasanten Preisanstiege fürchten. Im vierten Quartal 2024 waren Häuser und Wohnungen im Schnitt 2,1… [+3957 chars]",,de,'Preisanstieg'
https://www.zeit.de/wirtschaft/2025-02/heizkosten-heizen-deutschland-geld,https://www.zeit.de/wirtschaft/2025-02/heizkosten-heizen-deutschland-geld,0,www.zeit.de,Energiepreise: Sechs Prozent können in Deutschland nicht angemessen heizen,Im vergangenen Jahr sind die Heizkosten in Deutschland gesunken. Trotzdem konnten sich Millionen Menschen im Winter keine warme Wohnung leisten.,https://img.zeit.de/wirtschaft/2025-02/deutschland-haushalte-heizen-heizkosten-2024-bild/wide__1300x731,2025-02-10T08:32:46Z,http://archive.md/20250210091428/https://www.zeit.de/wirtschaft/2025-02/heizkosten-heizen-deutschland-geld,Millionen Menschen in Deutschland haben sich im vergangenen Jahr nach eigener Beurteilung kein ausreichend warmes Zuhause leisten können. Das zeigen Zahlen des Statistikamts der Europäischen Union au… [+2563 chars],,de,'Heizkosten'
https://www.n-tv.de/ratgeber/Gaspreise-fuer-Neukunden-rasant-gestiegen-article25550890.html,https://www.n-tv.de/ratgeber/Gaspreise-fuer-Neukunden-rasant-gestiegen-article25550890.html,0,www.n-tv.de,43 Prozent in einem Jahr: Gaspreise für Neukunden rasant gestiegen,Die Preisentwicklung in Sachen Heizen kennt gefühlt eigentlich nur eine Richtung: nach oben. Was insbesondere für die Gasheizung gilt. Für Neukunden kommt es jetzt noch mal besonders dicke.,https://www.n-tv.de/img/incoming/crop23419077/2431324790-cImg_16_9-w1200/imago0161059286h.jpg,2025-02-10T11:05:41Z,,"Die Preisentwicklung in Sachen Heizen kennt gefühlt eigentlich nur eine Richtung: nach oben. Was insbesondere für die Gasheizung gilt. Für Neukunden kommt es jetzt noch mal besonders dicke.
Laut ein… [+2473 chars]",,de,'Heizen'
https://www.tagesschau.de/wirtschaft/verbraucher/gaspreise-neukunden-verivox-100.html,https://www.tagesschau.de/wirtschaft/verbraucher/gaspreise-neukunden-verivox-100.html,0,www.tagesschau.de,Gas-Neuverträge 43 Prozent teurer als vor einem Jahr,"Wer jetzt einen neuen Gasvertrag abschließt, zahlt fast um die Hälfte mehr als Neukunden vor einem Jahr. Laut Verivox gibt es mehrere Gründe für den Preisanstieg.",https://images.tagesschau.de/image/5208ed99-5eb8-4caa-9d45-a58cd3ac2df9/AAABiJ8KRVE/AAABkZLhkrw/16x9-1280/gasflamme-124.jpg,2025-02-10T11:40:12Z,,"Stand: 10.02.2025 12:40 Uhr
Wer jetzt einen neuen Gasvertrag abschließt, zahlt fast um die Hälfte mehr als Neukunden vor einem Jahr. Laut Verivox gibt es mehrere Gründe für den Preisanstieg.
Die Ga… [+1869 chars]",,de,'Preisanstieg'
https://www.faz.net/aktuell/wirtschaft/klima-nachhaltigkeit/gaspreis-steigt-auf-hoechsten-stand-seit-zwei-jahren-110287453.html,https://www.faz.net/aktuell/wirtschaft/klima-nachhaltigkeit/gaspreis-steigt-auf-hoechsten-stand-seit-zwei-jahren-110287453.html,0,www.faz.net,Gaspreis steigt auf höchsten Stand seit zwei Jahren,In den letzten 12 Monaten hat sich der Gaspreis verdoppelt. Auch die Gasspeicher sind deutlich weniger stark gefüllt als vor einem Jahr.,https://media0.faz.net/ppmedia/aktuell/wirtschaft/796715490/1.10287486/facebook_teaser/gasheizung-in-leipzig.jpg,2025-02-10T13:40:05Z,http://archive.md/20250210165203/https://www.faz.net/aktuell/wirtschaft/klima-nachhaltigkeit/gaspreis-steigt-auf-hoechsten-stand-seit-zwei-jahren-110287453.html,Der Preis für europäisches Erdgas ist weiter im Höhenflug. Am Montag erreichte er mit der Aussicht auf weiter niedrige Temperaturen den höchsten Stand seit zwei Jahren. Der richtungweisenden Terminko… [+1945 chars],,de,'Gasspeicher'
https://www.nzz.ch/schweiz/ein-sozialarbeiter-warnt-es-laeuft-aus-dem-ruder-wir-muessen-die-sozialhilfe-zurueckbauen-ld.1868229,https://www.nzz.ch/schweiz/ein-sozialarbeiter-warnt-es-laeuft-aus-dem-ruder-wir-muessen-die-sozialhilfe-zurueckbauen-ld.1868229,0,www.nzz.ch,"INTERVIEW - Ein Sozialarbeiter warnt: «Es läuft aus dem Ruder, wir müssen die Sozialhilfe zurückbauen»",Urs Mühle ist seit fast fünfzig Jahren Teil des «Sozialkuchens». Lange kämpfte er für den Ausbau der Sozialhilfe. Heute nicht mehr. Im Gegenteil.,"https://img.nzz.ch/2025/01/31/43729e7b-f632-4075-8606-c325c4d5383e.jpeg?width=1200&height=675&fit=bounds&quality=75&auto=webp&crop=5568,3132,x0,y290&wmark=nzz",2025-02-10T15:43:59Z,http://archive.md/20250210160228/https://www.nzz.ch/schweiz/ein-sozialarbeiter-warnt-es-laeuft-aus-dem-ruder-wir-muessen-die-sozialhilfe-zurueckbauen-ld.1868229,"«Man unternimmt alles, um die Sozialhilfe von einem einfachen System der Nothilfe zu einer umfassenden Versicherung auszubauen»: Urs Mühle.
Als Urs Mühle Sozialarbeiter wurde, gab es das Wort noch g… [+11665 chars]",,de,'Ausbau'
https://www.golem.de/sonstiges/zustimmung/auswahl.html?from=https://www.golem.de/news/ftth-deutsche-glasfaser-braucht-ueber-eine-milliarde-euro-2502-193208.html&referer=https://t.co/c7e4ad676f,https://www.golem.de/sonstiges/zustimmung/auswahl.html?from=https://www.golem.de/news/ftth-deutsche-glasfaser-braucht-ueber-eine-milliarde-euro-2502-193208.html&referer=https://t.co/c7e4ad676f,0,www.golem.de,FTTH: Deutsche Glasfaser braucht über eine Milliarde Euro,"Deutsche Glasfaser braucht für den ländlichen FTTH-Ausbau schon wieder viel Geld. Ein Minderheitsanteil soll verkauft werden. (Deutsche Glasfaser, Glasfaser)",,2025-02-10T18:17:02Z,,"Besuchen Sie Golem.de wie gewohnt mit Werbung und Tracking,
 indem Sie der Nutzung aller Cookies zustimmen.
 Details zum Tracking finden Sie im Privacy Center.
Skript wurde nicht geladen. Informat… [+607 chars]",,de,'Ausbau'
https://www.zeit.de/news/2025-02/11/zu-lang-fuer-autobahnabfahrten-transporte-mit-rotorblaettern,https://www.zeit.de/news/2025-02/11/zu-lang-fuer-autobahnabfahrten-transporte-mit-rotorblaettern,0,www.zeit.de,Ausbau der Windenergie: Zu lang für Autobahnabfahrten? Transporte mit Rotorblättern,Hier finden Sie Informationen zu dem Thema „Ausbau der Windenergie“. Lesen Sie jetzt „Zu lang für Autobahnabfahrten? Transporte mit Rotorblättern“.,https://img.zeit.de/news/2025-02/11/zu-lang-fuer-autobahnabfahrten-transporte-mit-rotorblaettern-image-group/wide__1300x731,2025-02-11T05:30:36Z,,"Manche Anschlussstellen auf norddeutschen Autobahnen werden für Schwerlasttransporte zu einem Nadelöhr - etwa, wenn es um den Transport von großen Rotorblättern für Windkraftanlagen geht. Nach Angabe… [+4711 chars]",,de,'Ausbau'
https://www.zeit.de/news/2025-02/11/tui-legt-zum-winterstart-zu-verlust-verringert,https://www.zeit.de/news/2025-02/11/tui-legt-zum-winterstart-zu-verlust-verringert,0,www.zeit.de,Tourismus: Tui legt zum Winterstart zu – Verlust verringert,Hier finden Sie Informationen zu dem Thema „Tourismus“. Lesen Sie jetzt „Tui legt zum Winterstart zu – Verlust verringert“.,https://img.zeit.de/news/2025-02/11/tui-legt-zum-winterstart-zu-verlust-verringert-image-group/wide__1300x731,2025-02-11T06:58:26Z,,"Der weltgrößte Reisekonzern Tui ist mit klaren Zuwächsen in die Wintersaison gestartet. «Die Menschen priorisieren ihren Urlaub auch in Zeiten von Veränderung und konjunkturellen Risiken», sagte Tui-… [+1105 chars]",,de,'Winter'
https://www.businessinsider.de/gruenderszene/perspektive/diese-neun-startups-wollen-die-energiewende-vorantreiben/,https://www.businessinsider.de/gruenderszene/perspektive/diese-neun-startups-wollen-die-energiewende-vorantreiben/,0,www.businessinsider.de,Im Kampf gegen die Klimakrise: Das sind neun innovative Energie-Startups,"Mit 1,2 Milliarden Euro floss 2024 das meiste Wagniskapital in die Energie-Branche. Diese neun Startups wollen die Energiewende vorantreiben.",https://cdn.businessinsider.de/wp-content/uploads/2025/02/202501_GS_Artikel_Set100_v2_1800x1200.jpg?ver=1738852220,2025-02-11T07:00:00Z,https://web.archive.org/web/20250214161023/https://www.businessinsider.de/gruenderszene/perspektive/diese-neun-startups-wollen-die-energiewende-vorantreiben/,"Mit 1,2 Milliarden Euro ist im vergangenen Jahr das meiste Wagniskapital in die Energie-Branche geflossen. Wir stellen euch neun Startups vor, die die Energiewende vorantreiben wollen. Die Energiewen… [+9716 chars]",,de,'Energiewende'
https://www.horizont.net/agenturen/nachrichten/als-coo-international-markets-mediaplus-holt-ehemaligen-global-ceo-von-xaxis-225766,https://www.horizont.net/agenturen/nachrichten/als-coo-international-markets-mediaplus-holt-ehemaligen-global-ceo-von-xaxis-225766,0,www.horizont.net,Als COO International Markets: Mediaplus holt ehemaligen Global CEO von Xaxis,Die Mediaagenturgruppe Mediaplus arbeitet weiter an ihrem internationalen Ausbau. Dafür holt sie sich jetzt namhafte Verstärkung an Bord.,https://www.horizont.net/news/media/47/John-Wittesaele-461965.jpeg,2025-02-11T09:15:00Z,,Die Mediaagenturgruppe Mediaplus arbeitet weiter an ihrem internationalen Ausbau. Dafür holt sie sich jetzt namhafte Verstärkung an Bord. Als COO International Markets kommt der ehemalige Global CEO … [+397 chars],,de,'Ausbau'
https://stadt-bremerhaven.de/epic-games-store-der-winter-sale-beginnt/,https://stadt-bremerhaven.de/epic-games-store-der-winter-sale-beginnt/,0,stadt-bremerhaven.de,Epic Games Store: Der Winter-Sale beginnt,Im Epic Games Store hat der große Winter-Sale begonnen. Der läuft ab sofort und bis 24. Februar 2025. Es sind naturgemäß zahlreiche Spiele und DLCs zu reduzierten Preisen erhältlich. Zusätzliche Epic Points gibt es dieses Mal aber leider nicht als...Zum Beitr…,https://stadt-bremerhaven.de/wp-content/uploads/2025/02/Epic-Games-Winter-Sale.jpg,2025-02-11T10:00:40Z,,Im Epic Games Store hat der große Winter-Sale begonnen. Der läuft ab sofort und bis 24. Februar 2025. Es sind naturgemäß zahlreiche Spiele und DLCs zu reduzierten Preisen erhältlich. Zusätzliche Epic… [+1918 chars],,de,'Winter'
https://www.bild.de/leben-wissen/lifestyle/zeitumstellung-wann-wird-die-uhr-vor-und-wann-zurueckgestellt-66faa5fd79629e3eb0e7ec08,https://www.bild.de/leben-wissen/lifestyle/zeitumstellung-wann-wird-die-uhr-vor-und-wann-zurueckgestellt-66faa5fd79629e3eb0e7ec08,0,www.bild.de,Zeitumstellung - Wann wird die Uhr vor und wann zurückgestellt?,Jedes Jahr wird zweimal die Uhr umgestellt. Aber warum ist das so und wann wird auf Sommer- oder Winterzeit gewechselt? Alle Infos lesen Sie hier.,"https://images.bild.de/66faa5fd79629e3eb0e7ec08/c6321f7c4b7f613e072e3ce6d52d6e7e,71d26f0e?w=1280",2025-02-11T10:46:54Z,,"Wer hat an der Uhr gedreht?
Jedes Jahr aufs Neue werden in Deutschland die Uhren umgestellt. Je nachdem, ob es Sommer- oder Winterzeit wird, bekommen wir eine Stunde geschenkt oder es wird eine gekl… [+4384 chars]",,de,'Winter'
https://www.focus.de/finanzen/fruehrentnerin-andrea-48-kann-es-sich-nicht-leisten-zu-heizen_bd2d8283-5a88-4e6b-a1e7-40f9347a759c.html,https://www.focus.de/finanzen/fruehrentnerin-andrea-48-kann-es-sich-nicht-leisten-zu-heizen_bd2d8283-5a88-4e6b-a1e7-40f9347a759c.html,0,www.focus.de,Bringt sie an ihre Grenzen - Frührentnerin Andrea (48) kann es sich nicht leisten zu heizen: „Mir ist immer kalt“,Andrea kämpft mit den hohen Heizkosten und der Isolation in ihrer kalten Wohnung. Doch trotz allem gibt sie nicht auf und hofft auf eine bessere Zukunft.,https://quadro.burda-forward.de/ctf/0d9df9a4-a464-4cd4-bd54-7bf2c6878e05.3da2504e-6d41-4ce6-8236-07a2acb4c686.jpg?im=RegionOfInterestCrop%3D%281200%2C630%29%2CregionOfInterest%3D%281467%2C894%29&hash=5c463543a027ee46111650ab64b82ea5a8a9912b8bd0017e2e120acc058e7a03,2025-02-11T16:01:00Z,,In einem kleinen Fachwerkdorf bei Kassel kämpft Andrea (Name geändert) mit den Herausforderungen des Alltags. Die alleinerziehende Mutter lebt mit ihrem elfjährigen Sohn Ben in einer kalten Wohnung H… [+3147 chars],,de,'Heizkosten'
https://ooe.orf.at/stories/3292903/,https://ooe.orf.at/stories/3292903/,0,ooe.orf.at,Gaspreise: Stabilisierung ab 2026 erwartet,"Auch wenn es tagsüber zuletzt teilweise schon deutliche Plusgrade gegeben hat: Die kalten Nächte sorgen dafür, dass Heizungen auf ­­Hochtouren laufen. Die Kosten dafür sind vor allem seit dem Ukraine-Krieg ein viel diskutiertes Thema. Heizen ist für viele spü…",https://ibs.orf.at/ooe?image=https%3A%2F%2Foekastatic.orf.at%2Fmims%2F2024%2F43%2F61%2Fcrops%2Fw%3D1200%2Ch%3D627%2Cq%3D75%2F2396012_master_915661_heizung_sujet_14_pba.jpg%3Fs%3Dd863360e439e2217715ebbb89fa8a0996b1c760b,2025-02-11T17:59:19Z,,Derzeit bewegt sich der Großhandelspreis für Gas gerade wieder deutlich nach oben auf den höchsten Wert seit zwei Jahren. Damit liegt er noch immer weit unter den Spitzen nach dem russischen Überfall… [+2907 chars],,de,'Gasspeicher'
https://www.zeit.de/geld/2025-02/inflation-teuerung-wahl-donald-trump-afd,https://www.zeit.de/geld/2025-02/inflation-teuerung-wahl-donald-trump-afd,0,www.zeit.de,Inflation: Für AfD-Wähler fühlt sich alles viel teurer an,"Wie stark Menschen Inflation wahrnehmen, hängt auch mit ihrer Wahlabsicht zusammen, zeigen neue Daten. Die gefühlte Teuerung ist am stärksten an den politischen Rändern.",https://img.zeit.de/geld/2025-02/inflation-teuerung-wahl-donald-trump-afd-bild/wide__1300x731,2025-02-12T05:02:20Z,http://archive.md/20250212050903/https://www.zeit.de/geld/2025-02/inflation-teuerung-wahl-donald-trump-afd,"Das Leben in Deutschland ist teurer geworden. Doch jede Bürgerin, jeder Bürger nimmt die allgemeine Preissteigerung unterschiedlich stark wahr. Daten, die das Institut der Deutschen Wirtschaft (IW) i… [+582 chars]",,de,'Inflation'
https://www.n-tv.de/wirtschaft/Amerikas-Eier-Krise-ist-jetzt-Trumps-Problem-article25556456.html,https://www.n-tv.de/wirtschaft/Amerikas-Eier-Krise-ist-jetzt-Trumps-Problem-article25556456.html,0,www.n-tv.de,Steigende Inflation: Amerikas Eier-Krise ist jetzt Trumps Problem,Die Lebensmittelpreise zu senken war Donald Trumps wichtigstes Wahlkampfversprechen. Doch die Preise für Eier explodieren. Weder er noch sein Vorgänger Joe Biden können etwas dafür. Doch in der Trump-Ära spielen Fakten auch in der Inflationsdebatte keine Roll…,https://www.n-tv.de/img/incoming/crop25556583/6691322975-cImg_16_9-w1200/506899175.jpg,2025-02-12T10:02:09Z,https://web.archive.org/web/20250212110532/https://www.n-tv.de/wirtschaft/Amerikas-Eier-Krise-ist-jetzt-Trumps-Problem-article25556456.html,Die Lebensmittelpreise zu senken war Donald Trumps wichtigstes Wahlkampfversprechen. Doch die Preise für Eier explodieren. Weder er noch sein Vorgänger Joe Biden können etwas dafür. Doch in der Trump… [+5163 chars],,de,'Inflation'
https://www.tagesschau.de/faktenfinder/windenergie-falschbehauptungen-100.html,https://www.tagesschau.de/faktenfinder/windenergie-falschbehauptungen-100.html,0,www.tagesschau.de,Was ist dran an den Behauptungen über Windkraft?,Neben Migration gehört auch die Energieversorgung zu den größeren Wahlkampfthemen. Einige Politiker haben sich dabei vor allem auf die Windenergie eingeschossen. Doch viele Behauptungen darüber greifen zu kurz. Von P. Siggelkow.,https://images.tagesschau.de/image/ef86a865-c25f-4d69-aba1-c4cf217cbb51/AAABlI3gPXQ/AAABkZLhkrw/16x9-1280/windenergie-150.jpg,2025-02-12T10:05:15Z,https://web.archive.org/web/20250212130507/https://www.tagesschau.de/faktenfinder/windenergie-falschbehauptungen-100.html,"Stand: 12.02.2025 11:05 Uhr
Neben Migration gehört auch die Energieversorgung zu den größeren Wahlkampfthemen. Einige Politiker haben sich dabei vor allem auf die Windenergie eingeschossen. Doch vie… [+12149 chars]",,de,'Photovoltaik'
https://www.zeit.de/news/2025-02/12/messkampagne-fuer-offshore-windenergie-gestartet,https://www.zeit.de/news/2025-02/12/messkampagne-fuer-offshore-windenergie-gestartet,0,www.zeit.de,Windenergie: Messkampagne für Offshore-Windenergie gestartet,Hier finden Sie Informationen zu dem Thema „Windenergie“. Lesen Sie jetzt „Messkampagne für Offshore-Windenergie gestartet“.,https://img.zeit.de/news/2025-02/12/messkampagne-fuer-offshore-windenergie-gestartet-image-group/wide__1300x731,2025-02-12T10:56:06Z,,"In den nächsten 20 Jahren soll sich die installierte Leistung der Windenergieanlagen in Nord- und Ostsee auf mindestens 70 Gigawatt vervielfachen. Um das Ziel zu erreichen, hat das Bundesamt für Sees… [+2968 chars]",,de,'Windenergie'
https://www.diepresse.com/19357221/was-wird-aus-dem-skilehrer-im-besten-fall-ein-einfuehlsamer-naturvermittler,https://www.diepresse.com/19357221/was-wird-aus-dem-skilehrer-im-besten-fall-ein-einfuehlsamer-naturvermittler,0,www.diepresse.com,Was wird aus dem Skilehrer? Im besten Fall ein einfühlsamer Naturvermittler [premium],"Während sich Skigebiete mit wärmeren, schneearmen Wintern arrangieren (oder zusperren), braucht das Berufsbild des Skilehrers noch Klimawandelanpassungen.",https://www.diepresse.com/assets_v2/images/diepresse_meinung.png,2025-02-12T13:42:20Z,,"Während sich Skigebiete mit wärmeren, schneearmen Wintern arrangieren (oder zusperren), braucht das Berufsbild des Skilehrers noch Klimawandelanpassungen.
Der Skilehrer ist eine sagenumwobene Gestal… [+925 chars]",,de,'Winter'
https://www.tagesschau.de/wirtschaft/weltwirtschaft/inflation-usa-gestiegen-hoch-100.html,https://www.tagesschau.de/wirtschaft/weltwirtschaft/inflation-usa-gestiegen-hoch-100.html,0,www.tagesschau.de,US-Inflationsrate steigt überraschend und ist höher als gedacht,"Die US-Inflation ist zu Jahresbeginn überraschend gestiegen. Die Verbraucherpreise legten im Januar um 3,0 Prozent zum Vorjahresmonat zu und damit schneller als im Dezember mit 2,9 Prozent.",https://images.tagesschau.de/image/889b000d-68c3-44c3-a0b6-a94f0399aa1f/AAABlPqFAEE/AAABkZLhkrw/16x9-1280/usa-konsum-110.jpg,2025-02-12T14:40:35Z,,"Stand: 12.02.2025 15:40 Uhr
Die US-Inflation ist zu Jahresbeginn überraschend gestiegen. Die Verbraucherpreise legten im Januar um 3,0 Prozent zum Vorjahresmonat zu und damit schneller als im Dezemb… [+2634 chars]",,de,'Inflation'
