index,url,valid,domain,title,description,image,published,archive,content,quote,language,keyword
https://www.welt.de/politik/ausland/article245101534/Ukraine-News-Kiew-wirft-Russland-Angriffe-auf-Wohngebiete-vor.html,https://www.welt.de/politik/ausland/article245101534/Ukraine-News-Kiew-wirft-Russland-Angriffe-auf-Wohngebiete-vor.html,0,www.welt.de,Ukraine wirft Russland gezielte Angriffe auf Wohngebiete vor,"Im Winter richteten sich die russischen Angriffe vor allem gegen die Strom- und Wärmeversorgung, jetzt werden laut Kiew vermehrt Wohngebiete ins Visier genommen. Moskau wolle dadurch eine verfrühte Gegenoffensive provozieren. Mehr im Liveticker.",https://img.welt.de/img/politik/ausland/mobile245105744/1061350957-ci16x9-w1200/TOPSHOT-UKRAINE-RUSSIA-CONFLICT-WAR.jpg,2023-05-02T09:08:00Z,,"Die Ukraine hat Russland eine veränderte Taktik mit gezielten Raketenangriffen auf Wohngebiete vorgeworfen. Es gibt keinen Zweifel daran, dass sie direkte Angriffe eben auf zivile Mehrfamilienhäuser … [+6183 chars]",,de,'Winter'
https://www.telepolis.de/features/Rohstoff-der-Energiewende-Folgt-auf-die-Opec-nun-ein-Lithium-Kartell-8984431.html,https://www.telepolis.de/features/Rohstoff-der-Energiewende-Folgt-auf-die-Opec-nun-ein-Lithium-Kartell-8984431.html,0,www.telepolis.de,Rohstoff der Energiewende: Folgt auf die Opec nun ein Lithium-Kartell?,Viel ist von Entdollarisierung die Rede. Dabei wird die Weltwirtschaft mindestens ebenso stark von den Rohstoffmärkten entscheiden. Welche Rolle dabei die Lithiummärkte und die Energiewende spielen.,https://heise.cloudimg.io/bound/1200x1200/q85.png-lossy-85.webp-lossy-85.foil1/_www-heise-de_/imgs/18/4/1/5/2/4/5/6/lith-e39dcd5ca3b1e77a.png,2023-05-02T09:15:00Z,https://web.archive.org/web/20230502115048/https://www.telepolis.de/features/Rohstoff-der-Energiewende-Folgt-auf-die-Opec-nun-ein-Lithium-Kartell-8984431.html,Viel ist von Entdollarisierung die Rede. Dabei wird die Weltwirtschaft mindestens ebenso stark von den Rohstoffmärkten entscheiden. Welche Rolle dabei die Lithiummärkte und die Energiewende spielen.,,,
https://www.focus.de/finanzen/kommentar-von-hugo-mueller-vogg-hey-ampel-schraubt-statt-an-unseren-heizungen-besser-mal-an-der-rente_id_192766904.html,https://www.focus.de/finanzen/kommentar-von-hugo-mueller-vogg-hey-ampel-schraubt-statt-an-unseren-heizungen-besser-mal-an-der-rente_id_192766904.html,0,www.focus.de,"Kommentar von Hugo Müller-Vogg - Hey Ampel, schraubt statt an unseren Heizungen besser mal an der Rente!","Die Klimapolitik dominiert alles, seit Ukrainekrieg und Gasknappheit nicht mehr im Vordergrund stehen. Dabei droht die Ampel eines zu vergessen: Dass in unserem Rentensystem mehr neu zu justieren wäre als im Heizungskeller.Von FOCUS-online-Autor Hugo Müller-V…",https://p6.focus.de/img/finanzen/news/id_13179350/koennen-sich-hubertus-heil-und-olaf-scholz-mit-ihrem-vorschlag-zur-testpflicht-durchsetzen-.jpg?im=Crop%3D%280%2C0%2C2048%2C1024%29%3BResize%3D%281200%2C627%29&hash=01379c978eae3437e2bb42627426bd0cac77b56f62befb468ea5e920abcb21a6,2023-05-03T09:09:55Z,,"Die Klimapolitik dominiert alles, seit Ukrainekrieg und Gasknappheit nicht mehr im Vordergrund stehen. Dabei droht die Ampel eines zu vergessen: Dass in unserem Rentensystem mehr neu zu justieren wär… [+7322 chars]",,de,'Gasknappheit'
https://oesterreich.orf.at/stories/3205737/,https://oesterreich.orf.at/stories/3205737/,0,oesterreich.orf.at,Strom- und Gasverbrauch deutlich gesunken,"Der Winter 2022/23 war deutlich wärmer als der Winter des Vorjahres. Das führte zu einem deutlich geringeren Verbrauch von Strom und Gas. Der Stromabsatz an Verbraucherinnen und Verbraucher ging um 7,2 Prozent zurück, teilte die E-Control mit. Der Gasverbrauc…",https://ibs.orf.at/oes?image=https%3A%2F%2Foekastatic.orf.at%2Fmojo%2F1_4_1%2Fstoryserver%2Foeka%2Fcommon%2Fimages%2Fog-fallback-oes.png%3Fs%3Dec233e47ded343c91da59ce7aee601c044282ef3,2023-05-03T11:23:55Z,,"Auch im März 2023 wurde ein um 7,5 Prozent geringerer Stromverbrauch verzeichnet als im März 2022. Die Stromerzeugung war im März um 0,6 Prozent niedriger als im Vorjahresmonat.
Hälfte des Stroms au… [+1200 chars]",,de,'Wasserkraft'
… [+3147 chars],,de,'Energiewende',,,,,,,,,
