index,url,valid,domain,title,description,image,published,archive,content,quote,language,keyword
https://vorarlberg.orf.at/stories/3324375/,https://vorarlberg.orf.at/stories/3324375/,0,vorarlberg.orf.at,Grüne wollen Solaranlagen an der A14,Die Bundesregierung kürzt die Förderungen für den Tausch von Heizkesseln und für thermische Sanierungen deutlich. Statt bisher 74 Prozent werden künftig nur noch 30 Prozent der Kosten übernommen. Der Beschluss fiel am Freitag. Daniel Zadra von den Grünen krit…,https://ibs.orf.at/vbg?image=https%3A%2F%2Foekastatic.orf.at%2Fmims%2F2025%2F40%2F09%2Fcrops%2Fw%3D1200%2Ch%3D627%2Cq%3D75%2F2788033_master_1075409_downloadmedium_51.jpg%3Fs%3D37ad821d83fc252135759f5e8bf99406602fe9ae,2025-10-03T16:42:11Z,,"Wer künftig seine alte Heizung austauschen oder ein Gebäude thermisch sanieren will, bekommt vom Bund deutlich weniger Geld. Die Vorarlberger Grünen kritisieren die Entscheidung und warnen vor einer … [+818 chars]",,de,'Solar'
https://www.globenewswire.com/news-release/2025/10/04/3161261/0/de/Power-Queen-LiFePO4-Batterie-Herbstaktion-10-Jahre-zuverl%C3%A4ssige-Energie-und-%C3%BCber-800-Ersparnis.html,https://www.globenewswire.com/news-release/2025/10/04/3161261/0/de/Power-Queen-LiFePO4-Batterie-Herbstaktion-10-Jahre-zuverl%C3%A4ssige-Energie-und-%C3%BCber-800-Ersparnis.html,0,www.globenewswire.com,Power Queen LiFePO4 Batterie Herbstaktion: 10 Jahre zuverlässige Energie und über 800 € Ersparnis,"BERLIN, Oct. 04, 2025 (GLOBE NEWSWIRE) -- Mit dem Beginn der kälteren Monate rückt das Thema Energiesicherheit für deutsche Haushalte und Investoren gleichermaßen in den Vordergrund. Steigende Strompreise und die Gefahr von Stromausfällen im Herbst und Winter…",https://ml.globenewswire.com/Resource/Download/b2ccb988-3136-4e5e-85c8-b2427514ae16,2025-10-04T08:00:00Z,,"BERLIN, Oct. 04, 2025 (GLOBE NEWSWIRE) -- Mit dem Beginn der kälteren Monate rückt das Thema Energiesicherheit für deutsche Haushalte und Investoren gleichermaßen in den Vordergrund. Steigende Stromp… [+2715 chars]",,de,'Winter'
https://www.bild.de/regional/hessen/solarbranche-in-der-krise-deutscher-hersteller-streicht-350-jobs-68df8a4c35088eeb70a29900,https://www.bild.de/regional/hessen/solarbranche-in-der-krise-deutscher-hersteller-streicht-350-jobs-68df8a4c35088eeb70a29900,0,www.bild.de,Solarbranche in der Krise - Deutscher Hersteller streicht 350 Jobs,Der deutsche Solartechnik-Hersteller SMA Solar verschärft sein Sparprogramm und steht vor dem nächsten Stellenabbau.,"https://images.bild.de/68df8a4c35088eeb70a29900/f346a8b4bf9c4e8ac256db10a532a9e2,ffe04c61?w=1280",2025-10-04T09:09:59Z,,Niestetal (Hessen) Billig-Konkurrenz aus Fernost und schwächelnde Nachfrage auf dem heimischen Markt: Der Solartechnik-Hersteller SMA Solar bleibt unter Druck! Nun sollen bis zu 350 weitere Jobs abge… [+2082 chars],,de,'Solar'
https://www.sueddeutsche.de/leben/familie-inflation-kosten-einkaufen-bauen-li.3319069,https://www.sueddeutsche.de/leben/familie-inflation-kosten-einkaufen-bauen-li.3319069,0,www.sueddeutsche.de,Familien-Newsletter: 200 Euro für den Wocheneinkauf,Unsere Autorin geht ausnahmsweise einkaufen und ist geschockt von den gestiegenen Preisen. Warum die Inflation vor  allem Familien trifft und wie es sich  - auch mit Blick auf den Traum vom Eigenheim - klug rechnen lässt.,https://www.sueddeutsche.de/2025/10/01/7a6d233e-c8b0-4357-b1ce-2f154ab5d8a0.jpg?q=60&fm=webp&width=1200&rect=0%2C209%2C4000%2C2250,2025-10-04T09:59:27Z,,"Liebe Leserin, lieber Leser,
kürzlich stand ich an der Supermarktkasse und starrte ungläubig auf den Kassenzettel: Fast 200 Euro für Brot, Butter, Milch, Nudeln, etwas frisches Gemüse, Biofleisch, O… [+2127 chars]",,de,'Inflation'
https://www.bild.de/regional/hessen/deutscher-solar-hersteller-streicht-350-jobs-ganze-branche-in-der-krise-68df8a4c35088eeb70a29900,https://www.bild.de/regional/hessen/deutscher-solar-hersteller-streicht-350-jobs-ganze-branche-in-der-krise-68df8a4c35088eeb70a29900,0,www.bild.de,Ganze Branche in der Krise - Deutsches Solar-Unternehmen streicht 350 Jobs,"Der deutsche Solartechnik-Hersteller will 100 Millionen Euro einsparen. Zuvor hatte bereits ein anderes Solar-Unternehmen verkündet, 600 Stellen abzubauen.","https://images.bild.de/68df8a4c35088eeb70a29900/53242cf079e605f6f84edc4407285e7e,56395f1b?w=1280",2025-10-04T11:52:15Z,,Niestetal (Hessen) Das nächste deutsche Solar-Unternehmen hat drastischen Stellenabbau angekündigt: Weitere 350 Arbeitsplätze fallen weg. Erst zwei Wochen zuvor erhielten 600 Mitarbeiter eines andere… [+2900 chars],,de,'Solar'
https://www.telepolis.de/features/Benoetigt-Deutschland-neue-Gasspeicher-10704607.html,https://www.telepolis.de/features/Benoetigt-Deutschland-neue-Gasspeicher-10704607.html,0,www.telepolis.de,Benötigt Deutschland neue Gasspeicher?,"Deutschlands größter Gasspeicher in Rehden ist fast leer. Neue Kavernenspeicher könnten helfen, LNG-Gas effizient zu speichern.",https://heise.cloudimg.io/bound/1200x1200/q85.png-lossy-85.webp-lossy-85.foil1/_www-heise-de_/imgs/18/4/9/4/9/4/6/3/speicher-gas-36b0dc7d93025725.png,2025-10-05T04:00:00Z,,"Deutschlands größter Gasspeicher in Rehden ist fast leer. Neue Kavernenspeicher könnten helfen, LNG-Gas effizient zu speichern.
Die Meldung im Juli 2025, dass Deutschlands größter Gasspeicher im nie… [+5090 chars]",,de,'Gasspeicher'
https://www.welt.de/politik/deutschland/plus68ca6e9a4efb433c11cea417/windrad-streit-wo-ich-rot-sehe-ist-wenn-ich-gruen-hoere-sagt-eine-windrad-skeptikerin.html,https://www.welt.de/politik/deutschland/plus68ca6e9a4efb433c11cea417/windrad-streit-wo-ich-rot-sehe-ist-wenn-ich-gruen-hoere-sagt-eine-windrad-skeptikerin.html,0,www.welt.de,"„Wo ich rot sehe, ist, wenn ich grün höre“, sagt eine Windrad-Skeptikerin","Im Spessart spaltet ein Windkraft-Projekt die Bevölkerung: Für die einen sind die 19 geplanten Räder ein Schritt zur Energiewende, für die anderen eine Bedrohung für Wald und Heimat. Die Gegner beklagen, ihre Sorgen würden „als AfD-Parolen“ abgetan.",https://images.welt.de/68ca6e9a4efb433c11cea417/b151b533278b325910369b969f93d6a9-master/ci16x9-w1200/img-3457,2025-10-05T10:21:10Z,,"Im Spessart spaltet ein Windkraft-Projekt die Bevölkerung: Für die einen sind die 19 geplanten Räder ein Schritt zur Energiewende, für die anderen eine Bedrohung für Wald und Heimat. Die Gegner bekla… [+47 chars]",,de,'Energiewende'
https://taz.de/Solarstrom-fuer-Mietshaeuser/!6115178/,https://taz.de/Solarstrom-fuer-Mietshaeuser/!6115178/,0,taz.de,Solarstrom für Mie­tshäuser: Chance für eine soziale Energiewende,"Technisch ist Solarstrom für Mietshäuser möglich, doch der politische Wille fehlt. Man sollte sich daher von der Bürokratie nicht abschrecken lassen.",https://taz.de/picture/7967151/1200/39255143.jpeg,2025-10-05T17:58:00Z,,"Technisch ist Solarstrom für Mietshäuser möglich, doch der politische Wille fehlt. Man sollte sich daher von der Bürokratie nicht abschrecken lassen. mehr...",,de,'Energiewende'
https://www.bild.de/politik/meinung-kommentare-kolumnen/der-klima-sozialismus-muss-weg-wenn-unsere-kinder-eine-zukunft-haben-sollen-68e12d2bc9fcb483178b790d,https://www.bild.de/politik/meinung-kommentare-kolumnen/der-klima-sozialismus-muss-weg-wenn-unsere-kinder-eine-zukunft-haben-sollen-68e12d2bc9fcb483178b790d,0,www.bild.de,Meinung am Sonntag - Der Klima-Sozialismus muss weg,Diskussion über die Zukunft der Energiewende und die Herausforderungen für Deutschlands Wohlstand und Sicherheit.,"https://images.bild.de/68e12d2bc9fcb483178b790d/66ceb82e6e1c44e4c7cae79c08f2e00f,dbe4e1c1?w=1280",2025-10-05T18:03:58Z,,"Berlin  Diese Woche haben wir 35 Jahre deutsche Einheit gefeiert. Gefeiert? Wieder ging es vor allem um das, was uns trennt: Ost, West, Altlasten, alte Wunden. Aber ist das 2025 wirklich noch die Fra… [+3557 chars]",,de,'Solar'
https://www.nzz.ch/wirtschaft/eigentlich-wollte-europa-bei-rohstoffen-unabhaengiger-von-china-werden-am-beispiel-von-wolfram-zeigt-sich-die-plaene-drohen-zu-scheitern-ld.1905191,https://www.nzz.ch/wirtschaft/eigentlich-wollte-europa-bei-rohstoffen-unabhaengiger-von-china-werden-am-beispiel-von-wolfram-zeigt-sich-die-plaene-drohen-zu-scheitern-ld.1905191,0,www.nzz.ch,Eigentlich wollte Europa bei Rohstoffen unabhängiger von China werden. Am Beispiel von Wolfram zeigt sich: Die Pläne drohen zu scheitern,"Europa benötigt dringend Rohwaren für die Energiewende und die Aufrüstung. Die EU will daher, dass Metalle verstärkt auf dem Kontinent abgebaut werden. Doch Bergbauunternehmer klagen, dass die Mitgliedstaaten die Pläne der EU gar nicht umsetzen wollen.","https://img.nzz.ch/2025/10/03/1c3b2c7f-b4b7-463b-bcca-3f71d434500e.jpg?width=1200&height=675&fit=bounds&quality=75&auto=webp&crop=4000,2250,x0,y0&wmark=nzz",2025-10-06T03:30:00Z,,"Europa benötigt dringend Rohwaren für die Energiewende und die Aufrüstung. Die EU will daher, dass Metalle verstärkt auf dem Kontinent abgebaut werden. Doch Bergbauunternehmer klagen, dass die Mitgli… [+7279 chars]",,de,'Energiewende'
https://www.zeit.de/wirtschaft/2025-10/carsten-schneider-bundesumweltminister-klimaschutz-verbrenner-aus,https://www.zeit.de/wirtschaft/2025-10/carsten-schneider-bundesumweltminister-klimaschutz-verbrenner-aus,0,www.zeit.de,"Carsten Schneider: ""Das sind richtig geile Autos!""","Als Umweltminister will Carsten Schneider die Energiewende entpolarisieren. Bürger überzeuge man mit finanziellen Anreizen, statt mit dem erhobenen Zeigefinger.",https://img.zeit.de/politik/deutschland/2025-10/carsten-schneider-bundesumweltminister-klimaschutz-verbrenner-aus-bild-bild-05/wide__1300x731,2025-10-06T07:32:40Z,,Der SPD-Politiker Carsten Schneider ist seit Anfang Mai Bundesminister für Umwelt und Klima. In der Ampelregierung war der gebürtige Erfurter zuvor vier Jahre lang Ostbeauftragter der Bundesregierung… [+425 chars],,de,'Energiewende'
https://www.diepresse.com/20175016/nach-sparprogramm-omv-reduziert-auch-ihre-geplanten-investitionen,https://www.diepresse.com/20175016/nach-sparprogramm-omv-reduziert-auch-ihre-geplanten-investitionen,0,www.diepresse.com,Nach Sparprogramm: OMV reduziert auch ihre geplanten Investitionen deutlich,"Zwischen 2026 und 2030 soll um insgesamt fünf Mrd. Euro weniger investiert werden, so die OMV-Fährung. Gas soll das „Herzstück“ der Wachstumsstrategie bleiben.",https://img.diepresse.com/public/incoming/owvpk8-OMV/alternates/DPR_SOCIAL_NACHRICHTEN/OMV,2025-10-06T11:52:21Z,,"Zwischen 2026 und 2030 soll um insgesamt fünf Mrd. Euro weniger investiert werden, so die OMV-Fährung. Gas soll das Herzstück der Wachstumsstrategie bleiben. 
Der teilstaatliche Energiekonzern OMV h… [+3296 chars]",,de,'Investitionen'
https://www.tagesspiegel.de/wissen/neue-ideen-fur-die-kreislaufwirtschaft-diese-wissenschaftler-fuhren-die-industrie-auf-neue-wege-14442653.html,https://www.tagesspiegel.de/wissen/neue-ideen-fur-die-kreislaufwirtschaft-diese-wissenschaftler-fuhren-die-industrie-auf-neue-wege-14442653.html,0,www.tagesspiegel.de,Neue Ideen für die Kreislaufwirtschaft: Diese Wissenschaftler führen die Industrie auf neue Wege,"Sie sehen Abfall als Ressource, pushen die Energiewende und finden Materialien für die Kreislaufwirtschaft. Diese Forschenden machen eine Zukunft möglich, die den Planeten nicht verbraucht. Folge sieben der Serie.",https://www.tagesspiegel.de/images/14443226/alternates/BASE_16_9_W1400/1759326838000/portrait-von-fatma-nur-akyel-100-kopfe-der-wissenschaft-2025.jpeg,2025-10-06T12:50:49Z,,"Es steht schlecht ums Klima, doch multiple Krisen und Müllberge lassen diese Forschenden nicht verzagen. Im Gegenteil: Aus dem, was da ist, schaffen sie Neues. Und finden Tricks für einen klügeren Um… [+19 chars]",,de,'Energiewende'
https://www.tagesspiegel.de/internationales/ukraine-invasion-tag-1320-die-geheime-waffe-der-ukraine-gegen-winter-blackouts-14489756.html,https://www.tagesspiegel.de/internationales/ukraine-invasion-tag-1320-die-geheime-waffe-der-ukraine-gegen-winter-blackouts-14489756.html,0,www.tagesspiegel.de,"Ukraine-Invasion, Tag 1320: Die geheime Waffe der Ukraine gegen Winter-Blackouts","Merkel wirft einigen Ländern Blockade von Putin-Gesprächen vor dem Ukrainekrieg vor und aktueller Frontbericht zeigt, wie hinterlistig der Krieg geworden ist. Der Überblick am Abend.",https://www.tagesspiegel.de/images/12793274/alternates/BASE_16_9_W1400/1732884225000/workers-fix-a-thermal-power-plant-damaged-by-a-russian-missile-strike-at-an-undisclosed-location-in-ukraine.jpeg,2025-10-06T18:12:51Z,,"Drei Winter hat die Ukraine bereits unter russischem Bombardement verbracht Winter, in denen die ukrainische Bevölkerung dank der vielen Angriffe auf das Stromnetz oft frierend im Dunkeln saß. 
Im v… [+5403 chars]",,de,'Ausbau'
https://www.zeit.de/news/2025-10/07/berlin-hat-beim-ausbau-der-solarenergie-noch-viel-vor,https://www.zeit.de/news/2025-10/07/berlin-hat-beim-ausbau-der-solarenergie-noch-viel-vor,0,www.zeit.de,Sonnenenergie: Berlin hat beim Ausbau der Solarenergie noch viel vor,Hier finden Sie Informationen zu dem Thema „Sonnenenergie“. Lesen Sie jetzt „Berlin hat beim Ausbau der Solarenergie noch viel vor“.,https://img.zeit.de/news/2025-10/07/berlin-hat-beim-ausbau-der-solarenergie-noch-viel-vor-image-group/wide__1300x731,2025-10-07T03:01:06Z,,"Berlin hat beim Ausbau der Solarenergie noch einiges vor. Um die Ziele zu erreichen, müssen in Zukunft deutlich mehr Photovoltaikanlagen auf Berliner Dächern landen als bisher.
Welches Ziel hat der … [+1521 chars]",,de,'Solar'
https://www.stern.de/gesellschaft/regional/berlin-brandenburg/sonnenenergie--berlin-hat-beim-ausbau-der-solarenergie-noch-viel-vor-36110206.html,https://www.stern.de/gesellschaft/regional/berlin-brandenburg/sonnenenergie--berlin-hat-beim-ausbau-der-solarenergie-noch-viel-vor-36110206.html,0,www.stern.de,Sonnenenergie: Berlin hat beim Ausbau der Solarenergie noch viel vor,"Berlin (bb) - Berlin hat beim Ausbau der Solarenergie noch einiges vor. Um die Ziele zu erreichen, müssen in Zukunft deutlich mehr Photovoltaikanlagen auf",https://image.stern.de/36110208/t/XT/v1/w1440/r1.7778/-/07--45yl324ypav10axs2048jpeg---dd51c5602a182a32.jpg,2025-10-07T03:01:06Z,,"Kopiere den aktuellen Link
Zur Merkliste hinzufügen
Bis 2035 will Berlin mindestens ein Viertel seines Stroms aus Solarenergie gewinnen. Aber bis dahin ist es noch ein weiter Weg.
Berlin hat beim … [+1928 chars]",,de,'Ausbau'
https://www.tagesspiegel.de/berlin/sonnenenergie-berlin-hat-beim-ausbau-der-solarenergie-noch-viel-vor-14490350.html,https://www.tagesspiegel.de/berlin/sonnenenergie-berlin-hat-beim-ausbau-der-solarenergie-noch-viel-vor-14490350.html,0,www.tagesspiegel.de,Sonnenenergie: Berlin hat beim Ausbau der Solarenergie noch viel vor,Bis 2035 will Berlin mindestens ein Viertel seines Stroms aus Solarenergie gewinnen. Aber bis dahin ist es noch ein weiter Weg.,https://www.tagesspiegel.de/images/14490347/alternates/BASE_16_9_W1400/1759806151000/solaranlagen-projekt-der-bvg.jpeg,2025-10-07T03:02:31Z,,"Berlin hat beim Ausbau der Solarenergie noch einiges vor. Um die Ziele zu erreichen, müssen in Zukunft deutlich mehr Photovoltaikanlagen auf Berliner Dächern landen als bisher.
 Welches Ziel hat der… [+1582 chars]",,de,'Ausbau'
https://www.tagesspiegel.de/berlin/schafft-berlin-seine-klimaziele-wirtschaftssenatorin-legt-am-dienstag-zahlen-zum-solarausbau-vor-14490350.html,https://www.tagesspiegel.de/berlin/schafft-berlin-seine-klimaziele-wirtschaftssenatorin-legt-am-dienstag-zahlen-zum-solarausbau-vor-14490350.html,0,www.tagesspiegel.de,Schafft Berlin seine Klimaziele?: Wirtschaftssenatorin legt am Dienstag Zahlen zum Solarausbau vor,Bis 2035 will Berlin mindestens ein Viertel seines Stroms aus Solarenergie gewinnen. Bis dahin ist es noch ein weiter Weg. Die Wirtschaftssenatorin legt die neuen Zahlen vor.,https://www.tagesspiegel.de/images/14490347/alternates/BASE_16_9_W1400/1759806151000/solaranlagen-projekt-der-bvg.jpeg,2025-10-07T03:02:31Z,,Der Berliner Senat beschäftigt sich bei seiner Sitzung am Dienstag ab 10 Uhr mit dem Solarausbau in der Hauptstadt. Wirtschaftssenatorin Franziska Giffey (SPD) will den Senatsmitgliedern einen Überbl… [+1019 chars],,de,'Ausbau'
https://www.basicthinking.de/blog/2025/10/07/perowskit-solarzellen-ki/,https://www.basicthinking.de/blog/2025/10/07/perowskit-solarzellen-ki/,0,www.basicthinking.de,KI löst Solar-Rätsel – für effizientere Perowskit-Solarzellen,"Der Beitrag KI löst Solar-Rätsel – für effizientere Perowskit-Solarzellen erschien zuerst beim Online-Magazin BASIC thinking. Über unseren Newsletter UPDATE startest du jeden Morgen bestens informiert in den Tag.
Forscher haben eine KI eingesetzt, um die atom…",https://www.basicthinking.de/blog/wp-content/uploads/2025/09/perowskit-solarzellen-ki.webp,2025-10-07T03:45:11Z,,"Forscher haben eine KI eingesetzt, um die atomare Instabilität von Perowskit-Materialien zu entschlüsseln. Die Ergebnisse könnten dabei helfen, effizientere Perowskit-Solarzellen herzustellen. 
Der … [+3448 chars]",,de,'Solar'
https://www.n-tv.de/wirtschaft/Studie-Erneuerbare-loesen-Kohle-als-groesste-globale-Stromquelle-ab-article26078480.html,https://www.n-tv.de/wirtschaft/Studie-Erneuerbare-loesen-Kohle-als-groesste-globale-Stromquelle-ab-article26078480.html,0,www.n-tv.de,"""Entscheidender Wendepunkt"": Studie: Erneuerbare lösen Kohle als größte globale Stromquelle ab",Über Jahrzehnte dient Kohle weltweit als die Stromquelle Nummer 1. Doch einer Studie zufolge schnappen sich im ersten Halbjahr 2025 die erneuerbaren Energien den Spitzenrang. Dafür verantwortlich ist besonders ein Land.,https://www.n-tv.de/img/incoming/crop26078490/2411325292-cImg_16_9-w1200/548427617.jpg,2025-10-07T07:33:31Z,,Über Jahrzehnte dient Kohle weltweit als die Stromquelle Nummer 1. Doch einer Studie zufolge schnappen sich im ersten Halbjahr 2025 die erneuerbaren Energien den Spitzenrang. Dafür verantwortlich ist… [+1798 chars],,de,'Solar'
https://www.stern.de/news/politischer-gegenwind-verlangsamt-wachstum-bei-erneuerbaren-36111006.html,https://www.stern.de/news/politischer-gegenwind-verlangsamt-wachstum-bei-erneuerbaren-36111006.html,0,www.stern.de,Politischer Gegenwind verlangsamt Wachstum bei Erneuerbaren,"Der weltweite Zubau bei erneuerbaren Energien schreitet weiter voran - im Vergleich zum Vorjahr erwartet die Internationale Energieagentur (IEA) allerdings einen holprigeren Wachstumspfad. Bis 2030 wird aktuell ein Zubau von 4600 Gigawatt (GW) erwartet, wie d…",https://image.stern.de/36111008/t/jg/v1/w1440/r1.7778/-/07--windraeder-und-industrieschlot---6c00dc8c504a616f.jpg,2025-10-07T08:18:49Z,,"Kopiere den aktuellen Link
Zur Merkliste hinzufügen
Der weltweite Zubau bei erneuerbaren Energien schreitet weiter voran - im Vergleich zum Vorjahr erwartet die Internationale Energieagentur (IEA) … [+2488 chars]",,de,'Erneuerbare'
https://salzburg.orf.at/stories/3324823/,https://salzburg.orf.at/stories/3324823/,0,salzburg.orf.at,Ausbau Kinderbetreuung: Grüne kritisieren Land,"Die Grünen kritisierten am Dienstag bei einem Pressetermin, dass das Land mehr als sechs Mio. Euro an Bundesförderungen für den Ausbau der Kinderbetreuung in den vergangenen zwei Jahren nicht abgerufen habe. Das Geld müsste lediglich beantragt werden. Die FPÖ…",https://ibs.orf.at/sbg?image=https%3A%2F%2Foekastatic.orf.at%2Fmims%2F2024%2F22%2F99%2Fcrops%2Fw%3D1200%2Ch%3D627%2Cq%3D75%2F2219898_master_842499_ausserferntageseltern_04.jpg%3Fs%3D0a99e5533d2629e7355a45efea79ca651d585297,2025-10-07T10:43:34Z,,Besonders die Bereiche Betreuungsschlüssel und Personalkostenzuschüsse seien betroffen. Der Grüne Landtagsabgeordnete Simon Heilig-Hofbauer sprach am Dienstag von einem systematischen Versäumnis der … [+1012 chars],,de,'Ausbau'
https://www.zeit.de/news/2025-10/07/weltweit-erstmals-mehr-strom-aus-erneuerbaren-als-aus-kohle,https://www.zeit.de/news/2025-10/07/weltweit-erstmals-mehr-strom-aus-erneuerbaren-als-aus-kohle,0,www.zeit.de,Energiewende: Weltweit erstmals mehr Strom aus Erneuerbaren als aus Kohle,Hier finden Sie Informationen zu dem Thema „Energiewende“. Lesen Sie jetzt „Weltweit erstmals mehr Strom aus Erneuerbaren als aus Kohle“.,https://img.zeit.de/news/2025-10/07/weltweit-erstmals-mehr-strom-aus-erneuerbaren-als-aus-kohle-image-group/wide__1300x731,2025-10-07T11:13:58Z,,Erstmals ist im ersten Halbjahr 2025 weltweit mehr Grünstrom als Kohlestrom produziert worden. Zu diesem Ergebnis kommt eine Studie der Denkfabrik Ember. Demnach stieg die Stromerzeugung aus erneuerb… [+1998 chars],,de,'Erneuerbare'
https://www.stern.de/wirtschaft/news/energiewende--weltweit-erstmals-mehr-strom-aus-erneuerbaren-als-aus-kohle-36111812.html,https://www.stern.de/wirtschaft/news/energiewende--weltweit-erstmals-mehr-strom-aus-erneuerbaren-als-aus-kohle-36111812.html,0,www.stern.de,Energiewende: Weltweit erstmals mehr Strom aus Erneuerbaren als aus Kohle,"Zum ersten Mal hat im ersten Halbjahr Grünstrom weltweit Kohlestrom überholt. Das geht aus einer neuen Studie hervor. Warum die Fachleute in den Zahlen einen ""entscheidenden Wendepunkt"" sehen.",https://image.stern.de/36111814/t/ei/v1/w1440/r1.7778/-/07--vngslnxudov7axs2048jpeg---c712162ee27d765b.jpg,2025-10-07T11:13:58Z,,"Kopiere den aktuellen Link
Zur Merkliste hinzufügen
Zum ersten Mal hat im ersten Halbjahr Grünstrom weltweit Kohlestrom überholt. Das geht aus einer neuen Studie hervor. Warum die Fachleute in den … [+2206 chars]",,de,'Energiewende'
https://www.tagesspiegel.de/wirtschaft/entscheidender-wendepunkt-weltweit-erstmals-mehr-strom-aus-erneuerbaren-als-aus-kohle-14496668.html,https://www.tagesspiegel.de/wirtschaft/entscheidender-wendepunkt-weltweit-erstmals-mehr-strom-aus-erneuerbaren-als-aus-kohle-14496668.html,0,www.tagesspiegel.de,„Entscheidender Wendepunkt“: Weltweit erstmals mehr Strom aus Erneuerbaren als aus Kohle,Zum ersten Mal ist im ersten Halbjahr weltweit mehr Grünstrom als Kohlestrom produziert worden. Das geht aus einer neuen Studie hervor.,https://www.tagesspiegel.de/images/14496665/alternates/BASE_16_9_W1400/1759852713000/solarenergie-in-der-wuste-chinas.jpeg,2025-10-07T11:15:16Z,,Erstmals ist im ersten Halbjahr 2025 weltweit mehr Grünstrom als Kohlestrom produziert worden. Zu diesem Ergebnis kommt eine Studie der Denkfabrik Ember. Demnach stieg die Stromerzeugung aus erneuerb… [+2325 chars],,de,'Solar'
https://www.tagesspiegel.de/wirtschaft/energiewende-weltweit-erstmals-mehr-strom-aus-erneuerbaren-als-aus-kohle-14496668.html,https://www.tagesspiegel.de/wirtschaft/energiewende-weltweit-erstmals-mehr-strom-aus-erneuerbaren-als-aus-kohle-14496668.html,0,www.tagesspiegel.de,Energiewende: Weltweit erstmals mehr Strom aus Erneuerbaren als aus Kohle,Zum ersten Mal hat im ersten Halbjahr Grünstrom weltweit Kohlestrom überholt. Das geht aus einer neuen Studie hervor. Warum die Fachleute in den Zahlen einen „entscheidenden Wendepunkt“ sehen.,https://www.tagesspiegel.de/images/14496665/alternates/BASE_16_9_W1400/1759835715000/solarenergie-in-der-wuste-chinas.jpeg,2025-10-07T11:15:16Z,,Erstmals ist im ersten Halbjahr 2025 weltweit mehr Grünstrom als Kohlestrom produziert worden. Zu diesem Ergebnis kommt eine Studie der Denkfabrik Ember. Demnach stieg die Stromerzeugung aus erneuerb… [+2048 chars],,de,'Energiewende'
https://www.dw.com/de/mehr-solar-und-windstrom-als-kohlestrom-weltweit-energiewende-china-und-entwicklungsl%C3%A4nder/a-74263004,https://www.dw.com/de/mehr-solar-und-windstrom-als-kohlestrom-weltweit-energiewende-china-und-entwicklungsl%C3%A4nder/a-74263004,0,www.dw.com,Erneuerbare überholen Kohle bei Stromerzeugung weltweit,"Historischer Meilenstein: Im ersten Halbjahr 2025 wurde weltweit mehr Strom aus grüner Energie erzeugt als aus Kohle. Solar und Wind wachsen schneller als der Energiebedarf, das zeigen zwei neue Analysen.",https://static.dw.com/image/71850791_6.jpg,2025-10-07T11:31:00Z,,"Einen ""historischen Wandel"" nennt der Think Tank Ember die Ergebnisse seiner neuesten Analyse
.
Das Team analysierte monatliche Daten aus 88 Ländern, in denen 93 Prozent des weltweiten Strombedarfs… [+2165 chars]",,de,'Windenergie'
https://www.dw.com/de/weltweit-mehr-strom-aus-sonne-und-wind-als-aus-kohle-erneuerbare-energien-solar-energiewende-v2/a-74263004,https://www.dw.com/de/weltweit-mehr-strom-aus-sonne-und-wind-als-aus-kohle-erneuerbare-energien-solar-energiewende-v2/a-74263004,0,www.dw.com,Historischer Wandel: Erneuerbare Energien auf dem Vormarsch,"Es ist ein historischer Meilenstein: Im ersten Halbjahr 2025 wurde weltweit erstmals mehr Strom aus grüner Energie erzeugt als aus Kohle. Solar und Wind wachsen schneller als der Energiebedarf, das zeigen neue Analysen. Einen ""historischen Wandel"" nennt der T…",https://static.dw.com/image/71850791_6.jpg,2025-10-07T11:31:00Z,,"Einen ""historischen Wandel"" nennt der Think Tank Ember die Ergebnisse seiner neuesten Analyse
. Das Team analysierte monatliche Daten aus 88 Ländern, in denen 93 Prozent des weltweiten Strombedarfs … [+2162 chars]",,de,'Windenergie'
https://www.sueddeutsche.de/wirtschaft/energien-kohle-stromproduktion-li.3322968,https://www.sueddeutsche.de/wirtschaft/energien-kohle-stromproduktion-li.3322968,0,www.sueddeutsche.de,Energiewende: Weltweit erstmals mehr Strom aus Erneuerbaren als aus Kohle,Zum ersten Mal hat im ersten Halbjahr 2025 Grünstrom weltweit Kohlestrom überholt. Das geht aus einer neuen Studie hervor.,https://www.sueddeutsche.de/2025/10/07/a1015c4f-c9e0-401e-a4ed-c1d1b774b66b.jpg?q=60&fm=webp&width=1200&rect=0%2C209%2C4000%2C2250,2025-10-07T11:51:23Z,,"Der Anteil der Erneuerbaren am globalen Strommix habe sich damit auf 34,3Prozent erhöht, so die Ember-Experten. Der Kohleanteil sei auf 33,1 Prozent gesunken. Zum Vergleich: In Deutschland wurden lau… [+1447 chars]",,de,'Erneuerbare'
