index,url,valid,domain,title,description,image,published,archive,content,quote,language,keyword
https://www.welt.de/wirtschaft/article254846294/IfW-und-DIW-Wirtschaft-schleppt-sich-durch-die-Stagnation-Oekonomen-senken-Erwartungen-fuer-2025.html,https://www.welt.de/wirtschaft/article254846294/IfW-und-DIW-Wirtschaft-schleppt-sich-durch-die-Stagnation-Oekonomen-senken-Erwartungen-fuer-2025.html,0,www.welt.de,„Wirtschaft schleppt sich durch die Stagnation“ – Ökonomen senken Erwartungen für 2025,Deutschlands Wirtschaftsforscher blicken pessimistisch in die Zukunft. In den Winterprognosen rechnen die Experten von IfW und DIW mit Stagnation und einem Anstieg der Arbeitslosenquote. Nur ein Institut zeichnet auch ein optimistisches Szenario.,https://img.welt.de/img/wirtschaft/mobile254847912/3787930457-ci16x9-w1200/Thousands-of-new-cars-of-German-car.jpg,2024-12-12T10:57:50Z,https://web.archive.org/web/20241212143952/https://www.welt.de/wirtschaft/article254846294/IfW-und-DIW-Wirtschaft-schleppt-sich-durch-die-Stagnation-Oekonomen-senken-Erwartungen-fuer-2025.html,Deutschlands Wirtschaftsforscher blicken pessimistisch in die Zukunft. In den Winterprognosen rechnen die Experten von IfW und DIW mit Stagnation und einem Anstieg der Arbeitslosenquote. Nur ein Inst… [+5289 chars],,de,'Winter'
https://www.nzz.ch/wirtschaft/die-ezb-haelt-an-ihrer-strategie-fest-und-senkt-die-leitzinsen-auf-3-prozent-ld.1861231,https://www.nzz.ch/wirtschaft/die-ezb-haelt-an-ihrer-strategie-fest-und-senkt-die-leitzinsen-auf-3-prozent-ld.1861231,0,www.nzz.ch,Die EZB hält an ihrer Strategie fest und senkt die Leitzinsen auf 3 Prozent,"Die Inflation im Euro-Raum ist noch nicht endgültig besiegt, doch zugleich schwächelt zunehmend die Wirtschaft. In diesem Dilemma hat sich die EZB für einen weiteren kleinen Zinsschritt entschieden.","https://img.nzz.ch/2024/12/12/93c24ee6-c3e8-46cd-bece-c9428ef42401.jpeg?width=1200&height=675&fit=bounds&quality=75&auto=webp&crop=4000,2250,x0,y0&wmark=nzz",2024-12-12T13:15:51Z,https://web.archive.org/web/20241212214540/https://www.nzz.ch/wirtschaft/die-ezb-haelt-an-ihrer-strategie-fest-und-senkt-die-leitzinsen-auf-3-prozent-ld.1861231,"Das Hauptquartier der EZB in Frankfurt am Main: Die Notenbanker diskutieren das Tempo weiterer Zinssenkungen im kommenden Jahr.
Für Besinnlichkeit ist es in der Geldpolitik trotz den bevorstehenden … [+4943 chars]",,de,'Inflation'
https://www.iphone-ticker.de/solix-solarbank-2-ac-unterstuetzt-jetzt-bidirektionales-laden-247022/,https://www.iphone-ticker.de/solix-solarbank-2-ac-unterstuetzt-jetzt-bidirektionales-laden-247022/,0,www.iphone-ticker.de,SOLIX Solarbank 2 AC unterstützt jetzt bidirektionales Laden,Die neue SOLIX Solarbank 2 AC von Anker verfügt jetzt über eine bidirektionale Ladefunktion. Der Hersteller hat diese Option mit der neuesten Firmware für den Solar-Akku freigegeben. Wir haben die SOLIX Solarbank 2 AC bereits im vergangenen Monat ausführlich …,https://images.ifun.de/wp-content/uploads/2024/11/anker-solix-ac-feature.jpg,2024-12-12T13:24:25Z,,"Die neue SOLIX Solarbank 2 AC von Anker verfügt jetzt über eine bidirektionale Ladefunktion. Der Hersteller hat diese Option mit der neuesten Firmware für den Solar-Akku freigegeben.
Wir haben die S… [+2483 chars]",,de,'Solar'
https://www.sueddeutsche.de/muenchen/typisch-deutsch-heizung-sparen-winter-lux.Bqg6SPaw5bTUKnq8H7wGaL,https://www.sueddeutsche.de/muenchen/typisch-deutsch-heizung-sparen-winter-lux.Bqg6SPaw5bTUKnq8H7wGaL,0,www.sueddeutsche.de,SZ-Kolumne Typisch deutsch: Heizen oder geizen,"Der Gasofen ist der beste Freund der Frostbeule. Solange, bis die Nachzahlung in den Briefkasten flattert. Wie man trotz Sparflamme durch den Winter kommt.",https://www.sueddeutsche.de/2024/12/12/2dc2156f-40f1-498e-96fc-427b879bcc2e.jpeg?q=60&fm=webp&width=1200&rect=0%2C54%2C3000%2C1688,2024-12-12T14:12:54Z,https://web.archive.org/web/20241214015352/https://www.sueddeutsche.de/muenchen/typisch-deutsch-heizung-sparen-winter-lux.Bqg6SPaw5bTUKnq8H7wGaL,"In Syrien ist Heizen generell und derzeit ohnehin ein ganz kleines Thema. Aber die Erde dreht sich weiter, auch nach dem befreienden Sturz von Machthaber Assad. Es wird hitzig zugehen in den kommende… [+3007 chars]",,de,'Heizen'
https://www.zeit.de/news/2024-12/12/freie-fahrt-auf-autobahn-1-bauarbeiten-beendet,https://www.zeit.de/news/2024-12/12/freie-fahrt-auf-autobahn-1-bauarbeiten-beendet,0,www.zeit.de,Schneller Ausbau: Freie Fahrt auf Autobahn 1 – Bauarbeiten beendet,Hier finden Sie Informationen zu dem Thema „Schneller Ausbau“. Lesen Sie jetzt „Freie Fahrt auf Autobahn 1 – Bauarbeiten beendet“.,https://img.zeit.de/news/2024-12/12/freie-fahrt-auf-autobahn-1-bauarbeiten-beendet-image-group/wide__1300x731,2024-12-12T14:27:08Z,,"Ein halbes Jahr früher als geplant ist der Ausbau der Autobahn 1 auf sechs Fahrstreifen zwischen Bramsche und Lohne/Dinklage vollendet worden. Während der Arbeiten sei der Bauablauf optimiert worden,… [+1450 chars]",,de,'Ausbau'
https://www.zeit.de/news/2024-12/12/wieder-mehr-strom-aus-erneuerbaren,https://www.zeit.de/news/2024-12/12/wieder-mehr-strom-aus-erneuerbaren,0,www.zeit.de,Vorläufige Bilanz: Wieder mehr Strom aus Erneuerbaren,Hier finden Sie Informationen zu dem Thema „Vorläufige Bilanz“. Lesen Sie jetzt „Wieder mehr Strom aus Erneuerbaren“.,https://img.zeit.de/news/2024-12/12/wieder-mehr-strom-aus-erneuerbaren-image-group/wide__1300x731,2024-12-12T15:17:40Z,,"Der Anteil des Ökostroms am Bruttostromverbrauch steigt in diesem Jahr voraussichtlich auf einen neuen Höchststand von 56 Prozent. Das wären 1,5 Prozentpunkte mehr als im Vorjahr, teilte die Geschäft… [+1866 chars]",,de,'Erneuerbare'
https://www.stern.de/wirtschaft/news/vorlaeufige-bilanz--wieder-mehr-strom-aus-erneuerbaren-35306484.html,https://www.stern.de/wirtschaft/news/vorlaeufige-bilanz--wieder-mehr-strom-aus-erneuerbaren-35306484.html,0,www.stern.de,Vorläufige Bilanz: Wieder mehr Strom aus Erneuerbaren,Auch im Jahr 2024 ist der Anteil erneuerbarer Energien am Stromverbrauch erneut gestiegen. Die vorläufigen Daten des Umweltbundesamts zeigen: Vor allem der Strom aus Sonnenenergie boomt.,https://image.stern.de/35306486/t/Fw/v1/w1440/r1.7778/-/12--j5jnepd7etv3axs2048jpeg---f022e2ab12c2bf4b.jpg,2024-12-12T15:17:40Z,https://web.archive.org/web/20241212162238/https://www.stern.de/wirtschaft/news/vorlaeufige-bilanz--wieder-mehr-strom-aus-erneuerbaren-35306484.html,"Kopiere den aktuellen Link
Auch im Jahr 2024 ist der Anteil erneuerbarer Energien am Stromverbrauch erneut gestiegen. Die vorläufigen Daten des Umweltbundesamts zeigen: Vor allem der Strom aus Sonne… [+2045 chars]",,de,'Erneuerbare'
https://www.tagesspiegel.de/wirtschaft/neuer-hochststand-erreicht-anteil-an-strom-aus-erneuerbaren-energien-steigt-2024-erneut-12867235.html,https://www.tagesspiegel.de/wirtschaft/neuer-hochststand-erreicht-anteil-an-strom-aus-erneuerbaren-energien-steigt-2024-erneut-12867235.html,0,www.tagesspiegel.de,Neuer Höchststand erreicht: Anteil an Strom aus erneuerbaren Energien steigt 2024 weiter,"Das Umweltbundesamt (UBA) teilte dies am Donnerstag mit. Vor allem der Strom aus Solarenergie verzeichnet ein signifikantes Plus. Dennoch müsse der Ausbau der Erneuerbaren schneller gehen, sagt der Präsident der Behörde.",https://www.tagesspiegel.de/images/12867232/alternates/BASE_16_9_W1400/1734019576000/solarenergie.jpeg,2024-12-12T15:18:43Z,https://web.archive.org/web/20241213051720/https://www.tagesspiegel.de/wirtschaft/neuer-hochststand-erreicht-anteil-an-strom-aus-erneuerbaren-energien-steigt-2024-erneut-12867235.html,"Der Anteil des Ökostroms am Bruttostromverbrauch steigt in diesem Jahr voraussichtlich auf einen neuen Höchststand von 56 Prozent. 
Die Tagesspiegel-App Aktuelle Nachrichten, Hintergründe und Analys… [+2954 chars]",,de,'Erneuerbare'
https://www.tagesspiegel.de/wirtschaft/vorlaufige-bilanz-wieder-mehr-strom-aus-erneuerbaren-12867235.html,https://www.tagesspiegel.de/wirtschaft/vorlaufige-bilanz-wieder-mehr-strom-aus-erneuerbaren-12867235.html,0,www.tagesspiegel.de,Vorläufige Bilanz: Wieder mehr Strom aus Erneuerbaren,Auch im Jahr 2024 ist der Anteil erneuerbarer Energien am Stromverbrauch erneut gestiegen. Die vorläufigen Daten des Umweltbundesamts zeigen: Vor allem der Strom aus Sonnenenergie boomt.,https://www.tagesspiegel.de/images/12867232/alternates/BASE_16_9_W1400/1734016723000/solarenergie.jpeg,2024-12-12T15:18:43Z,,"Der Anteil des Ökostroms am Bruttostromverbrauch steigt in diesem Jahr voraussichtlich auf einen neuen Höchststand von 56 Prozent. Das wären 1,5 Prozentpunkte mehr als im Vorjahr, teilte die Geschäft… [+2592 chars]",,de,'Erneuerbare'
https://www.stern.de/news/schwache-konjunktur--ezb-senkt-leitzinsen-trotz-inflationsanstieg-35305990.html,https://www.stern.de/news/schwache-konjunktur--ezb-senkt-leitzinsen-trotz-inflationsanstieg-35305990.html,0,www.stern.de,Schwache Konjunktur: EZB senkt Leitzinsen trotz Inflationsanstieg,"Angesichts eingetrübter Konjunkturaussichten und abnehmender Sorge wegen der Inflation hat die Europäische Zentralbank (EZB) ihre drei Leitzinssätze erneut um 0,25 Prozent gesenkt. Der zentrale Leitzins, der Einlagezins, zu dem Geschäftsbanken Geld bei der EZ…",https://image.stern.de/35306564/t/gf/v1/w1440/r1.7778/-/12-----1648f5b92261bb25.jpg,2024-12-12T15:29:55Z,,"Kopiere den aktuellen Link
Angesichts eingetrübter Konjunkturaussichten und abnehmender Sorge wegen der Inflation hat die Europäische Zentralbank (EZB) ihre drei Leitzinssätze erneut um 0,25 Prozent… [+3878 chars]",,de,'Inflation'
https://www.zeit.de/wirtschaft/2024-12/erneuerbare-energie-hoechststand-strom-deutschland,https://www.zeit.de/wirtschaft/2024-12/erneuerbare-energie-hoechststand-strom-deutschland,0,www.zeit.de,Erneuerbare Energie: Anteil von Ökostrom auf Höchststand,56 Prozent des Stroms wird in diesem Jahr voraussichtlich aus Erneuerbarer Energie kommen – mehr als im Vorjahr. Bis zum Ende des Jahrzehnts sollen es 80 Prozent sein.,https://img.zeit.de/wissen/umwelt/2024-12/oekostrom-statistik-strom-erneuerbare-energie-bild/wide__1300x731,2024-12-12T16:02:09Z,http://archive.md/20241213065950/https://www.zeit.de/wirtschaft/2024-12/erneuerbare-energie-hoechststand-strom-deutschland,"In diesem Jahr wird wohl mehr Strom aus erneuerbarer Energie
produziert als je zuvor. Der Anteil von Ökostrom am Bruttostromverbrauch werde voraussichtlich
bei 54 Prozent legen, das wären 1,5 Proze… [+1744 chars]",,de,'Erneuerbare'
https://taz.de/Konjunktur-in-der-Eurozone/!6051311/,https://taz.de/Konjunktur-in-der-Eurozone/!6051311/,0,taz.de,Konjunktur in der Eurozone: EZB senkt zum vierten Mal in Folge die Zinsen,"Wegen zunehmender Risiken und sinkender Inflation reduziert die EZB den Leitzins von 3,25 auf 3,00 Prozent. Sie will damit die Konjunktur ankurbeln.",https://taz.de/picture/7411298/1200/37173550-1.jpeg,2024-12-12T16:26:00Z,https://web.archive.org/web/20241213104656/https://taz.de/Konjunktur-in-der-Eurozone/!6051311/,"Wegen zunehmender Risiken und sinkender Inflation reduziert die EZB den Leitzins von 3,25 auf 3,00 Prozent. Sie will damit die Konjunktur ankurbeln. mehr...",,de,'Inflation'
https://www.tagesspiegel.de/berlin/neue-gewissheit-fur-hausbesitzer-wo-es-in-berlin-keine-fernwarme-geben-wird-12867748.html,https://www.tagesspiegel.de/berlin/neue-gewissheit-fur-hausbesitzer-wo-es-in-berlin-keine-fernwarme-geben-wird-12867748.html,0,www.tagesspiegel.de,Neue Gewissheit für Hausbesitzer: Wo es in Berlin keine Fernwärme geben wird,"Der Berliner Senat veröffentlicht, wo Hausbesitzer künftig nicht auf Fernwärme oder Geothermie zum Heizen setzen können. Eine neue Karte gibt adressgenau Überblick.",https://www.tagesspiegel.de/images/12852365/alternates/BASE_16_9_W1400/1733840534000/berlin-lichtenberg-ot-hohenscha-nhausen-fernwa-rme-der-vattenfall-13-06-2023-energie-berlin-lichtenberg-ot-hohensch.jpeg,2024-12-12T16:42:14Z,http://archive.md/20241212174539/https://www.tagesspiegel.de/berlin/neue-gewissheit-fur-hausbesitzer-wo-es-in-berlin-keine-fernwarme-geben-wird-12867748.html,In vielen Gebieten am Berliner Stadtrand müssen sich Hausbesitzer auch in Zukunft selbst um die Heizenergieversorgung ihrer Gebäude kümmern. Das geht aus ersten Ergebnissen der Berliner Wärmeplanung … [+71 chars],,de,'Heizen'
https://www.computerbase.de/news/gaming/winter-sale-gog-lockt-mit-rabatten-und-gratis-spielen.90657/,https://www.computerbase.de/news/gaming/winter-sale-gog-lockt-mit-rabatten-und-gratis-spielen.90657/,0,www.computerbase.de,Winter Sale: GOG lockt mit Rabatten und Gratis-Spielen [Notiz],"Die Spieleplattform GOG beginnt ihren Winter Sale. Noch bis zum 3. Januar 2025 sind zahlreiche Spiele teils stark im Preis reduziert. Daneben gibt es einen Adventskalender, der bis zum 31. Dezember jeden Tag ein Gratis-Spiel bereithält.",https://pics.computerbase.de/1/1/5/2/6/6-494634becea02204/article-1280x720.4f74f714.jpg,2024-12-12T17:07:00Z,https://web.archive.org/web/20241212172821/https://www.computerbase.de/news/gaming/winter-sale-gog-lockt-mit-rabatten-und-gratis-spielen.90657/,"Die Spieleplattform GOG beginnt ihren Winter Sale. Noch bis zum 3. Januar 2025 sind zahlreiche Spiele teils stark im Preis reduziert. Daneben gibt es einen Adventskalender, der bis zum 31. Dezember j… [+1021 chars]",,de,'Winter'
https://www.jungewelt.de/artikel/489816.großbritannien-ausstand-gegen-reallohnverlust.html,https://www.jungewelt.de/artikel/489816.großbritannien-ausstand-gegen-reallohnverlust.html,0,www.jungewelt.de,Großbritannien: Ausstand gegen Reallohnverlust [Online-Abo],"Starmers Labour-Regierung schlägt Lohnerhöhung vor, die Inflation nahezu vollständig aufzufressen droht. Man wolle die Staatsfinanzen unter Kontrolle bekommen. Weitere Streikwellen im öffentlichen Dienst sind absehbar.",https://www.jungewelt.de/img/1100/203164.jpg,2024-12-12T18:35:54Z,https://web.archive.org/web/20241213074602/http://www.jungewelt.de/artikel/489816.gro%C3%9Fbritannien-ausstand-gegen-reallohnverlust.html,"Uneingeschränkter Zugriff auf alle Inhalte: Erleben Sie die Tageszeitung junge Welt in gedruckter oder digitaler Form oder beides kombiniert.
Nachrichtenauswahl und -aufbereitung erfordern finanziel… [+458 chars]",,de,'Inflation'
https://www.sueddeutsche.de/stil/heizung-kosten-wohnen-mieter-li.3158894,https://www.sueddeutsche.de/stil/heizung-kosten-wohnen-mieter-li.3158894,0,www.sueddeutsche.de,Rechtskolumne: Darf man Heizkosten schätzen?,"Bei einem Mieterwechsel wird oft vergessen, den Energieverbrauch zu ermitteln. Wie man die Kosten für Heizung und Warmwasser nachträglich berechnet und wann Mieter sie reduzieren dürfen.",https://www.sueddeutsche.de/2022/06/21/a4874bfb-1a1d-4c21-96b0-d243b21d20ab.jpeg?q=60&fm=webp&width=1200&rect=0%2C93%2C1269%2C714,2024-12-13T08:25:31Z,https://web.archive.org/web/20241216162322/https://www.sueddeutsche.de/stil/heizung-kosten-wohnen-mieter-li.3158894,"Zunächst ist es gut zu wissen, wie die Heiz- und Warmwasserkosten verteilt werden dürfen. Dies ist gesetzlich in der Heizkostenverordnung geregelt. Demnach dürfen nicht alle Kosten nach dem individue… [+4292 chars]",,de,'Heizkosten'
https://www.welt.de/regionales/hamburg/article254861162/Finanzmarkt-Die-wirtschaftlichen-Potenziale-der-Windenergie-an-den-Kuesten-sind-gross.html,https://www.welt.de/regionales/hamburg/article254861162/Finanzmarkt-Die-wirtschaftlichen-Potenziale-der-Windenergie-an-den-Kuesten-sind-gross.html,0,www.welt.de,„Die wirtschaftlichen Potenziale der Windenergie an den Küsten sind groß“,"Dänemarks drittgrößte Bank Sydbank will ihr Geschäft in Norddeutschland weiter ausbauen. Sie setzt dabei auch auf die Energiewende und die wirtschaftlichen Perspektiven, die der Fehmarnbelttunnel mit sich bringt.",https://img.welt.de/img/regionales/hamburg/mobile254861160/3787938217-ci16x9-w1200/Image-675c07f1f42ba80299f9f009.jpg,2024-12-13T10:21:00Z,,"Dänemarks drittgrößte Bank Sydbank will ihr Geschäft in Norddeutschland weiter ausbauen. Sie setzt dabei auch auf die Energiewende und die wirtschaftlichen Perspektiven, die der Fehmarnbelttunnel mit… [+5469 chars]",,de,'Windenergie'
https://www.focus.de/politik/meinung/nena-und-die-andere-meinung-dunkelflaute-deutschland-wir-sind-europas-geisterfahrer_id_260560964.html,https://www.focus.de/politik/meinung/nena-und-die-andere-meinung-dunkelflaute-deutschland-wir-sind-europas-geisterfahrer_id_260560964.html,0,www.focus.de,Nena und die andere Meinung - Deutschland in der Dunkelflaute: Wir sind der Geisterfahrer Europas,"Deutschlands grünes Prestigeprojekt, die Energiewende, ist aus dem Ruder gelaufen. Die Strompreise explodieren, die Produktion steht an manchen Orten still. Während Spitzenpolitiker das Projekt schönreden, zeigt sich die bittere Realität: Wir sind mehr denn j…",https://p6.focus.de/img/fotos/id_260560980/nena-brockhaus-l-und-wirtschaftsminister-robert-habeck-gruene-.png?im=Crop%3D%280%2C0%2C1071%2C535%29%3BResize%3D%281200%2C627%29&impolicy=perceptual&quality=mediumHigh&hash=e8f0a4ce0872191f26c7eed1bffa00888f79fcd4561e9cdc0b0c20aa60ae9342,2024-12-13T14:38:24Z,https://web.archive.org/web/20241219201902/https://www.focus.de/politik/meinung/nena-und-die-andere-meinung-dunkelflaute-deutschland-wir-sind-europas-geisterfahrer_id_260560964.html,"<ul><li>
Kommentare</li><li>
E-Mail</li><li>
Teilen</li><li>
Mehr</li><li>
Twitter</li><li>
Drucken</li><li>
Feedback</li><li>
Fehler meldenSie haben einen Fehler gefunden?
Bitte markieren S… [+7612 chars]",,de,'Energiewende'
https://www.n-tv.de/politik/Russen-klagen-ueber-stark-gestiegene-Preise-article25430776.html,https://www.n-tv.de/politik/Russen-klagen-ueber-stark-gestiegene-Preise-article25430776.html,0,www.n-tv.de,Inflation und Rubel-Verfall: Russen klagen über stark gestiegene Preise,Fast drei Jahre dauert der Krieg in der Ukraine nun schon an. Täglich regnen Raketen auf ukrainische Städte nieder. Russische Gräueltaten sind Alltag. Mittlerweile bekommen aber auch die Menschen in Russland den Krieg zu spüren. Gestiegene Preise sorgen für U…,https://bilder1.n-tv.de/img/incoming/crop25430812/0561327738-cImg_16_9-w1200/435916681.jpg,2024-12-13T15:06:29Z,https://web.archive.org/web/20241213151805/https://www.n-tv.de/politik/Russen-klagen-ueber-stark-gestiegene-Preise-article25430776.html,Fast drei Jahre dauert der Krieg in der Ukraine nun schon an. Täglich regnen Raketen auf ukrainische Städte nieder. Russische Gräueltaten sind Alltag. Mittlerweile bekommen aber auch die Menschen in … [+4229 chars],,de,'Inflation'
https://www.autobild.de/artikel/smartes-heizkoerperthermostat-aqara-e1-srts-a01-amazon-angebot-guenstig-27743583.html,https://www.autobild.de/artikel/smartes-heizkoerperthermostat-aqara-e1-srts-a01-amazon-angebot-guenstig-27743583.html,0,www.autobild.de,Aqara-Heizkörperthermostat E1 mit Zigbee 3.0 zum starken Preis,"Wenn Sie Ihre Heizkosten senken möchten, dann setzen Sie auf smarte Heizkörperthermostate. Bei Amazon ist derzeit der populäre Heizkörperregler Aqara E1 zum Sparpreis im Angebot.",https://i.auto-bild.de/ir_img/3/8/6/8/0/8/9/Amazon-Angebot--Beliebtes-Aqara-Heizkoerperthermostat-E1-mit-Zigbee-3-0-zum-2869-2048x1152-5dbf3f05335d397b.jpg?impolicy=og_images,2024-12-13T16:00:00Z,,"Amazon Prime 30 Tage kostenlos testen
statt 8,99 EUR
0,00 EUR",,de,'Heizkosten'
https://www.zeit.de/news/2024-12/13/experte-zu-hohem-boersenstrompreis-kaum-folgen-fuer-haushalte,https://www.zeit.de/news/2024-12/13/experte-zu-hohem-boersenstrompreis-kaum-folgen-fuer-haushalte,0,www.zeit.de,Energiewende: Experte zu hohem Börsenstrompreis: Kaum Folgen für Haushalte,Hier finden Sie Informationen zu dem Thema „Energiewende“. Lesen Sie jetzt „Experte zu hohem Börsenstrompreis: Kaum Folgen für Haushalte“.,https://img.zeit.de/news/2024-12/13/experte-zu-hohem-boersenstrompreis-kaum-folgen-fuer-haushalte-image-group/wide__1300x731,2024-12-13T17:10:34Z,,Zeitweise sehr hohe Stundenpreise an der Strombörse haben laut Experten so gut wie keine Auswirkungen auf Endverbraucher. Stromversorger würden ihren Strom in der Regel zu großen Anteilen über Langfr… [+4319 chars],,de,'Energiewende'
https://www.stern.de/wirtschaft/news/energiewende--experte-zu-hohem-boersenstrompreis--kaum-folgen-fuer-haushalte-35309798.html,https://www.stern.de/wirtschaft/news/energiewende--experte-zu-hohem-boersenstrompreis--kaum-folgen-fuer-haushalte-35309798.html,0,www.stern.de,Energiewende: Experte zu hohem Börsenstrompreis: Kaum Folgen für Haushalte,"Im Großhandel war Strom am Donnerstag zeitweise sehr teuer. Steigen dadurch jetzt die Preise für die Haushalte? Nein, sagen Experten. Es sei denn, man hat seinen Tarif an den Börsenpreis gekoppelt.",https://image.stern.de/35309800/t/mM/v1/w1440/r1.7778/-/13--ysnzgs3mt3v5axs2048jpeg---48cffc2ba61c89aa.jpg,2024-12-13T17:10:34Z,https://web.archive.org/web/20241213185711/https://www.stern.de/wirtschaft/news/energiewende--experte-zu-hohem-boersenstrompreis--kaum-folgen-fuer-haushalte-35309798.html,"Kopiere den aktuellen Link
Im Großhandel war Strom am Donnerstag zeitweise sehr teuer. Steigen dadurch jetzt die Preise für die Haushalte? Nein, sagen Experten. Es sei denn, man hat seinen Tarif an … [+4506 chars]",,de,'Wasserkraft'
https://www.tagesspiegel.de/wirtschaft/energiewende-experte-zu-hohem-borsenstrompreis-kaum-folgen-fur-haushalte-12874690.html,https://www.tagesspiegel.de/wirtschaft/energiewende-experte-zu-hohem-borsenstrompreis-kaum-folgen-fur-haushalte-12874690.html,0,www.tagesspiegel.de,Energiewende: Experte zu hohem Börsenstrompreis: Kaum Folgen für Haushalte,"Im Großhandel war Strom am Donnerstag zeitweise sehr teuer. Steigen dadurch jetzt die Preise für die Haushalte? Nein, sagen Experten. Es sei denn, man hat seinen Tarif an den Börsenpreis gekoppelt.",https://www.tagesspiegel.de/images/12874687/alternates/BASE_16_9_W1400/1734109891000/strompreise.jpeg,2024-12-13T17:11:31Z,https://web.archive.org/web/20241214194515/https://www.tagesspiegel.de/wirtschaft/energiewende-experte-zu-hohem-borsenstrompreis-kaum-folgen-fur-haushalte-12874690.html,Zeitweise sehr hohe Stundenpreise an der Strombörse haben laut Experten so gut wie keine Auswirkungen auf Endverbraucher. Stromversorger würden ihren Strom in der Regel zu großen Anteilen über Langfr… [+5023 chars],,de,'Energiewende'
https://www.focus.de/finanzen/gestern-war-dunkelflaute-fuenf-zahlen-zeigen-das-grosse-problem-der-deutschen-stromversorgung_id_260561521.html,https://www.focus.de/finanzen/gestern-war-dunkelflaute-fuenf-zahlen-zeigen-das-grosse-problem-der-deutschen-stromversorgung_id_260561521.html,0,www.focus.de,"Gestern war Dunkelflaute - Fünf Zahlen zeigen, was im deutschen Stromnetz alles falsch läuft","Der Strompreis verzehnfachte sich an Donnerstag und Freitag, weil Erneuerbare Energie wenig Strom lieferte, richtig? Nicht nur, meinen Kritiker. Auch Kohle und Gas liefen nicht mit Volllast. Ein Unding während einer Dunkelflaute. Die Bundesnetzagentur ermitte…",https://p6.focus.de/img/fotos/id_260561617/gettyimages-1435226599.jpg?im=Crop%3D%280%2C188%2C3464%2C1732%29%3BResize%3D%281200%2C627%29&impolicy=perceptual&quality=mediumHigh&hash=264f639fd946ed831e9a4cdba4c0abcbb9e575ebe4146368655e1d93f0df968f,2024-12-13T19:28:54Z,https://web.archive.org/web/20241213201337/https://www.focus.de/finanzen/gestern-war-dunkelflaute-fuenf-zahlen-zeigen-das-grosse-problem-der-deutschen-stromversorgung_id_260561521.html,"<ul><li>
Kommentare</li><li>
E-Mail</li><li>
Teilen</li><li>
Mehr</li><li>
Twitter</li><li>
Drucken</li><li>
Feedback</li><li>
Fehler meldenSie haben einen Fehler gefunden?
Bitte markieren S… [+7300 chars]",,de,'Solar'
https://t3n.de/news/t3n-adventskalender-tuerchen-14-2024-1127705/,https://t3n.de/news/t3n-adventskalender-tuerchen-14-2024-1127705/,0,t3n.de,t3n-Adventskalender: Mach deine Heizung smart und effizient mit Türchen 14,"Bereit, deine Heizung aufs nächste Level zu bringen? Hinter dem heutigen t3n Adventskalender-Türchen warten die neuen, innovativen smarten Thermostate tado° X auf dich. Durchschnittlich 22 Prozent des Heizenergieverbrauches lassen sich mit Hilfe von tado° e…",https://t3n.de/news/wp-content/uploads/2020/11/t3n-adventskalender-24tuerchen-beitragsbild-wordpress14.png,2024-12-13T23:01:00Z,https://web.archive.org/web/20241214032617/https://t3n.de/news/t3n-adventskalender-tuerchen-14-2024-1127705/,"Die tado° Thermostate bringen jeden Raum auf die richtige Wohlfuhltemperatur und lassen sich komfortabel per App steuern. Du kannst Zeitplane fur jeden Raum erstellen und darauf vertrauen, dass nur d… [+1718 chars]",,de,'Heizen'
https://www.stern.de/panorama/wissen/beobachten-statt-fuettern--deutsche-wildtier-stiftung-warnt-vor-entenfuettern-mit-brot-35310412.html,https://www.stern.de/panorama/wissen/beobachten-statt-fuettern--deutsche-wildtier-stiftung-warnt-vor-entenfuettern-mit-brot-35310412.html,0,www.stern.de,Beobachten statt Füttern: Deutsche Wildtier Stiftung warnt vor Entenfüttern mit Brot,"Enten haben Strategien, um kalte Winter gut zu überstehen. Dazu gehört auch Ruhe. Eine oft gut gemeinte Fütterung mit Brot hilft da nicht. Im Gegenteil, wie die Deutsche Wildtier Stiftung weiß.",https://image.stern.de/35310414/t/B5/v1/w1440/r1.7778/-/14--xesp4exhhav8axs2048jpeg---f086863d85e92695.jpg,2024-12-14T06:30:36Z,,"Kopiere den aktuellen Link
Enten haben Strategien, um kalte Winter gut zu überstehen. Dazu gehört auch Ruhe. Eine oft gut gemeinte Fütterung mit Brot hilft da nicht. Im Gegenteil, wie die Deutsche W… [+2313 chars]",,de,'Winter'
