index,url,valid,domain,title,description,image,published,archive,content,quote,language,keyword
https://www.berliner-zeitung.de/kultur-vergnuegen/habeck-bei-lanz-bald-duerfen-auch-deutsche-stromzaehler-rueckwaerts-laufen-li.313006,https://www.berliner-zeitung.de/kultur-vergnuegen/habeck-bei-lanz-bald-duerfen-auch-deutsche-stromzaehler-rueckwaerts-laufen-li.313006,0,www.berliner-zeitung.de,Habeck bei Lanz: „Auch deutsche Stromzähler werden bald rückwärts laufen“ - Berliner Zeitung,"<ol><li>Habeck bei Lanz: „Auch deutsche Stromzähler werden bald rückwärts laufen“  Berliner Zeitung
</li><li>Bauphysikerin kritisiert Habeck und moniert „Absurdistan der Energiewende“  FOCUS Online
</li><li>""Wie fanden Sie das?"" So äußert sich Habeck zu Bae…",https://berliner-zeitung.imgix.net/2023/02/01/dc5a9f12-c0ed-4093-961b-19ae4391ffd7.jpeg?w=1024&auto=format,2023-02-01T08:23:24Z,,Absurd das war die meist gebrauchte Vokabel des ZDF-Talks bei Markus Lanz: Deutschland als energiepolitisches Absurdistan. Bevor allerdings der zugeschaltete Robert Habeck darüber mit zwei Experten i… [+3435 chars],,de,'Solar'
https://wien.orf.at/stories/3192852/,https://wien.orf.at/stories/3192852/,0,wien.orf.at,Neue Energiesparhilfen für Kleinunternehmen,"Viele Wiener Kleinunternehmen spüren die Teuerung und die hohen Energiekosten stark. Um sie zu unterstützen, startet die Stadt Wien heute eine neue Förderung – mit bis zu 20.000 Euro für mehr Energieeffizienz. Zehn Millionen Euro werden dafür ausgeschüttet.",https://ibs.orf.at/wie?image=https%3A%2F%2Foekastatic.orf.at%2Fmims%2F2020%2F10%2F62%2Fcrops%2Fw%3D1200%2Ch%3D627%2Cq%3D75%2F492969_master_166062_vlcsnap-2020-03-04-17h23m20s832.jpg%3Fs%3Dc643888a50f178e2c65b370c1419a6bbf5c8c4e4,2023-02-01T08:44:59Z,https://web.archive.org/web/20230201103637/https://wien.orf.at/stories/3192852/,"Das Ziel der neuen Förderung, die durch die Wirtschaftsagentur Wien abgewickelt wird, ist es, Kleinunternehmen auf ihrem Weg zu mehr Nachhaltigkeit und Energieeffizienz zu begleiten. Die förderbaren … [+1749 chars]",,de,'Energieeffizienz'
https://www.telepolis.de/features/Volle-Gasspeicher-in-Deutschland-zu-welchem-Preis-7477595.html,https://www.telepolis.de/features/Volle-Gasspeicher-in-Deutschland-zu-welchem-Preis-7477595.html,0,www.telepolis.de,Volle Gasspeicher in Deutschland zu welchem Preis?,"Die kurzfristige Trennung vom russischen Gas und die folgende Sicherung der deutschen Gasversorgung hat zahlreiche bislang wenig berücksichtigte Langzeitfolgen, deren Kosten für die Endverbraucher bislang nur schwer abschätzbar sind.",https://heise.cloudimg.io/bound/1200x1200/q85.png-lossy-85.webp-lossy-85.foil1/_www-heise-de_/imgs/18/3/6/8/9/3/9/9/302b36a3775e6c28.jpeg,2023-02-01T09:00:00Z,,"Die kurzfristige Trennung vom russischen Gas und die folgende Sicherung der deutschen Gasversorgung hat zahlreiche bislang wenig berücksichtigte Langzeitfolgen, deren Kosten für die Endverbraucher bi… [+4640 chars]",,de,'Gasspeicher'
https://hallespektrum.de/nachrichten/umwelt-verkehr/solarstudi-studierende-packen-die-energiewende-an/431382/,https://hallespektrum.de/nachrichten/umwelt-verkehr/solarstudi-studierende-packen-die-energiewende-an/431382/,0,hallespektrum.de,SolarStudi – Studierende packen die Energiewende an,"Zum Auftakt des Februars findet heute und morgen jeweils von 9 bis 16 Uhr der fünfte Einsatz des Pilotprojektes SolarStudi statt. Diesmal packen Studenten die Energiewende im Orchideenweg 8 praktisch an, indem sie Solarzellen Montieren, Wärmepumpen Aufstellen…",https://hallespektrum.de/wp-content/uploads/2023/02/HalleZero-Solarzelle.png,2023-02-01T09:58:23Z,https://web.archive.org/web/20230202051556/https://hallespektrum.de/nachrichten/umwelt-verkehr/solarstudi-studierende-packen-die-energiewende-an/431382/,"Zum Auftakt des Februars findet heute und morgen jeweils von 9 bis 16 Uhr der fünfte Einsatz des Pilotprojektes SolarStudi statt.
Diesmal packen Studenten die Energiewende im Orchideenweg 8 praktisc… [+1325 chars]",,de,'Solar'
https://www.wiwo.de/politik/konjunktur/eurostat-inflationsrate-geht-vor-ezb-sitzung-spuerbar-zurueck/28956566.html,https://www.wiwo.de/politik/konjunktur/eurostat-inflationsrate-geht-vor-ezb-sitzung-spuerbar-zurueck/28956566.html,0,www.wiwo.de,Eurostat: Inflationsrate geht vor EZB-Sitzung spürbar zurück,Die Inflationsrate im Euro-Raum ist zu Jahresbeginn stärker als erwartet gefallen. Das teilte das Statistikamt Eurostat in einer ersten Schätzung mit.,https://www.wiwo.de/images/lebensmittel-einkaufen-im-supermarkt-kundin-am-obststand-symbolfoto-forderungen-nach-mehrwertsteuersenkung-oder-mehrw/28956606/2-format11240.jpg,2023-02-01T10:02:00Z,https://web.archive.org/web/20230201163252/https://www.wiwo.de/politik/konjunktur/eurostat-inflationsrate-geht-vor-ezb-sitzung-spuerbar-zurueck/28956566.html,"Im Januar kletterten die Verbraucherpreise binnen Jahresfrist um 8,5 Prozent, wie Eurostat am Mittwoch in einer ersten Schätzung bekanntgab. Von Reuters befragte Volkswirte hatten mit 9,0 Prozent ger… [+928 chars]",,de,'Preisanstieg'
https://www.welt.de/wirtschaft/article243539649/Inflationsrate-im-Euro-Raum-Spuerbarer-Rueckgang-auf-8-5-Prozent-im-Januar.html,https://www.welt.de/wirtschaft/article243539649/Inflationsrate-im-Euro-Raum-Spuerbarer-Rueckgang-auf-8-5-Prozent-im-Januar.html,0,www.welt.de,Inflationsrate geht im Januar spürbar zurück,"Nach einer ersten Schätzung der Statistiker von Eurostat ist die Inflationsrate im Euro-Raum zum Jahresbeginn spürbar auf 8,5 Prozent gesunken. Im November lag sie noch bei über 10 Prozent. Grund zur Entwarnung gebe es aber nicht.",https://img.welt.de/img/bildergalerien/mobile243539637/4171354417-ci16x9-w1200/EZB-im-Dunst.jpg,2023-02-01T10:25:22Z,,"Die Inflationsrate im Euro-Raum ist zu Jahresbeginn stärker als erwartet gefallen. Im Januar kletterten die Verbraucherpreise binnen Jahresfrist um 8,5 Prozent, wie das Statistikamt Eurostat am Mittw… [+1888 chars]",,de,'Inflation'
https://www.businessinsider.de/gruenderszene/perspektive/handysucht-schlafmangel-burnout-meine-firma-hat-mich-krank-gemacht-b/,https://www.businessinsider.de/gruenderszene/perspektive/handysucht-schlafmangel-burnout-meine-firma-hat-mich-krank-gemacht-b/,0,www.businessinsider.de,"Handysucht, Schlafmangel, Burnout: Er fand einen Weg aus dem Startup-Chaos – und schaffte den Exit",Mit seiner Solar-Firma legte er einen Exit hin. Doch hinter den Kulissen litt er an Burnout. Über seine fünfmonatige Auszeit.,https://cdn.businessinsider.de/wp-content/uploads/2022/11/TobiasSchuett.jpeg?ver=1667981350,2023-02-01T11:19:24Z,,"Handysucht, Schlafmangel, Burnout: Er fand einen Weg aus dem Startup-Chaos und schaffte den Exit
Im Herbst hat Tobias Schütt seine Solar-Firma an den Energieversorger EnBw verkauft. Hinter den Kulis… [+7970 chars]",,de,'Solar'
https://www.handelsblatt.com/politik/deutschland/energieeffizienz-diese-kriterien-muessen-fuer-eine-kfw-foerderung-erfuellt-sein-/28943648.html,https://www.handelsblatt.com/politik/deutschland/energieeffizienz-diese-kriterien-muessen-fuer-eine-kfw-foerderung-erfuellt-sein-/28943648.html,0,www.handelsblatt.com,KfW 40 Förderung: Welche Anforderungen für das perfekte Effizienzhaus zu erfüllen sind,Ob Sanierung im Bestand oder Neubau: Viele Maßnahmen für mehr Energieeffizienz werden staatlich gefördert. Doch einfache Lösungen gibt es nicht.,https://www.handelsblatt.com/images/wohnungsbau-in-deutschland/28943734/5-format2003.jpg,2023-02-01T11:40:50Z,https://web.archive.org/web/20230201145002/https://www.handelsblatt.com/politik/deutschland/energieeffizienz-diese-kriterien-muessen-fuer-eine-kfw-foerderung-erfuellt-sein-/28943648.html,"Wohnungsbau in DeutschlandOb Neubau oder Sanierung im Bestand: Für die staatliche KFW-Förderung sind hohe Anforderungen zu erfüllen.
(Foto: imago images/Westend61) 
Berlin Von der neuen Heizungsanl… [+1441 chars]",,de,'Energieeffizienz'
https://taz.de/Elektroautos-mit-Solarzellen/!5908960/,https://taz.de/Elektroautos-mit-Solarzellen/!5908960/,0,taz.de,Elektroautos mit Solarzellen: Sonne im Tank,"Die Firma Sono Motors will E-Autos bauen, die sich über Solarzellen selbst aufladen. Zu schön, um wahr zu sein? Versprechungen und Tücken im Check.",https://taz.de/picture/6059112/948/28296231-1.jpeg,2023-02-01T12:59:00Z,,"Die Firma Sono Motors will E-Autos bauen, die sich über Solarzellen selbst aufladen. Zu schön, um wahr zu sein? Versprechungen und Tücken im Check.
Schwarz muss sein: Der Sono hat Solarzellen auf Da… [+6566 chars]",,de,'Solar'
https://www.sueddeutsche.de/muenchen/ebersberg/landkreis-ebersberg-energiewende-oekostrom-1.5743399,https://www.sueddeutsche.de/muenchen/ebersberg/landkreis-ebersberg-energiewende-oekostrom-1.5743399,0,www.sueddeutsche.de,Energiewende im Landkreis Ebersberg: Wenn der Strom sichtbar wird,"Im neuen Energiemonitor kann man in Echtzeit nachverfolgen, wie die Elektrizität für den Landkreis erzeugt wird.",https://www.sueddeutsche.de/image/sz.1.5179728/1200x675?v=1675269098,2023-02-01T16:42:34Z,,"Im neuen Energiemonitor kann man in Echtzeit nachverfolgen, wie die Elektrizität für den Landkreis erzeugt wird.Im Landkreis gibt es bekanntlich einige regenerative Stromerzeuger, vom Solardach über … [+3030 chars]",,de,'Solar'
https://www.prnewswire.com/news-releases/jackery-tritt-in-den-australischen-markt-ein-um-eine-grunere-zukunft-zu-fordern-301736528.html,https://www.prnewswire.com/news-releases/jackery-tritt-in-den-australischen-markt-ein-um-eine-grunere-zukunft-zu-fordern-301736528.html,0,www.prnewswire.com,"Jackery tritt in den australischen Markt ein, um eine grünere Zukunft zu fördern","FREMONT, Kalifornien, 1. Februar 2023 /PRNewswire/ -- Jackery, der weltweit führende Anbieter von tragbaren Powerstationen und Solarmodulen, hat sich zum Ziel gesetzt, einen Beitrag zu einer nachhaltigeren Zukunft zu leisten. Nach einem erfolgreichen Jahrzehn…",https://mma.prnewswire.com/media/1877275/Jackery_Logo.jpg?p=facebook,2023-02-01T19:36:00Z,,"FREMONT, Kalifornien, 1. Februar 2023/PRNewswire/ -- Jackery, der weltweit führende Anbieter von tragbaren Powerstationen und Solarmodulen, hat sich zum Ziel gesetzt, einen Beitrag zu einer nachhalti… [+2986 chars]",,de,'Solar'
https://www.welt.de/wirtschaft/plus243494529/Neue-Regeln-Gesetze-Das-aendert-sich-im-Februar-2023-in-Deutschland-Windkraft-Coronaschutz-Verbandskasten.html,https://www.welt.de/wirtschaft/plus243494529/Neue-Regeln-Gesetze-Das-aendert-sich-im-Februar-2023-in-Deutschland-Windkraft-Coronaschutz-Verbandskasten.html,0,www.welt.de,"Windkraft, Coronaschutz, Verbandskasten – Das ändert sich im Februar für Verbraucher","Kurzer Monat, aber viele Änderungen: Ab Februar gilt das „Wind-an-Land“-Gesetz, damit es mit der Windenergie schneller vorangeht. Zudem gibt es neue Regelungen für Autofahrer, zur Maskenpflicht und für Stromverbraucher. Was Sie jetzt wissen sollten.",https://img.welt.de/img/wirtschaft/mobile243525073/9691353357-ci16x9-w1200-fnov-fpotl-fpi157750653/GettyImages-1411130003.jpg,2023-02-02T07:41:00Z,http://archive.md/20230202092811/https://www.welt.de/wirtschaft/plus243494529/Neue-Regeln-Gesetze-Das-aendert-sich-im-Februar-2023-in-Deutschland-Windkraft-Coronaschutz-Verbandskasten.html,"Gleellullol pel pel Pnpvekt pel ZeOeu tel 6epelee putt veklpekelutlek Uuthpuoke enppleeheu. Ble ueneu Uulpeklltleu pep Pnupep epel peu Pnppen pel Vlupeuelale, Oll peueu enek ponOlae Uoupel aepeklehl … [+7449 chars]",,de,'Windenergie'
https://www.golem.de/sonstiges/zustimmung/auswahl.html?from=https://www.golem.de/news/m2-pro-und-m2-max-im-vergleich-apples-beste-prozessoren-sind-nun-noch-besser-2302-171599.html&referer=https://t.co/041ede4031,https://www.golem.de/sonstiges/zustimmung/auswahl.html?from=https://www.golem.de/news/m2-pro-und-m2-max-im-vergleich-apples-beste-prozessoren-sind-nun-noch-besser-2302-171599.html&referer=https://t.co/041ede4031,0,www.golem.de,M2 Pro und M2 Max im Vergleich: Apples beste Prozessoren sind nun noch besser,"Mit dem M2 Pro und M2 Max hat Apple würdige Nachfolger für den tollen M1 Max gefunden. Gerade die Energieeffizienz gefällt uns. Ein Test von Oliver Nickel (Apple Silicon, Prozessor)",,2023-02-02T08:11:03Z,,"Besuchen Sie Golem.de wie gewohnt mit Werbung und Tracking,
 indem Sie der Nutzung aller Cookies zustimmen.
 Details zum Tracking finden Sie im Privacy Center.
Skript wurde nicht geladen. Informat… [+607 chars]",,de,'Energieeffizienz'
"https://winfuture.de/news,134345.html","https://winfuture.de/news,134345.html",0,winfuture.de,EU bringt gigantisches Förderprogramm für Green-Tech auf den Weg,Die EU-Kommission hat ein Rahmen-Programm für gigantische Investitionen in grüne Technologien vorgestellt. Mit diesem sollen Fehler der Vergangenheit korrigiert udn die Industrie Europas für die kommende Ära fit gemacht werden.(Weiter lesen),https://i.wfcdn.de/teaser/1920/45936.jpg,2023-02-02T08:36:00Z,"https://web.archive.org/web/20230202084527/https://winfuture.de/news,134345.html",Die EU-Kommission hat ein Rahmen-Programm für gigantische Investitionen in grüne Technologien vorgestellt. Mit diesem sollen Fehler der Vergangenheit korrigiert udn die Industrie Europas für die komm… [+1829 chars],,de,'Photovoltaik'
https://www.zeit.de/wirtschaft/2023-02/energie-gasspeicher-drei-viertel-gefuellt,https://www.zeit.de/wirtschaft/2023-02/energie-gasspeicher-drei-viertel-gefuellt,0,www.zeit.de,Energie: Gasspeicher zu über drei Viertel gefüllt,"Mit 78,6 Prozent Füllstand sind die deutschen Gasspeicher fast doppelt so voll wie gesetzlich vorgeschrieben. Besonders der milde Winter hat dazu beigetragen.",,2023-02-02T10:24:03Z,https://web.archive.org/web/20230202103638/https://www.zeit.de/wirtschaft/2023-02/energie-gasspeicher-drei-viertel-gefuellt,"When browsing with ads:
We collect personal data and also transmit it to third-party providers
 that help us improve and finance our digital content. Some of the information stored on your device, … [+732 chars]",,de,'Winter'
"https://winfuture.de/news,134353.html","https://winfuture.de/news,134353.html",0,winfuture.de,Stromerzeugung: Wind und Sonne setzten sich in der EU an die Spitze,"Wind- und Solar-Energie haben es im letzten Jahr geschafft, sich zumindest zusammengenommen an die Spitze im europäischen Stromnetz zu setzen. Angesichts der Trends der letzten Jahre dürften die Anteile bald noch deutlicher verteilt werden.(Weiter lesen)",https://i.wfcdn.de/teaser/1920/39104.jpg,2023-02-02T14:01:00Z,"https://web.archive.org/web/20230202140423/https://winfuture.de/news,134353.html","Wind- und Solar-Energie haben es im letzten Jahr geschafft, sich zumindest zusammengenommen an die Spitze im europäischen Stromnetz zu setzen. Angesichts der Trends der letzten Jahre dürften die Ante… [+2651 chars]",,de,'Solar'
https://www.zeit.de/news/2023-02/02/us-murmeltier-phil-sagt-sechs-weitere-wochen-winter-voraus,https://www.zeit.de/news/2023-02/02/us-murmeltier-phil-sagt-sechs-weitere-wochen-winter-voraus,0,www.zeit.de,Murmeltiertag: US-Murmeltier Phil sagt sechs weitere Wochen Winter voraus,,,2023-02-02T16:39:31Z,https://web.archive.org/web/20230202165331/https://www.zeit.de/news/2023-02/02/us-murmeltier-phil-sagt-sechs-weitere-wochen-winter-voraus,"When browsing with ads:
We collect personal data and also transmit it to third-party providers
 that help us improve and finance our digital content. Some of the information stored on your device, … [+732 chars]",,de,'Winter'
https://www.bild.de/politik/inland/politik-inland/minister-rechnet-sich-energiewende-schoen-experten-kritisieren-habecks-windkraft-82758846.bild.html,https://www.bild.de/politik/inland/politik-inland/minister-rechnet-sich-energiewende-schoen-experten-kritisieren-habecks-windkraft-82758846.bild.html,0,www.bild.de,Minister rechnet sich Energiewende schön - Experten kritisieren Habecks Windkraft-Plan,Wirtschaftsminister Robert Habeck rechnet kühn mit einer Verdreifachung (!) des Tempos beim Ausbau der Erneuerbaren Energien.,"https://images.bild.de/63da9419eaaec25f4a511363/6b5652498636bb2278b7ebfe9812b9f7,d62361b8?w=1280",2023-02-02T19:13:31Z,https://web.archive.org/web/20230202192103/https://www.bild.de/politik/inland/politik-inland/minister-rechnet-sich-energiewende-schoen-experten-kritisieren-habecks-windkraft-82758846.bild.html,"Wirtschaftsminister Robert Habeck (53, Grüne) hatte am Mittwoch große Töne gespuckt und verkünden lassen, Deutschlands Strom-Versorgung sei bis Ende des Jahrzehnts gewährleistet.
Was in seiner Erklä… [+2216 chars]",,de,'Ausbau'
https://www.stern.de/gesellschaft/regional/niedersachsen-bremen/energie--wasser-im-schwimmbad-mancherorts-wieder-waermer-33162678.html,https://www.stern.de/gesellschaft/regional/niedersachsen-bremen/energie--wasser-im-schwimmbad-mancherorts-wieder-waermer-33162678.html,0,www.stern.de,Energie: Wasser im Schwimmbad mancherorts wieder wärmer,"Im Januar sind viele Schwimmbäder voll - die guten Vorsätze für das neue Jahr werden umgesetzt. In einigen in Niedersachsen kann wieder bei Normaltemperatur gebadet werden, in vielen wird wegen der Energiekrise noch gespart.",https://image.stern.de/33162680/t/Vb/v1/w1440/r1.7778/-/03--urnnewsmldpacom2009010123020399458578v3w800h600l829t302r1824b1245jpeg---9d5a10e7f3d4b59a.jpg,2023-02-03T05:20:26Z,,"Im Januar sind viele Schwimmbäder voll - die guten Vorsätze für das neue Jahr werden umgesetzt. In einigen in Niedersachsen kann wieder bei Normaltemperatur gebadet werden, in vielen wird wegen der E… [+2461 chars]",,de,'Energiekrise'
https://stadt-bremerhaven.de/telekom-ausbau-im-dezember-2022-haben-909-000-haushalte-profitiert/,https://stadt-bremerhaven.de/telekom-ausbau-im-dezember-2022-haben-909-000-haushalte-profitiert/,0,stadt-bremerhaven.de,Telekom-Ausbau: Im Dezember 2022 haben 909.000 Haushalte profitiert,"Die Telekom hat im Dezember nach eigenen Angaben für 909.000 Haushalte die Internet-Geschwindigkeit erhöht. Zumindest gilt das in der Theorie. Denn praktisch gibt es da natürlich nur einen Schub, wenn auch ein entsprechender Tarif bei der Telekom gebucht wird…",https://stadt-bremerhaven.de/wp-content/uploads/2023/02/Telekom-Kabel.jpg,2023-02-03T08:00:31Z,https://web.archive.org/web/20230203093541/https://stadt-bremerhaven.de/telekom-ausbau-im-dezember-2022-haben-909-000-haushalte-profitiert/,"Die Telekom hat im Dezember nach eigenen Angaben für 909.000 Haushalte die Internet-Geschwindigkeit erhöht. Zumindest gilt das in der Theorie. Denn praktisch gibt es da natürlich nur einen Schub, wen… [+1104 chars]",,de,'Ausbau'
