index,url,valid,domain,title,description,image,published,archive,content,quote,language,keyword
https://www.golem.de/sonstiges/zustimmung/auswahl.html?from=https://www.golem.de/news/anzeige-solar-ueberwachungskamera-mit-akku-kurz-fuer-unter-30-euro-2510-200693.html&referer=https://t.co/830b67f8a0,https://www.golem.de/sonstiges/zustimmung/auswahl.html?from=https://www.golem.de/news/anzeige-solar-ueberwachungskamera-mit-akku-kurz-fuer-unter-30-euro-2510-200693.html&referer=https://t.co/830b67f8a0,0,www.golem.de,Anzeige: Solar-Überwachungskamera mit Akku kurz für unter 30 Euro,"Mehr Sicherheit für Haus und Garten: Solar-Außenkamera mit Akku gibt es jetzt zum halben Preis bei Amazon. (Videoüberwachung, Kameras)",,2025-10-01T09:10:02Z,,"Besuchen Sie Golem.de wie gewohnt mit Werbung und Tracking,
 indem Sie der Nutzung aller Cookies zustimmen.
 Details zum Tracking finden Sie im Privacy Center.
Skript wurde nicht geladen. Informat… [+607 chars]",,de,'Solar'
https://www.stern.de/gesellschaft/regional/mecklenburg-vorpommern/windenergie--baustart-fuer-letzten-windpark-von-dreierverbund-vor-ruegen-36096990.html,https://www.stern.de/gesellschaft/regional/mecklenburg-vorpommern/windenergie--baustart-fuer-letzten-windpark-von-dreierverbund-vor-ruegen-36096990.html,0,www.stern.de,Windenergie: Baustart für letzten Windpark von Dreierverbund vor Rügen,Der Windpark Windanker soll eine Dreiergruppe von Offshore-Windpark nordöstlich vor Rügen vervollständigen. Nun ist der Bau gestartet. Weitere Parks sind bereits geplant.,https://image.stern.de/36096992/t/4x/v1/w1440/r1.7778/-/01--s4ihe4kxyhv7axs2048jpeg---de60620fde60564a.jpg,2025-10-01T10:21:38Z,,"Kopiere den aktuellen Link
Zur Merkliste hinzufügen
Der Windpark Windanker soll eine Dreiergruppe von Offshore-Windpark nordöstlich vor Rügen vervollständigen. Nun ist der Bau gestartet. Weitere Pa… [+1452 chars]",,de,'Windenergie'
https://www.diepresse.com/20156442/teuerung-bei-vier-prozent-wie-es-mit-der-inflation-weitergeht,https://www.diepresse.com/20156442/teuerung-bei-vier-prozent-wie-es-mit-der-inflation-weitergeht,0,www.diepresse.com,Teuerung bei vier Prozent – wie es mit der Inflation weitergeht [premium],Die heimische Inflationsrate machte im September vier Prozent aus – und blieb damit weiterhin hoch. Daran wird sich so schnell auch nichts ändern. 2026 ist aber Besserung in Sicht.,https://img.diepresse.com/public/incoming/czj1qz-438250452.jpg/alternates/DPR_SOCIAL_NACHRICHTEN/438250452.jpg,2025-10-01T13:10:19Z,,Die Inflationsraten in Österreich sind vergleichsweise hoch und daran hat sich auch im September nichts geändert. Einer Schnellschätzung der Statistik Austria zufolge zogen die Preise zuletzt um vier… [+4138 chars],,de,'Inflation'
https://www.tagesspiegel.de/berlin-brandenburg-hochster-stand-dieses-jahr-inflation-steigt-auf-24-prozent-14442641.html,https://www.tagesspiegel.de/berlin-brandenburg-hochster-stand-dieses-jahr-inflation-steigt-auf-24-prozent-14442641.html,0,www.tagesspiegel.de,"Berlin / Brandenburg: Höchster Stand dieses Jahr: Inflation steigt auf 2,4 Prozent","Höchster Stand dieses Jahr: Inflation steigt auf 2,4 Prozent",,2025-10-01T13:42:35Z,,"Die Inflationsrate in Deutschland ist mit 2,4 Prozent im September auf den höchsten Stand im laufenden Jahr gestiegen. Das teilte das Statistische Bundesamt auf Basis vorläufiger Zahlen mit.
© dpa-i… [+83 chars]",,de,'Inflation'
https://www.ibiza-heute.de/ihr-garten-in-besten-haenden/,https://www.ibiza-heute.de/ihr-garten-in-besten-haenden/,0,www.ibiza-heute.de,Ihr Garten in  besten Händen,"Wir bieten professionelle Garten- und Landschaftspflege – zuverlässig, individuell und mit viel Erfahrung. Dauerpflege & Betreuung Spezielle Picudo Rojo-Behandlung Biologischer Palmschutz Gartenbeleuchtung (Solar) Rollrasen | Rasenaufbereitung Neubau, Umgesta…",https://www.ibiza-heute.de/wp-content/uploads/2025/10/Gartenpflege-Ibiza.jpg,2025-10-01T15:00:15Z,,"Wir bieten professionelle Garten- und Landschaftspflege zuverlässig, individuell und mit viel Erfahrung.
Dauerpflege &amp; BetreuungSpezielle Picudo Rojo-BehandlungBiologischer PalmschutzGartenbeleu… [+188 chars]",,de,'Solar'
https://www.jungewelt.de/artikel/509562.stahlindustrie-stahltarif-unter-inflation.html,https://www.jungewelt.de/artikel/509562.stahlindustrie-stahltarif-unter-inflation.html,0,www.jungewelt.de,Stahlindustrie: Stahltarif unter Inflation,"IG Metall und Stahlverband einigen sich in vierter Gesprächsrunde. Das Ziel der Gewerkschaft, den Ausgleich der Teuerung, hat sie nicht erreicht. Vorstand will nun Entlastung für Konzerne.",https://www.jungewelt.de/img/1100/214013.jpg,2025-10-01T17:35:53Z,,"Nun steht ein Tarifabschluss in der Stahlindustrie, vorerst für den Nordwesten der BRD. Die IG Metall und der Kapitalverband Stahl einigten sich in der Nacht zum Mittwoch, nachdem die Friedenspflicht… [+3560 chars]",,de,'Inflation'
https://www.sueddeutsche.de/wirtschaft/inflation-familie-kinder-sparen-li.3290317,https://www.sueddeutsche.de/wirtschaft/inflation-familie-kinder-sparen-li.3290317,0,www.sueddeutsche.de,"Inflation: Kinder, wir müssen sparen!","Musikunterricht und Markenklamotten sind ganz schön teuer geworden. Mit der Familie essen gehen, kostet ein halbes Vermögen. Wie erklärt man es den Kindern, wenn die Inflation zuschlägt?",https://www.sueddeutsche.de/2025/09/30/fdb76f1c-a0d5-42cc-a7fa-04ca3ed8c89d.jpg?q=60&fm=webp&width=1200&rect=0%2C60%2C3200%2C1800,2025-10-01T18:11:51Z,,"Es sind die kleinen Dinge, die plötzlich schmerzen. Die früher doch noch drin waren, ohne dass man darüber Gedanken verlor. Die Kugel Eis über zwei Euro. Einmal Pommes rot-weiß im Schwimmbad kostet i… [+349 chars]",,de,'Inflation'
https://www.nzz.ch/sport/ski/ski-alpin-kinofilm-begleitet-odermatt-und-sarrazin-auf-piste-und-im-spital-ld.1904579,https://www.nzz.ch/sport/ski/ski-alpin-kinofilm-begleitet-odermatt-und-sarrazin-auf-piste-und-im-spital-ld.1904579,0,www.nzz.ch,Vom Siegerpodest bis ins Spital: Ein Kinofilm begleitet die Abfahrer um Odermatt und Sarrazin durch den Winter,Die Dokumentation «Downhill Skiers» feierte am Zurich Film Festival Premiere. Neben spektakulären Action-Bildern zeigt er auch die verletzliche Seite der Draufgänger.,"https://img.nzz.ch/2025/10/01/da28e1c1-9615-4650-b347-bc38be2da88b.jpg?width=1200&height=675&fit=bounds&quality=75&auto=webp&crop=3584,2016,x128,y0&wmark=nzz",2025-10-02T03:30:00Z,,"Die Dokumentation «Downhill Skiers» feierte am Zurich Film Festival Premiere. Neben spektakulären Action-Bildern zeigt er auch die verletzliche Seite der Draufgänger.
Szene aus dem Dokumentarfilm «D… [+7781 chars]",,de,'Winter'
https://www.nzz.ch/wirtschaft/der-angriff-russlands-auf-die-ukraine-stuerzte-europa-in-eine-energiekrise-das-sollen-schweizer-stromhaendler-ausgenutzt-haben-ld.1904965,https://www.nzz.ch/wirtschaft/der-angriff-russlands-auf-die-ukraine-stuerzte-europa-in-eine-energiekrise-das-sollen-schweizer-stromhaendler-ausgenutzt-haben-ld.1904965,0,www.nzz.ch,Der Angriff Russlands auf die Ukraine stürzte Europa in eine Energiekrise. Das sollen Schweizer Stromhändler ausgenutzt haben,Eine neue Untersuchung der unabhängigen Strommarktaufsicht kommt zu einem brisanten Schluss.,"https://img.nzz.ch/2025/10/01/35b9d1a0-cb39-4c5d-a5c8-42d9072a419d.jpg?width=1200&height=674&fit=bounds&quality=75&auto=webp&crop=1474,829,x152,y0&wmark=nzz",2025-10-02T03:30:00Z,,"Eine neue Untersuchung der unabhängigen Strommarktaufsicht kommt zu einem brisanten Schluss.
Während der Energiekrise 2022 verkauften Schweizer Händler ihren Strom besonders teuer: die Staumauer Gra… [+9476 chars]",,de,'Winter'
https://www.bild.de/sport/fussball/noch-lange-nicht-am-limit-kurz-vor-nati-debuet-hoeness-lobt-jaquez-68dd572d6b68b965a656afed,https://www.bild.de/sport/fussball/noch-lange-nicht-am-limit-kurz-vor-nati-debuet-hoeness-lobt-jaquez-68dd572d6b68b965a656afed,0,www.bild.de,„Noch lange nicht am Limit“ - Kurz vor Nati-Debüt! Hoeneß lobt Jaquez,Im Winter kam Innenverteidiger Luca Jaquez (22) für sieben Millionen Euro vom FC Luzern zum VfB. Jetzt schwärmt Trainer Sebastian Hoeneß (43) vom Schweizer.,"https://images.bild.de/68dd572d6b68b965a656afed/ff22e2d8a8ff3f4ed777bce52464ece7,5f271cf?w=1280",2025-10-02T08:29:04Z,,"Sie sollen Anschläge in Deutschland geplant haben: Hier kommen die mutmaßlichen Hamas-Terroristen zur Haftvorführung
Sie sollen Anschläge in Deutschland geplant haben: Hier kommen die mutmaßlichen H… [+978 chars]",,de,'Winter'
https://www.stern.de/news/solarwirtschaft-fordert-konkretes-ausbauziel-bis-2030-fuer-batteriespeicher-36100336.html,https://www.stern.de/news/solarwirtschaft-fordert-konkretes-ausbauziel-bis-2030-fuer-batteriespeicher-36100336.html,0,www.stern.de,Solarwirtschaft fordert konkretes Ausbauziel bis 2030 für Batteriespeicher,"""Effizienzbooster für die Energiewende"": Batteriespeicher spielen nach Einschätzung der Solarwirtschaft eine zentrale Rolle bei der Transformation des Energiesystems in Deutschland. Nötig sei deshalb ein verbindliches Ausbauziel bis 2030, erklärte der Bundesv…",https://image.stern.de/36100338/t/rl/v1/w1440/r1.7778/-/02--montage-eines-stromspeichers-in-aachen---4229aca4495bf650.jpg,2025-10-02T09:32:07Z,,"Kopiere den aktuellen Link
Zur Merkliste hinzufügen
""Effizienzbooster für die Energiewende"": Batteriespeicher spielen nach Einschätzung der Solarwirtschaft eine zentrale Rolle bei der Transformatio… [+1235 chars]",,de,'Ausbau'
https://www.waz.de/ratgeber-wissen/energie/article408896370/kleines-kraftwerk-senkt-preis-balkonkraftwerk-anker-solix-speicher.html,https://www.waz.de/ratgeber-wissen/energie/article408896370/kleines-kraftwerk-senkt-preis-balkonkraftwerk-anker-solix-speicher.html,0,www.waz.de,"Während die Inflation steigt, sinkt der Preis für dieses Balkonkraftwerk","Kleines Kraftwerk macht mit erneuter Preisreduktion sein Quattro-Set mit Anker Solix Solarbank 3 E2700 Pro im Oktober noch attraktiver. Lesen Sie hier, was es kann und kostet.",https://img.sparknews.funkemedien.de/410139256/410139256_1759400248_v16_9_1600.jpeg,2025-10-02T10:19:00Z,,"Strom wird teurer wer gegensteuern will, setzt auf Eigenproduktion. Dieses Komplettset bietet alles, was es dafür braucht: vier starke Solarmodule, eine smarte Speicherlösung mit Notstromfunktion und… [+4991 chars]",,de,'Inflation'
"https://www.gamestar.de/artikel/spanien-blackout-energienetz-europa-neue-daten,3440393.html","https://www.gamestar.de/artikel/spanien-blackout-energienetz-europa-neue-daten,3440393.html",0,www.gamestar.de,News: Wissenschaft - Spaniens Lehren aus der Energiewende: Wie Solar und Wind den Blackout 2025 mit auslösten und weshalb wir das feiern sollten,"Blackout! Die Horror-Meldung rüttelte im Frühjahr 2025 Europa auf. Spanien lag im Dunkeln. Nun liegen neue Daten vor, die Details zu Hintergründen nennen.",https://images.cgames.de/images/gamestar/293/teaser-spanien-blackout-3-gs-_6378207.jpg,2025-10-02T12:53:00Z,,"Blackouts stellen eine Gefahr dar, da sie das nehmen, worauf unsere moderne Gesellschaft fußt: elektrischen Strom. Ohne ihn geht wenig bis gar nichts. Die Energiewende erfordert Umdenken.
(Bildquell… [+11434 chars]",,de,'Solar'
https://www.stern.de/gesellschaft/regional/sachsen/windenergie--kammern-fordern-festhalten-am-flaechenziel-fuer-windkraft-36101984.html,https://www.stern.de/gesellschaft/regional/sachsen/windenergie--kammern-fordern-festhalten-am-flaechenziel-fuer-windkraft-36101984.html,0,www.stern.de,Windenergie: Kammern fordern Festhalten am Flächenziel für Windkraft,Die Ost-Ministerpräsidenten sprechen sich für neue Regeln beim Windkraft-Ausbau aus. Die Industrie- und Handelskammern halten das für ein falsches Signal.,https://image.stern.de/36101986/t/O_/v1/w1440/r1.7778/-/02--akmzjfpyuyv3axs2048jpeg---3d50bf089821663e.jpg,2025-10-02T14:15:05Z,,"Kopiere den aktuellen Link
Zur Merkliste hinzufügen
Die Ost-Ministerpräsidenten sprechen sich für neue Regeln beim Windkraft-Ausbau aus. Die Industrie- und Handelskammern halten das für ein falsche… [+1911 chars]",,de,'Windenergie'
https://www.zeit.de/news/2025-10/02/kammern-fordern-festhalten-am-flaechenziel-fuer-windkraft,https://www.zeit.de/news/2025-10/02/kammern-fordern-festhalten-am-flaechenziel-fuer-windkraft,0,www.zeit.de,Windenergie: Kammern fordern Festhalten am Flächenziel für Windkraft,Hier finden Sie Informationen zu dem Thema „Windenergie“. Lesen Sie jetzt „Kammern fordern Festhalten am Flächenziel für Windkraft“.,https://img.zeit.de/news/2025-10/02/kammern-fordern-festhalten-am-flaechenziel-fuer-windkraft-image-group/wide__1300x731,2025-10-02T14:15:05Z,,"Die drei sächsischen Industrie- und Handelskammern (IHK) kritisieren den Vorstoß der Ost-Ministerpräsidenten, das Zwei-Prozent-Flächenziel beim Windkraft-Ausbau zu kippen. Ständige Änderungen der pol… [+1741 chars]",,de,'Windenergie'
https://www.zeit.de/news/2025-10/02/sma-solar-kuendigt-abbau-von-bis-zu-350-weiteren-stellen-an,https://www.zeit.de/news/2025-10/02/sma-solar-kuendigt-abbau-von-bis-zu-350-weiteren-stellen-an,0,www.zeit.de,Solarenergie: SMA Solar kündigt Abbau von bis zu 350 weiteren Stellen an,Hier finden Sie Informationen zu dem Thema „Solarenergie“. Lesen Sie jetzt „SMA Solar kündigt Abbau von bis zu 350 weiteren Stellen an“.,https://img.zeit.de/news/2025-10/02/sma-solar-kuendigt-abbau-von-bis-zu-350-weiteren-stellen-an-image-group/wide__1300x731,2025-10-02T14:38:20Z,,Der schwächelnde Solartechnikhersteller SMA Solar will bis Ende des Jahres 2026 weltweit rund weitere 350 Jobs streichen. Der Großteil des geplanten Personalabbaus betreffe den Unternehmenssitz Niest… [+2626 chars],,de,'Solar'
https://www.stern.de/gesellschaft/regional/hessen/solarenergie--sma-solar-kuendigt-abbau-von-bis-zu-350-weiteren-stellen-an-36102082.html,https://www.stern.de/gesellschaft/regional/hessen/solarenergie--sma-solar-kuendigt-abbau-von-bis-zu-350-weiteren-stellen-an-36102082.html,0,www.stern.de,Solarenergie: SMA Solar kündigt Abbau von bis zu 350 weiteren Stellen an,SMA Solar streicht bis Ende 2026 weltweit rund 350 weitere Stellen. Besonders betroffen ist der Standort Niestetal. Was das Unternehmen zu diesem Schritt bewegt.,https://image.stern.de/36102084/t/AG/v1/w1440/r1.7778/-/02--4rah6e6rknv6axs2048jpeg---2dc7de4f85c9fbf3.jpg,2025-10-02T14:38:20Z,,"Kopiere den aktuellen Link
Zur Merkliste hinzufügen
SMA Solar streicht bis Ende 2026 weltweit rund 350 weitere Stellen. Besonders betroffen ist der Standort Niestetal. Was das Unternehmen zu diesem… [+2803 chars]",,de,'Solar'
https://www.faz.net/aktuell/rhein-main/wirtschaft/sma-solar-baut-weitere-350-stellen-am-stammsitz-ab-110714467.html,https://www.faz.net/aktuell/rhein-main/wirtschaft/sma-solar-baut-weitere-350-stellen-am-stammsitz-ab-110714467.html,0,www.faz.net,Absatzprobleme: SMA Solar baut weitere 350 Stellen am Stammsitz ab,Der Wechselrichter-Hersteller SMA schreibt weiter rote Zahlen. Der Stellenabbau trifft vor allem den Stammsitz in Niestetal bei Kassel - zum zweiten Mal in kurzer Zeit.,https://media0.faz.net/ppmedia/w1200/aktuell/3451692908/1.10384408/facebook_teaser/sma-solar-will-sich-verstaerkt.jpg.webp,2025-10-02T14:48:11Z,,"Der Wechselrichterhersteller SMA Solar will bis Ende 2026 weitere 350 Vollzeitstellen abbauen, davon 300 am Stammsitz in Niestetal bei Kassel. Das teilte das Unternehmen am Donnerstag mit. Derzeit li… [+1103 chars]",,de,'Solar'
https://www.n-tv.de/wirtschaft/Mit-dieser-Studie-loesen-sich-die-Folgekosten-der-Energiewende-in-Luft-auf-article26070819.html,https://www.n-tv.de/wirtschaft/Mit-dieser-Studie-loesen-sich-die-Folgekosten-der-Energiewende-in-Luft-auf-article26070819.html,0,www.n-tv.de,"Vorschlag für Katherina Reiche: ""Mit dieser Studie lösen sich die Folgekosten der Energiewende in Luft auf""","Die Energiewende ist ein Mammutprojekt - teuer, komplex und voller Konflikte. Die Wirtschaftsberater von Roland Berger möchten die verfeindeten Lager zusammenbringen. In einer neuen Studie präsentieren sie eine Option, die Geld sparen und die Versorgungssiche…",https://www.n-tv.de/img/incoming/crop26071345/7521327683-cImg_16_9-w1200/550301294.jpg,2025-10-02T15:30:50Z,,"Die Energiewende ist ein Mammutprojekt - teuer, komplex und voller Konflikte. Die Wirtschaftsberater von Roland Berger möchten die verfeindeten Lager zusammenbringen. In einer neuen Studie ergänzen s… [+14109 chars]",,de,'Energiewende'
https://www.golem.de/sonstiges/zustimmung/auswahl.html?from=https://www.golem.de/news/restrukturierung-sma-solar-kuendigt-abbau-von-bis-zu-350-weiteren-stellen-an-2510-200775.html&referer=https://t.co/91769f3533,https://www.golem.de/sonstiges/zustimmung/auswahl.html?from=https://www.golem.de/news/restrukturierung-sma-solar-kuendigt-abbau-von-bis-zu-350-weiteren-stellen-an-2510-200775.html&referer=https://t.co/91769f3533,0,www.golem.de,Restrukturierung: SMA Solar kündigt Abbau von bis zu 350 weiteren Stellen an,"SMA Solar streicht bis Ende 2026 weltweit rund 350 weitere Stellen. Besonders betroffen ist der Standort Niestetal im Landkreis Kassel. (Unternehmen, Wirtschaft)",,2025-10-02T17:11:01Z,,"Besuchen Sie Golem.de wie gewohnt mit Werbung und Tracking,
 indem Sie der Nutzung aller Cookies zustimmen.
 Details zum Tracking finden Sie im Privacy Center.
Skript wurde nicht geladen. Informat… [+607 chars]",,de,'Solar'
https://www.stern.de/gesellschaft/regional/rheinland-pfalz-saarland/erneuerbare-energien--mehr-windenergieanlagen-in-rheinland-pfalz-genehmigt-36102764.html,https://www.stern.de/gesellschaft/regional/rheinland-pfalz-saarland/erneuerbare-energien--mehr-windenergieanlagen-in-rheinland-pfalz-genehmigt-36102764.html,0,www.stern.de,Erneuerbare Energien: Mehr Windenergieanlagen in Rheinland-Pfalz genehmigt,Der Ausbau der erneuerbaren Energien aus Wind und Sonne für die Energiewende ist gesetzlich definiert. Die Grünen setzen auf die zunehmende Leistung der Batteriespeicher.,https://image.stern.de/36102766/t/dD/v1/w1440/r1.7778/-/03--a45shljk3qv11axs2048jpeg---16cc96c22f2f6983.jpg,2025-10-03T02:00:20Z,,"Kopiere den aktuellen Link
Zur Merkliste hinzufügen
Der Ausbau der erneuerbaren Energien aus Wind und Sonne für die Energiewende ist gesetzlich definiert. Die Grünen setzen auf die zunehmende Leist… [+1616 chars]",,de,'Ausbau'
https://www.welt.de/wirtschaft/energie/plus68de4fff8016f8118e2fa4ca/stilllegung-von-gasspeichern-erloese-reichen-nicht-ploetzlich-offenbart-sich-auf-dem-energiemarkt-ein-bizarres-problem.html,https://www.welt.de/wirtschaft/energie/plus68de4fff8016f8118e2fa4ca/stilllegung-von-gasspeichern-erloese-reichen-nicht-ploetzlich-offenbart-sich-auf-dem-energiemarkt-ein-bizarres-problem.html,0,www.welt.de,„Erlöse reichen nicht“ – Plötzlich offenbart sich auf dem Energiemarkt ein bizarres Problem,Zu Beginn der Heizsaison sind viele Gasspeicher in Deutschland nur unzureichend gefüllt. Der Staatskonzern Uniper beantragt jetzt sogar die Stilllegung des drittgrößten deutschen Speichers. Der Grund überrascht – und offenbart ein großes Versorgungsrisiko für…,https://images.welt.de/68de4fff8016f8118e2fa4ca/a5bc7e7513b65a5f221929f637b3edb2/ci16x9-w1200/gasspeicher-fuellen-sich-schneller-als-vermutet,2025-10-03T04:10:55Z,,Die WELT als ePaper: Die vollständige Ausgabe steht Ihnen bereits am Vorabend zur Verfügung so sind Sie immer hochaktuell informiert. Weitere Informationen https://epaper.welt.de,,de,'Gasspeicher'
https://steiermark.orf.at/stories/3323840/,https://steiermark.orf.at/stories/3323840/,0,steiermark.orf.at,Viele Unfälle könnten verhindert werden,"In etwa zwei Monaten starten die steirischen Skigebiete in die Wintersaison. Experten erinnern, dass sich Skifahrer gut vorbereiten sollten. Denn viele Unfälle seien auf mangelnde Fitness und schlechtes oder ungenügendes Material zurückzuführen.",https://ibs.orf.at/stm?image=https%3A%2F%2Foekastatic.orf.at%2Fmims%2F2023%2F46%2F14%2Fcrops%2Fw%3D1200%2Ch%3D627%2Cq%3D75%2F2006086_master_755914_37175_skifahren_sujet_c_orf_felix_novak_32.jpg%3Fs%3Da30efd3722e72c894d27669a734582a71e743e3f,2025-10-03T06:11:00Z,,"Über den Sommer wurden teilweise Millionenbeträge in die Infrastruktur der Skigebiete investiert mehr dazu auch in Liftkarten werden im heurigen Winter teurer (27.9.2025).
Aber nicht nur die Skigebi… [+3114 chars]",,de,'Winter'
https://www.sueddeutsche.de/reise/skifahren-oesterreich-skipass-preise-li.3319421,https://www.sueddeutsche.de/reise/skifahren-oesterreich-skipass-preise-li.3319421,0,www.sueddeutsche.de,Wintersport: Skipässe so teuer wie noch nie,Die Preise für Tagesskipässe in Österreich steigen stark und erreichen Rekorde von über 80 Euro. Experten warnen vor einem Rückgang der Skifahrerzahlen. Günstigere Angebote für Familien könnten die Situation entschärfen.,https://www.sueddeutsche.de/2025/10/02/c480da9c-d2c9-4773-8243-63064ddd0af8.jpg?q=60&fm=webp&width=1200&rect=0%2C211%2C4000%2C2250,2025-10-03T08:05:12Z,,"Kaum eine Teuerung scheint das Blut der Alpen-Fans so sehr in Wallung zu bringen wie jene für Schnitzel und Skiticket. Wobei auf das Schnitzel im Notfall verzichtet werden kann, auf keinen Fall aber … [+480 chars]",,de,'Winter'
https://www.diepresse.com/20158624/schichtwechsel-was-man-diesen-winter-darueber-traegt,https://www.diepresse.com/20158624/schichtwechsel-was-man-diesen-winter-darueber-traegt,0,www.diepresse.com,Schichtwechsel: Was man diesen Winter darüber trägt [premium],"Wer den idealen Mantel, die perfekte Jacke schon im Kasten hat, hat Glück. Für alle anderen kommt mit der kalten Jahreszeit die Suche nach dem richtigen Darüber. Die Trends von den Laufstegen liefern Shopping-Inspiration.",https://img.diepresse.com/public/incoming/cppp7s-1-min.png/alternates/DPR_SOCIAL_NACHRICHTEN/1-min.png,2025-10-03T08:09:23Z,,"Das Wichtigste vorneweg: Nein, Echtpelz ist nicht in Mode. Die Designer setzen auf hochwertige und teils aus Recyclingstoffen hergestellte Kunstfelle, um uns flauschig umhüllt durch den Winter zu bri… [+2814 chars]",,de,'Winter'
https://stadt-bremerhaven.de/apple-tv-die-schwestern-grimm-erster-trailer-zur-fantasy-abenteuerserie-ist-da/,https://stadt-bremerhaven.de/apple-tv-die-schwestern-grimm-erster-trailer-zur-fantasy-abenteuerserie-ist-da/,0,stadt-bremerhaven.de,Apple TV+ „Die Schwestern Grimm“: Trailer zur Fantasy-Abenteuerserie,"Apple hat neulich einen Trailer zur Fantasy-Abenteuerserie „Die Schwestern Grimm“ veröffentlicht. Die Serie basiert auf dem New-York-Times-Bestsellerreihe „Die Grimm Akten“ von Michael Buckley. Die englischen Stimmen sind unter anderem mit Ariel Winter, Leah …",https://stadt-bremerhaven.de/wp-content/uploads/2024/06/apple-tv__e7aqjl2rqzau_og.jpg,2025-10-03T10:40:08Z,,Apple hat neulich einen Trailer zur Fantasy-Abenteuerserie Die Schwestern Grimm veröffentlicht. Die Serie basiert auf dem New-York-Times-Bestsellerreihe Die Grimm Akten von Michael Buckley. Die engli… [+1412 chars],,de,'Winter'
https://www.urlaubspiraten.de/pauschalreisen/winterflucht-fuerteventura-gutes-wetter-kurze-flugzeit,https://www.urlaubspiraten.de/pauschalreisen/winterflucht-fuerteventura-gutes-wetter-kurze-flugzeit,0,www.urlaubspiraten.de,Winterflucht Fuerteventura: Gutes Wetter + kurze Flugzeit ,"Heiße Winterflucht-Deals für den anstehenden Winter im Anflug! Sommer war meh - und deshalb verstehen wir, wenn der Sonnendurst nach den letzten Monaten noch nicht gestillt ist. Ja, denn irgendwie haben es eher die Sommerklamotten geschafft im Schrank einzu…",https://image.urlaubspiraten.de/720/image/upload/v1655808551/mediavault_images/AdobeStock_322069975_fjxe7e.jpg,2025-10-03T13:00:00Z,,"Heiße Winterflucht-Deals für den anstehenden Winter im Anflug! 
Sommer war meh - und deshalb verstehen wir, wenn der Sonnendurst nach den letzten Monaten noch nicht gestillt ist. Ja, denn irgendwie … [+897 chars]",,de,'Winter'
https://www.diepresse.com/20165452/blackout-durch-ueberspannungskollaps-warum-oesterreich-nicht-spanien,https://www.diepresse.com/20165452/blackout-durch-ueberspannungskollaps-warum-oesterreich-nicht-spanien,0,www.diepresse.com,"Blackout durch „Überspannungskollaps“: 
Warum Österreich nicht Spanien werden darf [premium]","Die Ursache für den verheerenden Stromausfall auf der Iberischen Halbinsel ist geklärt. Den einen Sündenbock haben die Experten zwar nicht gefunden, dafür aber eine klare Erkenntnis, was sich in der Energiewende ändern muss, um ähnliche Blackouts in Zukunft z…",https://img.diepresse.com/public/incoming/e941we-FILES-SPAIN-ENERGY-POLITICS-BLACKOUT/alternates/DPR_SOCIAL_NACHRICHTEN/FILES-SPAIN-ENERGY-POLITICS-BLACKOUT,2025-10-03T13:52:14Z,,"Am 28.April 2025 gingen in Spanien und Portugal die Lichter aus. 18 Stunden sollte es dauern, bis die Stromversorgung auf der Iberischen Halbinsel wiederhergestellt war. Die hektische Suche nach den … [+4058 chars]",,de,'Energiewende'
https://www.teltarif.de/winterreifen-standardgroesse-ebay-deal/news/99950.html,https://www.teltarif.de/winterreifen-standardgroesse-ebay-deal/news/99950.html,0,www.teltarif.de,ADAC-Testsieger in Standardgröße: Jetzt mit Gutschein sparen,Ein Gutschein bei eBay verbilligt Winterreifen um 10 Prozent. Auch die Testsieger in Standardgröße gibt es hier günstiger.,https://www.teltarif.de/img/arch/2025/kw40/winterreifen-standardgroesse-ebay-deal-1og.jpg,2025-10-03T14:50:00Z,,"Pünkt­lich zum Beginn der Winter­reifen­saison ""von Oktober bis Ostern"" startet eBay einen neuen Gutschein­code. Mit REIFEN25REIFEN25 sinken die Preise um 10 Prozent oder 50 Euro - das bringt reihen­… [+5388 chars]",,de,'Winter'
