index,url,valid,domain,title,description,image,published,archive,content,quote,language,keyword
https://www.horizont.net/agenturen/nachrichten/ausbau-des-livestreaming-angebots-leo-burnett-befoerdert-alina-michel-219132,https://www.horizont.net/agenturen/nachrichten/ausbau-des-livestreaming-angebots-leo-burnett-befoerdert-alina-michel-219132,0,www.horizont.net,Ausbau des Livestreaming-Angebots: Leo Burnett befördert Alina Michel,Seit 2021 betreut Leo Burnett das Livestreaming-Business für Samsung in Deutschland. Unter der Führung von Alina Michel wurde in dieser Zeit auch Live-Shopping für den Kunden etabliert. Nach den erfolgreichen Projekten wird Michel jetzt befördert.,https://www.horizont.net/news/media/44/Alina-Michel-436008.jpeg,2024-04-10T22:01:00Z,,"Sie sind bereits registriert?
Hier anmelden
Der Nutzung Ihrer Daten können Sie jederzeit widersprechen. Weitere Hinweise finden Sie unter Datenschutz.",,de,'Ausbau'
https://www.zeit.de/news/2024-04/11/kampf-um-den-ausbau-am-flughafen-startbahn-west-wird-40,https://www.zeit.de/news/2024-04/11/kampf-um-den-ausbau-am-flughafen-startbahn-west-wird-40,0,www.zeit.de,Luftverkehr: Kampf um den Ausbau am Flughafen: Startbahn West wird 40,Hier finden Sie Informationen zu dem Thema „Luftverkehr“. Lesen Sie jetzt „Kampf um den Ausbau am Flughafen: Startbahn West wird 40“.,https://img.zeit.de/news/2024-04/11/kampf-um-den-ausbau-am-flughafen-startbahn-west-wird-40-image-group/wide__1300x731,2024-04-11T03:28:05Z,,Mit Ziel Paris ist der Lufthansa-Airbus «Lüneburg» am 12. April 1984 von der Startbahn West am Frankfurter Flughafen abgehoben. Rund 15.000 Demonstranten verfolgten den ersten kommerziellen Start auf… [+6164 chars],,de,'Ausbau'
https://www.stern.de/gesellschaft/regional/hessen/luftverkehr--kampf-um-den-ausbau-am-flughafen--startbahn-west-wird-40-34617678.html,https://www.stern.de/gesellschaft/regional/hessen/luftverkehr--kampf-um-den-ausbau-am-flughafen--startbahn-west-wird-40-34617678.html,0,www.stern.de,Luftverkehr: Kampf um den Ausbau am Flughafen: Startbahn West wird 40,Mit heftigen Protesten versuchten Aktivisten den Bau der Startbahn West zu verhindern. 40 Jahre später ist eines der umstrittensten Bauprojekte in der deutschen Geschichte zentraler Bestandteil des Frankfurter Flughafens.,https://image.stern.de/34617680/t/1O/v1/w1440/r1.7778/-/11--urnnewsmldpacom2009010124041199633575v2w800h600l699t172r2112b1180jpeg---7e8bc55814001d13.jpg,2024-04-11T03:28:05Z,,Mit heftigen Protesten versuchten Aktivisten den Bau der Startbahn West zu verhindern. 40 Jahre später ist eines der umstrittensten Bauprojekte in der deutschen Geschichte zentraler Bestandteil des F… [+5774 chars],,de,'Ausbau'
https://www.nzz.ch/international/energiewende-deutschland-hat-keine-konkurrenzfaehigen-strompreise-ld.1825702,https://www.nzz.ch/international/energiewende-deutschland-hat-keine-konkurrenzfaehigen-strompreise-ld.1825702,0,www.nzz.ch,Ist die Energiekrise in Deutschland wirklich vorbei? Eine NZZ-Recherche zeigt: So einfach ist es nicht,"Glaubt man Bundeswirtschaftsminister Robert Habeck, gibt es keinen Grund zur Klage mehr für die Industrie. Die Strompreise sind gesunken, Kohle wird kaum noch verbrannt. Doch es gibt Zweifel an dieser Erzählung.","https://img.nzz.ch/2024/04/10/9852ea04-5762-4ad8-b9e6-a09fac80cf30.png?width=1200&height=674&fit=bound&quality=75&auto=webp&crop=1800,1011,x0,y169&wmark=nzz",2024-04-11T03:31:00Z,,"Wegen der deutschen Energiewende könnte der Standort für viele Industriebetriebe unattraktiv werden.
Seit kurzem verbreitet sich unter Politikern und Journalisten in Berlin eine neue Erzählung über … [+11885 chars]",,de,'Ausbau'
https://www.stern.de/wirtschaft/news/energie--china-kritisiert-eu-untersuchung-gegen-windkraftunternehmen-34618062.html,https://www.stern.de/wirtschaft/news/energie--china-kritisiert-eu-untersuchung-gegen-windkraftunternehmen-34618062.html,0,www.stern.de,Energie: China kritisiert EU-Untersuchung gegen Windkraftunternehmen,Chinas staatliche Investitionen im Bereich erneuerbare Energien stehen schon länger im Fokus Brüssels. Die EU-Kommission ermittelt nun gegen einige Firmen. Peking stößt die Maßnahme sauer auf.,https://image.stern.de/34618064/t/Gp/v1/w1440/r1.7778/-/11--urnnewsmldpacom2009010124041199634719v3w800h600l885t105r1673b768jpeg---478f1305eeaf277f.jpg,2024-04-11T06:30:50Z,,"Chinas staatliche Investitionen im Bereich erneuerbare Energien stehen schon länger im Fokus Brüssels. Die EU-Kommission ermittelt nun gegen einige Firmen. Peking stößt die Maßnahme sauer auf.
China… [+1814 chars]",,de,'Investitionen'
https://www.focus.de/finanzen/news/energie-china-kritisiert-eu-untersuchung-gegen-windkraftunternehmen_id_259843794.html,https://www.focus.de/finanzen/news/energie-china-kritisiert-eu-untersuchung-gegen-windkraftunternehmen_id_259843794.html,0,www.focus.de,Energie - China kritisiert EU-Untersuchung gegen Windkraftunternehmen,Chinas staatliche Investitionen im Bereich erneuerbare Energien stehen schon länger im Fokus Brüssels. Die EU-Kommission ermittelt nun gegen einige Firmen. Peking stößt die Maßnahme sauer auf.,https://p6.focus.de/img/finanzen/news/id_259843793/eine-windturbine-nach-der-installation-in-in-der-nordwestchinesischen-autonomen-region-xinjiang..jpg?im=Crop%3D%280%2C64%2C2048%2C1024%29%3BResize%3D%281200%2C627%29&impolicy=perceptual&quality=mediumHigh&hash=323cd0f90732f9220bf67ed7e30886257aa23b1732b427b12dca83288a511eb2,2024-04-11T06:35:03Z,,"China hat die von der EU-Kommission eingeleitete Ermittlung gegen chinesische Windkraftunternehmen scharf kritisiert. Die EU-Untersuchung stelle einen protektionistischen Akt dar, weil sie willkürlic… [+1561 chars]",,de,'Investitionen'
https://www.golem.de/sonstiges/zustimmung/auswahl.html?from=https://www.golem.de/news/fernwaerme-finnland-baut-groessten-warmwasserspeicher-der-welt-2404-184046.html&referer=https://t.co/fef2c11dec,https://www.golem.de/sonstiges/zustimmung/auswahl.html?from=https://www.golem.de/news/fernwaerme-finnland-baut-groessten-warmwasserspeicher-der-welt-2404-184046.html&referer=https://t.co/fef2c11dec,0,www.golem.de,Fernwärme: Finnland baut größten Warmwasserspeicher der Welt,"Die Energiewende braucht Speicher. Die finnische Stadt Vantaa baut einen großen unterirdischen Speicher, um im Winter heizen zu können. (Erneuerbare Energien, Umweltschutz)",,2024-04-11T08:47:01Z,,"Besuchen Sie Golem.de wie gewohnt mit Werbung und Tracking,
 indem Sie der Nutzung aller Cookies zustimmen.
 Details zum Tracking finden Sie im Privacy Center.
Skript wurde nicht geladen. Informat… [+607 chars]",,de,'Energiewende'
https://www.welt.de/regionales/hamburg/article250978950/Strom-Die-Balance-zwischen-Klimaschutz-Versorgungssicherheit-und-Bezahlbarkeit-ist-verloren-gegangen.html,https://www.welt.de/regionales/hamburg/article250978950/Strom-Die-Balance-zwischen-Klimaschutz-Versorgungssicherheit-und-Bezahlbarkeit-ist-verloren-gegangen.html,0,www.welt.de,„Die Balance ist verloren gegangen“,"Der Dortmunder Netzbetreiber Amprion will bis 2028 rund 27,5 Milliarden Euro in den Ausbau der Übertragungsnetze investieren. Die erste „Stromautobahn“ von der Küste nach Süden soll 2027 fertig sein. Doch die Energiewende-Politik der Bundesregierung kritisier…",https://img.welt.de/img/regionales/hamburg/mobile250978948/8571352887-ci16x9-w1200/Visualisierung-einer-Konverterstation-vo.jpg,2024-04-11T10:26:43Z,,"Das Dortmunder Unternehmen Amprion, einer der vier Betreiber von Höchstspannungsnetzen in Deutschland, will bis zum Jahr 2028 rund 27,5 Milliarden Euro in den Aus- und Umbau seines Übertragungsnetzes… [+4678 chars]",,de,'Energiewende'
https://www.golem.de/sonstiges/zustimmung/auswahl.html?from=https://www.golem.de/news/stromspeicher-methanol-statt-wasserstoff-als-langzeitspeicher-2404-183948.html&referer=https://t.co/204f4981f7,https://www.golem.de/sonstiges/zustimmung/auswahl.html?from=https://www.golem.de/news/stromspeicher-methanol-statt-wasserstoff-als-langzeitspeicher-2404-183948.html&referer=https://t.co/204f4981f7,0,www.golem.de,Stromspeicher: Methanol statt Wasserstoff als Langzeitspeicher,"Könnte grünes Methanol, hergestellt aus Kohlendioxid und Wasserstoff, eine Option sein, um in einer Dunkelflaute Strom bereitzustellen? Von Hanno Böck (Energiewende, Bundesregierung)",,2024-04-11T10:30:02Z,,"Besuchen Sie Golem.de wie gewohnt mit Werbung und Tracking,
 indem Sie der Nutzung aller Cookies zustimmen.
 Details zum Tracking finden Sie im Privacy Center.
Skript wurde nicht geladen. Informat… [+607 chars]",,de,'Energiewende'
https://www.businessinsider.de/gruenderszene/business/mit-diesem-pitchdeck-holte-sich-das-drohnen-startup-volateq-millionen/,https://www.businessinsider.de/gruenderszene/business/mit-diesem-pitchdeck-holte-sich-das-drohnen-startup-volateq-millionen/,0,www.businessinsider.de,Mit diesem Pitchdeck holte sich das Drohnen-Startup Volateq Millionen,Solarpanels sollten regelmäßig kontrolliert werden. Volateq will das mit Drohnen effizienter machen und hat sich dafür Millionen gesichert.,https://cdn.businessinsider.de/wp-content/uploads/2024/04/Volateq-supports-health-checks-of-solar-plants-cVolateq-scaled.jpg?ver=1712822753,2024-04-11T11:27:51Z,,Strom soll komplett klimaneutral produziert werden das ist das Ziel der Bundesregierung bis 2035. Dafür fördert sie unter anderem den Ausbau von Photovoltaik-Anlagen. Große Solarfelder müssen allerdi… [+1319 chars],,de,'Solar'
https://www.stern.de/gesellschaft/regional/nordrhein-westfalen/strom--stromnetzbetreiber-amprion-verdoppelt-investitionen-34619424.html,https://www.stern.de/gesellschaft/regional/nordrhein-westfalen/strom--stromnetzbetreiber-amprion-verdoppelt-investitionen-34619424.html,0,www.stern.de,Strom: Stromnetzbetreiber Amprion verdoppelt Investitionen,Dortmund - Der Strom-Übertragungsnetzbetreiber Amprion sieht sich beim Netzausbau auf einem guten Weg. Im vergangenen Jahr hätten sich die Investitionen,https://image.stern.de/34619426/t/CK/v1/w1440/r1.7778/-/11--urnnewsmldpacom2009010124041199637976v3w800h600l640t425r1920b1278jpeg---85f44b7ebce56d02.jpg,2024-04-11T11:29:44Z,,"Ohne Stromnetzausbau keine Energiewende. Als einer von vier Übertragungsnetzbetreibern spielt Amprion dabei eine wichtige Rolle.
Der Strom-Übertragungsnetzbetreiber Amprion sieht sich beim Netzausba… [+1932 chars]",,de,'Energiewende'
https://www.tagesspiegel.de/lichtblick-fur-die-kommunen-deutlich-mehr-geld-fur-klimaschutz-in-brandenburg-11500544.html,https://www.tagesspiegel.de/lichtblick-fur-die-kommunen-deutlich-mehr-geld-fur-klimaschutz-in-brandenburg-11500544.html,0,www.tagesspiegel.de,„Lichtblick für die Kommunen“: Deutlich mehr Geld für Klimaschutz in Brandenburg,"Für den kommunalen Klimaschutz stehen in diesem Jahr rund 35,5 Millionen Euro aus dem Brandenburg-Paket zur Verfügung. Mit dem Geld soll auch die Energiewende finanziert werden.",https://www.tagesspiegel.de/images/inbetriebnahme-des-weltweit-hochsten-windmessmastes2/alternates/BASE_16_9_W1400/inbetriebnahme-des-weltweit-hoechsten-windmessmastes.jpeg,2024-04-11T12:02:37Z,,In Brandenburg stehen jetzt deutlich mehr Landesmittel für den kommunalen Klimaschutz zur Verfügung als bislang geplant. Für das laufende Jahr würden dafür auf Beschluss des Finanzausschusses des Lan… [+1779 chars],,de,'Energiewende'
https://www.zeit.de/news/2024-04/11/leag-plant-wasserstoff-und-stromspeicherzentrum-in-boxberg,https://www.zeit.de/news/2024-04/11/leag-plant-wasserstoff-und-stromspeicherzentrum-in-boxberg,0,www.zeit.de,Erneuerbare Energien: Leag plant Wasserstoff- und Stromspeicherzentrum in Boxberg,Hier finden Sie Informationen zu dem Thema „Erneuerbare Energien“. Lesen Sie jetzt „Leag plant Wasserstoff- und Stromspeicherzentrum in Boxberg“.,https://img.zeit.de/news/2024-04/11/leag-plant-wasserstoff-und-stromspeicherzentrum-in-boxberg-image-group/wide__1300x731,2024-04-11T13:04:46Z,,Das Energieunternehmen Leag plant am Standort der früheren Braunkohlekraftwerke Boxberg I und II in der Oberlausitz ein Wasserstoff- und Stromspeicherzentrum. Zu dem Energiekomplex solle ein Wasserst… [+623 chars],,de,'Erneuerbare'
https://www.tagesspiegel.de/potsdam/brandenburg/energiewende-in-brandenburg-leag-plant-wasserstoff-und-stromspeicherzentrum-in-boxberg-11501474.html,https://www.tagesspiegel.de/potsdam/brandenburg/energiewende-in-brandenburg-leag-plant-wasserstoff-und-stromspeicherzentrum-in-boxberg-11501474.html,0,www.tagesspiegel.de,Energiewende in Brandenburg: Leag plant Wasserstoff- und Stromspeicherzentrum in Boxberg,Das Energieunternehmen Leag will am Standort der früheren Braunkohlekraftwerke Boxberg I und II Deutschlands größten Batteriespeicher errichten – wenn es Fördermittel erhält.,https://www.tagesspiegel.de/images/braunkohlekraftwerk2/alternates/BASE_16_9_W1400/braunkohlekraftwerk.jpeg,2024-04-11T13:11:22Z,,Das Energieunternehmen Leag plant am Standort der früheren Braunkohlekraftwerke Boxberg I und II in der Oberlausitz ein Wasserstoff- und Stromspeicherzentrum. Zu dem Energiekomplex solle ein Wasserst… [+683 chars],,de,'Energiewende'
https://www.diepresse.com/18358310/eu-parlament-segnet-reform-des-strommarkts-ab,https://www.diepresse.com/18358310/eu-parlament-segnet-reform-des-strommarkts-ab,0,www.diepresse.com,EU-Parlament segnet Reform des Strommarkts ab,"Die Reform soll Strompreise unabhängiger von Preisschwankungen machen und den
Ausbau erneuerbarer Energien beschleunigen.",https://img.diepresse.com/public/incoming/xevb69-kein-Titel/alternates/DPR_SOCIAL_NACHRICHTEN/%28kein%20Titel%29,2024-04-11T13:16:44Z,,"Die Reform soll Strompreise unabhängiger von Preisschwankungen machen und denAusbau erneuerbarer Energien beschleunigen.
Das EU-Parlament hat am Donnerstag in Brüssel mit einer breiten Mehrheit die … [+4569 chars]",,de,'Heizen'
https://www.sueddeutsche.de/bayern/bayern-geothermie-gebaeude-heizen-1.6541914,https://www.sueddeutsche.de/bayern/bayern-geothermie-gebaeude-heizen-1.6541914,0,www.sueddeutsche.de,Energiewende: 60 Prozent der Gebäude in Bayern könnten mit Erdwärme beheizt werden,Es könnte ein Baustein für klimafreundliches Heizen der Zukunft sein: Energie aus dem Grundwasser oder dem Erdreich. Eine neue Studie liefert erstaunliche Zahlen. Es gibt aber einen Haken.,https://www.sueddeutsche.de/image/sz.1.6541915/1200x675?v=1712845687,2024-04-11T14:28:10Z,,"Mehr als 60 Prozent der Gebäude in Bayern könnten ihren Wärmebedarf theoretisch vollständig über oberflächennahe Geothermie decken - also über Grundwasserwärmepumpen, Erdwärmesonden und Erdwärmekolle… [+1615 chars]",,de,'Heizen'
https://www.tagesschau.de/wirtschaft/kfw-stromanteil-eu-hoechstwert-100.html,https://www.tagesschau.de/wirtschaft/kfw-stromanteil-eu-hoechstwert-100.html,0,www.tagesschau.de,Anteil der Erneuerbaren 2023 auf Höchststand,"Im vergangenen Jahr wurden rund 44 Prozent des Stroms in der EU durch Erneuerbare Energien erzeugt. Das ist einer KfW-Studie zufolge ein ""neuer Höchstwert"". Die Förderbank kritisiert aber das noch zu langsame Tempo.",https://images.tagesschau.de/image/3d3b807c-a634-4d5c-8390-f1b2f45dd7a4/AAABjjdaLKM/AAABjcWen7M/16x9-1280/windkraft-178.jpg,2024-04-11T14:38:06Z,,"Stand: 11.04.2024 16:38 Uhr
Im vergangenen Jahr wurden rund 44 Prozent des Stroms in der EU durch Erneuerbare Energien erzeugt. Das ist einer KfW-Studie zufolge ein ""neuer Höchstwert"". Die Förderban… [+3146 chars]",,de,'Erneuerbare'
https://www.golem.de/sonstiges/zustimmung/auswahl.html?from=https://www.golem.de/news/siemens-gamesa-windrad-verliert-72-meter-langes-rotorblatt-2404-184085.html&referer=https://t.co/8c2e01aff1,https://www.golem.de/sonstiges/zustimmung/auswahl.html?from=https://www.golem.de/news/siemens-gamesa-windrad-verliert-72-meter-langes-rotorblatt-2404-184085.html&referer=https://t.co/8c2e01aff1,0,www.golem.de,Siemens Gamesa: Windrad verliert 72 Meter langes Rotorblatt,"In einem norwegischen Windpark hat ein von Siemens Gamesa hergestelltes Windrad eines seiner gewaltigen Rotorblätter verloren. (Energie & Klima, Energiewende)",,2024-04-12T05:30:01Z,,"Besuchen Sie Golem.de wie gewohnt mit Werbung und Tracking,
 indem Sie der Nutzung aller Cookies zustimmen.
 Details zum Tracking finden Sie im Privacy Center.
Skript wurde nicht geladen. Informat… [+607 chars]",,de,'Energiewende'
https://www.faz.net/aktuell/wissen/physik-mehr/solaranlagen-halten-nicht-ewig-sind-aber-so-konstruiert-kann-das-recycling-trotzdem-gelingen-19639994.html,https://www.faz.net/aktuell/wissen/physik-mehr/solaranlagen-halten-nicht-ewig-sind-aber-so-konstruiert-kann-das-recycling-trotzdem-gelingen-19639994.html,0,www.faz.net,"Kreislauf mit Silizium, Silber und Aluminium","Die Photovoltaik ist eine zentrale Säule der Energiewende. Doch Solarzellen benötigen wertvolle Materialien, die bisher nur unzureichend recycelt werden können. Forscher fordern deshalb Recycling-Strategien gegen die drohenden Abfallströme.",https://media1.faz.net/ppmedia/aktuell/15210938/1.9642383/facebook_teaser_fplus/die-in-solarzellen-verbaute.jpg,2024-04-12T05:45:48Z,,"Kreislauf mit Silizium, Silber und Aluminium
Solarzellen-Engpässe drohen
Experten fordern Recycling-Revolution für die Energiewende
Von Silvia BenettiDie Photovoltaik ist eine zentrale Säule der E… [+259 chars]",,de,'Solar'
https://www.zeit.de/news/2024-04/12/inflation-schwaecht-sich-weiter-ab,https://www.zeit.de/news/2024-04/12/inflation-schwaecht-sich-weiter-ab,0,www.zeit.de,Statistisches Bundesamt: Inflation schwächt sich weiter ab,Hier finden Sie Informationen zu dem Thema „Statistisches Bundesamt“. Lesen Sie jetzt „Inflation schwächt sich weiter ab“.,https://img.zeit.de/news/2024-04/12/inflation-schwaecht-sich-weiter-ab-image-group/wide__1300x731,2024-04-12T06:34:18Z,,Gesunkene Nahrungsmittel- und Energiepreise haben die Inflation in Deutschland im März auf den niedrigsten Stand seit rund drei Jahren gedrückt.  Nach Angaben des Statistischen Bundesamtes lagen die … [+2394 chars],,de,'Inflation'
https://www.zeit.de/wirtschaft/2024-04/inflationsrate-deutschland-sinkt-preise-lebensmittel-energie,https://www.zeit.de/wirtschaft/2024-04/inflationsrate-deutschland-sinkt-preise-lebensmittel-energie,0,www.zeit.de,Inflationsrate: Inflation in Deutschland so niedrig wie seit drei Jahren nicht mehr,"Lebensmittel werden wieder billiger und auch Energie kostet weniger als ein Jahr zuvor. Die Verbraucherpreise lagen im März nur 2,2 Prozent über dem Vorjahresniveau.",https://img.zeit.de/administratives/sharing/fallback-image/wide__1300x731,2024-04-12T06:51:08Z,,Gesunkene Preise für Nahrungsmittel und Energie haben die Inflation in Deutschland im März auf den niedrigsten Stand seit rund drei Jahren gedrückt. Nach Angaben des Statistischen Bundesamtes lagen d… [+1391 chars],,de,'Inflation'
https://www.faz.net/aktuell/wirtschaft/klima-nachhaltigkeit/teure-energiewende-wer-zahlt-die-milliarden-fuer-die-stromleitungen-19646334.html,https://www.faz.net/aktuell/wirtschaft/klima-nachhaltigkeit/teure-energiewende-wer-zahlt-die-milliarden-fuer-die-stromleitungen-19646334.html,0,www.faz.net,Teure Energiewende: Wer zahlt die Milliardeninvestitionen in die Stromleitungen?,"Wind im Norden, hoher Stromverbrauch im Süden: Dafür muss das Stromnetz ausgebaut und stabilisiert werden. Gleichzeitig will die Regierung Verbraucher und Wirtschaft vor steigenden Preisen schützen. Bloß wie?",https://media0.faz.net/ppmedia/aktuell/73683545/1.9646898/facebook_teaser/freileitungen-guenstiger-aber.jpg,2024-04-12T10:12:08Z,,"Nach Streichung eines Bundeszuschusses von 5,5 Milliarden Euro weiß die Ampelkoalition noch nicht, wie sie Wirtschaft und Verbraucher vor den stark steigenden Kosten für die Stromnetze bewahren kann.… [+3016 chars]",,de,'Energiewende'
https://www.zeit.de/news/2024-04/12/klage-soll-ausbau-der-a8-richtung-oesterreich-verhindern,https://www.zeit.de/news/2024-04/12/klage-soll-ausbau-der-a8-richtung-oesterreich-verhindern,0,www.zeit.de,Bayern: Klage soll den Ausbau der A8 verhindern,Hier finden Sie Informationen zu dem Thema „Bayern“. Lesen Sie jetzt „Klage soll den Ausbau der A8 verhindern“.,https://img.zeit.de/news/2024-04/12/klage-soll-ausbau-der-a8-richtung-oesterreich-verhindern-image-group/wide__1300x731,2024-04-12T10:40:58Z,,"Nach wiederholten Ankündigungen einer Klage gegen den Ausbau der Autobahn 8  macht der Bund Naturschutz ernst: Der Verband erklärte in München, am Montag beim Bundesverwaltungsgericht in Leipzig Klag… [+3566 chars]",,de,'Ausbau'
https://www.zeit.de/news/2024-04/12/groesste-photovoltaik-anlage-auf-einem-dach-geht-in-betrieb,https://www.zeit.de/news/2024-04/12/groesste-photovoltaik-anlage-auf-einem-dach-geht-in-betrieb,0,www.zeit.de,Energie: Größte Photovoltaik-Anlage auf einem Dach geht in Betrieb,Hier finden Sie Informationen zu dem Thema „Energie“. Lesen Sie jetzt „Größte Photovoltaik-Anlage auf einem Dach geht in Betrieb“.,https://img.zeit.de/news/2024-04/12/groesste-photovoltaik-anlage-auf-einem-dach-geht-in-betrieb-image-group/wide__1300x731,2024-04-12T13:06:21Z,,"Die größte Photovoltaik-Anlage auf einem Dach in Niedersachsen ist in Betrieb genommen worden. Sie wurde im Hafen von Brake an der Weser nördlich von Bremen auf zehn Lagerhallen montiert, wie das nie… [+1327 chars]",,de,'Energiewende'
https://www.focus.de/finanzen/boerse/gold/3000-dollar-pro-unze-was-weiter-fuer-die-krisenwaehrung-gold-spricht_id_259846043.html,https://www.focus.de/finanzen/boerse/gold/3000-dollar-pro-unze-was-weiter-fuer-die-krisenwaehrung-gold-spricht_id_259846043.html,0,www.focus.de,Die Kolumne von Robert Halver - 3000 Dollar pro Unze? Was weiter für die Krisenwährung Gold spricht,"Gold glänzt wie nie zuvor. Die üblichen Verdächtigen für den Höhenrausch sind Inflation und Überschuldung. Doch kommen unabhängig davon zusätzliche geopolitische Argumente hinzu, die im Trend weiter für Gold sprechen.Von FOCUS-online-Experte Robert Halver",https://p6.focus.de/img/fotos/id_254364681/gettyimages-157674749.jpg?im=Crop%3D%280%2C0%2C2121%2C1061%29%3BResize%3D%281200%2C627%29&impolicy=perceptual&quality=mediumHigh&hash=5dad94ad74f903a3d50bfa765d001a171ddff6cdf60a0d0df81616434465de86,2024-04-12T13:58:26Z,,"<ul><li>
E-Mail</li><li>
Teilen</li><li>
Mehr</li><li>
Twitter</li><li>
Drucken</li><li>
Feedback</li><li>
Fehler meldenSie haben einen Fehler gefunden?
Bitte markieren Sie die entsprechenden… [+6233 chars]",,de,'Inflation'
https://www.focus.de/immobilien/wohnen/sechs-dinge-sind-wichtig-heizen-darauf-muessen-mieter-jetzt-achten-spaetestens-ab-mai_id_259850123.html,https://www.focus.de/immobilien/wohnen/sechs-dinge-sind-wichtig-heizen-darauf-muessen-mieter-jetzt-achten-spaetestens-ab-mai_id_259850123.html,0,www.focus.de,"Sechs Dinge sind wichtig - Checkliste zeigt, worauf Mieter ab Mai beim Heizen achten müssen","Die Heizung ist aktuell in Deutschland bei einigen Mieterinnen und Mietern noch in Betrieb. Schließlich kann es abends und nachts noch recht kühl werden. Aber auch die letzten Vermieter werden demnächst, spätestens im Mai, ihre Anlagen umstellen. Wer dann nic…",https://p6.focus.de/img/digital/id_259850122/heizen-darauf-muessen-mieter-jetzt-achten-spaetestens-ab-mai.jpg?im=Crop%3D%280%2C130%2C1568%2C784%29%3BResize%3D%281200%2C627%29&impolicy=perceptual&quality=mediumHigh&hash=67dcc5c48be0c3c2b0b9299d7f94f406a445674f057f4f04e3aa3fcfae7729ea,2024-04-12T18:06:42Z,,Die Heizung ist aktuell in Deutschland bei einigen Mieterinnen und Mietern noch in Betrieb. Schließlich kann es abends und nachts noch recht kühl werden. Aber auch die letzten Vermieter werden demnäc… [+3341 chars],,de,'Heizen'
https://www.faz.net/aktuell/politik/ukraine-liveticker-us-regierungskreise-china-unterstuetzt-russland-bei-militaer-ausbau-faz-19030454.html,https://www.faz.net/aktuell/politik/ukraine-liveticker-us-regierungskreise-china-unterstuetzt-russland-bei-militaer-ausbau-faz-19030454.html,0,www.faz.net,US-Regierungskreise: China unterstützt Russland bei Militär-Ausbau,Ex-Geheimagent der Ukraine offenbar durch Autobombe in Moskau verletzt +++ Niederlande sagen der Ukraine weitere Milliardenhilfen zu +++ Deutsche Zustimmung für stärkere Militärhilfe der Ukraine steigt +++ alle Entwicklungen im Liveblog.,https://media1.faz.net/ppmedia/aktuell/3199572762/1.9650923/facebook_teaser/verstehen-sich-die.jpg,2024-04-12T20:49:49Z,,Die Zustimmung in der deutschen Bevölkerung zu einer stärkeren militärischen Unterstützung der Ukraine ist nach einer Umfrage gestiegen. Nach dem am Freitag veröffentlichten ZDF-Politbarometer sind 4… [+977 chars],,de,'Ausbau'
https://www.faz.net/aktuell/politik/ukraine-liveticker-atomkraftwerk-saporischschja-versetzt-letzten-reaktor-in-kaltzustand-faz-19030454.html,https://www.faz.net/aktuell/politik/ukraine-liveticker-atomkraftwerk-saporischschja-versetzt-letzten-reaktor-in-kaltzustand-faz-19030454.html,0,www.faz.net,Ukraine-Liveblog: Atomkraftwerk Saporischschja versetzt letzten Reaktor in Kaltzustand,USA und Großbritannien blockieren Handel mit russischen Metallen +++ US-Regierungskreise: China unterstützt Russland bei Militär-Ausbau +++ Ex-Geheimagent der Ukraine offenbar durch Autobombe in Moskau verletzt +++ alle Entwicklungen im Liveblog.,https://media0.faz.net/ppmedia/aktuell/politik/1262977516/1.9651302/facebook_teaser/ein-block-des-kernkraftwerks.jpg,2024-04-13T04:06:27Z,,Die Zustimmung in der deutschen Bevölkerung zu einer stärkeren militärischen Unterstützung der Ukraine ist nach einer Umfrage gestiegen. Nach dem am Freitag veröffentlichten ZDF-Politbarometer sind 4… [+977 chars],,de,'Ausbau'
