index,url,valid,domain,title,description,image,published,archive,content,quote,language,keyword
https://www.golem.de/sonstiges/zustimmung/auswahl.html?from=https://www.golem.de/news/energiewende-negative-strompreise-am-1-mai-auf-rekordjagd-2605-208225.html&referer=https://t.co/1b63a87f9a,https://www.golem.de/sonstiges/zustimmung/auswahl.html?from=https://www.golem.de/news/energiewende-negative-strompreise-am-1-mai-auf-rekordjagd-2605-208225.html&referer=https://t.co/1b63a87f9a,0,www.golem.de,Energiewende: Negative Strompreise am 1. Mai auf Rekordjagd,"Viel Sonne und Wind und zusätzlich kaum Verbrauch lassen den Strompreis ins Minus fallen. Daran zeigt sich, was die Energiewende bringen kann und wo es hakt. (Energiewende, Elektroauto)",,2026-05-01T08:57:01Z,,"Besuchen Sie Golem.de wie gewohnt mit Werbung und Tracking,
 indem Sie der Nutzung aller Cookies zustimmen.
 Details zum Tracking finden Sie im Privacy Center.
Skript wurde nicht geladen. Informat… [+607 chars]",,de,'Energiewende'
https://taz.de/Verkehr-in-Zeiten-der-Energiekrise/!6175103/,https://taz.de/Verkehr-in-Zeiten-der-Energiekrise/!6175103/,0,taz.de,Verkehr in Zeiten der Energiekrise: Grenzenlos reisen mit dem Niederlandeticket?,Mit einem Monatsabo will die niederländische Regierung Bahnfahren fördern. Vorbild: das Deutschlandticket. Doch die Bedingungen sind unterschiedlich.,https://taz.de/picture/8410031/1200/41049473.jpeg,2026-05-01T09:50:00Z,,Mit einem Monatsabo will die niederländische Regierung Bahnfahren fördern. Vorbild: das Deutschlandticket. Doch die Bedingungen sind unterschiedlich. mehr...,,de,'Energiekrise'
https://www.faz.net/aktuell/wirtschaft/unternehmen/aktionaersvertreter-sehen-die-usa-lastige-strategie-von-rwe-mit-sorge-accg-200785402.html,https://www.faz.net/aktuell/wirtschaft/unternehmen/aktionaersvertreter-sehen-die-usa-lastige-strategie-von-rwe-mit-sorge-accg-200785402.html,0,www.faz.net,RWE in den USA: „Sie legen viele Eier in einen Korb“,"RWE will bis zum Jahr 2031 rund 35 Milliarden Euro investieren, etwa die Hälfte davon in den USA und hauptsächlich in Erneuerbare. Dies sei unter der Trump-Regierung riskant, bemängeln Aktionäre auf der Hauptversammlung.",https://media0.faz.net/image/w1200h627/4304f74f4717/w3000h1567x0y76o/201809/431.0.18507472/geht-die-rechnung-auf.webp,2026-05-01T14:23:51Z,,Erratische Entscheidungen und die Windräder-Feindlichkeit von US-Präsident Donald Trump auf der einen Seite  riesige Investitionen in den USA auf der anderen: Mehrere Aktionärsvertreter haben während… [+3094 chars],,de,'Erneuerbare'
https://www.stern.de/politik/ausland/irankrieg-news--trump-unzufrieden-mit-juengstem-vorschlag-des-iran-37087516.html,https://www.stern.de/politik/ausland/irankrieg-news--trump-unzufrieden-mit-juengstem-vorschlag-des-iran-37087516.html,0,www.stern.de,Irankrieg: Trump: Unzufrieden mit jüngstem Vorschlag des Iran,"Der Irankrieg treibt Inflationsrate in Deutschland nach oben. Die USA prüfen wohl, wie der Iran auf eine Siegeserklärung von Trump reagieren könnte. Alle Entwicklungen im Newsblog.",https://image.stern.de/37320002/t/wX/v5/w1440/r1.7778/-/donald-trump-iran-nato.jpg,2026-05-01T16:49:00Z,,Die Angst vor einer sich erneut zuspitzenden Situation im Nahen Osten drückt den Dax. Der deutsche Leitindex verliert ein Prozent auf 23.715 Punkte. Hauptbelastungsfaktor bleibt der kräftig gestiegen… [+290 chars],,de,'Inflation'
https://www.zeit.de/news/2026-05/02/der-bau-neuer-solaranlagen-stockt,https://www.zeit.de/news/2026-05/02/der-bau-neuer-solaranlagen-stockt,0,www.zeit.de,Erneuerbare Energien: Der Bau neuer Solaranlagen stockt,Hier finden Sie Informationen zu dem Thema „Erneuerbare Energien“. Lesen Sie jetzt „Der Bau neuer Solaranlagen stockt“.,https://img.zeit.de/news/2026-05/02/der-bau-neuer-solaranlagen-stockt-image-group/wide__1300x731,2026-05-02T02:01:09Z,,In Deutschland werden weniger neue Solarstrom-Anlagen gebaut. Im ersten Quartal zeigt sich insgesamt ein Rückgang von sechs Prozent im Vergleich zum Vorjahreszeitraum bei der neu installierten Leistu… [+1673 chars],,de,'Solar'
https://www.zeit.de/news/2026-05/02/eroerterung-zu-prestige-windpark-altoetting-buehne-fuer-buerger,https://www.zeit.de/news/2026-05/02/eroerterung-zu-prestige-windpark-altoetting-buehne-fuer-buerger,0,www.zeit.de,Erneuerbare Energien: Erörterung zu Prestige-Windpark Altötting - Bühne für Bürger,Hier finden Sie Informationen zu dem Thema „Erneuerbare Energien“. Lesen Sie jetzt „Erörterung zu Prestige-Windpark Altötting - Bühne für Bürger“.,https://img.zeit.de/news/2026-05/02/eroerterung-zu-prestige-windpark-altoetting-buehne-fuer-buerger-image-group/wide__1300x731,2026-05-02T02:30:08Z,,"Beim geplanten Windpark im oberbayerischen Altötting haben nächste Woche Betroffene aus der Region das Wort. In einem Erörterungstermin können sie Kritik, Sorgen und Vorschläge persönlich und öffentl… [+4236 chars]",,de,'Erneuerbare'
https://www.nzz.ch/wirtschaft/ki-koennte-unter-dem-strich-negativ-fuer-die-wirtschaft-sein-sagt-der-anlagechef-des-groessten-etf-anbieters-europas-ld.10005083,https://www.nzz.ch/wirtschaft/ki-koennte-unter-dem-strich-negativ-fuer-die-wirtschaft-sein-sagt-der-anlagechef-des-groessten-etf-anbieters-europas-ld.10005083,0,www.nzz.ch,"«KI könnte unter dem Strich negativ für die Wirtschaft sein», sagt der Anlagechef des grössten ETF-Anbieters Europas",Der Iran-Krieg bringt Inflation und eine Wachstumsverlangsamung. Anleger ignorieren das und hoffen weiter auf die Verheissungen der künstlichen Intelligenz. Diese könnten unliebsame Folgen haben.,"https://img-msp-prod.nzz.ch/2026/04/29/769c8a7e-1349-45ce-a704-5bcacbd87962.jpg?width=1200&height=675&fit=bounds&quality=75&auto=webp&crop=7008,3942,x0,y484&wmark=nzz",2026-05-02T03:30:00Z,,"Der Iran-Krieg bringt Inflation und eine Wachstumsverlangsamung. Anleger ignorieren das und hoffen weiter auf die Verheissungen der künstlichen Intelligenz. Diese könnten unliebsame Folgen haben.
Ko… [+6839 chars]",,de,'Ölpreis'
https://www.stern.de/wirtschaft/news/luftverkehr--us-billigflieger-spirit-stellt-betrieb-ein-37361808.html,https://www.stern.de/wirtschaft/news/luftverkehr--us-billigflieger-spirit-stellt-betrieb-ein-37361808.html,0,www.stern.de,Luftverkehr: US-Billigflieger Spirit stellt Betrieb ein,Die US-Billigflieger Spirit kämpfte seit Jahren mit Turbulenzen. Der Preisanstieg beim Kerosin wegen des Iran-Kriegs trieb die Airline nun in die Pleite. Eine Hilfsaktion von Donald Trump schlug fehl.,https://image.stern.de/37361810/t/aY/v1/w1440/r1.7778/-/02--eelus7cphmv2axs2048jpeg---0fecc19d07ba87cf.jpg,2026-05-02T07:18:42Z,,"Kopiere den aktuellen Link
Zur Merkliste hinzufügen
Die US-Billigflieger Spirit kämpfte seit Jahren mit Turbulenzen. Der Preisanstieg beim Kerosin wegen des Iran-Kriegs trieb die Airline nun in die… [+2471 chars]",,de,'Preisanstieg'
https://www.tagesspiegel.de/wirtschaft/luftverkehr-us-billigflieger-spirit-stellt-betrieb-ein-15548148.html,https://www.tagesspiegel.de/wirtschaft/luftverkehr-us-billigflieger-spirit-stellt-betrieb-ein-15548148.html,0,www.tagesspiegel.de,Luftverkehr: US-Billigflieger Spirit stellt Betrieb ein,Die US-Billigflieger Spirit kämpfte seit Jahren mit Turbulenzen. Der Preisanstieg beim Kerosin wegen des Iran-Kriegs trieb die Airline nun in die Pleite. Eine Hilfsaktion von Donald Trump schlug fehl.,https://www.tagesspiegel.de/images/15548147/alternates/BASE_16_9_W1400/1777706389000/spirit-airlines.jpeg,2026-05-02T07:19:49Z,,"Der US-Billigflieger Spirit Airlines ist trotz Rettungsversuchen der Regierung von Präsident Donald Trump am Ende. Die geordnete Einstellung des Flugbetriebs habe begonnen, teilte die Fluggesellschaf… [+2314 chars]",,de,'Preisanstieg'
https://www.zeit.de/mobilitaet/2026-05/tankrabatt-benzinpreise-dieselpreise-tankstelle-adac,https://www.zeit.de/mobilitaet/2026-05/tankrabatt-benzinpreise-dieselpreise-tankstelle-adac,0,www.zeit.de,Tankrabatt : Tankrabatt kommt offenbar nicht komplett bei Autofahrern an,"Die Spritpreise fallen am ersten Tag – aber noch nicht im vollen Umfang. »Kaum verständlich«, kritisiert der ADAC, zumal der Ölpreis sinkt.",https://img.zeit.de/administratives/sharing/fallback-image-die-zeit/wide__1300x731,2026-05-02T09:23:04Z,,"Die Mineralölkonzerne haben den Tankrabatt laut ADAC
 am ersten Tag nicht vollständig an die Autofahrer weitergegeben. Nach 
Berechnungen des Automobilclubs fiel der Preisrückgang bei Diesel und 
… [+1447 chars]",,de,'Ölpreis'
https://www.nzz.ch/wirtschaft/die-zentralbanken-warten-und-wiegeln-ab-haben-sie-recht-ld.10005399,https://www.nzz.ch/wirtschaft/die-zentralbanken-warten-und-wiegeln-ab-haben-sie-recht-ld.10005399,0,www.nzz.ch,Die Zentralbanken warten und wiegeln ab: Haben sie recht?,Wegen des hohen Ölpreises werden Erinnerungen an den Ausbruch des Ukraine-Kriegs wach. Damals schossen die Inflationsraten in die Höhe. Doch heute ist die Ausgangslage besser als 2022.,"https://img-msp-prod.nzz.ch/2026/05/01/7e8e0158-f53a-428a-a7a1-4d03a77fb7e5.jpg?width=1200&height=674&fit=bounds&quality=75&auto=webp&crop=3782,2127,x0,y279&wmark=nzz",2026-05-03T03:30:00Z,,"Wegen des hohen Ölpreises werden Erinnerungen an den Ausbruch des Ukraine-Kriegs wach. Damals schossen die Inflationsraten in die Höhe. Doch heute ist die Ausgangslage besser als 2022.
Tobias Straum… [+5257 chars]",,de,'Inflation'
https://www.n-tv.de/wirtschaft/Enertrag-Chef-Joerg-Mueller-Seit-1990-ist-klar-Uns-bleiben-nur-Solar-und-Windenergie-id30763250.html,https://www.n-tv.de/wirtschaft/Enertrag-Chef-Joerg-Mueller-Seit-1990-ist-klar-Uns-bleiben-nur-Solar-und-Windenergie-id30763250.html,0,www.n-tv.de,"Das grüne Kraftwerk von Enertrag:  ""Seit 1990 ist klar: Uns bleiben nur Solar- und Windenergie""","Jörg Müller betreibt mit Enertrag in der Uckermark ein Verbundkraftwerk. Seine Kunden erhalten grünen Strom, und zwar rund um die Uhr. Das Potenzial war ihm zufolge bereits 1990 offensichtlich. Das Vorbild ist die Landwirtschaft.",https://www.n-tv.de/img/30763295/1777384328/Img_16_9/1200/Joerg-Mueller-Gruender-und-Eigentuemer-der-Enertrag-SE-steht-auf-dem-Gelaende-des-Energieunternehmens-Enertrag-vor-einem-Wasserstoffbehaelter-Das-Energieunternehmen-erzeugt-Strom-und-Waerme-ausschliesslich-aus-erneuerbaren-Quellen-Das-brandenburgische-Energieunternehmen-treibt-derzeit-seine-Planungen-fuer-den-Aufbau-einer-Wasserstoff-Anlage-auf-dem-Gelaende-der-Oelfraffinerie-PCK-in-Schwedt-voran.jpg,2026-05-03T04:58:17Z,,"Jörg Müller steht vor einem Wasserstoffbehälter: Das grüne Gas ist ein wichtiger Bestandteil des Verbundkraftwerks. (Foto: picture alliance/dpa)
Jörg Müller baut 1992 in Brandenburg seine erste Wind… [+14879 chars]",,de,'Windenergie'
https://www.stern.de/wirtschaft/news/luftverkehr--us-billigflieger-spirit-trotz-trump-rettungsversuchs-am-ende-37363544.html,https://www.stern.de/wirtschaft/news/luftverkehr--us-billigflieger-spirit-trotz-trump-rettungsversuchs-am-ende-37363544.html,0,www.stern.de,Luftverkehr: US-Billigflieger Spirit trotz Trump-Rettungsversuchs am Ende,Die US-Billigflieger Spirit kämpfte seit Jahren mit Turbulenzen. Der Preisanstieg beim Kerosin wegen des Iran-Kriegs trieb die Airline nun in die Pleite. Eine Hilfsaktion von Donald Trump schlug fehl.,https://image.stern.de/37363546/t/Vb/v1/w1440/r1.7778/-/03--mvebyyhvlbv1axs2048jpeg---c28f0c08cf9da45b.jpg,2026-05-03T07:17:34Z,,"Kopiere den aktuellen Link
Zur Merkliste hinzufügen
Die US-Billigflieger Spirit kämpfte seit Jahren mit Turbulenzen. Der Preisanstieg beim Kerosin wegen des Iran-Kriegs trieb die Airline nun in die… [+3328 chars]",,de,'Preisanstieg'
https://www.tagesspiegel.de/wirtschaft/luftverkehr-us-billigflieger-spirit-trotz-trump-rettungsversuchs-am-ende-15549987.html,https://www.tagesspiegel.de/wirtschaft/luftverkehr-us-billigflieger-spirit-trotz-trump-rettungsversuchs-am-ende-15549987.html,0,www.tagesspiegel.de,Luftverkehr: US-Billigflieger Spirit trotz Trump-Rettungsversuchs am Ende,Die US-Billigflieger Spirit kämpfte seit Jahren mit Turbulenzen. Der Preisanstieg beim Kerosin wegen des Iran-Kriegs trieb die Airline nun in die Pleite. Eine Hilfsaktion von Donald Trump schlug fehl.,https://www.tagesspiegel.de/images/15549986/alternates/BASE_16_9_W1400/1777792719000/spirit-airlines.jpeg,2026-05-03T07:18:39Z,,"Der US-Billigflieger Spirit Airlines ist trotz Rettungsversuchen der Regierung von Präsident Donald Trump am Ende. Die geordnete Einstellung des Flugbetriebs habe begonnen, teilte die Fluggesellschaf… [+3169 chars]",,de,'Preisanstieg'
https://www.focus.de/finanzen/iran-legt-usa-neues-hormus-angebot-vor-oelpreis-sinkt_442af84e-0b1d-4d43-8a60-962da6f00d57.html,https://www.focus.de/finanzen/iran-legt-usa-neues-hormus-angebot-vor-oelpreis-sinkt_442af84e-0b1d-4d43-8a60-962da6f00d57.html,0,www.focus.de,Iran legt USA neues Hormus-Angebot vor: Ölpreis sinkt,Die USA und der Iran verhandeln weiter über ein mögliches Kriegsende. Jetzt soll der Iran neue Vorschläge eingebracht haben.,"https://quadro.burda-forward.de/ctf/ca4e68cf-d09f-4db4-9b49-d6d49c92fe80.16745348-8675-4d2c-8446-4c856e3a2053.jpg?im=RegionOfInterestCrop=(1200,630),regionOfInterest=(2432,1564)&hash=4de036c1027fb60bc1bc030b513043b503decdab9167b2e81d3326b1ef5b93a8",2026-05-03T10:19:00Z,,"Der Ölpreis fällt wieder. Grund dafür ist ein neuer iranischer Vorschlag inmitten stockender US-Friedensgespräche. Die Nachrichtenagentur AFP berichtet, dass der Iran diesen Vorschlag am Donnerstagab… [+2742 chars]",,de,'Ölpreis'
https://www.teltarif.de/spirit-billig-airline-pleite/news/103306.html,https://www.teltarif.de/spirit-billig-airline-pleite/news/103306.html,0,www.teltarif.de,Wegen teurem Kerosin: Billig-Airline stellt Betrieb komplett ein,Die US-Billigflieger Spirit kämpfte seit Jahren mit Turbulenzen. Der Preisanstieg beim Kerosin wegen des Iran-Kriegs trieb die Airline nun in die Pleite. Eine Hilfsaktion von Donald Trump schlug fehl.,https://www.teltarif.de/img/arch/2026/kw18/spirit-billig-airline-pleite-2og.jpg,2026-05-03T10:40:00Z,,"Der US-Billig­flieger Spirit Airlines ist trotz
Rettungs­versu­chen der Regie­rung von Präsi­dent Donald Trump am Ende.
Die geord­nete Einstel­lung des Flug­betriebs habe begonnen, teilte die
Flug… [+3488 chars]",,de,'Preisanstieg'
https://www.diepresse.com/21686787/trotz-iran-krieg-an-den-boersen-geht-es-bergauf-und-bei-diesen-drei-das,https://www.diepresse.com/21686787/trotz-iran-krieg-an-den-boersen-geht-es-bergauf-und-bei-diesen-drei-das,0,www.diepresse.com,Trotz Iran-Krieg: An den Börsen geht es bergauf. Und bei diesen drei Aktien sollte das laut Experten nun auch der Fall sein [premium],"Die Börsen sind trotz Iran-Krieg und hohem Ölpreis gut gelaunt, und US-Techaktien drehen schon wieder auf. Bei diesen drei Aktien rechnen Analysten nun mit einem deutlichen Anstieg von bis zu 55 Prozent.",https://img.diepresse.com/public/incoming/hllwrg-boerse23imagojpg/alternates/DPR_SOCIAL_MEINUNG/Boerse23_Imago.jpg,2026-05-03T14:03:50Z,,"Auch der schnelle Wechsel zwischen Alarmismus und Entwarnung kann langweilig werden, wenn er häufig erfolgt und schon lange so geht. Beides ist beim Iran-Krieg und seinen Auswirkungen auf die Rohstof… [+4371 chars]",,de,'Ölpreis'
https://www.faz.net/aktuell/wirtschaft/asien-und-der-irankrieg-energiewende-beschleunigt-accg-200790893.html,https://www.faz.net/aktuell/wirtschaft/asien-und-der-irankrieg-energiewende-beschleunigt-accg-200790893.html,0,www.faz.net,Ölkrise: Der Irankrieg treibt Asien zur Energiewende,"Strom aus Sonne und Wind galt den Schwellenländern als unsicher und teuer – bis die Straße von Hormus schloss. Nun sollen die Erneuerbaren dafür sorgen, dass in Asien nicht mehr das Licht ausgeht.",https://media0.faz.net/image/w1200h627/dce328c685e5/w5218h2726x0y432o/202512/43601.0.1576558269/petronas-towers-in-kuala.webp,2026-05-03T17:41:08Z,,"Nichts symbolisiert die Abhängigkeit von fossilen Energien mehr als die Petrodollar-Türme. Die Vereinigten Arabischen Emirate haben den 828 Meter hohen Burj Khalifa gebaut, Saudi-Arabien den 600 Mete… [+8375 chars]",,de,'Ölpreis'
https://www.focus.de/finanzen/iran-legt-usa-neues-hormus-angebot-vor-und-der-oelpreis-sinkt_442af84e-0b1d-4d43-8a60-962da6f00d57.html,https://www.focus.de/finanzen/iran-legt-usa-neues-hormus-angebot-vor-und-der-oelpreis-sinkt_442af84e-0b1d-4d43-8a60-962da6f00d57.html,0,www.focus.de,Iran legt USA neues Hormus-Angebot vor und der Ölpreis sinkt,Die USA und der Iran verhandeln weiter über ein mögliches Kriegsende. Jetzt soll der Iran neue Vorschläge eingebracht haben.,"https://quadro.burda-forward.de/ctf/ca4e68cf-d09f-4db4-9b49-d6d49c92fe80.16745348-8675-4d2c-8446-4c856e3a2053.jpg?im=RegionOfInterestCrop=(1200,630),regionOfInterest=(2626,1145)&hash=3c39b315957a5a6f38ffe20c221a06105d0f8d034241dc9b0956ff35fcd288e0",2026-05-04T05:03:00Z,,"Der Ölpreis fällt wieder. Grund dafür ist ein neuer iranischer Vorschlag inmitten stockender US-Friedensgespräche. Die Nachrichtenagentur AFP berichtet, dass der Iran diesen Vorschlag am Donnerstagab… [+2742 chars]",,de,'Ölpreis'
https://www.tagesschau.de/wirtschaft/finanzen/marktberichte/marktbericht-dax-dow-trump-zoelle-100.html,https://www.tagesschau.de/wirtschaft/finanzen/marktberichte/marktbericht-dax-dow-trump-zoelle-100.html,0,www.tagesschau.de,Marktbericht: Anleger nehmen Trumps-Zolldrohungen gelassen,"Trotz der neuen Zolldrohung aus den USA bleiben die Anleger gelassen. Der DAX dürfte mit einem leichten Plus starten. Die Ölpreise sind jedoch hoch, die Lage im Nahen Osten bleibt angespannt.",https://images.tagesschau.de/image/9846c754-037c-44b5-a472-59ab3bebd565/AAABlLYN4vU/AAABnSSvrFg/16x9-big/boerse-386.jpg?width=1280,2026-05-04T05:37:31Z,,"Stand: 04.05.2026 07:37 Uhr
Trotz der neuen Zolldrohung aus den USA bleiben die Anleger gelassen. Der DAX dürfte mit einem leichten Plus starten. Die Ölpreise sind jedoch hoch, die Lage im Nahen Ost… [+3093 chars]",,de,'Ölpreis'
https://www.apfelpage.de/news/drastischer-preisanstieg-ikeas-dirigera-hub-kostet-nun-deutlich-mehr/,https://www.apfelpage.de/news/drastischer-preisanstieg-ikeas-dirigera-hub-kostet-nun-deutlich-mehr/,0,www.apfelpage.de,Drastischer Preisanstieg: IKEAs DIRIGERA-Hub kostet nun deutlich mehr,"IKEA hat sich über die Jahre zu einem großen Player in Sachen Smart Home gemausert und seit Dezember 2026 zudem auch eine neue Preisuntergrenze bei ... Weiterlesen ...
Der Beitrag Drastischer Preisanstieg: IKEAs DIRIGERA-Hub kostet nun deutlich mehr erschien …",https://www.apfelpage.de/wp-content/uploads/2022/08/Moegliche-Anschluesse-IKEA-DIRIGERA.jpg,2026-05-04T07:11:52Z,,IKEA hat sich über die Jahre zu einem großen Player in Sachen Smart Home gemausert und seit Dezember 2026 zudem auch eine neue Preisuntergrenze bei Matterprodukten gesetzt. Der DIRIGERA-Hub als Schal… [+1119 chars],,de,'Preisanstieg'
https://www.diepresse.com/21798928/experte-macht-klare-ansage-die-krise-ist-im-russischen-smartphone,https://www.diepresse.com/21798928/experte-macht-klare-ansage-die-krise-ist-im-russischen-smartphone,0,www.diepresse.com,Experte macht klare Ansage: „Die Krise ist im russischen Smartphone angekommen“,"Auf den ersten Blick sieht es danach aus, dass Russlands Wirtschaft durch den hohen Ölpreis wieder durchatmen kann. Blicke man jedoch tiefer, zeige sich, wie viel bereits aus dem Ruder gelaufen ist, sagt Vasily Astrov, der soeben für seine präzisen Russland-A…",https://www.diepresse.com/assets_v2/images/diepresse_meinung.png,2026-05-04T08:55:30Z,,"Auf den ersten Blick sieht es danach aus, dass Russlands Wirtschaft durch den hohen Ölpreis wieder durchatmen kann. Blicke man jedoch tiefer, zeige sich, wie viel bereits aus dem Ruder gelaufen ist, … [+1597 chars]",,de,'Ölpreis'
https://www.focus.de/finanzen/news/oelpreis-schiesst-wieder-ueber-100-dollar-angespannte-lage-am-golf-verunsichert-anleger_e6698ba6-db73-4c4e-bc2f-f2ce0efe65b4.html,https://www.focus.de/finanzen/news/oelpreis-schiesst-wieder-ueber-100-dollar-angespannte-lage-am-golf-verunsichert-anleger_e6698ba6-db73-4c4e-bc2f-f2ce0efe65b4.html,0,www.focus.de,Ölpreis schießt wieder über 100 Dollar – angespannte Lage am Golf verunsichert Anleger,"Die Ölpreise steigen wieder deutlich an. Drohungen aus Iran, ein beschossener Tanker und zähe Verhandlungen belasten die Versorgungslage.","https://quadro.burda-forward.de/ctf/1226ae98-b8dc-46cf-a643-66dd7ba17303.e1a2b89b-bb5c-4f20-bf6e-72c37759527d.jpg?im=RegionOfInterestCrop=(1200,630),regionOfInterest=(2803,1230)&hash=470f02ecc347806e3b240d0982dde5b121444a1fb218c591c53fecfc1090fa1c",2026-05-04T10:28:00Z,,"Die Ölpreise haben am Montag deutlich zugelegt und Verluste der Vorwoche teilweise wettgemacht. Brent stieg um 1,1 Prozent auf 109,39 Dollar je Barrel, die US-Sorte WTI legte um ein Prozent auf 102,9… [+1938 chars]",,de,'Ölpreis'
https://www.stern.de/gesellschaft/regional/sachsen/erneuerbare-energien--weniger-strom-abregelungen-in-ostdeutschland-37366468.html,https://www.stern.de/gesellschaft/regional/sachsen/erneuerbare-energien--weniger-strom-abregelungen-in-ostdeutschland-37366468.html,0,www.stern.de,Erneuerbare Energien: Weniger Strom-Abregelungen in Ostdeutschland,"Mehr Strom aus Sonne und Wind – trotzdem landet nicht alles im Netz. Das hat auch Folgen für Stromkunden. In Sachsen, Sachsen-Anhalt und Thüringen wird weniger Strom abgeschaltet.",https://image.stern.de/37366470/t/2m/v1/w1440/r1.7778/-/04--nibfc7hgmav23axs2048jpeg---42171716251223bb.jpg,2026-05-04T11:02:11Z,,"Kopiere den aktuellen Link
Zur Merkliste hinzufügen
Mehr Strom aus Sonne und Wind trotzdem landet nicht alles im Netz. Das hat auch Folgen für Stromkunden. In Sachsen, Sachsen-Anhalt und Thüringen … [+4873 chars]",,de,'Erneuerbare'
https://www.diepresse.com/21797412/eu-wirft-china-sabotageplaene-mittels-photovoltaik-und-windkraft-vor,https://www.diepresse.com/21797412/eu-wirft-china-sabotageplaene-mittels-photovoltaik-und-windkraft-vor,0,www.diepresse.com,EU wirft China Sabotagepläne mittels Photovoltaik und Windkraft vor [premium],"Die Europäische Kommission stoppt praktisch alle Subventionen für Energieprojekte, in denen chinesische Wechselrichter verbaut sind. Sie könnten nämlich für gezielte Attacken auf Europas Stromnetze genutzt werden. In erster Linie zielt dieser Bann auf Huawei …",https://img.diepresse.com/public/incoming/z8e7x5-imago-images-0584167841/alternates/DPR_SOCIAL_MAGAZIN/imago%20images%200584167841,2026-05-04T12:00:13Z,,Mit großer Verschwiegenheit hat die Europäische Kommission am 1. April eine Entscheidung mit weitreichenden industrie- und geopolitischen Folgen gefällt. Die 26 Kommissare unter Vorsitz von Präsident… [+4839 chars],,de,'Windenergie'
https://www.golem.de/sonstiges/zustimmung/auswahl.html?from=https://www.golem.de/news/energiewende-von-negativen-strompreisen-profitieren-am-ende-alle-2605-208280.html&referer=https://t.co/41106bce60,https://www.golem.de/sonstiges/zustimmung/auswahl.html?from=https://www.golem.de/news/energiewende-von-negativen-strompreisen-profitieren-am-ende-alle-2605-208280.html&referer=https://t.co/41106bce60,0,www.golem.de,Energiewende: Von negativen Strompreisen profitieren am Ende alle,"Viel Sonne und dazu Wind lassen die Strompreise ins Negative fallen. Das verursacht Kosten bei Energieerzeugern und durch Export, ergibt aber Sinn. Von Mario Petzold (Erneuerbare Energien, Smart Meter)",,2026-05-04T13:50:02Z,,"Besuchen Sie Golem.de wie gewohnt mit Werbung und Tracking,
 indem Sie der Nutzung aller Cookies zustimmen.
 Details zum Tracking finden Sie im Privacy Center.
Skript wurde nicht geladen. Informat… [+607 chars]",,de,'Erneuerbare'
https://www.faz.net/aktuell/wirtschaft/gastbeitrag-von-carsten-schneider-fossile-krise-braucht-eine-erneuerbare-antwort-accg-200780605.html,https://www.faz.net/aktuell/wirtschaft/gastbeitrag-von-carsten-schneider-fossile-krise-braucht-eine-erneuerbare-antwort-accg-200780605.html,0,www.faz.net,Energiekrise: Die fossile Krise braucht eine erneuerbare Antwort,"Die Atomkraft ist keine Antwort auf die fossile Energiekrise. Sie ist teuer, riskant und auf staatliche Absicherung angewiesen. Von einer Renaissance kann weltweit keine Rede sein.",https://media0.faz.net/image/w1200h627/fd4194550c2f/w6000h3135x0y206o/202604/43601.0.2001589266/carsten-schneider-spd.webp,2026-05-05T04:18:38Z,,"Die Welt erlebt eine fossile Energiekrise. Wieder einmal. Das zeigt: Wer auf ausländisches Öl und Gas angewiesen ist, bleibt verwundbar. Russlands Krieg gegen die Ukraine und der Konflikt in Iran mac… [+416 chars]",,de,'Windenergie'
https://www.sueddeutsche.de/wirtschaft/schweiz-inflation-benzin-iran-krieg-li.3478822,https://www.sueddeutsche.de/wirtschaft/schweiz-inflation-benzin-iran-krieg-li.3478822,0,www.sueddeutsche.de,Energiepreise: Inflation in der Schweiz verdoppelt sich,Grund sind die durch den Krieg in Nahen Osten gestiegenen Spritpreise. Dennoch ist die Lage im Nachbarland besser als in Deutschland.,https://www.sueddeutsche.de/2026/05/05/0b6c98dc-60b1-4598-99c4-2dda3a69ca09.jpg?q=60&fm=webp&width=1200&rect=0%2C209%2C4000%2C2250,2026-05-05T11:24:57Z,,"Die Inflationsrate in der Schweiz hat sich im April verdoppelt und den höchsten Stand seit fast eineinhalb Jahren erreicht. Grund dafür war ein starker Preisanstieg bei Benzin, ausgelöst durch den Ko… [+749 chars]",,de,'Preisanstieg'
