index,url,valid,domain,title,description,image,published,archive,content,quote,language,keyword
https://www.focus.de/earth/neue-technologien/mit-der-kraft-von-6-atomkraftwerken-underdog-koennte-deutschen-energiesektor-revolutionieren_id_259824418.html,https://www.focus.de/earth/neue-technologien/mit-der-kraft-von-6-atomkraftwerken-underdog-koennte-deutschen-energiesektor-revolutionieren_id_259824418.html,0,www.focus.de,Doch wieder Wasserkraft? - Wie ein Underdog den deutschen Energiesektor revolutionieren will,Wasserkraft gilt als Musterschüler Erneuerbarer Energien - doch die verfügbaren Kapazitäten sind längst ausgereizt. Eine neue Studie sagt nun: Mit Aufrüstung könnte Deutschland wieder mehr Energie aus Wasserkraft produzieren.,https://p6.focus.de/img/digital/id_259824417/mit-der-kraft-von-6-atomkraftwerken-underdog-koennte-deutschen-energiesektor-revolutionieren.jpg?im=Crop%3D%280%2C47%2C1568%2C784%29%3BResize%3D%281200%2C627%29&impolicy=perceptual&quality=mediumHigh&hash=b25e805b2cc8dd98da9d787a839581192d6f9e52e64b3d329fc79673a0c8522d,2024-04-05T14:24:27Z,,Nach und nach sollen fossile Wege der Energiegewinnung nachhaltigen Lösungen weichen. Solar- und Windkraft ersetzen damit Erdöl und Kohlestrom so zumindest die Pläne der Bundesregierung. Allerdings g… [+2843 chars],,de,'Wasserkraft'
https://salzburg.orf.at/stories/3251936/,https://salzburg.orf.at/stories/3251936/,0,salzburg.orf.at,Positive Winterbilanz trotz kurzer Saison,"Zu kurz, aber trotzdem erfolgreich – so ziehen Salzburgs Touristiker nun Bilanz über die abgelaufene Wintersaison. Das Nächtigungsplus von drei Prozent hätte deutlich stärker ausfallen können, wäre der Februar und März nicht deutlich zu mild gewesen.",https://ibs.orf.at/sbg?image=https%3A%2F%2Foekastatic.orf.at%2Fmims%2F2020%2F42%2F10%2Fcrops%2Fw%3D1200%2Ch%3D627%2Cq%3D75%2F718827_master_249310_wintersport_kitzsteinhorn_06_coe.jpg%3Fs%3D45a3f53ac1963f0eb1a835cad19037d377d88d1a,2024-04-05T16:45:00Z,,Der frühe Ostertermin und der wegen des Schaltjahres um einen Tag verlängerte Februar haben sich positiv ausgewirkt. Das überaus milde Wetter habe dagegen für etwas weniger Skifahrer als in der Saiso… [+2188 chars],,de,'Winter'
https://www.welt.de/wirtschaft/plus250890028/Stromluecke-Sahara-Staub-zeigt-ein-Grundproblem-der-Energiewende-auf.html,https://www.welt.de/wirtschaft/plus250890028/Stromluecke-Sahara-Staub-zeigt-ein-Grundproblem-der-Energiewende-auf.html,0,www.welt.de,Plötzliche Stromlücke – der Sahara-Staub offenbart die große Schwäche der Energiewende,"Sand und Staub aus der Sahara haben die deutschen Netzbetreiber an Ostern kalt erwischt. In Baden-Württemberg fehlte teilweise mehr als die Hälfte des erwarteten Solarstroms. Um die überraschende Lücke zu füllen, mussten Reservekraftwerke aktiviert werden – z…",https://img.welt.de/img/wirtschaft/mobile250896076/6921353877-ci16x9-w1200-fnov-fpotl-fpi157750653/DWO-WI-Teaser-Saharastaub-Solarstrom-pd-jpg.jpg,2024-04-05T17:38:30Z,,"Die WELT als ePaper: Die vollständige Ausgabe steht Ihnen bereits am Vorabend zur Verfügung so sind Sie immer hochaktuell informiert. Weitere Informationen: http://epaper.welt.de 
 Der Kurz-Link die… [+49 chars]",,de,'Solar'
https://www.diepresse.com/18340949/simbabwes-zentralbank-fuehrt-an-gold-gekoppelte-neue-waehrung-ein,https://www.diepresse.com/18340949/simbabwes-zentralbank-fuehrt-an-gold-gekoppelte-neue-waehrung-ein,0,www.diepresse.com,Simbabwes Zentralbank führt an Gold gekoppelte neue Währung ein,Die neue Währung soll für mehr Sicherheit und Vorhersehbarkeit sorgen. Simbabwe gehört zu den Ländern mit den höchsten Inflationsraten weltweit.,https://img.diepresse.com/public/incoming/dyodki-ZIMBABWE-CURRENCY-GOVERNMENT/alternates/DPR_SOCIAL_NACHRICHTEN/ZIMBABWE-CURRENCY-GOVERNMENT,2024-04-05T17:48:05Z,,"Die neue Währung soll für mehr Sicherheit und Vorhersehbarkeit sorgen. Simbabwe gehört zu den Ländern mit den höchsten Inflationsraten weltweit. 
Angesichts der hohen Inflation in Simbabwe hat die Z… [+1406 chars]",,de,'Inflation'
https://www.faz.net/aktuell/sport/formel-1/formel-1-in-japan-ferrari-und-die-decodierung-des-red-bulls-19633457.html,https://www.faz.net/aktuell/sport/formel-1/formel-1-in-japan-ferrari-und-die-decodierung-des-red-bulls-19633457.html,0,www.faz.net,Formel 1 in Japan: Die Decodierung des Red Bulls,"Ferrari hat den Winter genutzt, um das Geheimnis des schier übermächtigen Konkurrenten Red Bull zu entschlüsseln. Dabei wurde klar: Das Geheimnis liegt nicht nur in einem überlegenen Auto.",https://media0.faz.net/ppmedia/aktuell/sport/2657868843/1.9633594/facebook_teaser_fplus/muss-er-um-seine-dominanz.jpg,2024-04-05T19:11:13Z,,"Das ist ein anderes Ferrari-Gefühl als im vergangenen Jahr. Der Betrachter hat bei jedem Schritt den Eindruck, dass dieses Team weiß, was es tut. Ferrari setzt fort, was sich in der zweiten Saisonhäl… [+914 chars]",,de,'Winter'
https://www.nzz.ch/wirtschaft/kopie-von-wasserstoffschloss-schweiz-ld.1821961,https://www.nzz.ch/wirtschaft/kopie-von-wasserstoffschloss-schweiz-ld.1821961,0,www.nzz.ch,Mit Wasserstoff die Energiewende retten? Die Euphorie weicht in der Schweiz der Ernüchterung,Grüner Wasserstoff gilt als ein wichtiger Baustein der Energiewende.  Einheimische Produzenten haben es aber schwer.,"https://img.nzz.ch/2024/03/14/00a52672-5321-4df8-a17f-72a444609299.jpeg?width=1200&height=675&fit=bound&quality=75&auto=webp&crop=7749,4359,x0,y404&wmark=nzz",2024-04-06T03:30:00Z,,"Anlieferung beim Laufwasserkraftwerk Reichenau des Energieunternehmens Axpo: Ein Elektrolyseur spaltet Wasser in Wasserstoff und Sauerstoff auf. 
Die Zukunft kommt in einer unscheinbaren weissen Kis… [+11553 chars]",,de,'Wasserkraft'
https://www.n-tv.de/wirtschaft/Chinas-Solar-Macht-wird-zum-Problem-article24852183.html,https://www.n-tv.de/wirtschaft/Chinas-Solar-Macht-wird-zum-Problem-article24852183.html,0,www.n-tv.de,Nationale Strategie: Chinas Solar-Macht wird zum Problem,"China baut viel mehr Solarzellen, als es derzeit braucht. Nicht nur in Deutschland hat das bereits Opfer in der Unternehmenslandschaft gefordert. Aber Peking geht es um mehr als nur Marktmacht.",https://bilder1.n-tv.de/img/incoming/crop24852204/3331328464-cImg_16_9-w1200/395320795.jpg,2024-04-06T07:51:41Z,,"China baut viel mehr Solarzellen, als es derzeit braucht. Nicht nur in Deutschland hat das bereits Opfer in der Unternehmenslandschaft gefordert. Aber Peking geht es um mehr als nur Marktmacht.
Sola… [+6233 chars]",,de,'Photovoltaik'
https://www.dw.com/de/faktencheck-versteht-trump-mehr-von-wirtschaft-als-biden/a-68740228,https://www.dw.com/de/faktencheck-versteht-trump-mehr-von-wirtschaft-als-biden/a-68740228,0,www.dw.com,Faktencheck: Versteht Trump mehr von Wirtschaft als Biden?,"Wer verfügt über mehr Wirtschaftskompetenz, Biden oder Trump? Für den einen sprechen die Daten, für den anderen die Umfragen. Die DW hat vier Behauptungen zu Wachstum, Inflation, Schulden und Aktien in den USA geprüft.",https://static.dw.com/image/68511952_6.jpg,2024-04-06T10:01:00Z,https://web.archive.org/web/20240406103628/https://www.dw.com/de/faktencheck-versteht-trump-mehr-von-wirtschaft-als-biden/a-68740228,"Nach Umfragen des Meinungsforschungsinstitutes YouGov
 traut eine Mehrheit der US-Bevölkerung Ex-Präsident Donald Trump im Bereich Wirtschaft mehr zu als Amtsinhaber Joe Biden. 
Nur 26 Prozent der … [+6537 chars]",,de,'Inflation'
https://www.focus.de/finanzen/news/faktencheck-versteht-trump-mehr-von-wirtschaft-als-biden_id_259829353.html,https://www.focus.de/finanzen/news/faktencheck-versteht-trump-mehr-von-wirtschaft-als-biden_id_259829353.html,0,www.focus.de,- Faktencheck: Versteht Trump mehr von Wirtschaft als Biden?,"Wer verfügt über mehr Wirtschaftskompetenz, Biden oder Trump? Für den einen sprechen die Daten, für den anderen die Umfragen. Die DW hat vier Behauptungen zu Wachstum, Inflation, Schulden und Aktien in den USA geprüft.",https://p6.focus.de/img/finanzen/news/id_259829352/widersacher-auch-im-bereich-wirtschaftspolitik-amtsinhaber-joe-biden-l-und-ex-praesident-donald-trump.jpg?im=Crop%3D%280%2C29%2C940%2C470%29%3BResize%3D%281200%2C627%29&impolicy=perceptual&quality=mediumHigh&hash=d2dd5a4101fda6582bb33ea01e6c712fca647b3d34b689267fa39cac36010be5,2024-04-06T10:20:04Z,https://web.archive.org/web/20240407073653/https://www.focus.de/finanzen/news/faktencheck-versteht-trump-mehr-von-wirtschaft-als-biden_id_259829353.html,"Nach Umfragen des Meinungsforschungsinstitutes YouGov traut eine Mehrheit der US-Bevölkerung Ex-Präsident Donald Trump im Bereich Wirtschaft mehr zu als Amtsinhaber Joe Biden.
Nur 26 Prozent der im … [+6309 chars]",,de,'Inflation'
https://www.focus.de/finanzen/technologie-zur-abschreckung-mit-seiner-neuen-solar-strategie-schafft-china-ein-gefaehrliches-druckmittel_id_259829359.html,https://www.focus.de/finanzen/technologie-zur-abschreckung-mit-seiner-neuen-solar-strategie-schafft-china-ein-gefaehrliches-druckmittel_id_259829359.html,0,www.focus.de,Technologie zur Abschreckung - Mit seiner neuen Solar-Strategie schafft China ein gefährliches Druckmittel,"China baut mehr Solarzellen, als es derzeit braucht. In Deutschland hat das bereits erste Opfer in der Unternehmenslandschaft gefordert. Aber Peking geht es nicht nur um Marktmacht.",https://p6.focus.de/img/fotos/id_259829360/solarenergie-in-der-81594335.jpg?im=Crop%3D%280%2C577%2C3464%2C1732%29%3BResize%3D%281200%2C627%29&impolicy=perceptual&quality=mediumHigh&hash=e5c7a664af913eafb04687759c7c74333cf2b7b4c208f8f85fe7f234d11de2c2,2024-04-06T10:22:30Z,,"China baut mehr Solarzellen, als es derzeit braucht. In Deutschland hat das bereits erste Opfer in der Unternehmenslandschaft gefordert. Aber Peking geht es nicht nur um Marktmacht.Solarzellen so wei… [+6393 chars]",,de,'Photovoltaik'
https://www.diepresse.com/18342003/um-ganze-zwei-milliarden-euro-stiegen-die-staatsausgaben-im-jaenner-und-februar,https://www.diepresse.com/18342003/um-ganze-zwei-milliarden-euro-stiegen-die-staatsausgaben-im-jaenner-und-februar,0,www.diepresse.com,Um ganze zwei Milliarden Euro stiegen die Staatsausgaben im Jänner und Februar,"Obwohl der Staat in den ersten beiden Monaten des Jahres auch etwas mehr eingenommen hat, schnellten die Ausgaben weitaus stärker in die Höhe. Das lag unter anderem an der in Österreich besonders hohen Inflation – und auch daran, wie die Regierung darauf reag…",https://img.diepresse.com/public/incoming/niweiv-kein-Titel/alternates/DPR_SOCIAL_NACHRICHTEN/%28kein%20Titel%29,2024-04-06T10:30:13Z,https://web.archive.org/web/20240406122208/https://www.diepresse.com/18342003/um-ganze-zwei-milliarden-euro-stiegen-die-staatsausgaben-im-jaenner-und-februar,"Obwohl der Staat in den ersten beiden Monaten des Jahres auch etwas mehr eingenommen hat, schnellten die Ausgaben weitaus stärker in die Höhe. Das lag unter anderem an der in Österreich besonders hoh… [+2953 chars]",,de,'Inflation'
https://www.faz.net/aktuell/wirtschaft/warum-die-inflation-so-unpopulaer-ist-19633981.html,https://www.faz.net/aktuell/wirtschaft/warum-die-inflation-so-unpopulaer-ist-19633981.html,0,www.faz.net,Warum die Inflation so unbeliebt ist,"Steigende Preise sind allseits unbeliebt, sogar bei denen, die davon profitieren. Das liegt auch an der Selbstüberschätzung der Menschen, sagt eine Harvard-Ökonomin.",https://media0.faz.net/ppmedia/aktuell/wirtschaft/1250645332/1.9635608/facebook_teaser/zuletzt-schwaechte-sich-der.jpg,2024-04-06T11:41:59Z,https://web.archive.org/web/20240406132307/https://www.faz.net/aktuell/wirtschaft/warum-die-inflation-so-unpopulaer-ist-19633981.html,"Inflation ist unbeliebt. In Deutschland steht sie auf Platz 1 der größten Sorgen der Bevölkerung, die das Marktforschungsinstitut GfK erhebt. Dabei ist nicht gesagt, dass jeder schlechter dran ist, w… [+1862 chars]",,de,'Inflation'
https://www.tagesspiegel.de/wirtschaft/immobilien/um-bis-zu-31-prozent-wo-die-neumieten-besonders-stark-gestiegen-sind-11469074.html,https://www.tagesspiegel.de/wirtschaft/immobilien/um-bis-zu-31-prozent-wo-die-neumieten-besonders-stark-gestiegen-sind-11469074.html,0,www.tagesspiegel.de,Um bis zu 31 Prozent : Wo die Neumieten besonders stark gestiegen sind,In den deutschen Metropolen drängen noch mehr Suchende auf den Wohnungsmarkt. Der Preisanstieg in einigen Großstädten ist bei Neuvermietung daher enorm hoch. Der Druck auf die Mieter steigt.,https://www.tagesspiegel.de/images/wohnungspolitik1/alternates/BASE_16_9_W1400/wohnungspolitik.jpeg,2024-04-06T13:45:44Z,,"Sinkende Immobilienpreise, gestiegene Bauzinsen: Der deutsche Wohnungsmarkt bewegt sich seit Monaten im Krisenmodus. Doch was Kaufinteressenten erleichtert zur Kenntnis nehmen, ist für viele Mieter i… [+175 chars]",,de,'Preisanstieg'
https://www.zeit.de/news/2024-04/07/mehr-als-400-000-balkonkraftwerke-zahl-steigt-rasant,https://www.zeit.de/news/2024-04/07/mehr-als-400-000-balkonkraftwerke-zahl-steigt-rasant,0,www.zeit.de,Solar: Mehr als 400 000 Balkonkraftwerke - Zahl steigt rasant,Hier finden Sie Informationen zu dem Thema „Solar“. Lesen Sie jetzt „Mehr als 400 000 Balkonkraftwerke - Zahl steigt rasant“.,https://img.zeit.de/news/2024-04/07/mehr-als-400-000-balkonkraftwerke-zahl-steigt-rasant-image-group/wide__1300x731,2024-04-07T04:33:08Z,,An immer mehr deutschen Balkonen hängen Solarzellen. Inzwischen listet das Marktstammdatenregister mehr als 400.000 steckerfertige Solaranlagen in Betrieb auf. Alleine im ersten Quartal wurden demnac… [+2461 chars],,de,'Solar'
https://www.telepolis.de/features/Solare-Zukunft-gegen-fossile-Vergangenheit-9677189.html,https://www.telepolis.de/features/Solare-Zukunft-gegen-fossile-Vergangenheit-9677189.html,0,www.telepolis.de,Solare Zukunft gegen fossile Vergangenheit,"Alles Leben verdankt sich der Sonne – auch die Energie, die wir aus Kohle, Gas oder Erdöl gewinnen, ist in Jahrmillionen gespeicherte Sonnenenergie.",https://heise.cloudimg.io/bound/1200x1200/q85.png-lossy-85.webp-lossy-85.foil1/_www-heise-de_/imgs/18/4/5/6/8/4/7/0/shutterstock_2299614357-26cde0a3b7f52b01.jpeg,2024-04-07T05:00:00Z,,"Alte und neue Energiequellen im Hafen von Eemshaven. Bild: Make more Aerials, Shutterstock.com
Alles Leben verdankt sich der Sonne auch die Energie, die wir aus Kohle, Gas oder Erdöl gewinnen, ist i… [+6076 chars]",,de,'Wasserkraft'
https://www.zeit.de/news/2024-04/07/photovoltaik-an-auffahrten-noch-nicht-so-verbreitet,https://www.zeit.de/news/2024-04/07/photovoltaik-an-auffahrten-noch-nicht-so-verbreitet,0,www.zeit.de,Energie: Photovoltaik an Auffahrten noch nicht so verbreitet,Hier finden Sie Informationen zu dem Thema „Energie“. Lesen Sie jetzt „Photovoltaik an Auffahrten noch nicht so verbreitet“.,https://img.zeit.de/news/2024-04/07/photovoltaik-an-auffahrten-noch-nicht-so-verbreitet-image-group/wide__1300x731,2024-04-07T06:23:29Z,,Das Verkehrsministerium bietet seit einiger Zeit bislang ungenutzte Flächen entlang von Straßen im Land zur Investition in Photovoltaik-Anlagen an. «Das Land bietet seine Unterstützung und seine Fläc… [+2866 chars],,de,'Photovoltaik'
https://www.stern.de/gesellschaft/regional/baden-wuerttemberg/energie--photovoltaik-an-auffahrten-noch-nicht-so-verbreitet-34605712.html,https://www.stern.de/gesellschaft/regional/baden-wuerttemberg/energie--photovoltaik-an-auffahrten-noch-nicht-so-verbreitet-34605712.html,0,www.stern.de,Energie: Photovoltaik an Auffahrten noch nicht so verbreitet,Anschlussstellen an Schnellstraßen sollen zu einer Rundfahrt um die Solarenergie werden - so stellt es sich das Verkehrsministerium vor. An mehr als 200 Innenflächen von Bundes- und Landstraßen können Module entstehen. Doch das braucht Zeit.,https://image.stern.de/34605714/t/5P/v1/w1440/r1.7778/-/07--urnnewsmldpacom2009010124040799588184v3w800h600l772t553r2050b1462jpeg---f6c1958588f5c02f.jpg,2024-04-07T06:23:29Z,,Anschlussstellen an Schnellstraßen sollen zu einer Rundfahrt um die Solarenergie werden - so stellt es sich das Verkehrsministerium vor. An mehr als 200 Innenflächen von Bundes- und Landstraßen könne… [+2459 chars],,de,'Solar'
https://www.focus.de/finanzen/boerse/wochenausblick-von-carsten-mumm-zinssenkungen-sind-absehbar-das-sollte-die-aktienmaerkte-weiter-stuetzen_id_259830872.html,https://www.focus.de/finanzen/boerse/wochenausblick-von-carsten-mumm-zinssenkungen-sind-absehbar-das-sollte-die-aktienmaerkte-weiter-stuetzen_id_259830872.html,0,www.focus.de,Wochenausblick von Carsten Mumm - Drei Leitzinserhöhungen der Fed in 2024 könnten zu optimistisch sein,"Staatsschuldenquote, Konjunkturdaten, privater Konsum, Inflation, Zinserwartungen: Der Wochenausblick von Carsten Mumm, Chefvolkswirt bei der Privatbank Donner & Reuschel.",https://p6.focus.de/img/fotos/id_259744301/gettyimages-820374390.jpg?im=Crop%3D%280%2C282%2C3475%2C1737%29%3BResize%3D%281200%2C627%29&impolicy=perceptual&quality=mediumHigh&hash=1bc83de2e310b289f9c2c50f0f049065bca8d52910f45c2705e8d485a5393b37,2024-04-07T07:45:30Z,https://web.archive.org/web/20240407075544/https://www.focus.de/finanzen/boerse/wochenausblick-von-carsten-mumm-zinssenkungen-sind-absehbar-das-sollte-die-aktienmaerkte-weiter-stuetzen_id_259830872.html,"Staatsschuldenquote, Konjunkturdaten, privater Konsum, Inflation, Zinserwartungen: Der Wochenausblick von Carsten Mumm, Chefvolkswirt bei der Privatbank Donner &amp; Reuschel.Die deutschen Staatsschu… [+4613 chars]",,de,'Inflation'
https://www.faz.net/aktuell/wirtschaft/energiewende-wie-sieht-die-zukunft-der-atomkraft-aus-19633982.html,https://www.faz.net/aktuell/wirtschaft/energiewende-wie-sieht-die-zukunft-der-atomkraft-aus-19633982.html,0,www.faz.net,Energiewende: Wie sieht die Zukunft der Atomkraft aus?,Vor einem Jahr hat Deutschland seine letzten Reaktoren abgeschaltet. Aber international geht das Atomzeitalter weiter. Hier sind fünf wichtige Trends in der Nukleartechnik.,https://media0.faz.net/ppmedia/aktuell/wirtschaft/2321321663/1.9636610/facebook_teaser/baustelle-des-atomkraftwerks.jpg,2024-04-07T09:39:57Z,,"Es ist ein kontroverser Jahrestag: Am 15. April 2023, einem Samstag, gingen in Deutschland die letzten drei Atomkraftwerke vom Netz. Aber auch wenn Deutschland raus ist aus der Atomkraft internationa… [+3476 chars]",,de,'Energiewende'
https://www.morgenpost.de/wirtschaft/article242044086/Balkonkraftwerke-boomen-doch-die-Buerokratie-bremst-Ausbau.html,https://www.morgenpost.de/wirtschaft/article242044086/Balkonkraftwerke-boomen-doch-die-Buerokratie-bremst-Ausbau.html,0,www.morgenpost.de,"Balkonkraftwerke boomen, doch die Bürokratie bremst Ausbau","Immer mehr Mieter wollen Strom selbst erzeugen, doch die Hürden sind hoch. Ein neues Gesetz soll das ändern – und scheitert an der FDP.",https://img.sparknews.funkemedien.de/239053435/239053435_1712491803_v16_9_1600.jpeg,2024-04-07T12:09:48Z,,"Berlin. Immer mehr Mieter wollen Strom selbst erzeugen, doch die Hürden sind hoch. Ein neues Gesetz soll das ändern und scheitert an der FDP.
Balkonkraftwerke erleben in Deutschland einen Boom. Imme… [+6811 chars]",,de,'Ausbau'
https://noe.orf.at/stories/3252074/,https://noe.orf.at/stories/3252074/,0,noe.orf.at,Mostbirnbaumblüte heuer schon Anfang April,"Die Mostbirnbaumblüte hat dieses Jahr schon Ende März begonnen, viel früher als in den vergangenen Jahrzehnten. Das liegt an den zuletzt hohen Temperaturen bzw. dem milden Winter. Das Naturspektakel ist noch bis Mitte April im  Mostviertel zu beobachten.",https://ibs.orf.at/noe?image=https%3A%2F%2Foekastatic.orf.at%2Fmims%2F2024%2F15%2F87%2Fcrops%2Fw%3D1200%2Ch%3D627%2Cq%3D75%2F2164558_master_819687_bluete_2.jpeg%3Fs%3D5efb105726c2979de588d4ebe220809c71cf6b96,2024-04-07T16:31:00Z,,"Es sind 300.000 Birnbäume, die derzeit im westlichen Mostviertel blühen und zahlreiche Besucherinnen nach Niederösterreich locken. Warum die Mostbirnbaumblüte dieses Jahr schon so früh blüht, erklärt… [+1205 chars]",,de,'Winter'
https://vorarlberg.orf.at/tv/stories/3252102/,https://vorarlberg.orf.at/tv/stories/3252102/,0,vorarlberg.orf.at,Kinderschneetag: Kinder treffen ÖSV-Stars,"Österreich ist ein Land des Wintersports, jedoch nimmt die Zahl der aktiven Wintersportler ab. Um die Lust am Sport im Schnee zu wecken gibt es den ÖSV-Kinderschneetag. Der fand nun in Zürs mit 1.000 Kindern statt. Trainiert wurden sie von den ÖSV-Stars.",https://ibs.orf.at/vbg?image=https%3A%2F%2Foekastatic.orf.at%2Fmims%2F2024%2F15%2F83%2Fcrops%2Fw%3D1200%2Ch%3D627%2Cq%3D75%2F2164797_master_819783_kinderschneetag1.jpg%3Fs%3Dbe4ff51ee327e8af1fa14725d27ff8045c184467,2024-04-07T17:06:01Z,,"Egal ob mit dem Snowboard, am Biathlonstand, oder bei verschiedenen Geschicklichkeitsübungen, die Mission beim Kinderschneetag war ganz einfach: Kinder wieder für Bewegung im Schnee zu begeistern. Es… [+1294 chars]",,de,'Winter'
https://www.zeit.de/news/2024-04/08/elternvertreter-fuer-ausbau-der-schulsozialarbeit,https://www.zeit.de/news/2024-04/08/elternvertreter-fuer-ausbau-der-schulsozialarbeit,0,www.zeit.de,Bildung: Elternvertreter für Ausbau der Schulsozialarbeit,Hier finden Sie Informationen zu dem Thema „Bildung“. Lesen Sie jetzt „Elternvertreter für Ausbau der Schulsozialarbeit“.,https://img.zeit.de/news/2024-04/08/elternvertreter-fuer-ausbau-der-schulsozialarbeit-image-group/wide__1300x731,2024-04-08T03:10:03Z,,Die Landeselternvertretung fordert deutliche Verbesserungen beim Ausbau der Schulsozialarbeit in Thüringen. «Die Problemlagen in der Schülerschaft sind in den letzten Jahren deutlich diverser und her… [+754 chars],,de,'Ausbau'
https://www.zeit.de/news/2024-04/08/erster-300-tonnen-transformator-fuer-suedostlink-trasse-ist-da,https://www.zeit.de/news/2024-04/08/erster-300-tonnen-transformator-fuer-suedostlink-trasse-ist-da,0,www.zeit.de,Energiewende: Erster 300-Tonnen-Transformator für Südostlink-Trasse ist da,Hier finden Sie Informationen zu dem Thema „Energiewende“. Lesen Sie jetzt „Erster 300-Tonnen-Transformator für Südostlink-Trasse ist da“.,https://img.zeit.de/news/2024-04/08/erster-300-tonnen-transformator-fuer-suedostlink-trasse-ist-da-image-group/wide__1300x731,2024-04-08T03:16:08Z,,"Am Startpunkt für die geplante 540 Kilometer lange Höchstspannungsleitung Suedostlink am Umspannwerk Wolmirstedt bei Magdeburg kommt am Montag ein schwergewichtiger Transport an. Ein erster, rund 300… [+1938 chars]",,de,'Energiewende'
https://www.nzz.ch/wirtschaft/erneuerbarer-strom-schweiz-kann-ehrgeizige-ziele-erreichen-ld.1825054,https://www.nzz.ch/wirtschaft/erneuerbarer-strom-schweiz-kann-ehrgeizige-ziele-erreichen-ld.1825054,0,www.nzz.ch,Erneuerbarer Strom: Schweiz kann ehrgeizige Ziele erreichen,"In zwei Monaten kommt das neue Stromversorgungsgesetz an die Urne. Die Gegner halten den darin geplanten Ausbau der erneuerbaren Energien für illusorisch. Nun zeigt eine Studie: Das Ziel ist ambitioniert, aber machbar.","https://img.nzz.ch/2023/01/26/f8e54989-ed7f-4e6e-a801-0010f7c52d98.jpeg?width=1200&height=674&fit=bound&quality=75&auto=webp&crop=7631,4287,x0,y399&wmark=nzz",2024-04-08T03:30:00Z,,"Sie ist in jedem Szenario der Schlüssel für eine Zukunft mit erneuerbarer Energie: Installation von Solarpanels an Gebäuden.
Am 9. Juni stimmen die Schweizerinnen und Schweizer über das Gesetz für e… [+7681 chars]",,de,'Ausbau'
https://hallespektrum.de/nachrichten/umwelt-verkehr/fruehjahrszeit-ist-reifenwechselzeit-sicher-unterwegs-in-die-warme-saison/464518/,https://hallespektrum.de/nachrichten/umwelt-verkehr/fruehjahrszeit-ist-reifenwechselzeit-sicher-unterwegs-in-die-warme-saison/464518/,0,hallespektrum.de,Frühjahrszeit ist Reifenwechselzeit: Sicher unterwegs in die warme Saison,"Mit dem Frühling in vollem Gange und sommerlichen Temperaturen, rückt der Wechsel von Winter- auf Sommerreifen für viele Autofahrer nun ins Rampenlicht. Die altbewährte Regel „Von O bis O“ – von Oktober bis Ostern – wird oft als Leitfaden genannt, doch Expert…",https://hallespektrum.de/wp-content/uploads/2021/12/Autoreifen.png,2024-04-08T08:15:56Z,,"Mit dem Frühling in vollem Gange und sommerlichen Temperaturen, rückt der Wechsel von Winter- auf Sommerreifen für viele Autofahrer nun ins Rampenlicht. Die altbewährte Regel „Von O bis O“ – von Okto… [+1554 chars]",,de,'Winter'
https://www.stern.de/gesellschaft/regional/berlin-brandenburg/obdachlosigkeit--berliner-kaeltehilfe-diesen-winter-stark-ausgelastet-34607846.html,https://www.stern.de/gesellschaft/regional/berlin-brandenburg/obdachlosigkeit--berliner-kaeltehilfe-diesen-winter-stark-ausgelastet-34607846.html,0,www.stern.de,Obdachlosigkeit: Berliner Kältehilfe diesen Winter stark ausgelastet,"Das Berliner Kältehilfesystem ist Wohlfahrtsverbänden zufolge diesen Winter erneut an seine Grenzen gestoßen. Bereits im September hätten die Verbände darauf hingewiesen, dass für die Unterbringung von Obdachlosen Hunderte Plätze fehlten, sagte Diakonie-Vorst…",https://image.stern.de/34607848/t/IA/v1/w1440/r1.7778/-/08--urnnewsmldpacom2009010124040899597662v2w800h600l256t87r1378b1447jpeg---35f78230f7a2f7f1.jpg,2024-04-08T08:41:32Z,,"Das Berliner Kältehilfesystem ist Wohlfahrtsverbänden zufolge diesen Winter erneut an seine Grenzen gestoßen. Bereits im September hätten die Verbände darauf hingewiesen, dass für die Unterbringung v… [+2369 chars]",,de,'Winter'
