index,url,valid,domain,title,description,image,published,archive,content,quote,language,keyword
https://www.stern.de/digital/technik/fruehjahrsangebote--balkonkraftwerk-aktuell-ueber-700-euro-guenstiger-35547388.html,https://www.stern.de/digital/technik/fruehjahrsangebote--balkonkraftwerk-aktuell-ueber-700-euro-guenstiger-35547388.html,0,www.stern.de,Solarstrom-Angebot: XL-Balkonkraftwerk mit Stromspeicher von Anker im Sale – guter Deal?,Kleines Kraftwerk verkauft gerade Balkonkraftwerke mit Stromspeicher und großem Rabatt. Die Quattro-Anlage mit Anker-Speicher ist momentan 700 Euro günstiger.,https://image.stern.de/35547390/t/Kz/v2/w1440/r1.7778/-/xl-balkonkraftwerk-angebot.jpg,2025-03-13T07:40:27Z,,"Kopiere den aktuellen Link
Zur Merkliste hinzufügen
Kleines Kraftwerk verkauft gerade Balkonkraftwerke mit Stromspeicher und großem Rabatt. Die Quattro-Anlage mit Anker-Speicher ist momentan 700 Eu… [+2739 chars]",,de,'Solar'
https://www.stern.de/news/gasspeicher-in-deutschland-stark-entleert---wenig-anreize-zur-wiederbefuellung-35548462.html,https://www.stern.de/news/gasspeicher-in-deutschland-stark-entleert---wenig-anreize-zur-wiederbefuellung-35548462.html,0,www.stern.de,Gasspeicher in Deutschland stark entleert - wenig Anreize zur Wiederbefüllung,"Die Gasspeicher in Deutschland sind aktuell deutlich weniger gefüllt als zu vergleichbaren Zeitpunkten in Vorjahren. Wie die Initiative Energien Speichern (Ines) am Donnerstag mitteilte, liegt der Füllstand bei derzeit etwa 32 Prozent - Ende Februar 2024 ware…",https://image.stern.de/35548464/t/A1/v1/w1440/r1.7778/-/13--einigung-im-gasstreit---2a1e63d4700a72c2.jpg,2025-03-13T11:34:49Z,https://web.archive.org/web/20250313222016/https://www.stern.de/news/gasspeicher-in-deutschland-stark-entleert---wenig-anreize-zur-wiederbefuellung-35548462.html,"Kopiere den aktuellen Link
Zur Merkliste hinzufügen
Die Gasspeicher in Deutschland sind aktuell deutlich weniger gefüllt als zu vergleichbaren Zeitpunkten in Vorjahren. Wie die Initiative Energien … [+2315 chars]",,de,'Gasspeicher'
https://www.sueddeutsche.de/wirtschaft/gasspeicher-deutschland-li.3218879,https://www.sueddeutsche.de/wirtschaft/gasspeicher-deutschland-li.3218879,0,www.sueddeutsche.de,Energie: Die Gasspeicher sind ziemlich leer,"Sie sind dafür da, den im Winter größeren Gasbedarf zu decken. In diesem Jahr wurden die Speicher stärker entleert als in den Vorjahren. Das hat nicht nur mit den Temperaturen zu tun.",https://www.sueddeutsche.de/2025/03/13/5ead9e22-f32d-4959-acba-03647dd18961.jpeg?q=60&fm=webp&width=1200&rect=0%2C209%2C4000%2C2250,2025-03-13T14:43:16Z,https://web.archive.org/web/20250320101754/https://www.sueddeutsche.de/wirtschaft/gasspeicher-deutschland-li.3218879,Der Verband nennt zwei Hauptgründe für die starke Entleerung der Speicher im Januar und Februar. Zum einen sei die Versorgungsaufgabe der Speicher deutlich größer als in den beiden zurückliegenden Wi… [+1444 chars],,de,'Gasspeicher'
https://www.zeit.de/news/2025-03/14/carver-kunstschnee-klima-skiverletzungen-aendern-sich,https://www.zeit.de/news/2025-03/14/carver-kunstschnee-klima-skiverletzungen-aendern-sich,0,www.zeit.de,"Wintersport: Carver, Kunstschnee, Klima: Skiverletzungen ändern sich","Hier finden Sie Informationen zu dem Thema „Wintersport“. Lesen Sie jetzt „Carver, Kunstschnee, Klima: Skiverletzungen ändern sich“.",https://img.zeit.de/news/2025-03/14/carver-kunstschnee-klima-skiverletzungen-aendern-sich-image-group/wide__1300x731,2025-03-14T04:00:39Z,https://web.archive.org/web/20250318033018/https://www.zeit.de/news/2025-03/14/carver-kunstschnee-klima-skiverletzungen-aendern-sich,"Knie, Schulter, Kopf: War früher der Beinbruch die typische Folge eines Skiunfalls, so müssen sich Ärzte heute meist um andere Verletzungen kümmern. 
Mehr als jede fünfte Verletzung durch Kollision… [+3465 chars]",,de,'Winter'
https://steiermark.orf.at/stories/3296890/,https://steiermark.orf.at/stories/3296890/,0,steiermark.orf.at,Trockenheit beeinflusst Stromproduktion,Der fehlende Niederschlag der vergangenen Monate wirkt sich auf die steirischen Wasserkraftwerke aus. Im Winter gab es kaum Regen oder Schneefall. Daher wird weniger Strom durch Wasserkraft erzeugt. Gestiegen ist hingegen die Produktion aus PV-Anlagen.,https://ibs.orf.at/stm?image=https%3A%2F%2Foekastatic.orf.at%2Fmims%2F2022%2F22%2F74%2Fcrops%2Fw%3D1200%2Ch%3D627%2Cq%3D75%2F1362058_master_488374__z7b7216.jpg%3Fs%3Db9bd17eda61d3d58227a6fc843b57d122ca5bc23,2025-03-14T06:23:00Z,https://web.archive.org/web/20250314085434/https://steiermark.orf.at/stories/3296890/,"In der Steiermark gibt es 40 Laufkraftwerke davon 30 an der Mur. Der Verbund meldet, dass Enns und Mur aktuell wesentlich weniger Wasser führen, als zu dieser Zeit üblich. Dadurch werde deutlich weni… [+1671 chars]",,de,'Wasserkraft'
https://www.welt.de/regionales/hamburg/article255689332/Elektro-Heizkessel-So-soll-die-Windenergie-ins-Fernwaermenetz-kommen.html,https://www.welt.de/regionales/hamburg/article255689332/Elektro-Heizkessel-So-soll-die-Windenergie-ins-Fernwaermenetz-kommen.html,0,www.welt.de,So soll die Windenergie ins Fernwärmenetz kommen,"In Hamburg ist „Karoline“ in den Regelbetrieb gegangen, als eine neue Schnittstelle von Strom- und Wärmemarkt. Mit Anlagen wie dieser sollen mehr Wind- und Solarstrom in die Energieversorgung eingespeist und die Netze einfacher stabilisiert werden.",https://img.welt.de/img/regionales/hamburg/mobile255695670/2347936887-ci16x9-w1200/Power-to-Heat-Anlage-Karoline.jpg,2025-03-14T09:43:00Z,https://web.archive.org/web/20250315072710/https://www.welt.de/regionales/hamburg/article255689332/Elektro-Heizkessel-So-soll-die-Windenergie-ins-Fernwaermenetz-kommen.html,"In Hamburg ist Karoline in den Regelbetrieb gegangen, als eine neue Schnittstelle von Strom- und Wärmemarkt. Mit Anlagen wie dieser sollen mehr Wind- und Solarstrom in die Energieversorgung eingespei… [+4786 chars]",,de,'Windenergie'
https://praxistipps.chip.de/was-bedeutet-bifazial-so-funktionieren-doppelseitige-solaranlagen_186016,https://praxistipps.chip.de/was-bedeutet-bifazial-so-funktionieren-doppelseitige-solaranlagen_186016,0,praxistipps.chip.de,Was bedeutet bifazial? So funktionieren doppelseitige Solaranlagen,"Was bedeutet bifazial? Wenn Sie sich das auch schon einmal gefragt haben, wird es Zeit für eine Antwort. Bifaziale Solaranlagen nutzen Sonnenlicht effizienter, indem sie Energie von beiden Seiten eines Solarmoduls gewinnen. … ... mehr",https://im.contentlounge.net/styles/manual_crop/s3/2025-03/368469448.jpg?im=AspectCrop%3D%281.91%2C1%29%2Cgravity%3DCenter%3BResize%3D%281200%2C630%29%2Caspect%3Dfit%3BBackgroundColor%2Ccolor%3Dffffff&hash=1b67bfaea8d3a1705e4b628f0e117b63dcff428d508f65caff9eff0cedd6794a,2025-03-14T13:52:15Z,,"Was bedeutet bifazial? Wenn Sie sich das auch schon einmal gefragt haben, wird es Zeit für eine Antwort. Bifaziale Solaranlagen nutzen Sonnenlicht effizienter, indem sie Energie von beiden Seiten ein… [+7207 chars]",,de,'Solar'
https://www.golem.de/sonstiges/zustimmung/auswahl.html?from=https://www.golem.de/news/e-fuels-synthetischer-treibstoff-aus-biogas-hergestellt-2503-194321.html&referer=https://t.co/9eca11dd59,https://www.golem.de/sonstiges/zustimmung/auswahl.html?from=https://www.golem.de/news/e-fuels-synthetischer-treibstoff-aus-biogas-hergestellt-2503-194321.html&referer=https://t.co/9eca11dd59,0,www.golem.de,E-Fuels: Synthetischer Treibstoff aus Biogas hergestellt,"42.000 Tonnen E-Fuels soll die Anlage im Süden Dänemarks jährlich produzieren, die ansonsten reinen Wasserstoff erzeugt. (Energiewende, Umweltschutz)",,2025-03-14T14:06:01Z,,"Besuchen Sie Golem.de wie gewohnt mit Werbung und Tracking,
 indem Sie der Nutzung aller Cookies zustimmen.
 Details zum Tracking finden Sie im Privacy Center.
Skript wurde nicht geladen. Informat… [+607 chars]",,de,'Energiewende'
https://www.faz.net/aktuell/wirtschaft/klima-nachhaltigkeit/energiewende-emissionen-sinken-gemaess-nationalen-zielen-110357275.html,https://www.faz.net/aktuell/wirtschaft/klima-nachhaltigkeit/energiewende-emissionen-sinken-gemaess-nationalen-zielen-110357275.html,0,www.faz.net,Erfolge der Energiewende: Habeck fürchtet Klimarückschritte unter Schwarz-Rot,"Der grüne Wirtschaftsminister zieht noch einmal Bilanz zur Klimapolitik. Die Emissionen sinken gemäß den nationalen Zielen, reißen aber die EU-Vorgaben. Zwei Bereiche bleiben die Sorgenkinder.",https://media1.faz.net/ppmedia/aktuell/politik/1547916196/1.10317055/facebook_teaser/bald-nicht-mehr-vizekanzler.jpg,2025-03-14T15:28:13Z,https://web.archive.org/web/20250314160043/https://www.faz.net/aktuell/wirtschaft/klima-nachhaltigkeit/energiewende-emissionen-sinken-gemaess-nationalen-zielen-110357275.html,"Am Ende wollte Robert Habeck noch einmal zeigen, dass nur er der Richtige ist und die Klima- und Energiepolitik von Schwarz-Rot nichts taugt. Die Regierung der vergangenen drei Jahre mit der Kärrnera… [+4617 chars]",,de,'Energiewende'
https://www.golem.de/sonstiges/zustimmung/auswahl.html?from=https://www.golem.de/news/klimaziele-65-prozent-weniger-co2-bis-2030-ist-realistisch-2503-194328.html&referer=https://t.co/a3c3eaa0b8,https://www.golem.de/sonstiges/zustimmung/auswahl.html?from=https://www.golem.de/news/klimaziele-65-prozent-weniger-co2-bis-2030-ist-realistisch-2503-194328.html&referer=https://t.co/a3c3eaa0b8,0,www.golem.de,Klimaziele: 65 Prozent weniger CO2 bis 2030 ist realistisch,"Nach aktuellem Stand sind Deutschlands Ziele für den CO2-Ausstoß bis 2030 realistisch. Schon jetzt werden sie übererfüllt, aber nicht in jedem Sektor. (Energiewende, GreenIT)",,2025-03-14T17:13:01Z,,"Besuchen Sie Golem.de wie gewohnt mit Werbung und Tracking,
 indem Sie der Nutzung aller Cookies zustimmen.
 Details zum Tracking finden Sie im Privacy Center.
Skript wurde nicht geladen. Informat… [+607 chars]",,de,'Energiewende'
https://www.faz.net/aktuell/wirtschaft/eon-chef-birnbaum-und-rwe-chef-krebber-erklaeren-ihren-plan-zur-energiewende-110355439.html,https://www.faz.net/aktuell/wirtschaft/eon-chef-birnbaum-und-rwe-chef-krebber-erklaeren-ihren-plan-zur-energiewende-110355439.html,0,www.faz.net,"„Die Energiewende wird scheitern, wenn wir nicht die Kosten runterbringen“","Weniger zusätzliche Stromtrassen, weniger neue Windräder, weniger Subventionen: Eon-Chef Leo Birnbaum und RWE-Chef Markus Krebber fordern in der Energiewende Kostensenkungen in dreistelliger Milliardenhöhe. Hier stellen sie ihren Plan vor.",https://media0.faz.net/ppmedia/aktuell/1400166024/1.10355450/facebook_teaser/offshore-windpark-von-rwe-vor.jpg,2025-03-15T07:13:54Z,http://archive.md/20250315071658/https://www.faz.net/aktuell/wirtschaft/eon-chef-birnbaum-und-rwe-chef-krebber-erklaeren-ihren-plan-zur-energiewende-110355439.html,"Herr Birnbaum, Herr Krebber, Eon und RWE legen einen gemeinsamen Plan für einen Neustart der Energiewende in Deutschland vor. Was wollen Sie ändern?
Birnbaum: Am Umbau unseres Energiesystems für den… [+11494 chars]",,de,'Energiewende'
https://www.telepolis.de/features/Angst-vor-China-Spionage-Sabotiert-die-Bundeswehr-die-Energiewende-10311932.html,https://www.telepolis.de/features/Angst-vor-China-Spionage-Sabotiert-die-Bundeswehr-die-Energiewende-10311932.html,0,www.telepolis.de,Angst vor China-Spionage: Sabotiert die Bundeswehr die Energiewende?,Die Bundeswehr blockiert immer häufiger den Bau von Windrädern wegen Tiefflugkorridoren. Gleichzeitig warnen Militärexperten vor Spionage durch chinesische Windkraftanlagen.,https://heise.cloudimg.io/bound/1200x1200/q85.png-lossy-85.webp-lossy-85.foil1/_www-heise-de_/imgs/18/4/8/1/6/8/3/8/jjj_Zeichenfla__che_1-6e2a6a1314d8ee86.png,2025-03-15T11:00:00Z,https://web.archive.org/web/20250315130747/https://www.telepolis.de/features/Angst-vor-China-Spionage-Sabotiert-die-Bundeswehr-die-Energiewende-10311932.html,"Die Bundeswehr blockiert immer häufiger den Bau von Windrädern wegen Tiefflugkorridoren. Gleichzeitig warnen Militärexperten vor Spionage durch chinesische Windkraftanlagen.
Dass sich die Bundeswehr… [+5025 chars]",,de,'Energiewende'
https://www.telepolis.de/features/Windkraft-oder-Landesverteidigung-was-ist-wichtiger-10311932.html,https://www.telepolis.de/features/Windkraft-oder-Landesverteidigung-was-ist-wichtiger-10311932.html,0,www.telepolis.de,Windkraft oder Landesverteidigung – was ist wichtiger?,Bundeswehr blockiert zunehmend Ausbau der Windkraft. Tiefflugkorridore für Hubschrauber haben Vorrang vor Windrädern. Doch ist militärische Sicherheit wirklich wichtiger als die Energiewende?,https://heise.cloudimg.io/bound/1200x1200/q85.png-lossy-85.webp-lossy-85.foil1/_www-heise-de_/imgs/18/4/8/1/6/8/3/8/jjj_Zeichenfla__che_1-6e2a6a1314d8ee86.png,2025-03-15T11:00:00Z,https://web.archive.org/web/20250315112305/https://www.telepolis.de/features/Windkraft-oder-Landesverteidigung-was-ist-wichtiger-10311932.html,"Bundeswehr blockiert zunehmend Ausbau der Windkraft. Tiefflugkorridore für Hubschrauber haben Vorrang vor Windrädern. Doch ist militärische Sicherheit wirklich wichtiger als die Energiewende?
Dass s… [+5025 chars]",,de,'Ausbau'
https://vorarlberg.orf.at/stories/3297106/,https://vorarlberg.orf.at/stories/3297106/,0,vorarlberg.orf.at,Grundwasserspiegel profitiert vom Vorjahr,Seit 28 Jahren war kein Winter mehr so trocken wie der heurige. Seit Jänner hat es um 40 Prozent weniger geregnet und geschneit als im langjährigen Schnitt. Das ist bereits bei der Stromerzeugung aus Wasserkraft spürbar und bereitet auch in der Landwirtschaft…,https://ibs.orf.at/vbg?image=https%3A%2F%2Foekastatic.orf.at%2Fmims%2F2025%2F11%2F35%2Fcrops%2Fw%3D1200%2Ch%3D627%2Cq%3D75%2F2549903_master_977635_universum_das_alpenrheintal_04.jpg%3Fs%3D06541c7e9a0a89a9eac1e9f5ac9a318601c74504,2025-03-15T12:08:33Z,,"Die extreme Trockenheit der vergangenen Monate wirkt sich in verschiedensten Bereichen aus. So sei die Schneelage in den Bergen sehr gering, betont Thomas Blank von der Abteilung Wasserwirtschaft bei… [+1400 chars]",,de,'Wasserkraft'
https://www.welt.de/wirtschaft/plus255642526/Immobilien-Diese-Karte-zeigt-wo-der-Sanierungsbedarf-besonders-gering-ist.html,https://www.welt.de/wirtschaft/plus255642526/Immobilien-Diese-Karte-zeigt-wo-der-Sanierungsbedarf-besonders-gering-ist.html,0,www.welt.de,"Großer Effizienz-Atlas – Diese Karte zeigt, wo der Sanierungsbedarf besonders gering ist","Der Anteil sanierungsbedürftiger Immobilien hat sich deutlich erhöht, zeigt eine neue Auswertung. Regional gibt es dabei deutliche Unterschiede, in zwei Gegenden ist die Energieeffizienz noch besonders gut. Klicken Sie sich hier durch alle Landkreise auf der …",https://img.welt.de/img/wirtschaft/mobile255701382/6287930717-ci16x9-w1200-fnov-fpotl-fpi157750653/DWOSB-WI-Energieeffizienz-js.jpg,2025-03-15T20:29:40Z,http://archive.md/20250315203533/https://www.welt.de/wirtschaft/plus255642526/Immobilien-Diese-Karte-zeigt-wo-der-Sanierungsbedarf-besonders-gering-ist.html,"Der Anteil sanierungsbedürftiger Immobilien hat sich deutlich erhöht, zeigt eine neue Auswertung. Regional gibt es dabei deutliche Unterschiede, in zwei Gegenden ist die Energieeffizienz noch besonde… [+78 chars]",,de,'Energieeffizienz'
https://www.zeit.de/news/2025-03/16/imker-verlieren-wegen-milden-winters-bienenvoelker,https://www.zeit.de/news/2025-03/16/imker-verlieren-wegen-milden-winters-bienenvoelker,0,www.zeit.de,Tiere und Hobby: Imker verlieren wegen milden Winters Bienenvölker,Hier finden Sie Informationen zu dem Thema „Tiere und Hobby“. Lesen Sie jetzt „Imker verlieren wegen milden Winters Bienenvölker“.,https://img.zeit.de/news/2025-03/16/imker-verlieren-wegen-milden-winters-bienenvoelker-image-group/wide__1300x731,2025-03-16T06:30:37Z,https://web.archive.org/web/20250318033059/https://www.zeit.de/news/2025-03/16/imker-verlieren-wegen-milden-winters-bienenvoelker,Hamburgs Imker haben wegen des deutlich zu milden und nassen Winters erneut einige Bienenvölker verloren. Bei einem milderen Winter setze die Brutzeit bei den Honigbienen früher ein und damit beginne… [+1710 chars],,de,'Winter'
https://kaernten.orf.at/stories/3297238/,https://kaernten.orf.at/stories/3297238/,0,kaernten.orf.at,Badehaus am Pressegger See geplant,"Andere Seen in Kärnten haben es schon, jetzt soll auch am Pressegger See um acht Millionen Euro ein Badehaus samt Beherbergungsbetrieb entstehen. Der Ganzjahresbetrieb soll als Ergänzung zum Winter- Angebot auf dem Nassfeld fungieren. Erste Pläne wurden in de…",https://ibs.orf.at/ktn?image=https%3A%2F%2Foekastatic.orf.at%2Fmims%2F2023%2F35%2F63%2Fcrops%2Fw%3D1200%2Ch%3D627%2Cq%3D75%2F1919226_master_720563_sujet_sujetbild_pressegger_see_hermann_verderber.jpg%3Fs%3Da819664fc415587b543393720eb6b4f500c291e8,2025-03-16T12:06:35Z,https://web.archive.org/web/20250316171400/https://kaernten.orf.at/stories/3297238/,"Es sei eine einmalige Chance, dem Strandbad aus den 1960er Jahren eine Perspektive für kommende Generationen zu geben, sagt Bürgermeister Leopold Astner (ÖVP). 500.000 Euro wurden seit dem Vorjahr be… [+2187 chars]",,de,'Winter'
https://www.bild.de/sport/fussball/1-fc-saarbruecken-zweitliga-profi-hatte-schon-wohnung-in-saarbruecken-67d6ba077de6aa748383a581,https://www.bild.de/sport/fussball/1-fc-saarbruecken-zweitliga-profi-hatte-schon-wohnung-in-saarbruecken-67d6ba077de6aa748383a581,0,www.bild.de,Trotzdem platzte der Wechsel - Zweitliga-Profi hatte schon Wohnung in Saarbrücken,In der Winterpause suchte der FCS nach Sturm-Verstärkung. Mit einem war man schon klar.,"https://images.bild.de/67d6ba077de6aa748383a581/d83f3f86ef6f45f4e3d7f18189af739a,ad714ef9?w=1280",2025-03-16T13:07:29Z,https://web.archive.org/web/20250316134618/https://www.bild.de/sport/fussball/1-fc-saarbruecken-zweitliga-profi-hatte-schon-wohnung-in-saarbruecken-67d6ba077de6aa748383a581,Der 1. FC Saarbrücken suchte im Winter dringend Verstärkung im Sturm. Schlussendlich verpflichtete man Ex-Bundesliga-Profi Florian Krüger und Ösi-Angreifer Stefan Feiertag. Doch ursprünglich war ein … [+178 chars],,de,'Winter'
https://www.faz.net/aktuell/wirtschaft/klima-nachhaltigkeit/energiewende-100-milliarden-zu-teuer-110360323.html,https://www.faz.net/aktuell/wirtschaft/klima-nachhaltigkeit/energiewende-100-milliarden-zu-teuer-110360323.html,0,www.faz.net,Einigung auf Finanzpaket: Energiewende 100 Milliarden zu teuer,Die Chefs von RWE und Eon sehen enormen Sparbedarf. Aus der Forschung gibt es Unterstützung. Doch die Politik reduziert mit dem Sondervermögen den Reformdruck.,https://media0.faz.net/ppmedia/aktuell/wirtschaft/803397088/1.10360166/facebook_teaser/muss-das-sein-erdkabel-hier-in.jpg,2025-03-16T15:03:20Z,http://archive.md/20250316152131/https://www.faz.net/aktuell/wirtschaft/klima-nachhaltigkeit/energiewende-100-milliarden-zu-teuer-110360323.html,"In Deutschland ist eine Diskussion darüber entbrannt, wie sich die Energiewende effizienter gestalten lässt und ob die für den Klima- und Transformationsfonds KTF gedachten 100 Milliarden Euro aus de… [+5369 chars]",,de,'Energiewende'
https://burgenland.orf.at/stories/3297283/,https://burgenland.orf.at/stories/3297283/,0,burgenland.orf.at,Special Olympics: Drei heimische Medaillen,Die Special Olympics Welt-Winterspiele in Turin und Sestriere sind Geschichte. Die Bilanz des österreichischen Teams kann sich aber sehen lassen – insgesamt gewinnen die Sportlerinnen und Sportler 41 Medaillen. Drei davon wandern auch in das Burgenland.,https://ibs.orf.at/bgl?image=https%3A%2F%2Foekastatic.orf.at%2Fmims%2F2022%2F25%2F63%2Fcrops%2Fw%3D1200%2Ch%3D627%2Cq%3D75%2F1387061_master_498163_so3.jpg%3Fs%3D91fde6a7c436001802862427e4ba600e28fbf132,2025-03-16T15:13:08Z,,"39 Sportlerinnen und Sportler aus Österreich traten bei den diesjährigen World-Winter-Games an, davon auch sieben aus dem Burgenland. Österreich war bei den Winterspielen in allen acht Bewerben vertr… [+1062 chars]",,de,'Winter'
"https://www.gamestar.de/artikel/beste-smart-home-heizkoerper-thermostate-matter-tado-x-test,3429170.html","https://www.gamestar.de/artikel/beste-smart-home-heizkoerper-thermostate-matter-tado-x-test,3429170.html",0,www.gamestar.de,Deals: Heizkosten 2025 - So spare ich ohne Komfortverlust dieses Jahr bares Geld! [Anzeige],"Die smarten Heizkörperthermostate von tado° X bieten Matter, Thread und das bislang schönste Design am Markt. Statt Batterien gibt's sogar Akkus mit USB-C. Jetzt bekommt ihr die Smart Home Thermostate mit 50% Rabatt! Mein Langzeit-Fazit.",https://images.cgames.de/images/gamestar/293/titelbild-smart-home-heizkörperthermostate-tado-x-matter-review-test_6341783.jpg,2025-03-17T10:17:00Z,,"Im Test müssen sich die neuen Smart Home Heizkörper-Thermostate von tado° beweisen.
Seit es im Herbst 2024 kälter wurde, ist Heizen bei uns nicht mehr dasselbe. Eine deutsche Marke hat aufgerüstet u… [+6016 chars]",,de,'Heizkosten'
https://www.focus.de/earth/rwe-und-eon-ausgerechnet-deutschlands-energie-bosse-haben-ein-problem-mit-dem-klima-milliarden_b6a41711-5a6c-412b-a1db-11d687f2de7e.html,https://www.focus.de/earth/rwe-und-eon-ausgerechnet-deutschlands-energie-bosse-haben-ein-problem-mit-dem-klima-milliarden_b6a41711-5a6c-412b-a1db-11d687f2de7e.html,0,www.focus.de,RWE und Eon - Ausgerechnet Deutschlands Energie-Bosse haben ein Problem mit dem Klima-Milliarden,"100 Milliarden Euro für den Klimaschutz? Das muss nicht unbedingt eine gute Nachricht sein, urteilen die Chefs der Energieriesen RWE und Eon. Die nämlich sehen enorme Einsparmöglichkeiten bei der Energiewende.",https://quadro.burda-forward.de/ctf/e2960937-2294-4f21-8eb7-7fc7b645c16b.ff0f1161-02e6-4359-bce1-dadbb8c52695.jpeg?im=RegionOfInterestCrop%3D%281200%2C630%29%2CregionOfInterest%3D%281060.5%2C707%29&hash=e6c57b3ad0c6ad8e2dcbc4944d426f1e81b72bf104bf0a0061efc91283d6ea3f,2025-03-17T11:23:00Z,https://web.archive.org/web/20250317141309/https://www.focus.de/earth/rwe-und-eon-ausgerechnet-deutschlands-energie-bosse-haben-ein-problem-mit-dem-klima-milliarden_b6a41711-5a6c-412b-a1db-11d687f2de7e.html,"Die Energiewende in Deutschland ist alternativlos, doch der bisherige Kurs verursacht immense Kosten das kritisieren die Vorstandsvorsitzenden der Energiekonzerne Eon und RWE, Leonhard Birnbaum und M… [+4651 chars]",,de,'Energiewende'
https://www.golem.de/sonstiges/zustimmung/auswahl.html?from=https://www.golem.de/news/gezeiten-windraeder-sollen-unter-wasser-betrieben-werden-2503-194372.html&referer=https://t.co/acea8d7304,https://www.golem.de/sonstiges/zustimmung/auswahl.html?from=https://www.golem.de/news/gezeiten-windraeder-sollen-unter-wasser-betrieben-werden-2503-194372.html&referer=https://t.co/acea8d7304,0,www.golem.de,Gezeiten: Windräder sollen unter Wasser betrieben werden,"Vor der Küste der Normandie entsteht ein neuartiges Gezeitenkraftwerk mit dem Potenzial, Millionen Haushalte mit Strom zu versorgen. (Energiewende, Umweltschutz)",,2025-03-17T12:45:01Z,,"Besuchen Sie Golem.de wie gewohnt mit Werbung und Tracking,
 indem Sie der Nutzung aller Cookies zustimmen.
 Details zum Tracking finden Sie im Privacy Center.
Skript wurde nicht geladen. Informat… [+607 chars]",,de,'Energiewende'
https://www.zeit.de/wirtschaft/2025-03/power-to-heat-anlagen-stromnetz-windenergie-solarenergie-heizen-wasserkessel,https://www.zeit.de/wirtschaft/2025-03/power-to-heat-anlagen-stromnetz-windenergie-solarenergie-heizen-wasserkessel,0,www.zeit.de,Power-to-Heat-Anlagen: Boom der Wasserkessel,"Was tun, wenn zu viel Wind- und Solarstrom produziert wird? Immer mehr Stadtwerke heizen damit. Warum das Verfahren ein Modell für die Energiewende sein kann.",https://img.zeit.de/wirtschaft/2025-03/power-to-heat-anlagen-stromnetz-windenergie-solarenergie-heizen-wasserkessel-bild/wide__1300x731,2025-03-17T14:18:57Z,http://archive.md/20250317142805/https://www.zeit.de/wirtschaft/2025-03/power-to-heat-anlagen-stromnetz-windenergie-solarenergie-heizen-wasserkessel,"Wenn der Wind in der Region
Mecklenburg richtig aufdreht, sind die Stromnetze rund um Neubrandenburg schnell an ihren Grenzen. Die 65.000-Einwohner-Stadt ist umgeben von Windkraftanlagen,
wie fast … [+821 chars]",,de,'Solar'
https://www.stern.de/gesellschaft/regional/sachsen-anhalt/erneuerbare-energien--buergerwindpark-druiberg-bekommt-neue-windraeder-35559238.html,https://www.stern.de/gesellschaft/regional/sachsen-anhalt/erneuerbare-energien--buergerwindpark-druiberg-bekommt-neue-windraeder-35559238.html,0,www.stern.de,Erneuerbare Energien: Bürgerwindpark Druiberg bekommt neue Windräder,Vor 25 Jahren wurde der erste Bürgerwindpark in Sachsen-Anhalt im Landkreis Harz gegründet. Inzwischen sind einige der Windräder in die Jahre gekommen - sie werden in großem Stil ausgetauscht.,https://image.stern.de/35559240/t/1K/v1/w1440/r1.7778/-/17--7dz2agmpjev11axs2048jpeg---a22c279e6dd876dc.jpg,2025-03-17T16:05:22Z,https://web.archive.org/web/20250318061819/https://www.stern.de/gesellschaft/regional/sachsen-anhalt/erneuerbare-energien--buergerwindpark-druiberg-bekommt-neue-windraeder-35559238.html,"Kopiere den aktuellen Link
Zur Merkliste hinzufügen
Vor 25 Jahren wurde der erste Bürgerwindpark in Sachsen-Anhalt im Landkreis Harz gegründet. Inzwischen sind einige der Windräder in die Jahre gek… [+989 chars]",,de,'Erneuerbare'
