index,url,valid,domain,title,description,image,published,archive,content,quote,language,keyword
https://www.n-tv.de/ratgeber/Heizen-mit-Scheitholz-und-Pellets-Das-sollten-Sie-abwaegen-article24576198.html,https://www.n-tv.de/ratgeber/Heizen-mit-Scheitholz-und-Pellets-Das-sollten-Sie-abwaegen-article24576198.html,0,www.n-tv.de,Für alle geeignet?: Heizen mit Scheitholz und Pellets: Das sollten Sie abwägen,"Mit Pellets oder Scheitholz zu heizen ist umstritten. Dennoch sind Holzöfen sehr beliebt. Um damit weitgehend klimafreundlich zu heizen, gibt es einige Dinge zu bedenken.",https://bilder4.n-tv.de/img/incoming/crop24475051/0481324213-cImg_16_9-w1200/imago0068244013h.jpg,2023-12-04T10:51:22Z,https://web.archive.org/web/20231204113248/https://www.n-tv.de/ratgeber/Heizen-mit-Scheitholz-und-Pellets-Das-sollten-Sie-abwaegen-article24576198.html,"Mit Pellets oder Scheitholz zu heizen ist umstritten. Dennoch sind Holzöfen sehr beliebt. Um damit weitgehend klimafreundlich zu heizen, gibt es einige Dinge zu bedenken. 
Das knackende Holz, die wo… [+8420 chars]",,de,'Heizen'
https://www.n-tv.de/wirtschaft/Tausende-Windkraftanlagen-in-Eiffelturm-Hoehe-benoetigt-article24577269.html,https://www.n-tv.de/wirtschaft/Tausende-Windkraftanlagen-in-Eiffelturm-Hoehe-benoetigt-article24577269.html,0,www.n-tv.de,Hafenflächen fehlen für Ausbau: Windkraft: Tausende Anlagen in Eiffelturm-Höhe benötigt,"Die Windkraft soll mal das Rückgrat der deutschen Energieversorgung werden. Doch der Weg, um die ehrgeizigen Ziele zu erreichen, ist steinig. Das zeigt sich in einer Analyse zum Offshore-Ausbau, der als Problem vor allem die fehlenden Hafenflächen sieht.",https://bilder3.n-tv.de/img/incoming/crop24577354/0451323050-cImg_16_9-w1200/imago0103083421h.jpg,2023-12-04T15:45:31Z,https://web.archive.org/web/20231204155933/https://www.n-tv.de/wirtschaft/Tausende-Windkraftanlagen-in-Eiffelturm-Hoehe-benoetigt-article24577269.html,"Die Windkraft soll mal das Rückgrat der deutschen Energieversorgung werden. Doch der Weg, um die ehrgeizigen Ziele zu erreichen, ist steinig. Das zeigt sich in einer Analyse zum Offshore-Ausbau, der … [+2826 chars]",,de,'Ausbau'
https://www.n-tv.de/wirtschaft/Droht-bei-der-Kaelte-doch-ein-Gasmangel-article24577438.html,https://www.n-tv.de/wirtschaft/Droht-bei-der-Kaelte-doch-ein-Gasmangel-article24577438.html,0,www.n-tv.de,RWE-Chef warnt vor Risiken: Droht bei der Kälte doch ein Gasmangel?,Ein besonders kalter Winter würde Deutschland weiterhin in einen Gas-Engpass katapultieren. Meteorologen und Speicherbetreiber machen aber trotz der aktuellen Temperaturen Hoffnung. Durch eine andere Gefahr ist die Versorgungssicherheit allerdings dennoch bed…,https://bilder4.n-tv.de/img/incoming/crop24577495/7611325177-cImg_16_9-w1200/315872438.jpg,2023-12-04T16:52:31Z,https://web.archive.org/web/20231204165915/https://www.n-tv.de/wirtschaft/Droht-bei-der-Kaelte-doch-ein-Gasmangel-article24577438.html,Ein besonders kalter Winter würde Deutschland weiterhin in einen Gas-Engpass katapultieren. Meteorologen und Speicherbetreiber machen aber trotz der aktuellen Temperaturen Hoffnung. Durch eine andere… [+5475 chars],,de,'Winter'
https://www.morgenpost.de/berlin/article240745824/Kaelte-in-Berlin-Wer-muss-eigentlich-streuen.html,https://www.morgenpost.de/berlin/article240745824/Kaelte-in-Berlin-Wer-muss-eigentlich-streuen.html,0,www.morgenpost.de,Kälte in Berlin – Wer muss eigentlich streuen?,Der Winter wirft Fragen auf: Wie heizt man richtig? Wer ist zuständig für das Streuen? Und was bedeutet die Kälte für die Haustiere?,https://img.sparknews.funkemedien.de/240745822/240745822_1701705199_v4_3_800.jpeg,2023-12-04T17:00:00Z,https://web.archive.org/web/20231205013541/https://www.morgenpost.de/berlin/article240745824/Kaelte-in-Berlin-Wer-muss-eigentlich-streuen.html,"Berlin. Der Winter wirft Fragen auf: Wie heizt man richtig? Wer ist zuständig für das Streuen? Und was bedeutet die Kälte für die Haustiere?
Bis zu minus fünf Grad zeigte das Thermometer zeitweise a… [+9141 chars]",,de,'Heizen'
https://www.faz.net/aktuell/wirtschaft/was-tun-mit-der-heizung-ein-energieberater-antwortet-19353297.html,https://www.faz.net/aktuell/wirtschaft/was-tun-mit-der-heizung-ein-energieberater-antwortet-19353297.html,0,www.faz.net,„Nach 15 Jahren über die Heizung nachdenken“,"Energieberater Lennart Feldmann weiß, worauf es beim Heizen ankommt. Ein Gespräch über winzige Wärmepumpen, die richtige Fensterdichtung und die Frage aller Fragen: Wer muss umrüsten?",https://media1.faz.net/ppmedia/aktuell/gesellschaft/2797005613/1.9353295/facebook_teaser/qualm-steigt-an-einem-kalten.jpg,2023-12-04T19:15:39Z,https://web.archive.org/web/20231204200730/https://www.faz.net/aktuell/wirtschaft/was-tun-mit-der-heizung-ein-energieberater-antwortet-19353297.html,"Herr Feldmann, worüber sollte ich mir zuerst Gedanken machen, wenn es um eine neue Heizung für meine Immobilie geht?
Es fängt immer damit an, dass man sich den energetischen Ist-Zustand anschaut. Da… [+1282 chars]",,de,'Heizen'
https://www.stern.de/gesellschaft/regional/mecklenburg-vorpommern/energie--ostsee-windpark-arcadis-ost-1-vor-ruegen-komplett-am-netz-34258554.html,https://www.stern.de/gesellschaft/regional/mecklenburg-vorpommern/energie--ostsee-windpark-arcadis-ost-1-vor-ruegen-komplett-am-netz-34258554.html,0,www.stern.de,Energie: Ostsee-Windpark Arcadis Ost 1 vor Rügen komplett am Netz,Vor Rügen ist ein weiterer Windpark komplett am Netz. Eine zwischenzeitliche Durststrecke beim Offshore-Ausbau ist der zuständigen Firma zufolge überwunden. Dafür gibt es ein anderes Problem.,https://image.stern.de/34258556/t/QD/v1/w1440/r1.7778/-/05--urnnewsmldpacom2009010123120599183266v2w800h600l1392t925r4176b2781jpeg---a9320f9dc4cd4209.jpg,2023-12-05T04:36:13Z,,"Vor Rügen ist ein weiterer Windpark komplett am Netz. Eine zwischenzeitliche Durststrecke beim Offshore-Ausbau ist der zuständigen Firma zufolge überwunden. Dafür gibt es ein anderes Problem.
Vor Rü… [+3459 chars]",,de,'Windenergie'
https://www.welt.de/podcasts/zwei-zimmer-kueche-bad/plus248821878/Machen-Waermepumpen-das-Wohnen-und-Heizen-wirklich-teurer-Podcast.html,https://www.welt.de/podcasts/zwei-zimmer-kueche-bad/plus248821878/Machen-Waermepumpen-das-Wohnen-und-Heizen-wirklich-teurer-Podcast.html,0,www.welt.de,Machen Wärmepumpen das Wohnen und Heizen wirklich teurer?,"Lärm, Ästhetik und hohe Umbaukosten: Die Wärmepumpe ist für viele Bürger zum Reizwort geworden. Dennoch: In vielen Häusern wird sie künftig zur Pflicht. Wissenschaftsredakteurin Céline Lauer und Immobilienjournalist Michael Fabricius sprechen in „Zwei Zimmer,…",https://img.welt.de/img/podcasts/zwei-zimmer-kueche-bad/mobile247425596/6491358137-ci16x9-w1200-fnov-fpotl-fpi157750653/Zwei-Zimmer-Kueche-Bad-Wie-wohnen-wir-und-was-ist-es-uns-wer.jpg,2023-12-05T05:37:26Z,https://web.archive.org/web/20231206045827/https://www.welt.de/podcasts/zwei-zimmer-kueche-bad/plus248821878/Machen-Waermepumpen-das-Wohnen-und-Heizen-wirklich-teurer-Podcast.html,"Über kurz oder lang werden sich die Deutschen von Heizsystemen, die auf fossilen Brennstoffen basieren, trennen müssen. Wärmepumpen sind eine Alternative. Aber warum tun wir uns hierzulande so schwer… [+378 chars]",,de,'Heizen'
https://www.dw.com/de/kenia-angeknackster-klimachampion/a-67623881,https://www.dw.com/de/kenia-angeknackster-klimachampion/a-67623881,0,www.dw.com,Kenia: angeknackster Klimachampion,"Kenia bezieht einen Großteil seines Stroms aus Erneuerbaren Energien - und nutzt sein grünes Image, um für Klimaziele zu werben. Nach außen funktioniert das ganz gut. Doch im Land weist das Bild Risse auf. Wie eine aufgeworfene grüne Decke ziehen sich Wälder …",https://static.dw.com/image/67625203_6.jpg,2023-12-05T07:39:00Z,,"Wie eine aufgeworfene grüne Decke ziehen sich Wälder über die sanften Hügel, immer wieder durchbrochen von schroffen Steilhängen. ""Im Ostafrikanischen Graben bricht Afrika auseinander"", sagt die Geol… [+8308 chars]",,de,'Wasserkraft'
https://www.welt.de/politik/deutschland/article248885754/Umweltbundesamt-Chef-fordert-Milliarden-Sondervermoegen-fuer-Klimaschutz.html,https://www.welt.de/politik/deutschland/article248885754/Umweltbundesamt-Chef-fordert-Milliarden-Sondervermoegen-fuer-Klimaschutz.html,0,www.welt.de,Umweltbundesamt-Chef fordert Milliarden-Sondervermögen für Klimaschutz,"Der Präsident des Umweltbundesamts fordert Milliarden für Investitionen in den Klimaschutz. Ein neues Sondervermögen mit der Größenordnung „50 Milliarden plus X“ würde „Erwartungssicherheit“ bei Bürgern und der Wirtschaft schaffen, findet er.",https://img.welt.de/img/bildergalerien/mobile248885424/7301353667-ci16x9-w1200/Monitoringbericht-zu-Folgen-des-Klimawandels-in-Deutschland.jpg,2023-12-05T10:42:37Z,https://web.archive.org/web/20231206050008/http://www.welt.de/politik/deutschland/article248885754/Umweltbundesamt-Chef-fordert-Milliarden-Sondervermoegen-fuer-Klimaschutz.html,"Um Investitionen in den Klimaschutz zu gewährleisten, fordert Umweltbundesamt-Chef Dirk Messner ein Milliarden-Sondervermögen. Was wir brauchen, ist ein Sondervermögen für den Ausbau unserer digitale… [+1704 chars]",,de,'Heizen'
https://wien.orf.at/stories/3235396/,https://wien.orf.at/stories/3235396/,0,wien.orf.at,Hauptkläranlage: Wärmepumpen in Betrieb,Bei der Hauptkläranlage Wien in Simmering ist die erste Ausbaustufe einer riesigen Wärmepumpe in Betrieb genommen worden. Aus dem Abwasser der Kläranlage wird damit Fernwärme erzeugt. In die erste Stufe investierte die Wien Energie 70 Millionen Euro.,https://ibs.orf.at/wie?image=https%3A%2F%2Foekastatic.orf.at%2Fmims%2F2023%2F49%2F80%2Fcrops%2Fw%3D1200%2Ch%3D627%2Cq%3D75%2F2032127_master_766280_wien_energie_inbetriebnahme_von_europas_leistungsstaerkste_grosswaermepumpe_.jpg%3Fs%3D35992e4ba36956f351a23b03fa2695d70235d91a,2023-12-05T12:25:14Z,https://web.archive.org/web/20231205145001/https://wien.orf.at/stories/3235396/,"Sauberes Heizen mit schmutziger Herkunft, so lautet das Prinzip der Wärmepumpen-Anlage, die ihre Energie aus der benachbarten ebs-Kläranlage bezieht. Es handelt sich laut Wien Energie um die größte d… [+1885 chars]",,de,'Heizen'
"https://www.gamestar.de/artikel/ram-teurer-arbeitsspeicher-pc-gaming,3405020.html","https://www.gamestar.de/artikel/ram-teurer-arbeitsspeicher-pc-gaming,3405020.html",0,www.gamestar.de,News: Arbeitsspeicher - Warum nach SSDs und Grafikkarten jetzt auch RAM teurer werden soll,Keine leichten Zeiten auf dem PC-Markt: Auch für RAM müsst ihr bald wohl mehr hinlegen. Der erwartete Preisanstieg ist nicht mal klein.,https://images.cgames.de/images/gamestar/4/ram-preis-teaser_6265909.jpg,2023-12-05T14:58:00Z,"https://web.archive.org/web/20231205190432/https://www.gamestar.de/artikel/ram-teurer-arbeitsspeicher-pc-gaming,3405020.html","RAM soll teurer werden - und das ordentlich.
Seit ein paar Wochen müssen PC-Spieler tapfer sein. Denn die Preise kennen aktuell nur eine Richtung, und die zeigt nach oben.
Den Anfang machten Grafik… [+2674 chars]",,de,'Preisanstieg'
https://www.faz.net/aktuell/finanzen/vergleich-von-heizkosten-wie-teuer-das-heizen-jetzt-ist-19362419.html,https://www.faz.net/aktuell/finanzen/vergleich-von-heizkosten-wie-teuer-das-heizen-jetzt-ist-19362419.html,0,www.faz.net,Kostenvergleich: So teuer ist das Heizen jetzt,Die Heizkosten fallen in dieser Heizsaison bislang deutlich niedriger aus als im Vorjahr. So wie in früheren Jahren wird es gleichwohl nicht wieder. Wem wird jetzt wie viel abgeknöpft?,https://media0.faz.net/ppmedia/aktuell/finanzen/2956557583/1.9362418/facebook_teaser/heizen.jpg,2023-12-05T20:14:18Z,https://web.archive.org/web/20231206034415/https://www.faz.net/aktuell/finanzen/vergleich-von-heizkosten-wie-teuer-das-heizen-jetzt-ist-19362419.html,"Die Heizsaison im vorigen Jahr war von Horrorszenarien geprägt. Die Bürger in Deutschland überlegten, ob sie bald nach einer kalten Dusche im dunklen Bad stehen müssten. Die ersten Behörden warnten, … [+5650 chars]",,de,'Heizkosten'
