index,url,valid,domain,title,description,image,published,archive,content,quote,language,keyword
https://www.zeit.de/news/2025-10/07/solarausbau-giffey-will-mehr-auf-grosse-daecher-schauen,https://www.zeit.de/news/2025-10/07/solarausbau-giffey-will-mehr-auf-grosse-daecher-schauen,0,www.zeit.de,Photovoltaik: Solarausbau: Giffey will mehr auf große Dächer schauen,Hier finden Sie Informationen zu dem Thema „Photovoltaik“. Lesen Sie jetzt „Solarausbau: Giffey will mehr auf große Dächer schauen“.,https://img.zeit.de/news/2025-10/07/solarausbau-giffey-will-mehr-auf-grosse-daecher-schauen-image-group/wide__1300x731,2025-10-07T12:04:57Z,,Beim Solar-Ausbau will Berlins Wirtschaftssenatorin Franziska Giffey (SPD) künftig stärker große Dächer von Unternehmen und anderen Eigentümern in den Blick nehmen. «Wenn wir auf 4.400 Megawattpeak L… [+1408 chars],,de,'Photovoltaik'
https://www.sueddeutsche.de/wissen/erneuerbare-energien-kohle-photovoltaik-china-li.3322879,https://www.sueddeutsche.de/wissen/erneuerbare-energien-kohle-photovoltaik-china-li.3322879,0,www.sueddeutsche.de,Weltweite Stromproduktion: Erneuerbare Energien überholen Kohlekraftwerke,"Kohle verliert, Strom aus Sonne und Wind wird wichtiger. Ein Land prescht besonders voraus, andere fallen erstaunlich weit zurück. Fünf Erkenntnisse zur globalen Energiewende.",https://www.sueddeutsche.de/2025/10/07/56fe59c0-4673-405b-9b3a-fc7858e21166.jpg?q=60&fm=webp&width=1200&rect=0%2C87%2C3724%2C2095,2025-10-07T12:54:27Z,,"Kohle verliert, Strom aus Sonne und Wind wird wichtiger. Ein Land prescht besonders voraus, andere fallen erstaunlich weit zurück. Fünf Erkenntnisse zur globalen Energiewende.
Von Christoph von Eich… [+3 chars]",,de,'Energiewende'
https://www.stern.de/gesellschaft/regional/baden-wuerttemberg/energiewende--in-deutschland-einmalig--enbw-baut-wasserspeicher-im-berg-36112442.html,https://www.stern.de/gesellschaft/regional/baden-wuerttemberg/energiewende--in-deutschland-einmalig--enbw-baut-wasserspeicher-im-berg-36112442.html,0,www.stern.de,Energiewende: In Deutschland einmalig: EnBW baut Wasserspeicher im Berg,"In Forbach entsteht ein unterirdischer Wasserspeicher, der das Pumpspeicherkraftwerk deutlich leistungsfähiger macht. Was das für die Energieversorgung bedeutet.",https://image.stern.de/36112444/t/CJ/v1/w1440/r1.7778/-/07--ypeekuuct7v7axs2048jpeg---71ca3de975bc40d1.jpg,2025-10-07T13:09:18Z,,"Kopiere den aktuellen Link
Zur Merkliste hinzufügen
In Forbach entsteht ein unterirdischer Wasserspeicher, der das Pumpspeicherkraftwerk deutlich leistungsfähiger macht. Was das für die Energievers… [+1689 chars]",,de,'Energiewende'
https://www.tagesspiegel.de/wissen/droht-im-winter-gasknappheit-was-es-bedeutet-dass-die-speicher-in-deutschland-ungewohnlich-leer-sind-14496185.html,https://www.tagesspiegel.de/wissen/droht-im-winter-gasknappheit-was-es-bedeutet-dass-die-speicher-in-deutschland-ungewohnlich-leer-sind-14496185.html,0,www.tagesspiegel.de,"Droht im Winter Gasknappheit?: Was es bedeutet, dass die Speicher in Deutschland ungewöhnlich leer sind","Die Gasspeicher in Deutschland sind aktuell so niedrig befüllt wie seit Jahren nicht mehr. Offiziell besteht kein Grund zur Sorge. Experten aus der Forschung sehen das ähnlich, warnen aber vor möglichen Engpässen.",https://www.tagesspiegel.de/images/14497022/alternates/BASE_16_9_W1400/1759841524000/ausbau-der-erdgaspipeline-stegal-beendet.jpeg,2025-10-07T14:15:12Z,,Der Füllstand der deutschen Gasspeicher ist derzeit ungewöhnlich niedrig niedriger als zu diesem Zeitpunkt in den Vorjahren. Offiziell besteht aber kein Grund zur Sorge. Doch könnte sich die Lage sch… [+4380 chars],,de,'Gasspeicher'
https://www.stern.de/gesellschaft/regional/mecklenburg-vorpommern/windenergie--windkraftunternehmen-eno-energy-beantragt-insolvenz-36112956.html,https://www.stern.de/gesellschaft/regional/mecklenburg-vorpommern/windenergie--windkraftunternehmen-eno-energy-beantragt-insolvenz-36112956.html,0,www.stern.de,Windenergie: Windkraftunternehmen eno energy beantragt Insolvenz,"Viele genehmigte Projekte sind eigentlich gut, doch für eno energy gibt es trotzdem Probleme. Ein wichtiger Zulieferer hat Verträge gekündigt. Nun hat die Firma einen Insolvenzantrag gestellt.",https://image.stern.de/36112958/t/uv/v1/w1440/r1.7778/-/07--h5ky3hw7a6v7axs2048jpeg---53ab21e8ae75b6dd.jpg,2025-10-07T15:22:57Z,,"Kopiere den aktuellen Link
Zur Merkliste hinzufügen
Viele genehmigte Projekte sind eigentlich gut, doch für eno energy gibt es trotzdem Probleme. Ein wichtiger Zulieferer hat Verträge gekündigt. Nu… [+1311 chars]",,de,'Windenergie'
https://www.nzz.ch/pro/der-us-oekonomieprofessor-john-cochrane-mahnt-eine-weitere-inflationswelle-ist-sehr-wahrscheinlich-ld.1905535,https://www.nzz.ch/pro/der-us-oekonomieprofessor-john-cochrane-mahnt-eine-weitere-inflationswelle-ist-sehr-wahrscheinlich-ld.1905535,0,www.nzz.ch,INTERVIEW - Der US-Ökonomieprofessor John Cochrane mahnt: «Eine weitere Inflationswelle ist sehr wahrscheinlich»,"Cochrane hält eine Krise wie 2022 in Grossbritannien oder gar in Argentinien für möglich. Er sagt, die USA und Europa müssten besser aufzeigen, wie sie ihre Schuldenberge in den Griff kriegen wollen.","https://img.nzz.ch/2025/10/07/e612c73a-a459-4328-9239-84d866fe2dbe.jpg?width=1200&height=675&fit=bounds&quality=75&auto=webp&crop=3669,2064,x213,y375&wmark=nzz",2025-10-08T03:30:00Z,,"Cochrane hält eine Krise wie 2022 in Grossbritannien oder gar in Argentinien für möglich. Er sagt, die USA und Europa müssten besser aufzeigen, wie sie ihre Schuldenberge in den Griff kriegen wollen.… [+14429 chars]",,de,'Inflation'
https://www.stern.de/gesellschaft/regional/mecklenburg-vorpommern/erneuerbare-energie--mv-verschaerft-regeln-fuer-neue-windraeder-in-bestehenden-parks-36115060.html,https://www.stern.de/gesellschaft/regional/mecklenburg-vorpommern/erneuerbare-energie--mv-verschaerft-regeln-fuer-neue-windraeder-in-bestehenden-parks-36115060.html,0,www.stern.de,Erneuerbare Energie: MV verschärft Regeln für neue Windräder in bestehenden Parks,So manches Windrad kommt in die Jahre. Mit dem Ersatz der Altanlagen durch höhere Windräder droht eine wachsende Belastung für Anwohner. Dem wurde in MV nun ein Riegel vorgeschoben.,https://image.stern.de/36115062/t/e7/v1/w1440/r1.7778/-/08--2afuej6t3vv6axs2048jpeg---a5ab594d6caf958d.jpg,2025-10-08T11:57:42Z,,"Kopiere den aktuellen Link
Zur Merkliste hinzufügen
So manches Windrad kommt in die Jahre. Mit dem Ersatz der Altanlagen durch höhere Windräder droht eine wachsende Belastung für Anwohner. Dem wurd… [+2328 chars]",,de,'Erneuerbare'
https://www.horizont.net/medien/nachrichten/b4p-studienerkenntnisse-so-sollten-marketer-und-werber-mit-deutschlands-dauerkrise-umgehen-231013,https://www.horizont.net/medien/nachrichten/b4p-studienerkenntnisse-so-sollten-marketer-und-werber-mit-deutschlands-dauerkrise-umgehen-231013,0,www.horizont.net,B4P-Studienerkenntnisse: So sollten Marketer und Werber mit Deutschlands Dauerkrise umgehen,"Rezession, Inflation, Energiekrise, Ukrainekrieg, Zollstreit: Ein paar Jahre nach Corona ist die Lage im Land und drumherum kaum einfacher geworden. Was macht das mit den Menschen – und der Markenkommunikation? Antworten gibt die Markt-Media-Studie „Best for …",https://www.horizont.net/news/media/49/Tanja-Seiter--Burda--GIK-482680.jpeg,2025-10-08T12:36:00Z,,"Rezession, Inflation, Energiekrise, Ukrainekrieg, Zollstreit: Ein paar Jahre nach Corona ist die Lage im Land und drumherum kaum einfacher geworden. Was macht das mit den Menschen – und der Markenkom… [+367 chars]",,de,'Inflation'
https://www.jungewelt.de/artikel/510011.erneuerbare-energieträger-grüner-energiemix.html,https://www.jungewelt.de/artikel/510011.erneuerbare-energieträger-grüner-energiemix.html,0,www.jungewelt.de,Erneuerbare Energieträger: »Grüner« Energiemix,"Der Trend hält an: Solar- und Windkraft statt Kohle – doch Großprojekte und Methanlecks gefährden vielerorts die regenerative Energiewende, den »grünen« Energiemix.",https://www.jungewelt.de/img/1100/214240.jpg,2025-10-08T17:37:00Z,,Der Ausbau der erneuerbaren Energieträger schreitet voran. In den ersten sechs Monaten 2025 konnte die Zunahme des Strombedarfs vollständig durch den Zubau neuer Solar- und Windkraftanlagen abgedeckt… [+3778 chars],,de,'Energiewende'
https://www.faz.net/aktuell/wissen/energiewende-macht-weltweit-fortschritte-reicht-das-fuer-die-klimaziele-accg-110722384.html,https://www.faz.net/aktuell/wissen/energiewende-macht-weltweit-fortschritte-reicht-das-fuer-die-klimaziele-accg-110722384.html,0,www.faz.net,Neuer IEA-Bericht: Energiewende macht weltweit Fortschritte,"Die USA bremsen, doch im Rest der Welt nimmt die Energiewende zugunsten der Erneuerbaren Fahrt auf. Das zeigen die Zahlen der Internationalen Energieagentur. Fragezeichen bleiben, ob das für die Klimaziele reicht.",https://media0.faz.net/ppmedia/w1200/aktuell/wirtschaft/267857726/1.10722412/facebook_teaser/erneuerbare-energien.jpg.webp,2025-10-09T05:11:54Z,,"In Deutschland entsteht manchmal der Eindruck, als sei der Ausbau der erneuerbaren Energiequellen, vor allem Sonne und Wind, ins Stocken geraten. Tatsächlich aber geht es voran, und das gilt umso meh… [+6400 chars]",,de,'Windenergie'
https://www.tagesspiegel.de/wissen/leere-grune-versprechen-fossilindustrie-investiert-kaum-in-erneuerbare-14504393.html,https://www.tagesspiegel.de/wissen/leere-grune-versprechen-fossilindustrie-investiert-kaum-in-erneuerbare-14504393.html,0,www.tagesspiegel.de,Leere grüne Versprechen: Fossilindustrie investiert kaum in Erneuerbare,"Öl- und Gasunternehmen geben sich als Gestalter der Energiewende. An ihren Beteiligungen an Erneuerbaren-Projekten bemessen, bleiben sie aber weit hinter diesem Anspruch zurück.",https://www.tagesspiegel.de/images/14504225/alternates/BASE_16_9_W1400/1759921339000/burning-chimney.jpeg,2025-10-09T06:31:58Z,,"Es sind Namen wie Gazprom, ExxonMobil, Total und BP: Nach außen geben sich viele Öl- und Gasunternehmen klimabewusst. Doch bislang beteiligen sie sich kaum am Klimaschutz und machen ihr Hauptgeschäft… [+3251 chars]",,de,'Wasserkraft'
https://ooe.orf.at/stories/3325185/,https://ooe.orf.at/stories/3325185/,0,ooe.orf.at,Politik fordert Ausbau erneuerbarer Energie,"Beim Energiekongress am Wolfgangsee, veranstaltet vom Verbund, stehen Strompreise, Versorgungssicherheit und Energiewende im Fokus. Energieexperten und Politiker fordern Steuererleichterungen und den massiven Ausbau erneuerbarer Energien – besonders Windkraft…",https://ibs.orf.at/ooe?image=https%3A%2F%2Foekastatic.orf.at%2Fmims%2F2025%2F41%2F47%2Fcrops%2Fw%3D1200%2Ch%3D627%2Cq%3D75%2F2793831_master_1077747_251009_ooeh_roh_verbund_orf_0585_00_09_44_12.jpg%3Fs%3D6250f3ca4b4ee2c39fe42db72c66596d6a583e91,2025-10-09T13:34:28Z,,"Ein zentrales Thema beim Energiekongress waren die weiterhin hohen Strompreise. Verbund-Vorstand Michael Strugl betonte, dass kurzfristig vor allem steuerliche Maßnahmen helfen könnten, um den Preise… [+2117 chars]",,de,'Energiewende'
https://www.basicthinking.de/blog/2025/10/09/besten-solarhersteller-in-deutschland/,https://www.basicthinking.de/blog/2025/10/09/besten-solarhersteller-in-deutschland/,0,www.basicthinking.de,Solar-Award: Die besten Solarhersteller in Deutschland,"Der Beitrag Solar-Award: Die besten Solarhersteller in Deutschland erschien zuerst beim Online-Magazin BASIC thinking. Über unseren Newsletter UPDATE startest du jeden Morgen bestens informiert in den Tag.
Wer sich eine Photovoltaikanlage zulegen möchte, scha…",https://www.basicthinking.de/blog/wp-content/uploads/2025/10/besten-solarhersteller-deutschland.jpg,2025-10-09T18:23:04Z,,"Wer sich eine Photovoltaikanlage zulegen möchte, schaut meist auf drei Aspekte: Qualität, Zuverlässigkeit und Preis. Welche Solarhersteller in diesen Kategorien bei den Kunden am besten abschneiden, … [+2106 chars]",,de,'Solar'
