index,url,valid,domain,title,description,image,published,archive,content,quote,language,keyword
https://www.spiegel.de/wirtschaft/iea-chef-fatih-birol-europa-wird-gut-durch-den-naechsten-winter-kommen-a-fb1a00d9-b825-4851-b288-404ad9f95680,https://www.spiegel.de/wirtschaft/iea-chef-fatih-birol-europa-wird-gut-durch-den-naechsten-winter-kommen-a-fb1a00d9-b825-4851-b288-404ad9f95680,0,www.spiegel.de,IEA-Chef Fatih Birol: »Europa wird gut durch den nächsten Winter kommen«,"Trotz Gaskrise erwartet der Chef der Internationalen Energieagentur keinen Mangel. Aber Deutschlands Atomkraftwerke müssten womöglich länger laufen, sagt Fatih Birol.",https://cdn.prod.www.spiegel.de/images/60bccc78-5548-4c58-8ea1-71aea4e3dd89_w1280_r1.77_fpx61.36_fpy50.jpg,2022-10-27T04:36:31Z,https://web.archive.org/web/20221027044026/https://www.spiegel.de/wirtschaft/iea-chef-fatih-birol-europa-wird-gut-durch-den-naechsten-winter-kommen-a-fb1a00d9-b825-4851-b288-404ad9f95680,"Mehr Perspektiven, mehr verstehen.
Freier Zugang zu allen Artikeln, Videos, Audioinhalten und Podcasts
<ul><li>
Alle Artikel auf SPIEGEL.de frei zugänglich
</li><li>
DER SPIEGEL als E-Paper und … [+743 chars]",,de,'Winter'
