index,url,valid,domain,title,description,image,published,archive,content,quote,language,keyword
https://www.stern.de/wirtschaft/news/verbraucherpreise--inflation-ueber-zwei-prozent-marke-35297388.html,https://www.stern.de/wirtschaft/news/verbraucherpreise--inflation-ueber-zwei-prozent-marke-35297388.html,0,www.stern.de,Verbraucherpreise: Inflation über Zwei-Prozent-Marke,Die Teuerungsrate in Deutschland ist zum zweiten Mal in Folge gestiegen. Im November zogen vor allem in einem Bereich die Preise deutlich an. Volkswirte erwarten vorerst weiter steigende Inflation.,https://image.stern.de/35297836/t/U3/v1/w1440/r1.7778/-/10--ilfkjtmpoxv6axs2048jpeg---6a25b5dda78261b5.jpg,2024-12-10T09:18:44Z,,"Kopiere den aktuellen Link
Die Teuerungsrate in Deutschland ist zum zweiten Mal in Folge gestiegen. Im November zogen vor allem in einem Bereich die Preise deutlich an. Volkswirte erwarten vorerst w… [+3468 chars]",,de,'Heizen'
https://www.tagesspiegel.de/wirtschaft/niedrige-kaufkraft-bei-verbrauchern-inflation-wieder-uber-zwei-prozent-marke-12848918.html,https://www.tagesspiegel.de/wirtschaft/niedrige-kaufkraft-bei-verbrauchern-inflation-wieder-uber-zwei-prozent-marke-12848918.html,0,www.tagesspiegel.de,Niedrige Kaufkraft bei Verbrauchern: Inflation wieder über Zwei-Prozent-Marke,Die Teuerungsrate in Deutschland ist zum zweiten Mal in Folge gestiegen. Im November zogen vor allem in einem Bereich die Preise deutlich an. Volkswirte erwarten einen weiteren Anstieg der Inflation.,https://www.tagesspiegel.de/images/12849041/alternates/BASE_16_9_W1400/1733822954000/hohe-teuerungsraten-schmalern-die-kaufkraft-von-verbrauchern.jpeg,2024-12-10T09:42:56Z,,Steigende Preise für Dienstleistungen und Lebensmittel haben die Teuerungsrate in Deutschland erstmals seit Juli wieder über die Zwei-Prozent-Marke getrieben. Im November lagen die Verbraucherpreise … [+2876 chars],,de,'Inflation'
https://www.zeit.de/news/2024-12/10/kretschmann-glaubt-an-fortschritte-beim-ausbau-der-windkraft,https://www.zeit.de/news/2024-12/10/kretschmann-glaubt-an-fortschritte-beim-ausbau-der-windkraft,0,www.zeit.de,Energie: Kretschmann glaubt an Fortschritte beim Ausbau der Windkraft,Hier finden Sie Informationen zu dem Thema „Energie“. Lesen Sie jetzt „Kretschmann glaubt an Fortschritte beim Ausbau der Windkraft“.,https://img.zeit.de/news/2024-12/10/kretschmann-glaubt-an-fortschritte-beim-ausbau-der-windkraft-image-group/wide__1300x731,2024-12-10T12:16:07Z,,"Obwohl im laufenden Jahr erneut nur wenige neue Windräder ans Netz gegangen sind, glaubt Ministerpräsident Winfried Kretschmann daran, dass der Ausbau der Windkraft im Südwesten bald Fahrt aufnimmt. … [+1359 chars]",,de,'Ausbau'
https://www.sueddeutsche.de/wirtschaft/fachkraefte-energiewende-deutschland-li.3164139,https://www.sueddeutsche.de/wirtschaft/fachkraefte-energiewende-deutschland-li.3164139,0,www.sueddeutsche.de,Deutschen Industrie- und Handelskammer: Für die Energiewende fehlen mehr als 500 000 Fachkräfte,"Viele Unternehmen befürchten, dass der Fachkräftemangel die Energiewende verzögert. Zu diesem Ergebnis kommt nun auch eine Studie im Auftrag der Deutschen Industrie- und Handelskammer.",https://www.sueddeutsche.de/2022/06/08/073386d3-34f7-4d7c-becd-c19c05d13875.jpeg?q=60&fm=webp&width=1200&rect=0%2C55%2C1406%2C791,2024-12-10T14:28:44Z,,"Viele Unternehmen befürchten, dass der Fachkräftemangel die Energiewende verzögert. Zu diesem Ergebnis kommt nun auch eine Studie im Auftrag der Deutschen Industrie- und Handelskammer.Beim geplanten … [+1086 chars]",,de,'Solar'
https://www.faz.net/aktuell/politik/ukraine/ukraine-liveticker-tusk-verhandlungen-koennten-in-diesem-winter-beginnen-faz-19030454.html,https://www.faz.net/aktuell/politik/ukraine/ukraine-liveticker-tusk-verhandlungen-koennten-in-diesem-winter-beginnen-faz-19030454.html,0,www.faz.net,Ukraine-Liveblog: Tusk: Verhandlungen könnten in diesem Winter beginnen,Polens Regierungschef sieht allerdings noch viele „Fragezeichen“ +++ FSB nimmt Deutsch-Russen wegen Sabotageverdachts fest +++ Trump droht Verbündeten mit Austritt aus der NATO +++ alle Entwicklungen im Liveblog,https://media0.faz.net/ppmedia/aktuell/politik/1692120030/1.10166566/facebook_teaser/donald-tusk-mit-dem-deutschen.jpg,2024-12-10T15:37:17Z,https://web.archive.org/web/20241210200250/https://www.faz.net/aktuell/politik/ukraine/ukraine-liveticker-tusk-verhandlungen-koennten-in-diesem-winter-beginnen-faz-19030454.html,"Russland hat nach eigenen Angaben einen Mann mit deutscher Staatsangehörigkeit inhaftiert. Er gehört laut einer Mitteilung des Geheimdienstes FSB vom Dienstagmorgen zu einer Gruppe, auf die man im Zu… [+2044 chars]",,de,'Winter'
https://www.tagesschau.de/ausland/europa/tusk-verhandlungen-ukraine-100.html,https://www.tagesschau.de/ausland/europa/tusk-verhandlungen-ukraine-100.html,0,www.tagesschau.de,Tusk hält Ukraine-Verhandlungen im Winter für möglich,"Knapp drei Jahre nach Beginn des russischen Angriffskriegs gegen die Ukraine mehren sich Forderungen nach einer Verhandlungslösung. Polens Regierungschef Tusk erklärte, Gespräche könnten noch ""in diesem Winter"" stattfinden.",https://images.tagesschau.de/image/9faffa40-bc6c-459e-a27d-b9037895ff85/AAABk7EdDZs/AAABkZLhkrw/16x9-1280/donald-tusk-132.jpg,2024-12-10T15:45:02Z,https://web.archive.org/web/20241211201851/https://www.tagesschau.de/ausland/europa/tusk-verhandlungen-ukraine-100.html,"Stand: 10.12.2024 16:45 Uhr
Knapp drei Jahre nach Beginn des russischen Angriffskriegs gegen die Ukraine mehren sich Forderungen nach einer Verhandlungslösung. Polens Regierungschef Tusk erklärte, G… [+2746 chars]",,de,'Winter'
https://www.sueddeutsche.de/muenchen/muenchen-foerderprogramm-waermepumpe-gebaeude-sanierung-heizung-nahwaerme-lux.TWcLLaAdaLaQXazVp8LHhD,https://www.sueddeutsche.de/muenchen/muenchen-foerderprogramm-waermepumpe-gebaeude-sanierung-heizung-nahwaerme-lux.TWcLLaAdaLaQXazVp8LHhD,0,www.sueddeutsche.de,Klimaschutz in München: Wärmepumpe? Photovoltaik? Was die Stadt künftig noch fördert,Der Klimaausschuss im Rathaus hat sich auf Spaßmaßnahmen beim „Förderprogramm Klimaneutrale Gebäude“ geeinigt. Wofür es künftig noch Zuschüsse gibt – und wo gestrichen wurde.,https://www.sueddeutsche.de/2024/04/11/dc524143-772b-4807-83fe-af565bbe6580.jpeg?q=60&fm=webp&width=1200&rect=0%2C26%2C1378%2C775,2024-12-10T15:52:13Z,,"Weil die Stadt überall sparen muss, wäre es vermessen, dies nicht auch beim FKG zu tun: So rechtfertigte die Grünen-Fraktionschefin Mona Fuchs, dass die Zusage für FKG-Gelder künftig auf 60 Millionen… [+2810 chars]",,de,'Photovoltaik'
https://www.faz.net/aktuell/finanzen/goldpreis-koennte-auf-fast-3000-dollar-steigen-110165733.html,https://www.faz.net/aktuell/finanzen/goldpreis-koennte-auf-fast-3000-dollar-steigen-110165733.html,0,www.faz.net,Goldpreis könnte auf fast 3000 Dollar steigen,"Der Edelmetallkonzern Heraeus erwartet, dass die Politik von Donald Trump im nächsten Jahr zu neuer Inflation führt. Das Unternehmen prognostiziert, das werde die globale Goldnachfrage ankurbeln.",https://media0.faz.net/ppmedia/aktuell/finanzen/881150712/1.10166048/facebook_teaser/gold.jpg,2024-12-10T20:05:27Z,https://web.archive.org/web/20241210204139/https://www.faz.net/aktuell/finanzen/goldpreis-koennte-auf-fast-3000-dollar-steigen-110165733.html,"Es werde nicht mehr ganz so Schlag auf Schlag gehen wie zeitweise im zu Ende gehenden Jahr, als Medien schon überlegten, ob sie überhaupt noch über neue Goldpreisrekorde berichten sollten, weil sie s… [+5481 chars]",,de,'Photovoltaik'
https://www.zeit.de/news/2024-12/11/eberl-kein-neuer-bayern-torwart-im-winter,https://www.zeit.de/news/2024-12/11/eberl-kein-neuer-bayern-torwart-im-winter,0,www.zeit.de,Bayern München: Eberl: Kein neuer Bayern-Torwart im Winter,Hier finden Sie Informationen zu dem Thema „Bayern München“. Lesen Sie jetzt „Eberl: Kein neuer Bayern-Torwart im Winter“.,https://img.zeit.de/news/2024-12/11/eberl-kein-neuer-bayern-torwart-im-winter-image-group/wide__1300x731,2024-12-11T03:24:35Z,,"Trotz des Rippenbruchs von Kapitän Manuel Neuer möchte Bayern München im Winter keinen neuen Torhüter verpflichten. «Nein, wir haben mit Peretz einen herausragenden Ersatz. Und Manuel wird ja zurückk… [+920 chars]",,de,'Winter'
https://www.zeit.de/news/2024-12/11/sylter-austern-ziehen-ins-winterlager,https://www.zeit.de/news/2024-12/11/sylter-austern-ziehen-ins-winterlager,0,www.zeit.de,Vom Watt an Land: Sylter Austern ziehen ins Winterlager,Hier finden Sie Informationen zu dem Thema „Vom Watt an Land“. Lesen Sie jetzt „Sylter Austern ziehen ins Winterlager“.,https://img.zeit.de/news/2024-12/11/sylter-austern-ziehen-ins-winterlager-image-group/wide__1300x731,2024-12-11T06:11:41Z,,Zum Schutz vor dem Eis werden gut eine Million Austern aus dem Watt vor List ins Winterlager in Meerwasserbecken an Land gebracht. «Wir sind jetzt dabei die Nachwuchsaustern zu bergen und ins Becken … [+2764 chars],,de,'Winter'
https://www.welt.de/politik/ausland/article254832418/Ukraine-Krieg-Tusk-rechnet-mit-Verhandlungen-in-diesem-Winter.html,https://www.welt.de/politik/ausland/article254832418/Ukraine-Krieg-Tusk-rechnet-mit-Verhandlungen-in-diesem-Winter.html,0,www.welt.de,Tusk rechnet mit Verhandlungen über Ukraine-Krieg in diesem Winter,Die polnische EU-Ratspräsidentschaft dauert von Januar bis Juni 2025. Donald Tusk hält den Beginn von Verhandlungen über ein Ende des Krieges gegen die Ukraine noch in diesem Winter für möglich. Der polnische Regierungschef kündigte mehrere Treffen mit auslän…,https://img.welt.de/img/politik/ausland/mobile254832482/3827939647-ci16x9-w1200/Polens-Regierungschef-Donald-Tusk.jpg,2024-12-11T06:51:04Z,https://web.archive.org/web/20241211072725/http://www.welt.de/politik/ausland/article254832418/Ukraine-Krieg-Tusk-rechnet-mit-Verhandlungen-in-diesem-Winter.html,"Der polnische Regierungschef Donald Tusk schließt den Beginn von Ukraine-Verhandlungen noch in diesem Winter nicht aus. Unsere EU-Ratspräsidentschaft wird unter anderem mitverantwortlich dafür sein, … [+1485 chars]",,de,'Winter'
https://www.faz.net/aktuell/wirtschaft/klima-nachhaltigkeit/china-plant-eine-opec-fuer-solarmodule-enorme-ueberkapazitaeten-110167512.html,https://www.faz.net/aktuell/wirtschaft/klima-nachhaltigkeit/china-plant-eine-opec-fuer-solarmodule-enorme-ueberkapazitaeten-110167512.html,0,www.faz.net,China plant eine „OPEC“ für Solarmodule,Die chinesische Solarindustrie bildet ein Kartell und will so den Preissturz der Solarpaneele stoppen. Das könnte auf Kosten deutscher Kunden gehen.,https://media0.faz.net/ppmedia/aktuell/wirtschaft/3183146514/1.10167510/facebook_teaser/blick-auf-eine-solarfabrik-in.jpg,2024-12-11T10:45:42Z,https://web.archive.org/web/20241211124114/https://www.faz.net/aktuell/wirtschaft/klima-nachhaltigkeit/china-plant-eine-opec-fuer-solarmodule-enorme-ueberkapazitaeten-110167512.html,"Die Kosten der Energiewende in Deutschland könnten damit höher ausfallen, als es ohne die Einigung der Fall wäre. Denn China dominiert die Branche: Die vier größten Solarmodulhersteller der Welt sind… [+6132 chars]",,de,'Solar'
https://www.zeit.de/2024/52/regenbogenkartoffeln-aris-guzman-rezept-schweizer-kueche,https://www.zeit.de/2024/52/regenbogenkartoffeln-aris-guzman-rezept-schweizer-kueche,0,www.zeit.de,Regenbogenkartoffeln: Farben im Winter,"Diversity tut Kartoffeln gut. Rote, blaue, gelbe, süße: Fein gehobelt und gebacken leuchten sie wie ein Regenbogen. Wer braucht da noch ein Hauptgericht?",https://img.zeit.de/zeit-magazin/wochenmarkt/2024-12/regenbogenkartoffeln-aris-guzman-rezept-schweizer-kueche-teaser-2/wide__1300x731,2024-12-11T11:08:43Z,https://web.archive.org/web/20241211211349/https://www.zeit.de/2024/52/regenbogenkartoffeln-aris-guzman-rezept-schweizer-kueche,"""Meine Mutter hat in der Schweiz als Wurstwaren-Verkäuferin gearbeitet, ihr Partner als Metzger. Gemüse gab es beim Essen maximal als Beilage. Über Veganer dachte ich früher, die spinnen doch! Ich st… [+337 chars]",,de,'Winter'
https://www.zeit.de/news/2024-12/11/rekordanteil-erneuerbarer-bei-stromerzeugung-in-bayern,https://www.zeit.de/news/2024-12/11/rekordanteil-erneuerbarer-bei-stromerzeugung-in-bayern,0,www.zeit.de,Energie: Rekordanteil Erneuerbarer bei Stromerzeugung in Bayern,Hier finden Sie Informationen zu dem Thema „Energie“. Lesen Sie jetzt „Rekordanteil Erneuerbarer bei Stromerzeugung in Bayern“.,https://img.zeit.de/news/2024-12/11/rekordanteil-erneuerbarer-bei-stromerzeugung-in-bayern-image-group/wide__1300x731,2024-12-11T11:10:27Z,,"Der Anteil der erneuerbaren Energien an der Stromerzeugung in Bayern ist vergangenes Jahr auf den Rekordwert von 70,4 Prozent gestiegen. Das ist ein außergewöhnlich deutliches Plus zu 2022, als mit 5… [+2670 chars]",,de,'Erneuerbare'
https://www.stern.de/gesellschaft/regional/bayern/energie--rekordanteil-erneuerbarer-bei-stromerzeugung-in-bayern-35301786.html,https://www.stern.de/gesellschaft/regional/bayern/energie--rekordanteil-erneuerbarer-bei-stromerzeugung-in-bayern-35301786.html,0,www.stern.de,Energie: Rekordanteil Erneuerbarer bei Stromerzeugung in Bayern,"Erneuerbare Energien machen einen immer größeren Teil der Stromerzeugung in Bayern aus. Das liegt allerdings auch daran, dass die Stromgewinnung insgesamt rückläufig ist.",https://image.stern.de/35301788/t/oL/v1/w1440/r1.7778/-/11--gd7cpcsrvjv6axs2048jpeg---8cde3f45abe18270.jpg,2024-12-11T11:10:27Z,https://web.archive.org/web/20241212041611/https://www.stern.de/gesellschaft/regional/bayern/energie--rekordanteil-erneuerbarer-bei-stromerzeugung-in-bayern-35301786.html,"Kopiere den aktuellen Link
Erneuerbare Energien machen einen immer größeren Teil der Stromerzeugung in Bayern aus. Das liegt allerdings auch daran, dass die Stromgewinnung insgesamt rückläufig ist.… [+2830 chars]",,de,'Photovoltaik'
https://www.faz.net/aktuell/politik/ukraine/ukraine-liveticker-donald-trump-nennt-ukraine-oberste-aussenpolitische-prioritaet-faz-19030454.html,https://www.faz.net/aktuell/politik/ukraine/ukraine-liveticker-donald-trump-nennt-ukraine-oberste-aussenpolitische-prioritaet-faz-19030454.html,0,www.faz.net,Ukraine-Liveblog: Trump nennt Ukraine oberste außenpolitische Priorität,Sechs Tote nach russischem Angriff auf Saporischschja +++ Ukraine verwendet immer mehr Raketen und Drohnen aus eigener Produktion +++ Tusk könnte sich Verhandlungsbeginn im Winter vorstellen +++ alle Entwicklungen im Liveblog,https://media1.faz.net/ppmedia/aktuell/politik/1541962351/1.10167785/facebook_teaser/donald-trump-emmanuel-macron.jpg,2024-12-11T11:22:30Z,,"Russland hat nach eigenen Angaben einen Mann mit deutscher Staatsangehörigkeit inhaftiert. Er gehört laut einer Mitteilung des Geheimdienstes FSB vom Dienstagmorgen zu einer Gruppe, auf die man im Zu… [+2044 chars]",,de,'Winter'
https://www.nzz.ch/meinung/linker-populismus-olaf-scholz-will-ploetzlich-die-lebensmittelpreise-senken-das-sollte-er-lieber-der-ezb-ueberlassen-ld.1861926,https://www.nzz.ch/meinung/linker-populismus-olaf-scholz-will-ploetzlich-die-lebensmittelpreise-senken-das-sollte-er-lieber-der-ezb-ueberlassen-ld.1861926,0,www.nzz.ch,KOMMENTAR - Linker Populismus: Olaf Scholz will plötzlich die Lebensmittelpreise senken. Das sollte er lieber der EZB überlassen,Kurz vor dem absehbaren Ende seiner Amtszeit will der Bundeskanzler wegen der hohen Inflation die Steuern auf Lebensmittel reduzieren. Das ist ein leicht durchschaubares Wahlkampfmanöver.,"https://img.nzz.ch/2024/12/11/5a4d8607-01a2-4482-be74-5ee2acaaf9d6.png?width=800&height=450&fit=bounds&quality=75&auto=webp&crop=800,450,x0,y175",2024-12-11T17:19:02Z,http://archive.md/20241211184648/https://www.nzz.ch/meinung/linker-populismus-olaf-scholz-will-ploetzlich-die-lebensmittelpreise-senken-das-sollte-er-lieber-der-ezb-ueberlassen-ld.1861926,"Am Donnerstag entscheidet der EZB-Rat über die künftige Geldpolitik: Viele Ökonomen erwarten eine weitere Zinssenkung um 0,25 Prozentpunkte.
Pünktlich zum anlaufenden Bundestagswahlkampf hat Olaf Sc… [+4449 chars]",,de,'Inflation'
https://futurezone.at/produkte/solardach-elektroauto-dartsolar-preis-funktion-rentieren-tesla-nachruesten-dachtraeger-bestellen/402986999,https://futurezone.at/produkte/solardach-elektroauto-dartsolar-preis-funktion-rentieren-tesla-nachruesten-dachtraeger-bestellen/402986999,0,futurezone.at,Günstiges Solardach für E-Autos soll sich fünffach rentieren,"Beim Fahren ist das Solardach zusammengeschoben. Am Parkplatz wird es auseinandergezogen, um mehr Energie zu sammeln.",https://image.futurezone.at/images/facebook/8888736/my-tesla-with-an-expanding-solar-roof-generates-4-5kwh-per-v0-wmzwpush541e1png.jpg,2024-12-11T19:13:41Z,https://web.archive.org/web/20241211205308/https://futurezone.at/produkte/solardach-elektroauto-dartsolar-preis-funktion-rentieren-tesla-nachruesten-dachtraeger-bestellen/402986999,"11.12.2024
Beim Fahren ist das Solardach zusammengeschoben. Am Parkplatz wird es auseinandergezogen, um mehr Energie zu sammeln.
DartSolar hat eine spannende Idee, wie Elektroautos mit Photovoltaik… [+324 chars]",,de,'Photovoltaik'
https://www.zeit.de/news/2024-12/12/disco-und-firmenfeiern-hochsaison-fuer-eisbahnen-in-sachsen,https://www.zeit.de/news/2024-12/12/disco-und-firmenfeiern-hochsaison-fuer-eisbahnen-in-sachsen,0,www.zeit.de,Wintervergnügen: Disco und Firmenfeiern: Hochsaison für Eisbahnen in Sachsen,Hier finden Sie Informationen zu dem Thema „Wintervergnügen“. Lesen Sie jetzt „Disco und Firmenfeiern: Hochsaison für Eisbahnen in Sachsen“.,https://img.zeit.de/news/2024-12/12/disco-und-firmenfeiern-hochsaison-fuer-eisbahnen-in-sachsen-image-group/wide__1300x731,2024-12-12T03:00:38Z,,"Die Kühlsysteme sind hochgefahren, das Wasser ist gefroren und das fertige Eis auf den Bahnen glatt geschliffen: Viele Eisbahn-Betreiber in Sachsen sind in die Wintersaison gestartet. Nun läuft die H… [+4197 chars]",,de,'Winter'
https://www.zeit.de/news/2024-12/12/ezb-zwischen-konjunktursorgen-und-hartnaeckiger-inflation,https://www.zeit.de/news/2024-12/12/ezb-zwischen-konjunktursorgen-und-hartnaeckiger-inflation,0,www.zeit.de,Geldpolitik: EZB zwischen Konjunktursorgen und hartnäckiger Inflation,Hier finden Sie Informationen zu dem Thema „Geldpolitik“. Lesen Sie jetzt „EZB zwischen Konjunktursorgen und hartnäckiger Inflation“.,https://img.zeit.de/news/2024-12/12/ezb-zwischen-konjunktursorgen-und-hartnaeckiger-inflation-image-group/wide__1300x731,2024-12-12T04:00:37Z,,"Die Europäische Zentralbank (EZB) ist ihrem Ziel stabiler Preise näher gekommen und hat die Leitzinsen seit Juni deutlich gesenkt. Die jüngsten Daten zeigen zwar, wie hartnäckig die Inflation ist. De… [+5104 chars]",,de,'Inflation'
https://www.stern.de/news/geldpolitik--ezb-zwischen-konjunktursorgen-und-hartnaeckiger-inflation-35304004.html,https://www.stern.de/news/geldpolitik--ezb-zwischen-konjunktursorgen-und-hartnaeckiger-inflation-35304004.html,0,www.stern.de,Geldpolitik: EZB zwischen Konjunktursorgen und hartnäckiger Inflation,"Die Wirtschaft schwächelt, die Inflation hat wieder angezogen. Für die Währungshüter der Europäischen Zentralbank eine schwierige Gemengelage. Der weitere Zinskurs gilt dennoch als ausgemacht.",https://image.stern.de/35304006/t/js/v1/w1440/r1.7778/-/12--nvfrxvz7djv3axs2048jpeg---e1bdca3547af0276.jpg,2024-12-12T04:00:37Z,,"Kopiere den aktuellen Link
Die Wirtschaft schwächelt, die Inflation hat wieder angezogen. Für die Währungshüter der Europäischen Zentralbank eine schwierige Gemengelage. Der weitere Zinskurs gilt de… [+5591 chars]",,de,'Inflation'
https://www.tagesspiegel.de/wirtschaft/geldpolitik-ezb-zwischen-konjunktursorgen-und-hartnackiger-inflation-12861664.html,https://www.tagesspiegel.de/wirtschaft/geldpolitik-ezb-zwischen-konjunktursorgen-und-hartnackiger-inflation-12861664.html,0,www.tagesspiegel.de,Geldpolitik: EZB zwischen Konjunktursorgen und hartnäckiger Inflation,"Die Wirtschaft schwächelt, die Inflation hat wieder angezogen. Für die Währungshüter der Europäischen Zentralbank eine schwierige Gemengelage. Der weitere Zinskurs gilt dennoch als ausgemacht.",https://www.tagesspiegel.de/images/12861661/alternates/BASE_16_9_W1400/1733976143000/ezb.jpeg,2024-12-12T04:02:23Z,,"Die Europäische Zentralbank (EZB) ist ihrem Ziel stabiler Preise näher gekommen und hat die Leitzinsen seit Juni deutlich gesenkt. Die jüngsten Daten zeigen zwar, wie hartnäckig die Inflation ist. De… [+5835 chars]",,de,'Inflation'
https://www.focus.de/finanzen/news/geldpolitik-ezb-zwischen-konjunktursorgen-und-hartnaeckiger-inflation_id_260555626.html,https://www.focus.de/finanzen/news/geldpolitik-ezb-zwischen-konjunktursorgen-und-hartnaeckiger-inflation_id_260555626.html,0,www.focus.de,Geldpolitik - EZB zwischen Konjunktursorgen und hartnäckiger Inflation,"Die Wirtschaft schwächelt, die Inflation hat wieder angezogen. Für die Währungshüter der Europäischen Zentralbank eine schwierige Gemengelage. Der weitere Zinskurs gilt dennoch als ausgemacht.",https://p6.focus.de/img/finanzen/news/id_260555625/die-ezb-stemmt-sich-gegen-die-hartnaeckige-inflation-archivbild-.jpg?im=Crop%3D%280%2C146%2C2048%2C1024%29%3BResize%3D%281200%2C627%29&impolicy=perceptual&quality=mediumHigh&hash=0d061d618d50659b5adf2e6840db223afca4545a0dbdfd2d546f27c5a91a271a,2024-12-12T04:05:06Z,,"Die Europäische Zentralbank (EZB) ist ihrem Ziel stabiler Preise näher gekommen und hat die Leitzinsen seit Juni deutlich gesenkt. Die jüngsten Daten zeigen zwar, wie hartnäckig die Inflation ist. De… [+5110 chars]",,de,'Inflation'
https://www.n-tv.de/wirtschaft/Was-muss-Deutschland-besser-machen-article25426593.html,https://www.n-tv.de/wirtschaft/Was-muss-Deutschland-besser-machen-article25426593.html,0,www.n-tv.de,Klimaziele und Wirtschaftskrise: Was muss Deutschland besser machen?,"Egal, wie die nächste Bundesregierung aussieht: Klimaschutz wird weiter ein Thema sein. Doch wie wichtig ist er noch, wenn Inflation und lahmende Wirtschaft die Menschen belasten? Sind Deutschlands Klimaziele zu hoch? Und wie bringt man Klimaschutz und Wirtsc…",https://bilder3.n-tv.de/img/incoming/crop25426594/6831329991-cImg_16_9-w1200/492730295.jpg,2024-12-12T09:00:00Z,,"Egal, wie die nächste Bundesregierung aussieht: Klimaschutz wird weiter ein Thema sein. Doch wie wichtig ist er noch, wenn Inflation und lahmende Wirtschaft die Menschen belasten? Sind Deutschlands K… [+703 chars]",,de,'Inflation'
"https://www.cio.de/a/ezb-zwischen-konjunktursorgen-und-hartnaeckiger-inflation,3748380?utm_source=Seiten_3932&utm_medium=RSS&utm_campaign=RSS-Feeds","https://www.cio.de/a/ezb-zwischen-konjunktursorgen-und-hartnaeckiger-inflation,3748380?utm_source=Seiten_3932&utm_medium=RSS&utm_campaign=RSS-Feeds",0,www.cio.de,Unsichrheiten: EZB zwischen Konjunktursorgen und hartnäckiger Inflation,"Die Wirtschaft schwächelt, die Inflation hat wieder angezogen. Für die Währungshüter der Europäischen Zentralbank eine schwierige Gemengelage. Der weitere Zinskurs gilt dennoch als ausgemacht.",https://images.cio.de/bdb/3303124/640x360.jpg,2024-12-12T09:00:00Z,"https://web.archive.org/web/20241212105606/https://www.cio.de/a/ezb-zwischen-konjunktursorgen-und-hartnaeckiger-inflation,3748380","Die Europäische Zentralbank (EZB) ist ihrem Ziel stabiler Preise näher gekommen und hat die Leitzinsen seit Juni deutlich gesenkt. Die jüngsten Daten zeigen zwar, wie hartnäckig die Inflation ist. De… [+4854 chars]",,de,'Inflation'
https://www.golem.de/sonstiges/zustimmung/auswahl.html?from=https://www.golem.de/news/dartsolar-autofach-solarzellen-zum-nachruesten-und-aufklappen-2412-191638.html&referer=https://t.co/97cdcef71c,https://www.golem.de/sonstiges/zustimmung/auswahl.html?from=https://www.golem.de/news/dartsolar-autofach-solarzellen-zum-nachruesten-und-aufklappen-2412-191638.html&referer=https://t.co/97cdcef71c,0,www.golem.de,Dartsolar: Autofach-Solarzellen zum Nachrüsten und Aufklappen,"Dartsolar hat ein mitfahrendes Photovoltaik-System für Teslas vorgestellt, das auf das Dach montiert und beim Parken ausgeklappt wird. (Solarenergie, Auto)",,2024-12-12T09:23:02Z,,"Besuchen Sie Golem.de wie gewohnt mit Werbung und Tracking,
 indem Sie der Nutzung aller Cookies zustimmen.
 Details zum Tracking finden Sie im Privacy Center.
Skript wurde nicht geladen. Informat… [+607 chars]",,de,'Solar'
https://www.faz.net/aktuell/wirtschaft/schweizer-notenbank-senkt-zinsen-ueberraschend-stark-um-50-basispunkte-110169730.html,https://www.faz.net/aktuell/wirtschaft/schweizer-notenbank-senkt-zinsen-ueberraschend-stark-um-50-basispunkte-110169730.html,0,www.faz.net,"Schweizer Notenbank senkt Zinsen überraschend stark um 0,5 Prozentpunkte",Die SNB hat ihre Inflationsprognose 2024 und 2025 weiter zurückgenommen. Jetzt fallen zum vierten Mal in Folge die Leitzinsen. Dieses Mal ist der Rückgang sogar überraschend stark.,https://media1.faz.net/ppmedia/aktuell/wirtschaft/1959665898/1.10169735/facebook_teaser/blick-auf-die-schweizer.jpg,2024-12-12T10:04:50Z,https://web.archive.org/web/20241212103218/https://www.faz.net/aktuell/wirtschaft/schweizer-notenbank-senkt-zinsen-ueberraschend-stark-um-50-basispunkte-110169730.html,"Außerdem sei man weiterhin bereit, bei Bedarf am Devisenmarkt aktiv zu sein. Der zugrundeliegende Inflationsdruck hat in diesem Quartal nochmals abgenommen, erklärte die SNB. Die Nationalbank wird di… [+1993 chars]",,de,'Inflation'
