index,url,valid,domain,title,description,image,published,archive,content,quote,language,keyword
https://www.sueddeutsche.de/politik/energiekrise-liveblog-soforthilfe-gaspreisbremse-1.5704622,https://www.sueddeutsche.de/politik/energiekrise-liveblog-soforthilfe-gaspreisbremse-1.5704622,0,www.sueddeutsche.de,Liveblog zur Energiekrise: Dezemberhilfe kommt nicht bei allen sofort an,"Privatkunden und kleine Unternehmen, die direkt mit ihren Gas. oder Fernwärmeversorgern abrechnen, müssen in diesem Monat keinen Abschlag zahlen. Viele Mieter profitieren aber erst in einigen Monaten.",https://www.sueddeutsche.de/image/sz.1.5707156/1200x675?v=1669884861,2022-12-01T09:10:41Z,,"Der Krieg Russlands gegen die Ukraine hat auch massive Folgen für die Energieversorgung in Europa und Deutschland. Die Politik versucht, diese sicherzustellen und die Menschen wegen der stark steigen… [+131 chars]",,de,'Energiekrise'
https://www.handelsblatt.com/unternehmen/energie/heizoelpreis-prognose-koennte-der-heizoelpreis-2023-wieder-fallen/28763860.html,https://www.handelsblatt.com/unternehmen/energie/heizoelpreis-prognose-koennte-der-heizoelpreis-2023-wieder-fallen/28763860.html,0,www.handelsblatt.com,Heizölpreis-Prognose: Wird Heizöl wieder teurer oder sinken die Preise?,In Zeiten der Energiekrise stiegen zuletzt auch die Heizölpreise deutlich an. Aber warum ist auch Heizöl so teuer geworden? Und wie lassen sich trotzdem Energiekosten sparen?,https://www.handelsblatt.com/images/heizoelpreise-aktuell/28831670/4-format2003.jpg,2022-12-01T09:22:16Z,,"Heizölpreise aktuellDie Energiekrise beeinflusst auch die Heizölpreise. Experten geben eine Prognose, wie sich der Heizölpreis künftig entwickeln könnte.
(Foto: dpa)
Düsseldorf 4,4 Millionen Ölheiz… [+15754 chars]",,de,'Energiekrise'
https://www.handelsblatt.com/unternehmen/energie/gaspreisentwicklung-gaspreise-steigen-seit-kaelteeinbruch-anhaltend/28682942.html,https://www.handelsblatt.com/unternehmen/energie/gaspreisentwicklung-gaspreise-steigen-seit-kaelteeinbruch-anhaltend/28682942.html,0,www.handelsblatt.com,Gaspreisentwicklung 2022: Gaspreise steigen seit Kälteeinbruch anhaltend,Der Gaspreis steigt seit Winterbeginn aktuell wieder. Experten warnen vor deutlich höheren Rechnungen für Verbraucher. Das Wichtigste im Überblick.,https://www.handelsblatt.com/images/gaspreise-aktuell/28831590/2-format2003.jpg,2022-12-01T10:33:18Z,,"Gaspreise aktuellDie Gaspreisentwicklung macht Energie in Deutschland zunehmend teurer.
(Foto: imago stock&amp;people) 
Düsseldorf Die Gaspreise in Deutschland entwickeln sich seit einem Jahr rasan… [+16476 chars]",,de,'Winter'
https://www.zeit.de/wirtschaft/2022-12/energiekrise-gaspreis-klaus-mueller-bundesnetzagentur,https://www.zeit.de/wirtschaft/2022-12/energiekrise-gaspreis-klaus-mueller-bundesnetzagentur,0,www.zeit.de,"Bundesnetzagenturchef Klaus Müller: ""Deutschland kann Krise""","Eines der wichtigsten Krisenzentren dieser Tage sitzt nicht in Berlin, sondern in Bonn. Wie steht es um die Energiekrise, kommen wir gut durch den Winter, Herr Müller?",,2022-12-01T11:07:40Z,,"When browsing with ads:
We collect personal data and also transmit it to third-party providers
 that help us improve and finance our digital content. Some of the information stored on your device, … [+732 chars]",,de,'Winter'
https://www.zeit.de/wirtschaft/2022-12/soforthilfe-dezember-energiekosten-haeufigste-fragen-faq,https://www.zeit.de/wirtschaft/2022-12/soforthilfe-dezember-energiekosten-haeufigste-fragen-faq,0,www.zeit.de,Soforthilfe: Wie die Dezemberhilfe Verbraucher bei den Energiekosten entlasten soll,Eine Einmalzahlung soll Gas- und Fernwärmekunden in der Energiekrise entlasten. Doch nicht alle werden die Hilfe sofort spüren. So kommt das Geld bei Ihnen an.,,2022-12-01T11:36:41Z,,"When browsing with ads:
We collect personal data and also transmit it to third-party providers
 that help us improve and finance our digital content. Some of the information stored on your device, … [+732 chars]",,de,'Energiekrise'
https://www.zeit.de/wirtschaft/2022-12/energiekrise-forderungen-empel-koalition-nachbesserungen,https://www.zeit.de/wirtschaft/2022-12/energiekrise-forderungen-empel-koalition-nachbesserungen,0,www.zeit.de,Energiekrise: Ampel-Politiker planen Nachbesserungen an Gas- und Strompreisbremse,"Zu spät, zu kompliziert, nicht zielgenau: Die Opposition im Bundestag kritisiert die Pläne der Regierung zu den Preisbremsen. Auch die Ampel-Koalition will nachbessern.",,2022-12-01T11:46:25Z,,"When browsing with ads:
We collect personal data and also transmit it to third-party providers
 that help us improve and finance our digital content. Some of the information stored on your device, … [+732 chars]",,de,'Energiekrise'
https://www.diepresse.com/6222566/frankreich-bereitet-sich-auf-eventuelle-stundenweise-stromausfaelle-im-winter-vor,https://www.diepresse.com/6222566/frankreich-bereitet-sich-auf-eventuelle-stundenweise-stromausfaelle-im-winter-vor,0,www.diepresse.com,Frankreich bereitet sich auf eventuelle stundenweise Stromausfälle im Winter vor,"Etwa sechs Millionen Menschen könnten gleichzeitig betroffen sein. Die Regierung hat Haushalte und Unternehmen aufgerufen, den Energieverbrauch um 10 Prozent zu senken.",https://media.diepresse.com/social_diepresse_nachrichten/images/uploads_1200/2/e/6/6222566/ECE2888B-1B35-4075-BDCB-5FD64A940C60_v0_h.jpg,2022-12-01T11:50:00Z,,"Etwa sechs Millionen Menschen könnten gleichzeitig betroffen sein. Die Regierung hat Haushalte und Unternehmen aufgerufen, den Energieverbrauch um 10 Prozent zu senken.
Frankreich bereitet sich auf … [+2630 chars]",,de,'Winter'
https://www.welt.de/debatte/henryk-m-broder/plus242427497/Strategie-gegen-Antisemitismus-Wieder-will-Deutschland-der-Welt-zeigen-wie-es-geht.html,https://www.welt.de/debatte/henryk-m-broder/plus242427497/Strategie-gegen-Antisemitismus-Wieder-will-Deutschland-der-Welt-zeigen-wie-es-geht.html,0,www.welt.de,"Und wieder will Deutschland der Welt zeigen, wie es geht","Die Bundesregierung hat diverse „Aktionspläne“. Neu im Angebot ist die „erste Nationale Strategie gegen Antisemitismus und für jüdisches Leben“. Das werde „auch international wichtige Impulse geben“. Wie schon bei der Energiewende, der Digitalisierung und dem…",https://img.welt.de/img/debatte/kommentare/mobile242105943/3361351307-ci16x9-w1200-fnov-fpotl-fpi157750653/WON-Kombo-Kolumne-Henryk-M-BroderAutor.jpg,2022-12-01T12:10:23Z,,"Onpoloueulluu nup BeOuhlelletolpelnua lup Uepeu aelnteu, pelnulel peu Zelluueteu Phlluupoteu aeaeu BepplpOnp, peu Zelluueteu Phlluupoteu lulealelluu nup peu Zelluueteu Phlluupoteu aeaeu BeeklpevlleOl… [+1814 chars]",,de,'Energiewende'
https://www.zeit.de/mobilitaet/2022-11/fahrradkauf-preis-energiekrise-inflation,https://www.zeit.de/mobilitaet/2022-11/fahrradkauf-preis-energiekrise-inflation,0,www.zeit.de,"Fahrradkauf: Ist jetzt ein guter Zeitpunkt, ein Fahrrad zu kaufen?","Trotz Energiekrise und Inflation senken einige Fahrradhersteller die Preise. Wir erklären, was dahintersteckt. Und ob es sich lohnt, weiter abzuwarten.",,2022-12-01T12:20:27Z,,"When browsing with ads:
We collect personal data and also transmit it to third-party providers
 that help us improve and finance our digital content. Some of the information stored on your device, … [+732 chars]",,de,'Energiekrise'
https://www.morgenpost.de/lifestyle/wohnen/article237044999/So-verwenden-Sie-Mehrfachsteckdosen-richtig.html,https://www.morgenpost.de/lifestyle/wohnen/article237044999/So-verwenden-Sie-Mehrfachsteckdosen-richtig.html,0,www.morgenpost.de,Adventsbeleuchtung: So verwenden Sie Mehrfachsteckdosen richtig,Trotz Energiekrise gönnen sich die meisten auch in diesem Jahr ihre Weihnachtsbeleuchtung. Da sind schnell mal ein paar Steckdosen mehr nötig. Folgendes sollten Sie im Sinne der Sicherheit beachten.,https://img.morgenpost.de/img/wohnen/crop237044997/5502602520-w820-cv16_9-q85/Eine-Mehrfachsteckdose-mit-Steckern-drin.jpg,2022-12-01T12:26:18Z,,"Berlin (dpa/tmn). Die Lichterkette und der Weihnachtsstern in den Fenstern, die ohnehin vorhandene Stehlampe und am Ende auch der Weihnachtsbaum - all das braucht Strom. Wer dafür nicht genug passend… [+1591 chars]",,de,'Energiekrise'
https://www.handelsblatt.com/politik/deutschland/stromausfall-im-krankenhaus-so-bereitet-sich-die-uniklinik-essen-auf-den-blackout-vor/28835380.html,https://www.handelsblatt.com/politik/deutschland/stromausfall-im-krankenhaus-so-bereitet-sich-die-uniklinik-essen-auf-den-blackout-vor/28835380.html,0,www.handelsblatt.com,Energiekrise: Was bei einem Blackout in einer der größten Kliniken Deutschlands passieren würde,"Fällt der Strom aus, können nur wenige Krankenhäuser tagelang den Betrieb aufrechterhalten. Die Uniklinik Essen probt den Ernstfall eines Blackouts – und rechnet mit dem Schlimmsten.",https://www.handelsblatt.com/images/angst-vor-dem-blackout-auf-der-intensivstation/28835824/2-format2003.png,2022-12-01T12:33:55Z,,"Angst vor dem Blackout auf der IntensivstationVorsorgen für den Ernstfall.
(Foto: Universitätsklinik Essen, Imago [M]) 
Berlin Stefan Neuhaus ist einer der Ersten, der erfährt, wenn in Essen die Li… [+1009 chars]",,de,'Energiekrise'
https://www.n-tv.de/politik/Frankreich-im-Krisenmodus-Geplante-Stromausfaelle-im-Winter-article23756244.html,https://www.n-tv.de/politik/Frankreich-im-Krisenmodus-Geplante-Stromausfaelle-im-Winter-article23756244.html,0,www.n-tv.de,"Gezielt abschalten, um zu sparen: Frankreich im Krisenmodus: Geplante Stromausfälle im Winter","Frankreich kämpft wegen seiner anfälligen Atomkraftwerke seit Langem mit seiner Stromerzeugung. Im Winter muss daher Energie gespart werden, es drohen Stromausfälle. Dazu soll teils gezielt der Strom abgestellt werden. Präfekturen sollen Pläne erarbeiten, Bür…",https://bilder2.n-tv.de/img/incoming/crop23756281/9481329530-cImg_16_9-w1200/314387219.jpg,2022-12-01T12:35:26Z,,"Frankreich kämpft wegen seiner anfälligen Atomkraftwerke seit Langem mit seiner Stromerzeugung. Im Winter muss daher Energie gespart werden, es drohen Stromausfälle. Dazu soll teils gezielt der Strom… [+2818 chars]",,de,'Winter'
https://www.manager-magazin.de/politik/eurozone-arbeitslosigkeit-erreicht-mit-6-5-prozent-weiteres-rekordtief-a-79afd9a4-fa74-4e8f-9474-98f0a14d85c4,https://www.manager-magazin.de/politik/eurozone-arbeitslosigkeit-erreicht-mit-6-5-prozent-weiteres-rekordtief-a-79afd9a4-fa74-4e8f-9474-98f0a14d85c4,0,www.manager-magazin.de,"Eurozone: Arbeitslosigkeit erreicht mit 6,5 Prozent weiteres Rekordtief","Trotz Inflation und Energiekrise bleibt der Arbeitsmarkt in Europa stabil. Die Zahl der Menschen ohne Job ging im Oktober auf 6,5 Prozent zurück. Spanien und Griechenland verzeichnen weiterhin eine hohe Jugendarbeitslosigkeit.",https://cdn.prod.www.manager-magazin.de/images/cad25703-600f-47c2-bb97-45103acb6c81_w1280_r1.77_fpx48.57_fpy48.99.jpg,2022-12-01T12:48:57Z,,"Jugendarbeitslosigkeit weiterhin in Spanien und Griechenland hoch
Am schwersten von Arbeitslosigkeit betroffen waren zuletzt Spanien (12,5 Prozent) und Griechenland (11,6 Prozent). In diesen Ländern… [+333 chars]",,de,'Energiekrise'
https://www.handelsblatt.com/unternehmen/energie/einmalzahlung-so-kommt-die-dezemberhilfe-fuer-gas-und-fernwaerme-bei-ihnen-an/28834320.html,https://www.handelsblatt.com/unternehmen/energie/einmalzahlung-so-kommt-die-dezemberhilfe-fuer-gas-und-fernwaerme-bei-ihnen-an/28834320.html,0,www.handelsblatt.com,Einmalzahlung: So funktioniert die Einmalzahlung für Gas und Fernwärme im Dezember,Private Haushalte sowie Unternehmen sollen in der Energiekrise eine Einmalzahlung als Entlastung erhalten. So funktioniert die geplante Soforthilfe der Bundesregierung.,https://www.handelsblatt.com/images/gasherd/28834654/7-format2003.jpg,2022-12-01T12:50:55Z,,"GasherdDie Einmalzahlung im Dezember soll Verbraucher beim Gas-Abschlag entlasten.
(Foto: dpa)
Düsseldorf Der Winter naht und mit Temperaturen unter dem Gefrierpunkt dürften die Auswirkungen der En… [+1246 chars]",,de,'Energiekrise'
https://www.bild.de/politik/ausland/politik-ausland/frankreich-fuerchtet-stromausfaelle-krisenstab-arbeitet-an-blackout-plan-fuer-wi-82120244.bild.html,https://www.bild.de/politik/ausland/politik-ausland/frankreich-fuerchtet-stromausfaelle-krisenstab-arbeitet-an-blackout-plan-fuer-wi-82120244.bild.html,0,www.bild.de,Krisenstab arbeitet an Blackout-Plan - Frankreich fürchtet Stromausfälle im Winter,Frankreich rechnet mit stundenlangen Blackouts im Winter.Foto: IAN LANGSDON/EPA-EFE/Shutterstock,"https://images.bild.de/6388947c08ba5f71743aa2c2/91aa27eb24486027f7f288bba033e111,a9cb7197?w=1280",2022-12-01T13:24:29Z,,"Frankreich rechnet mit stundenlangen Blackouts im Winter!
Laut Regierungskreisen könnten bis zu sechs Millionen Menschen gleichzeitig betroffen sein. Außerdem könnte sich der Stromausfall auch auf S… [+2620 chars]",,de,'Winter'
https://www.bild.de/auto/mobilitaet-reisen-motorrad/mobilitaet-und-mehr/blackout-angst-schweiz-plant-fahrverbote-fuer-e-autos-82118284.bild.html,https://www.bild.de/auto/mobilitaet-reisen-motorrad/mobilitaet-und-mehr/blackout-angst-schweiz-plant-fahrverbote-fuer-e-autos-82118284.bild.html,0,www.bild.de,Bei unseren Nachbarn - Fahrverbote für E-Autos geplant!,Wegen der anhaltenden Energiekrise befürchtet die Schweiz Stromausfälle im Winter. Die Maßnahmen betreffen auch Autofahrer!,"https://images.bild.de/6388766008ba5f71743aa26b/b0ca7fac1f5cc07fb39ef4f98669cca8,59d21d73?w=1280",2022-12-01T13:42:21Z,,"Auf den Black Friday folgt die Angst vor dem Blackout!
Wegen der anhaltenden Energiekrise befürchten Verbraucher, Unternehmen und Politiker Probleme mit einer stabilen Stromversorgung in der kalten … [+2854 chars]",,de,'Energiekrise'
https://www.welt.de/wirtschaft/article242434167/Kampf-mit-hoher-Inflation-Russische-Behoerden-erhoehen-Preise-fuer-Gas-und-Strom.html,https://www.welt.de/wirtschaft/article242434167/Kampf-mit-hoher-Inflation-Russische-Behoerden-erhoehen-Preise-fuer-Gas-und-Strom.html,0,www.welt.de,Russische Behörden erhöhen Preise für Gas und Strom,"In Russland werden die Energiepreise für die Bürger erhöht. Die Hoffnung, dass Gas durch weniger Exporte auf dem Binnenmarkt billiger wird, hat sich nicht erfüllt. Die russischen Bürger kämpfen seit Kriegsbeginn mit einer zweistelligen Inflationsrate. Bei 43 …",https://img.welt.de/img/newsticker/dpa_nt/infoline_nt/wirtschaft_nt/mobile242426997/0651353337-ci16x9-w1200/Moskau.jpg,2022-12-01T14:14:04Z,,Die russischen Behörden heizen die Inflation im eigenen Land durch die Anhebung der staatlich regulierten Nebenkostentarife deutlich an. Die Preise für Gas steigen nach Medienangaben vom Donnerstag u… [+1303 chars],,de,'Inflation'
https://www.tagesschau.de/wirtschaft/verbraucher/stromausfall-brownout-energiekrise-netz-101.html,https://www.tagesschau.de/wirtschaft/verbraucher/stromausfall-brownout-energiekrise-netz-101.html,0,www.tagesschau.de,"Gezielte Stromabschaltungen: Was passiert beim ""Brownout""?","Netzbetreiber schließen nicht aus, dass sie bei Engpässen im Winter stundenweise einzelne Stadtviertel vom Stromnetz nehmen müssen. Für diesen Fall gibt es konkrete Szenarien. <em>Von Michael Heussen</em>.",https://www.tagesschau.de/multimedia/bilder/stromausfall-121~_v-original.jpg,2022-12-01T14:44:48Z,,"Netzbetreiber schließen nicht aus, dass sie bei Engpässen im Winter stundenweise einzelne Stadtviertel vom Stromnetz nehmen müssen. Für diesen Fall gibt es konkrete Szenarien.
Von außen sieht der St… [+4486 chars]",,de,'Winter'
https://www.sueddeutsche.de/muenchen/landkreismuenchen/aschheim-windkraft-klimaschutz-energieagentur-1.5707596,https://www.sueddeutsche.de/muenchen/landkreismuenchen/aschheim-windkraft-klimaschutz-energieagentur-1.5707596,0,www.sueddeutsche.de,Energiewende: Aschheim hat Platz für bis zu fünf Windräder,Die Gemeinde will zwei mögliche Standorte näher auf ihre Eignung untersuchen lassen.,https://www.sueddeutsche.de/assets/png/sz-ecb090256670a577bd629a9718686332.png,2022-12-01T14:51:10Z,,Die Gemeinde will zwei mögliche Standorte näher auf ihre Eignung untersuchen lassen.Bis zu fünf Windräder könnten sich theoretisch einmal auf dem Gebiet der Gemeinde Aschheim drehen. Zumindest hat da… [+2041 chars],,de,'Energiewende'
https://www.handelsblatt.com/unternehmen/industrie/handelsblatt-industrie-gipfel-2022-die-handelsbarriere-ist-da-deutsche-industrie-fuerchtet-um-marktzugang-in-den-usa/28843010.html,https://www.handelsblatt.com/unternehmen/industrie/handelsblatt-industrie-gipfel-2022-die-handelsbarriere-ist-da-deutsche-industrie-fuerchtet-um-marktzugang-in-den-usa/28843010.html,0,www.handelsblatt.com,Handelsblatt Industrie-Gipfel 2022: „Die Handelsbarriere ist da“ – Deutsche Industrie fürchtet um Marktzugang in den USA,Das Anti-Inflationsprogramm der USA stellt die Unternehmen vor neue Schwierigkeiten. Manager fordern eine europäische Antwort auf den Subventionswettlauf.,https://www.handelsblatt.com/images/kirsten-ludowig-im-gespraech-mit-bosch-manager-rolf-najork-beim-industrie-gipfel-2022-/28843408/4-format2003.jpg,2022-12-01T15:28:00Z,,"Duisburg Der russische Angriffskrieg auf die Ukraine, Handelskonflikte mit China und die Energiekrise setzen die Industrie zunehmend unter Druck. Die Unternehmen fordern eine europäische Antwort auf … [+5184 chars]",,de,'Inflation'
https://www.faz.net/aktuell/finanzen/trotz-hoher-inflation-wird-der-sprit-billiger-18502472.html,https://www.faz.net/aktuell/finanzen/trotz-hoher-inflation-wird-der-sprit-billiger-18502472.html,0,www.faz.net,Trotz hoher Inflation wird der Sprit billiger,Wirken die Zinserhöhungen der Europäischen Zentralbank schon auf die hohe Inflation? Und könnte das mit dem Wechselkurs zu tun haben? Eine Spurensuche.,https://media1.faz.net/ppmedia/aktuell/finanzen/2773218408/1.8502471/facebook_teaser_fplus/ezb.jpg,2022-12-01T15:30:09Z,,"Zinserhöhungen der Notenbanken haben meistens eine relativ lange Vorlaufzeit, bevor sie auf die Inflation wirken mit einer Ausnahme: dem Wechselkurs. Wenn der Wechselkurs der eigenen Währung durch da… [+465 chars]",,de,'Inflation'
https://www.wiwo.de/finanzen/boerse/bitcoin-kurs-aktuell-kerninflation-in-den-usa-bei-5-0-prozent-bitcoin-bei-17-000-dollar/27382428.html,https://www.wiwo.de/finanzen/boerse/bitcoin-kurs-aktuell-kerninflation-in-den-usa-bei-5-0-prozent-bitcoin-bei-17-000-dollar/27382428.html,0,www.wiwo.de,"Bitcoin-Kurs aktuell: Kerninflation in den USA bei 5,0 Prozent – Bitcoin bei 17.000 Dollar","Die US-Verbraucherpreise sind langsamer gestiegen als erwartet. Der Bitcoin legt zu, die Entwicklungen rund um die gescheiterte FTX-Übernahme drücken aber auf den Kryptomarkt. Die Nachrichten im Bitcoin-Newsblog.",https://www.wiwo.de/images/file-photo-illustration-shows-representations-of-cryptocurrency-bitcoin/28435878/2-format11240.jpg,2022-12-01T15:46:00Z,,"Aktuelle News und Nachrichten von heute zum Bitcoin (BTC) und zum aktuellen Kurs
Hier sehen Sie den aktuellen Bitcoin-Kurs in US-Dollar und in Echtzeit. Der tatsächliche Wert kann daher von den im T… [+83458 chars]",,de,'Inflation'
https://www.tagesschau.de/wirtschaft/ranking-teuerste-staedte-101.html,https://www.tagesschau.de/wirtschaft/ranking-teuerste-staedte-101.html,0,www.tagesschau.de,"Auswertung des ""Economist"": New York und Singapur am teuersten",Energiepreise und Inflation ließen die Lebenshaltungskosten in vielen Städten weltweit ansteigen. Am teuersten lebt es sich einer Studie zufolge in New York und Singapur. Moskau und St. Petersburg verzeichnen die größten Preissprünge.,https://www.tagesschau.de/multimedia/bilder/new-york-367~_v-original.jpg,2022-12-01T16:41:26Z,,Energiepreise und Inflation ließen die Lebenshaltungskosten in vielen Städten weltweit ansteigen. Am teuersten lebt es sich einer Studie zufolge in New York und Singapur. Moskau und St. Petersburg ve… [+2642 chars],,de,'Inflation'
https://www.faz.net/aktuell/finanzen/wirken-die-zinserhoehungen-der-ezb-schon-auf-die-inflation-18502472.html,https://www.faz.net/aktuell/finanzen/wirken-die-zinserhoehungen-der-ezb-schon-auf-die-inflation-18502472.html,0,www.faz.net,Wirken die Zinserhöhungen der EZB schon auf die Inflation?,Im Kampf gegen die hohe Inflation hat die EZB jetzt dreimal die Zinsen angehoben. Folgen müsste man zuerst beim Wechselkurs und den Einfuhrpreisen sehen. Eine Spurensuche.,https://media1.faz.net/ppmedia/aktuell/finanzen/2773218408/1.8502471/facebook_teaser_fplus/ezb.jpg,2022-12-01T16:59:15Z,,"Zinserhöhungen der Notenbanken haben meistens eine relativ lange Vorlaufzeit, bevor sie auf die Inflation wirken mit einer Ausnahme: dem Wechselkurs. Wenn der Wechselkurs der eigenen Währung durch da… [+465 chars]",,de,'Inflation'
https://www.faz.net/aktuell/wirtschaft/wiederaufbaufonds-in-italien-bleibt-eu-geld-liegen-18502728.html,https://www.faz.net/aktuell/wirtschaft/wiederaufbaufonds-in-italien-bleibt-eu-geld-liegen-18502728.html,0,www.faz.net,Wiederaufbaufonds: In Italien bleiben EU-Milliarden ungenutzt liegen,"Überforderte Behörden und die Inflation bremsen die Investitionsprojekte in Italien. Wo aber sind die überwiesenen Gelder gelandet, fragt der EU-Haushaltsausschuss.",https://media0.faz.net/ppmedia/aktuell/2486453909/1.8503024/facebook_teaser/ministerpraesidentin-giorgia.jpg,2022-12-01T17:14:35Z,,Italien drängt auf eine Verlängerung der Fristen für die Staatsausgaben im Rahmen des Europäischen Wiederaufbaufonds. Denn die staatliche Verwaltung kann die Mittel nicht schnell genug vergeben. Ital… [+3219 chars],,de,'Inflation'
https://www.handelsblatt.com/meinung/kolumnen/marktkolumne/maerkte-insight-wechselnde-signale-statt-eindeutiger-botschaften-der-notenbanken-wie-anleger-damit-am-besten-umgehen/28844212.html,https://www.handelsblatt.com/meinung/kolumnen/marktkolumne/maerkte-insight-wechselnde-signale-statt-eindeutiger-botschaften-der-notenbanken-wie-anleger-damit-am-besten-umgehen/28844212.html,0,www.handelsblatt.com,Märkte-Insight: Wechselnde Signale statt eindeutiger Botschaften der Notenbanken – Wie Anleger damit am besten umgehen,Die Notenbanken wägen die Gefahren von Inflation und Rezession ab und betreiben jetzt vor allem Risikomanagement. Das sollten Anleger auch tun.,https://www.handelsblatt.com/images/wechselnde-signale/28844218/3-format2003.jpg,2022-12-01T17:31:44Z,,"Wechselnde SignaleHandelsblatt-Redakteur Frank Wiebe erklärt, warum von den Notenbanken in der nächsten Zeit keine eindeutigen Botschaften kommen dürften.
(Foto: Imago, Privat) 
War es das schon? K… [+1025 chars]",,de,'Inflation'
https://www.sueddeutsche.de/politik/gemeinnuetzigkeit-deutsche-spenden-milliarden-1.5707423,https://www.sueddeutsche.de/politik/gemeinnuetzigkeit-deutsche-spenden-milliarden-1.5707423,0,www.sueddeutsche.de,Gemeinnützigkeit: Deutsche spenden Milliarden,Der Deutsche Spendenrat erwartet in diesem Jahr trotz Kriegsängsten und Inflation ein ähnlich hohes Spendenaufkommen wie im Vorjahr. Die Deutschen hätten...,https://www.sueddeutsche.de/assets/png/sz-ecb090256670a577bd629a9718686332.png,2022-12-01T17:51:55Z,,"Der Deutsche Spendenrat erwartet in diesem Jahr trotz Kriegsängsten und Inflation ein ähnlich hohes Spendenaufkommen wie im Vorjahr. Die Deutschen hätten bereits von Januar bis September 2022 etwa 3,… [+490 chars]",,de,'Inflation'
https://www.handelsblatt.com/politik/international/macron-bei-biden-biden-verspricht-macron-aenderungen-am-anti-inflationspaket-kritik-von-eu-kommissar-breton/28844580.html,https://www.handelsblatt.com/politik/international/macron-bei-biden-biden-verspricht-macron-aenderungen-am-anti-inflationspaket-kritik-von-eu-kommissar-breton/28844580.html,0,www.handelsblatt.com,Macron bei Biden: Biden verspricht Macron Änderungen am Anti-Inflationspaket – Kritik von EU-Kommissar Breton,"Biden verspricht, kleinere Fehler im Anti-Inflationspaket beheben zu können. Thierry Breton warnt vor großen Schäden für beide Seiten.",https://www.handelsblatt.com/images/joe-biden-emmanuel-macron-jill-biden-brigitte-macron/28844594/2-format2003.jpg,2022-12-02T01:36:14Z,https://web.archive.org/web/20221202095101/https://www.handelsblatt.com/politik/international/macron-bei-biden-biden-verspricht-macron-aenderungen-am-anti-inflationspaket-kritik-von-eu-kommissar-breton/28844580.html,"Berlin US-Präsident Joe Biden hat den Staatsbesuch des französischen Präsidenten Emmanuel Macron genutzt, um den Ärger der Europäer über das amerikanische Anti-Inflationspaket zu besänftigen. Wir kön… [+2978 chars]",,de,'Inflation'
https://www.handelsblatt.com/politik/international/thierry-breton-biden-verspricht-macron-aenderungen-am-anti-inflationspaket-zugunsten-europas/28844580.html,https://www.handelsblatt.com/politik/international/thierry-breton-biden-verspricht-macron-aenderungen-am-anti-inflationspaket-zugunsten-europas/28844580.html,0,www.handelsblatt.com,Thierry Breton: Biden verspricht Macron Änderungen am Anti-Inflationspaket zugunsten Europas,"Biden verspricht, kleinere Fehler im Anti-Inflationspaket beheben zu können. Kritik war zuvor auch von EU-Binnenmarktkommissar Breton gekommen.",https://www.handelsblatt.com/images/joe-biden-emmanuel-macron-jill-biden-brigitte-macron/28844594/2-format2003.jpg,2022-12-02T01:36:14Z,https://web.archive.org/web/20221202030922/https://www.handelsblatt.com/politik/international/thierry-breton-biden-verspricht-macron-aenderungen-am-anti-inflationspaket-zugunsten-europas/28844580.html,"Berlin US-Präsident Joe Biden hat den Staatsbesuch des französischen Präsidenten Emmanuel Macron genutzt, um den Ärger der Europäer über das amerikanische Anti-Inflationspaket zu besänftigen. Wir kön… [+3104 chars]",,de,'Inflation'
