index,url,valid,domain,title,description,image,published,archive,content,quote,language,keyword
https://www.stern.de/gesellschaft/regional/thueringen/erneuerbare-energien--verbraucherschuetzer--energiewende-braucht-klare-regeln-35940568.html,https://www.stern.de/gesellschaft/regional/thueringen/erneuerbare-energien--verbraucherschuetzer--energiewende-braucht-klare-regeln-35940568.html,0,www.stern.de,Erneuerbare Energien: Verbraucherschützer: Energiewende braucht klare Regeln,"Ob Heizung oder Auto: Aus Sicht von Verbraucherschützern gibt es nicht nur für Unternehmen zu wenig Klarheit, welche Förderungen es für den Umstieg auf erneuerbare Energien langfristig gibt.",https://image.stern.de/35940570/t/4_/v1/w1440/r1.7778/-/01--ykcb5goaq5v12axs2048jpeg---999321d928768eed.jpg,2025-08-01T03:00:57Z,,"Kopiere den aktuellen Link
Zur Merkliste hinzufügen
Ob Heizung oder Auto: Aus Sicht von Verbraucherschützern gibt es nicht nur für Unternehmen zu wenig Klarheit, welche Förderungen es für den Umsti… [+1785 chars]",,de,'Energiewende'
https://www.faz.net/aktuell/wirtschaft/immobilien-wohnen/vonovia-setzt-jetzt-auf-serielle-sanierung-wenn-fenster-die-wohnung-heizen-110616045.html,https://www.faz.net/aktuell/wirtschaft/immobilien-wohnen/vonovia-setzt-jetzt-auf-serielle-sanierung-wenn-fenster-die-wohnung-heizen-110616045.html,0,www.faz.net,Serielle Sanierung: Jetzt sollen Fenster die Wohnungen heizen,"Deutschlands größter Immobilienkonzern Vonovia setzt auf serielle Sanierung, um die Energieeffizienz im Bestand zu verbessern. Obwohl das teuer ist, sollen Mieter nicht stärker belastet werden.",https://media0.faz.net/ppmedia/aktuell/160297361/1.10616044/facebook_teaser_fplus/neue-heizung-hier-erwaermt.jpg,2025-08-01T04:17:47Z,http://archive.md/20250801071151/https://www.faz.net/aktuell/wirtschaft/immobilien-wohnen/vonovia-setzt-jetzt-auf-serielle-sanierung-wenn-fenster-die-wohnung-heizen-110616045.html,"Zwischen den anderen Häusern sticht die Holzverkleidung heraus. In dieser Straße im Stadtteil Köln Kalk stehen viele Mehrfamilienhäuser, die in den Fünfziger- bis Siebzigerjahren gebaut wurden. An ma… [+262 chars]",,de,'Energieeffizienz'
https://www.morgenpost.de/ratgeber-wissen/article409615002/rente-passbilder-solarstrom-die-wichtigsten-aenderungen-im-august.html,https://www.morgenpost.de/ratgeber-wissen/article409615002/rente-passbilder-solarstrom-die-wichtigsten-aenderungen-im-august.html,0,www.morgenpost.de,"Rente, Passbilder, Solarstrom: Das ändert sich im August","Ab dem 1. August können Verbraucher Batterien leichter entsorgen, Technikhersteller müssen für mehr Sicherheit sorgen. Ein Überblick.",https://img.sparknews.funkemedien.de/409634406/409634406_1753873686_v16_9_1600.jpeg,2025-08-01T05:32:00Z,,"Berlin. Ab dem 1. August können Verbraucher Batterien leichter entsorgen, Technikhersteller müssen für mehr Sicherheit sorgen. Ein Überblick.
<ul><li>Ab dem 1. August 2025 treten wieder einige Änder… [+5111 chars]",,de,'Solar'
https://www.morgenpost.de/wirtschaft/article409533680/blackout-durch-erneuerbare-forscher-zeigt-ausweg-auf.html,https://www.morgenpost.de/wirtschaft/article409533680/blackout-durch-erneuerbare-forscher-zeigt-ausweg-auf.html,0,www.morgenpost.de,Blackout durch Erneuerbare? Forscher zeigt Ausweg auf,So könnte das Stromnetz der Zukunft mit 100 Prozent erneuerbaren Energien stabilisiert werden – trotz Schwankungen und Unwägbarkeiten.,https://img.sparknews.funkemedien.de/408891980/408891980_1745920197_v16_9_1600.jpeg,2025-08-03T09:11:15Z,,"Berlin. So könnte das Stromnetz der Zukunft mit 100 Prozent erneuerbaren Energien stabilisiert werden trotz Schwankungen und Unwägbarkeiten.
Unter diesem Dach begegnen sich die alte und die neue Ene… [+5167 chars]",,de,'Erneuerbare'
https://www.stern.de/gesellschaft/regional/berlin-brandenburg/energiepolitik--panter--osten-bei-neuen-gaskraftwerken-nicht-benachteiligen-35945210.html,https://www.stern.de/gesellschaft/regional/berlin-brandenburg/energiepolitik--panter--osten-bei-neuen-gaskraftwerken-nicht-benachteiligen-35945210.html,0,www.stern.de,Energiepolitik: Panter: Osten bei neuen Gaskraftwerken nicht benachteiligen,"Der Bund will neue Gaskraftwerke bauen. Sie sollen einspringen, wenn Sonne und Wind nicht genug Strom liefern. Doch wie stark werden ostdeutsche Kohleregionen von den Investitionen profitieren?",https://image.stern.de/35945212/t/hj/v1/w1440/r1.7778/-/03--zr5ehror3uv21axs2048jpeg---cb2632a05e19303b.jpg,2025-08-03T09:16:43Z,,"Kopiere den aktuellen Link
Zur Merkliste hinzufügen
Der Bund will neue Gaskraftwerke bauen. Sie sollen einspringen, wenn Sonne und Wind nicht genug Strom liefern. Doch wie stark werden ostdeutsche … [+1807 chars]",,de,'Erneuerbare'
https://www.tagesspiegel.de/berlin/energiepolitik-panter-osten-bei-neuen-gaskraftwerken-nicht-benachteiligen-14125877.html,https://www.tagesspiegel.de/berlin/energiepolitik-panter-osten-bei-neuen-gaskraftwerken-nicht-benachteiligen-14125877.html,0,www.tagesspiegel.de,Energiepolitik: Panter: Osten bei neuen Gaskraftwerken nicht benachteiligen,"Der Bund will neue Gaskraftwerke bauen. Sie sollen einspringen, wenn Sonne und Wind nicht genug Strom liefern. Doch wie stark werden ostdeutsche Kohleregionen von den Investitionen profitieren?",https://www.tagesspiegel.de/images/14125874/alternates/BASE_16_9_W1400/1754212664000/kraftwerk-schwarze-pumpe.jpeg,2025-08-03T09:17:44Z,,"Pläne des Bundes, Süddeutschland beim Bau neuer Gaskraftwerke zu bevorzugen, stoßen in Sachsen auf scharfe Kritik. Mit einem Südbonus würden ostdeutsche Kraftwerksstandorte systematisch benachteiligt… [+1650 chars]",,de,'Erneuerbare'
https://www.zeit.de/news/2025-08/04/solarboom-in-nrw-schwaecht-sich-ab,https://www.zeit.de/news/2025-08/04/solarboom-in-nrw-schwaecht-sich-ab,0,www.zeit.de,Energiewende: Solarboom in NRW schwächt sich ab,Hier finden Sie Informationen zu dem Thema „Energiewende“. Lesen Sie jetzt „Solarboom in NRW schwächt sich ab“.,https://img.zeit.de/news/2025-08/04/solarboom-in-nrw-schwaecht-sich-ab-image-group/wide__1300x731,2025-08-04T04:05:35Z,,Der Solarboom hat sich im ersten Halbjahr auch in Nordrhein-Westfalen abgeschwächt: In NRW wurde mit 940 Megawatt (MW) etwa 20 Prozent weniger Solarstromleistung in Betrieb genommen als im vergleichb… [+2282 chars],,de,'Erneuerbare'
https://www.stern.de/gesellschaft/regional/nordrhein-westfalen/energiewende--solarboom-in-nrw-schwaecht-sich-ab-35946256.html,https://www.stern.de/gesellschaft/regional/nordrhein-westfalen/energiewende--solarboom-in-nrw-schwaecht-sich-ab-35946256.html,0,www.stern.de,Energiewende: Solarboom in NRW schwächt sich ab,Die Stromerzeugung aus Sonnenlicht liegt weiterhin im Trend. Die Wachstumskurve wird allerdings etwas flacher. Die Erneuerbaren-Branche wünscht sich mehr Unterstützung.,https://image.stern.de/35946258/t/rW/v1/w1440/r1.7778/-/04--zr47tk4ktuv10axs2048jpeg---fb147d2a82d1607b.jpg,2025-08-04T04:05:35Z,,"Kopiere den aktuellen Link
Zur Merkliste hinzufügen
Die Stromerzeugung aus Sonnenlicht liegt weiterhin im Trend. Die Wachstumskurve wird allerdings etwas flacher. Die Erneuerbaren-Branche wünscht s… [+2466 chars]",,de,'Energiewende'
https://futurezone.at/digital-life/china-solarthermie-kraftwerk-dunhuang-video-lichtspiel/403066299,https://futurezone.at/digital-life/china-solarthermie-kraftwerk-dunhuang-video-lichtspiel/403066299,0,futurezone.at,Surreales Lichtspiel bei Chinas größtem Solarthermie-Kraftwerk,Die Anlage ist derzeit das leistungsstärkste Sonnenwärmekraftwerk seiner Art.,https://image.futurezone.at/images/facebook/9065639/solar_twin_tower.png,2025-08-04T09:16:29Z,,"04.08.2025
Die Anlage ist derzeit das leistungsstärkste Sonnenwärmekraftwerk seiner Art.
Auffällig bei den Aufnahmen ist, dass das Licht der Spiegel nicht direkt auf die Spitze der Türme gebündelt … [+1414 chars]",,de,'Windenergie'
