index,url,valid,domain,title,description,image,published,archive,content,quote,language,keyword
https://www.zeit.de/news/2026-05/05/mit-backpulver-zur-energiewende-pilotanlage-bei-rostock,https://www.zeit.de/news/2026-05/05/mit-backpulver-zur-energiewende-pilotanlage-bei-rostock,0,www.zeit.de,Energiewende: Mit Backpulver zur Energiewende - Pilotanlage bei Rostock,Hier finden Sie Informationen zu dem Thema „Energiewende“. Lesen Sie jetzt „Mit Backpulver zur Energiewende - Pilotanlage bei Rostock“.,https://img.zeit.de/news/2026-05/05/mit-backpulver-zur-energiewende-pilotanlage-bei-rostock-image-group/wide__1300x731,2026-05-05T12:33:27Z,,"Strom aus erneuerbaren Energiequellen, etwa Wind oder Sonne, in Wasserstoff speichern - das gilt als wichtiger Baustein der Energiewende. Bei der Lagerung und dem Transport dieses grünen Wasserstoffe… [+3196 chars]",,de,'Energiewende'
https://www.nzz.ch/wirtschaft/der-neue-schlagabtausch-im-iran-krieg-treibt-den-oelpreis-die-hoehe-wirklich-brenzlig-wird-es-aber-erst-ab-herbst-ld.10005709,https://www.nzz.ch/wirtschaft/der-neue-schlagabtausch-im-iran-krieg-treibt-den-oelpreis-die-hoehe-wirklich-brenzlig-wird-es-aber-erst-ab-herbst-ld.10005709,0,www.nzz.ch,Der neue Schlagabtausch im Iran-Krieg treibt den Ölpreis die Höhe – wirklich brenzlig wird es aber erst ab Herbst,Die USA wollen die Öffnung der Strasse von Hormuz erzwingen und heizen den Konflikt damit an. Die Nervosität am Ölmarkt steigt.,"https://img-msp-prod.nzz.ch/2026/05/05/ffe5c5de-81b3-4574-86e2-0565f3485b58.jpg?width=1200&height=675&fit=bounds&quality=75&auto=webp&crop=6000,3375,x0,y0&wmark=nzz",2026-05-05T13:19:38Z,,"Die USA wollen die Öffnung der Strasse von Hormuz erzwingen und heizen den Konflikt damit an. Die Nervosität am Ölmarkt steigt.
Zusammenfassung
Merken
Das Patt am Persischen Golf hält an: Ein Frac… [+6157 chars]",,de,'Ölpreis'
https://www.faz.net/aktuell/finanzen/finanzmarkt/zinserhoehung-sollten-sich-die-aussichten-nicht-bessern-200799556.html,https://www.faz.net/aktuell/finanzen/finanzmarkt/zinserhoehung-sollten-sich-die-aussichten-nicht-bessern-200799556.html,0,www.faz.net,"Bundesbankpräsident Nagel: Diese zwei Faktoren entscheiden, ob die EZB die Zinsen anhebt",Im April hat die EZB die Zinsen unverändert gelassen. Jetzt richten sich die Blicke auf die Juni-Sitzung. Was könnte sie da angesichts gestiegener Inflationsraten noch von einer Zinserhöhung abhalten?,https://media0.faz.net/image/w1200h627/a2f4eee56f49/w2048h1070x0y148o/202603/43601.0.1848738582/der-bundesbankpraesident.webp,2026-05-05T19:36:36Z,,Für die Geldpolitik im Euroraum wird die nächste Zinssitzung der Europäischen Zentralbank (EZB) im Juni spannend. Im April hatten die Notenbanker die Zinsen trotz kräftig gestiegener Inflationsraten … [+4518 chars],,de,'Ölpreis'
https://www.n-tv.de/wirtschaft/S-P-und-Nasdaq-schliessen-auf-Rekordhoch-id30790017.html,https://www.n-tv.de/wirtschaft/S-P-und-Nasdaq-schliessen-auf-Rekordhoch-id30790017.html,0,www.n-tv.de,Nach überzeugenden Bilanzen: S&P und Nasdaq schließen auf Rekordhoch,Nach den Vortagesverlusten schlägt die Wall Street einen rasanten Erholungskurs ein. Wichtigster Treiber sind positiv aufgenommene Quartalszahlen. Der Einsatz des US-Militärs in der Straße von Hormus wirkt sich auf den Ölpreis aus.,https://www.n-tv.de/img/30790024/1778028132/Img_16_9/1200/Traders-work-on-the-floor-at-the-New-York-Stock-Exchange-NYSE-in-New-York-City-U-S-May-5-2026.jpg,2026-05-05T21:46:00Z,,"Nach überzeugenden BilanzenS&amp;P und Nasdaq schließen auf Rekordhoch 
Die US-Anleger sind nach zähen Tagen wieder in Kauflaune. (Foto: REUTERS)
Nach den Vortagesverlusten schlägt die Wall Street … [+3544 chars]",,de,'Ölpreis'
https://www.computerbase.de/news/storage/micron-die-250-tb-ssd-klasse-ist-mit-der-6600-ion-angekommen.97208/,https://www.computerbase.de/news/storage/micron-die-250-tb-ssd-klasse-ist-mit-der-6600-ion-angekommen.97208/,0,www.computerbase.de,Micron: Die 250-TB-SSD-Klasse ist mit der 6600 ION angekommen,"Microns bisher „größte“ SSD erreicht den Markt. Die Enterprise-SSD der Serie 6600 ION speichert 245,76 TB und damit die doppelte Datenmenge des vorherigen Spitzenmodells der Serie. Dank PCIe 5.0 sind hohe Transferraten möglich. Leistung und Energieeffizienz l…",https://pics.computerbase.de/1/2/2/5/0/7-6248e520700b161a/article-1280x720.9991d3cd.jpg,2026-05-06T07:30:00Z,,"Microns bisher größte SSD erreicht den Markt. Die Enterprise-SSD der Serie 6600 ION speichert 245,76 TB und damit die doppelte Datenmenge des vorherigen Spitzenmodells der Serie. Dank PCIe 5.0 sind h… [+3841 chars]",,de,'Energieeffizienz'
https://www.golem.de/sonstiges/zustimmung/auswahl.html?from=https://www.golem.de/news/co2-neutralitaet-klimaziele-der-eu-auf-kostenguenstigem-weg-erreichbar-2605-208350.html&referer=https://t.co/1bb23aa506,https://www.golem.de/sonstiges/zustimmung/auswahl.html?from=https://www.golem.de/news/co2-neutralitaet-klimaziele-der-eu-auf-kostenguenstigem-weg-erreichbar-2605-208350.html&referer=https://t.co/1bb23aa506,0,www.golem.de,CO2-Neutralität: Klimaziele der EU auf kostengünstigem Weg erreichbar,"Der Weg zur Unabhängigkeit von fossiler Energie und Energieimporten ist klar. Neue Simulationen zeigen, dass dies realisierbar ist - zur Hälfte. (Energiewende, Elektromobilität)",,2026-05-06T08:06:01Z,,"Besuchen Sie Golem.de wie gewohnt mit Werbung und Tracking,
 indem Sie der Nutzung aller Cookies zustimmen.
 Details zum Tracking finden Sie im Privacy Center.
Skript wurde nicht geladen. Informat… [+607 chars]",,de,'Energiewende'
https://www.faz.net/aktuell/finanzen/boerse-warum-die-ki-kluft-waechst-200796440.html,https://www.faz.net/aktuell/finanzen/boerse-warum-die-ki-kluft-waechst-200796440.html,0,www.faz.net,Hohe Investitionen: Die KI-Kluft wächst,"Die einen Unternehmen können unglaubliche Milliardensummen in KI investieren, während die anderen mit veralteter IT hadern. Die Börse selektiert streng.",https://media0.faz.net/image/w1200h627/e1336f801118/w5500h2873x0y660o/202505/43601.0.1051582736/national-energy-research.webp,2026-05-06T09:02:22Z,,"Die großen US-Techkonzerne investieren immense Summen in Künstliche Intelligenz (KI). In einem Jahr geben sie mehr aus, als die Bundesregierung in zwölf Jahren in ihrem Infrastruktur-Schuldenprogramm… [+1363 chars]",,de,'Investitionen'
https://www.zeit.de/news/2026-05/06/oelpreisschock-treibt-inflation-in-thueringen-auf-3-2-prozent,https://www.zeit.de/news/2026-05/06/oelpreisschock-treibt-inflation-in-thueringen-auf-3-2-prozent,0,www.zeit.de,"Verbraucherpreise: Ölpreisschock treibt Inflation in Thüringen auf 3,2 Prozent","Hier finden Sie Informationen zu dem Thema „Verbraucherpreise“. Lesen Sie jetzt „Ölpreisschock treibt Inflation in Thüringen auf 3,2 Prozent“.",https://img.zeit.de/news/2026-05/06/oelpreisschock-treibt-inflation-in-thueringen-auf-3-2-prozent-image-group/wide__1300x731,2026-05-06T10:05:13Z,,"Der Ölpreisschock infolge des Iran-Krieges hat die Verbraucherpreise in Thüringen deutlich nach oben getrieben. Waren und Dienstleistungen waren im April durchschnittlich 3,2 Prozent teurer als noch … [+1703 chars]",,de,'Inflation'
https://www.stern.de/gesellschaft/regional/thueringen/verbraucherpreise--oelpreisschock-treibt-inflation-in-thueringen-auf-3-2-prozent-37373880.html,https://www.stern.de/gesellschaft/regional/thueringen/verbraucherpreise--oelpreisschock-treibt-inflation-in-thueringen-auf-3-2-prozent-37373880.html,0,www.stern.de,"Verbraucherpreise: Ölpreisschock treibt Inflation in Thüringen auf 3,2 Prozent","Heizöl, Sprit, USB-Sticks: In Thüringen schnellen die Preise in die Höhe. Wer jetzt tankt oder raucht, spürt den Preisschub besonders – und auch im Supermarkt bleibt’s nicht beim Alten.",https://image.stern.de/37373882/t/Ls/v1/w1440/r1.7778/-/06--afpftkng2jv20axs2048jpeg---9361ed223fb37ade.jpg,2026-05-06T10:05:13Z,,"Kopiere den aktuellen Link
Zur Merkliste hinzufügen
Heizöl, Sprit, USB-Sticks: In Thüringen schnellen die Preise in die Höhe. Wer jetzt tankt oder raucht, spürt den Preisschub besonders und auch im… [+1902 chars]",,de,'Ölpreis'
https://www.n-tv.de/politik/Bericht-ueber-nahes-Kriegsende-Oelpreis-stuerzt-unter-100-Dollar-id30791852.html,https://www.n-tv.de/politik/Bericht-ueber-nahes-Kriegsende-Oelpreis-stuerzt-unter-100-Dollar-id30791852.html,0,www.n-tv.de,USA und Iran verhandeln wieder: Bericht über nahes Kriegsende - Ölpreis stürzt unter 100 Dollar,Nicht zum ersten Mal kommen aus Washington Signale über ein bevorstehendes Kriegsende. Doch auch die pakistanischen Vermittler sehen offenbar vielversprechende Bewegung bei den Friedensbemühungen. Auf den Märkten macht sich Hoffnung breit.,https://www.n-tv.de/img/30791919/1778071734/Img_16_9/1200/Ein-Containerschiff-liegt-vor-Anker-waehrend-im-Vordergrund-ein-kleines-Motorboot-in-der-Strasse-von-Hormus-vor-vorbeifaehrt.jpg,2026-05-06T10:55:54Z,,"Fahren bald wieder Schiffe durch die Straße von Hormus? (Foto: picture alliance/dpa/ISNA/AP)
Nicht zum ersten Mal kommen aus Washington Signale über ein bevorstehendes Kriegsende. Doch auch die paki… [+4081 chars]",,de,'Ölpreis'
https://www.faz.net/aktuell/finanzen/dax-ueber-25-000-punkte-oelpreis-rutscht-ab-200804681.html,https://www.faz.net/aktuell/finanzen/dax-ueber-25-000-punkte-oelpreis-rutscht-ab-200804681.html,0,www.faz.net,Börse: Dax überwindet die Marke von 25.000 Punkten – Ölpreis rutscht ab,"Der deutsche Leitindex hat die 25.000-Punkte-Marke zum ersten Mal seit Beginn des Irankriegs geknackt. Der Ölpreis rutscht ab, der Goldpreis ist im Aufwind.",https://media0.faz.net/image/w1200h627/fe4bc58fc068/w4916h2568x0y106o/202605/43601.0.2047022853/das-moegliche-ende-des-usa.webp,2026-05-06T12:03:21Z,,"Neue Hoffnungen auf ein baldiges Ende des Konflikts zwischen den USA und Iran sorgen für Aufbruchstimmung an den Börsen. Der Dax notierte am Mittwoch am frühen Nachmittag rund 2,7 Prozent höher über … [+2860 chars]",,de,'Ölpreis'
https://www.stern.de/wirtschaft/news/folgen-des-kriegs--nahostkrieg-treibt-spritpreise---aber-weniger-stark-als-2022-37376512.html,https://www.stern.de/wirtschaft/news/folgen-des-kriegs--nahostkrieg-treibt-spritpreise---aber-weniger-stark-als-2022-37376512.html,0,www.stern.de,Folgen des Kriegs: Nahostkrieg treibt Spritpreise – aber weniger stark als 2022,Autofahrer bekommen die Folgen des Iran-Kriegs an den Tankstellen zu spüren. Neue Daten zeigen kräftige Preisanstiege. Der historische Vergleich zeigt aber noch höhere Sprünge in früheren Krisen.,https://image.stern.de/37376514/t/_U/v1/w1440/r1.7778/-/07--2qbfjofuemv3axs2048jpeg---82f204d81fcdaffd.jpg,2026-05-07T06:48:49Z,,"Kopiere den aktuellen Link
Zur Merkliste hinzufügen
Autofahrer bekommen die Folgen des Iran-Kriegs an den Tankstellen zu spüren. Neue Daten zeigen kräftige Preisanstiege. Der historische Vergleich … [+1858 chars]",,de,'Preisanstieg'
https://www.tagesspiegel.de/wirtschaft/folgen-des-kriegs-nahostkrieg-treibt-spritpreise--aber-weniger-stark-als-2022-15567667.html,https://www.tagesspiegel.de/wirtschaft/folgen-des-kriegs-nahostkrieg-treibt-spritpreise--aber-weniger-stark-als-2022-15567667.html,0,www.tagesspiegel.de,Folgen des Kriegs: Nahostkrieg treibt Spritpreise – aber weniger stark als 2022,Autofahrer bekommen die Folgen des Iran-Kriegs an den Tankstellen zu spüren. Neue Daten zeigen kräftige Preisanstiege. Der historische Vergleich zeigt aber noch höhere Sprünge in früheren Krisen.,https://www.tagesspiegel.de/images/15567666/alternates/BASE_16_9_W1400/1778136593000/hohe-spritpreise.jpeg,2026-05-07T06:49:53Z,,Die Preisanstiege bei Energie wegen des Iran-Kriegs sind ähnlich stark wie in früheren Öl- und Weltwirtschaftskrisen - aber weniger heftig als im Ukraine-Krieg 2022. Das zeigen Daten des Statistische… [+1700 chars],,de,'Preisanstieg'
https://www.diepresse.com/22076960/in-den-usa-steht-ein-neues-geldpolitisches-zeitalter-bevor-das-hat-auch,https://www.diepresse.com/22076960/in-den-usa-steht-ein-neues-geldpolitisches-zeitalter-bevor-das-hat-auch,0,www.diepresse.com,In den USA steht ein neues geldpolitisches Zeitalter bevor: Das hat auch Auswirkungen auf den Euro [premium],"Der künftige Chef der US-Notenbank Fed, Kevin Warsh, will die Geldpolitik umkrempeln und sich an eine ganz andere Inflationsberechnung als bisher üblich halten. So sieht das Modell aus. Und so beeinflusst es andere Währungen.",https://img.diepresse.com/public/incoming/259p30-dollarimagojpg/alternates/WEBP_WIDE_1200/Dollar_Imago.jpg,2026-05-07T09:26:19Z,,"Als sich Kevin Warsh am 21. April dem US-Senat stellte, sprach der designierte Chef der Notenbank Fed viel über sein Verhältnis zu Donald Trump. Ob ihn der Präsident jemals dazu aufgefordert hatte, d… [+5178 chars]",,de,'Inflation'
https://www.n-tv.de/wirtschaft/Spritpreise-steigen-durch-Iran-Krieg-weniger-stark-als-2022-id30795768.html,https://www.n-tv.de/wirtschaft/Spritpreise-steigen-durch-Iran-Krieg-weniger-stark-als-2022-id30795768.html,0,www.n-tv.de,Kriegsausbrüche im Vergleich: Spritpreise steigen weniger stark als 2022,"Seit Beginn des Krieges im Nahen Osten belasten hohe Preise für Kraftstoffe viele Autofahrer in Deutschland. Zu Beginn des Ukraine-Krieges war der Preisanstieg jedoch noch stärker. Statistiker erklären, woran das liegt.",https://www.n-tv.de/img/30795378/1778149184/Img_16_9/1200/Hohe-Spritpreise-an-den-Tankstellen-belasten-Autofahrer-in-Deutschland.jpg,2026-05-07T09:56:55Z,,"Autofahrer bekommen die Folgen des Iran-Kriegs durch hohe Kraftstoffpreise zu spüren. 
Seit Beginn des Krieges im Nahen Osten belasten hohe Preise für Kraftstoffe viele Autofahrer in Deutschland. Zu… [+1996 chars]",,de,'Preisanstieg'
https://www.stern.de/wirtschaft/news/preisanstiege-im-vergleich--fuenf-minuten-arbeit-fuer-einen-liter-sprit-37376586.html,https://www.stern.de/wirtschaft/news/preisanstiege-im-vergleich--fuenf-minuten-arbeit-fuer-einen-liter-sprit-37376586.html,0,www.stern.de,Preisanstiege im Vergleich: Fünf Minuten Arbeit für einen Liter Sprit,Für einen Liter Benzin musste ein durchschnittlicher Arbeitnehmer im April fünf Minuten arbeiten. Der Ölpreisanstieg durch den Iran-Krieg ist aber weniger heftig als nach Ausbruch des Ukraine-Kriegs.,https://image.stern.de/37377304/t/iD/v1/w1440/r1.7778/-/07--r7zziz2kggv1axs2048jpeg---6cb6c6c8f66f864b.jpg,2026-05-07T10:21:52Z,,"Kopiere den aktuellen Link
Zur Merkliste hinzufügen
Für einen Liter Benzin musste ein durchschnittlicher Arbeitnehmer im April fünf Minuten arbeiten. Der Ölpreisanstieg durch den Iran-Krieg ist abe… [+2886 chars]",,de,'Ölpreis'
https://www.tagesspiegel.de/wirtschaft/preisanstiege-im-vergleich-funf-minuten-arbeit-fur-einen-liter-sprit-15569545.html,https://www.tagesspiegel.de/wirtschaft/preisanstiege-im-vergleich-funf-minuten-arbeit-fur-einen-liter-sprit-15569545.html,0,www.tagesspiegel.de,Preisanstiege im Vergleich: Fünf Minuten Arbeit für einen Liter Sprit,Für einen Liter Benzin musste ein durchschnittlicher Arbeitnehmer im April fünf Minuten arbeiten. Der Ölpreisanstieg durch den Iran-Krieg ist aber weniger heftig als nach Ausbruch des Ukraine-Kriegs.,https://www.tagesspiegel.de/images/15569544/alternates/BASE_16_9_W1400/1778149381000/last-durch-spritpreise-laut-ifo-institut-nicht-hoher.jpeg,2026-05-07T10:23:01Z,,Die gestiegenen Preise für Benzin und Diesel belasten Arbeitnehmer nach Ansicht von Experten des Dresdner Ifo-Instituts nicht mehr als in vergangenen Jahren. Grund dafür sind die stetig gestiegenen L… [+2728 chars],,de,'Ölpreis'
https://www.stern.de/digital/technik/so-lassen-sich-mit-einer-eigenen-pv-anlage-stromkosten-sparen--37376836.html,https://www.stern.de/digital/technik/so-lassen-sich-mit-einer-eigenen-pv-anlage-stromkosten-sparen--37376836.html,0,www.stern.de,Hohe Benzin- und Energiepreise: So lassen sich mit einer eigenen PV-Anlage Stromkosten sparen,"Strom bleibt teuer, Benzin ebenfalls. Eine eigene PV-Anlage kann helfen, die Energiekosten zu senken. Entscheidend ist dabei, wie viel Solarstrom selbst genutzt wird.",https://image.stern.de/37377146/t/kg/v1/w1440/r1.7778/-/hohe-energie--und-benzinpreise--so-laesst-sich-mit-einer-solaranlage-sparen.jpg,2026-05-07T12:58:00Z,,"Kopiere den aktuellen Link
Zur Merkliste hinzufügen
Strom bleibt teuer, Benzin ebenfalls. Eine eigene PV-Anlage kann helfen, die Energiekosten zu senken. Entscheidend ist dabei, wie viel Solarstrom… [+6657 chars]",,de,'Heizkosten'
https://www.faz.net/aktuell/wirtschaft/unternehmen/shell-goldene-zeiten-fuer-oelkonzerne-200809256.html,https://www.faz.net/aktuell/wirtschaft/unternehmen/shell-goldene-zeiten-fuer-oelkonzerne-200809256.html,0,www.faz.net,Hoher Ölpreis: Goldene Zeiten für Ölkonzerne,"Nach BP und Equinor meldet nun auch Shell einen steilen Gewinnsprung. Der Vorstandschef allerdings warnt vor den Folgen, die der Irankrieg nach sich ziehen könnte.",https://media0.faz.net/image/w1200h627/dacacf973542/w8172h4269x0y164o/202605/43601.0.2057286870/gewinnsprung-shell-profitiert.webp,2026-05-07T14:08:04Z,,"Die Öl- und Gasindustrie verbucht so hohe Gewinnsteigerungen wie lange nicht. Hohe Preise, eine starke Nachfrage im Handel und gestiegene Raffineriemargen infolge der Krise rund um den Irankrieg habe… [+2539 chars]",,de,'Ölpreis'
https://www.nzz.ch/schweiz/marktaufseher-warnt-vor-stromknappheit-und-fordert-in-aller-deutlichkeit-das-umstrittene-abkommen-mit-der-eu-ld.10006206,https://www.nzz.ch/schweiz/marktaufseher-warnt-vor-stromknappheit-und-fordert-in-aller-deutlichkeit-das-umstrittene-abkommen-mit-der-eu-ld.10006206,0,www.nzz.ch,Marktaufseher warnt vor Stromknappheit und fordert «in aller Deutlichkeit» das umstrittene Abkommen mit der EU,"Im Winter hat die Schweiz nur genügend Strom, weil in Frankreich Atomkraftwerke laufen.","https://img-msp-prod.nzz.ch/2026/05/07/f029ab28-92f0-4980-9227-c209bb017ce2.jpg?width=1200&height=674&fit=bounds&quality=75&auto=webp&crop=5862,3297,x0,y76&wmark=nzz",2026-05-07T15:03:13Z,,"Im Winter hat die Schweiz nur genügend Strom, weil in Frankreich Atomkraftwerke laufen.
Zusammenfassung
Merken
Alles andere als ein Stromabkommen mit der EU sei «höchst problematisch», sagt Elcom-… [+5085 chars]",,de,'Winter'
https://www.welt.de/wirtschaft/article69fc82160696bba25ef31cf6/umweltminister-nicht-vorschlag-der-bundesregierung-schneider-stellt-sich-gegen-reiches-energie-reform.html,https://www.welt.de/wirtschaft/article69fc82160696bba25ef31cf6/umweltminister-nicht-vorschlag-der-bundesregierung-schneider-stellt-sich-gegen-reiches-energie-reform.html,0,www.welt.de,„Nicht Vorschlag der Bundesregierung“ – Schneider stellt sich gegen Reiches Energie-Reform,"Bei der Reform des Erneuerbare-Energien-Gesetzes gibt es noch viel Streit zwischen Union und SPD. Zwar hat Wirtschaftsministerin Katherina Reiche einen Gesetzentwurf vorgelegt, aber davon distanziert sich Umweltminister Carsten Schneider (SPD).",https://images.welt.de/69fc82160696bba25ef31cf6/0e5dbd3c60dcd235453254afe74da107-master/ci16x9-w1200/dpa-com-260426-935-1304392-jpg,2026-05-07T15:04:56Z,,"Bei der Reform des Erneuerbare-Energien-Gesetzes gibt es noch viel Streit zwischen Union und SPD. Zwar hat Wirtschaftsministerin Katherina Reiche einen Gesetzentwurf vorgelegt, aber davon distanziert… [+5179 chars]",,de,'Energieeffizienz'
https://www.faz.net/aktuell/wirtschaft/unternehmen/unabhaengigkeit-schuetzen-wirtschaftsprueferkammer-will-finanzinvestoren-auf-die-finger-schauen-accg-200808711.html,https://www.faz.net/aktuell/wirtschaft/unternehmen/unabhaengigkeit-schuetzen-wirtschaftsprueferkammer-will-finanzinvestoren-auf-die-finger-schauen-accg-200808711.html,0,www.faz.net,Private Equity steigt ein: Aufsicht will Investitionen in Prüffirmen streng kontrollieren,"Wirtschaftsprüfer brauchen Geld, um in Künstliche Intelligenz zu investieren. Das ruft Finanzinvestoren auf den Plan. Die Wirtschaftsprüferkammer kündigt Kontrollen an, um die Unabhängigkeit der Bilanzprüfung zu sichern.",https://media0.faz.net/image/w1200h627/4db7303117c2/w7008h3661x0y505o/202508/43601.0.1224078324/stimmt-die-bilanz-fuer-die.webp,2026-05-08T05:18:00Z,,"Während das Interesse von Finanzinvestoren an Wirtschaftsprüfergesellschaften wächst, stellt sich die Aufsicht schützend vor die Unabhängigkeit des Berufsstands. Unsere Position ist die eines durchau… [+3289 chars]",,de,'Investitionen'
https://www.computerbase.de/news/gaming/preiserhoehung-auch-nintendo-switch-2-wird-ab-september-teurer.97269/,https://www.computerbase.de/news/gaming/preiserhoehung-auch-nintendo-switch-2-wird-ab-september-teurer.97269/,0,www.computerbase.de,Preiserhöhung: Auch Nintendo Switch 2 wird ab September teurer,"Aus einem Gerücht wird Realität: Auch Nintendos aktuelle Spielkonsole wird ab September teurer. Statt aktuell 469,99 Euro wird der UVP dann 499,99 Euro betragen. Das Entspricht einem Preisanstieg um 30 Euro oder sechs Prozent. Der Stichtag 1. September 2026 g…",https://pics.computerbase.de/1/2/2/5/7/2-13b8b61d0b220083/article-1280x720.8a6b3bdf.jpg,2026-05-08T08:33:00Z,,"Aus einem Gerücht wird Realität: Auch Nintendos aktuelle Spielkonsole wird ab September teurer. Statt aktuell 469,99 Euro wird der UVP dann 499,99 Euro betragen. Das Entspricht einem Preisanstieg um … [+491 chars]",,de,'Preisanstieg'
