index,url,valid,domain,title,description,image,published,archive,content,quote,language,keyword
https://www.stern.de/gesellschaft/regional/mecklenburg-vorpommern/windenergie--baustart-fuer-letzten-windpark-von-dreierverbund-vor-ruegen-36096990.html,https://www.stern.de/gesellschaft/regional/mecklenburg-vorpommern/windenergie--baustart-fuer-letzten-windpark-von-dreierverbund-vor-ruegen-36096990.html,0,www.stern.de,Windenergie: Baustart für letzten Windpark von Dreierverbund vor Rügen,Der Windpark Windanker soll eine Dreiergruppe von Offshore-Windpark nordöstlich vor Rügen vervollständigen. Nun ist der Bau gestartet. Weitere Parks sind bereits geplant.,https://image.stern.de/36096992/t/4x/v1/w1440/r1.7778/-/01--s4ihe4kxyhv7axs2048jpeg---de60620fde60564a.jpg,2025-10-01T10:21:38Z,,"Kopiere den aktuellen Link
Zur Merkliste hinzufügen
Der Windpark Windanker soll eine Dreiergruppe von Offshore-Windpark nordöstlich vor Rügen vervollständigen. Nun ist der Bau gestartet. Weitere Pa… [+1452 chars]",,de,'Windenergie'
https://www.diepresse.com/20156442/teuerung-bei-vier-prozent-wie-es-mit-der-inflation-weitergeht,https://www.diepresse.com/20156442/teuerung-bei-vier-prozent-wie-es-mit-der-inflation-weitergeht,0,www.diepresse.com,Teuerung bei vier Prozent – wie es mit der Inflation weitergeht [premium],Die heimische Inflationsrate machte im September vier Prozent aus – und blieb damit weiterhin hoch. Daran wird sich so schnell auch nichts ändern. 2026 ist aber Besserung in Sicht.,https://img.diepresse.com/public/incoming/czj1qz-438250452.jpg/alternates/DPR_SOCIAL_NACHRICHTEN/438250452.jpg,2025-10-01T13:10:19Z,,Die Inflationsraten in Österreich sind vergleichsweise hoch und daran hat sich auch im September nichts geändert. Einer Schnellschätzung der Statistik Austria zufolge zogen die Preise zuletzt um vier… [+4138 chars],,de,'Inflation'
https://www.tagesspiegel.de/berlin-brandenburg-hochster-stand-dieses-jahr-inflation-steigt-auf-24-prozent-14442641.html,https://www.tagesspiegel.de/berlin-brandenburg-hochster-stand-dieses-jahr-inflation-steigt-auf-24-prozent-14442641.html,0,www.tagesspiegel.de,"Berlin / Brandenburg: Höchster Stand dieses Jahr: Inflation steigt auf 2,4 Prozent","Höchster Stand dieses Jahr: Inflation steigt auf 2,4 Prozent",,2025-10-01T13:42:35Z,,"Die Inflationsrate in Deutschland ist mit 2,4 Prozent im September auf den höchsten Stand im laufenden Jahr gestiegen. Das teilte das Statistische Bundesamt auf Basis vorläufiger Zahlen mit.
© dpa-i… [+83 chars]",,de,'Inflation'
https://www.jungewelt.de/artikel/509562.stahlindustrie-stahltarif-unter-inflation.html,https://www.jungewelt.de/artikel/509562.stahlindustrie-stahltarif-unter-inflation.html,0,www.jungewelt.de,Stahlindustrie: Stahltarif unter Inflation,"IG Metall und Stahlverband einigen sich in vierter Gesprächsrunde. Das Ziel der Gewerkschaft, den Ausgleich der Teuerung, hat sie nicht erreicht. Vorstand will nun Entlastung für Konzerne.",https://www.jungewelt.de/img/1100/214013.jpg,2025-10-01T17:35:53Z,,"Nun steht ein Tarifabschluss in der Stahlindustrie, vorerst für den Nordwesten der BRD. Die IG Metall und der Kapitalverband Stahl einigten sich in der Nacht zum Mittwoch, nachdem die Friedenspflicht… [+3560 chars]",,de,'Inflation'
https://www.sueddeutsche.de/wirtschaft/inflation-familie-kinder-sparen-li.3290317,https://www.sueddeutsche.de/wirtschaft/inflation-familie-kinder-sparen-li.3290317,0,www.sueddeutsche.de,"Inflation: Kinder, wir müssen sparen!","Musikunterricht und Markenklamotten sind ganz schön teuer geworden. Mit der Familie essen gehen, kostet ein halbes Vermögen. Wie erklärt man es den Kindern, wenn die Inflation zuschlägt?",https://www.sueddeutsche.de/2025/09/30/fdb76f1c-a0d5-42cc-a7fa-04ca3ed8c89d.jpg?q=60&fm=webp&width=1200&rect=0%2C60%2C3200%2C1800,2025-10-01T18:11:51Z,,"Es sind die kleinen Dinge, die plötzlich schmerzen. Die früher doch noch drin waren, ohne dass man darüber Gedanken verlor. Die Kugel Eis über zwei Euro. Einmal Pommes rot-weiß im Schwimmbad kostet i… [+349 chars]",,de,'Inflation'
https://www.nzz.ch/sport/ski/ski-alpin-kinofilm-begleitet-odermatt-und-sarrazin-auf-piste-und-im-spital-ld.1904579,https://www.nzz.ch/sport/ski/ski-alpin-kinofilm-begleitet-odermatt-und-sarrazin-auf-piste-und-im-spital-ld.1904579,0,www.nzz.ch,Vom Siegerpodest bis ins Spital: Ein Kinofilm begleitet die Abfahrer um Odermatt und Sarrazin durch den Winter,Die Dokumentation «Downhill Skiers» feierte am Zurich Film Festival Premiere. Neben spektakulären Action-Bildern zeigt er auch die verletzliche Seite der Draufgänger.,"https://img.nzz.ch/2025/10/01/da28e1c1-9615-4650-b347-bc38be2da88b.jpg?width=1200&height=675&fit=bounds&quality=75&auto=webp&crop=3584,2016,x128,y0&wmark=nzz",2025-10-02T03:30:00Z,,"Die Dokumentation «Downhill Skiers» feierte am Zurich Film Festival Premiere. Neben spektakulären Action-Bildern zeigt er auch die verletzliche Seite der Draufgänger.
Szene aus dem Dokumentarfilm «D… [+7781 chars]",,de,'Winter'
https://www.nzz.ch/wirtschaft/der-angriff-russlands-auf-die-ukraine-stuerzte-europa-in-eine-energiekrise-das-sollen-schweizer-stromhaendler-ausgenutzt-haben-ld.1904965,https://www.nzz.ch/wirtschaft/der-angriff-russlands-auf-die-ukraine-stuerzte-europa-in-eine-energiekrise-das-sollen-schweizer-stromhaendler-ausgenutzt-haben-ld.1904965,0,www.nzz.ch,Der Angriff Russlands auf die Ukraine stürzte Europa in eine Energiekrise. Das sollen Schweizer Stromhändler ausgenutzt haben,Eine neue Untersuchung der unabhängigen Strommarktaufsicht kommt zu einem brisanten Schluss.,"https://img.nzz.ch/2025/10/01/35b9d1a0-cb39-4c5d-a5c8-42d9072a419d.jpg?width=1200&height=674&fit=bounds&quality=75&auto=webp&crop=1474,829,x152,y0&wmark=nzz",2025-10-02T03:30:00Z,,"Eine neue Untersuchung der unabhängigen Strommarktaufsicht kommt zu einem brisanten Schluss.
Während der Energiekrise 2022 verkauften Schweizer Händler ihren Strom besonders teuer: die Staumauer Gra… [+9476 chars]",,de,'Winter'
https://www.bild.de/sport/fussball/noch-lange-nicht-am-limit-kurz-vor-nati-debuet-hoeness-lobt-jaquez-68dd572d6b68b965a656afed,https://www.bild.de/sport/fussball/noch-lange-nicht-am-limit-kurz-vor-nati-debuet-hoeness-lobt-jaquez-68dd572d6b68b965a656afed,0,www.bild.de,„Noch lange nicht am Limit“ - Kurz vor Nati-Debüt! Hoeneß lobt Jaquez,Im Winter kam Innenverteidiger Luca Jaquez (22) für sieben Millionen Euro vom FC Luzern zum VfB. Jetzt schwärmt Trainer Sebastian Hoeneß (43) vom Schweizer.,"https://images.bild.de/68dd572d6b68b965a656afed/ff22e2d8a8ff3f4ed777bce52464ece7,5f271cf?w=1280",2025-10-02T08:29:04Z,,"Sie sollen Anschläge in Deutschland geplant haben: Hier kommen die mutmaßlichen Hamas-Terroristen zur Haftvorführung
Sie sollen Anschläge in Deutschland geplant haben: Hier kommen die mutmaßlichen H… [+978 chars]",,de,'Winter'
https://www.waz.de/ratgeber-wissen/energie/article408896370/kleines-kraftwerk-senkt-preis-balkonkraftwerk-anker-solix-speicher.html,https://www.waz.de/ratgeber-wissen/energie/article408896370/kleines-kraftwerk-senkt-preis-balkonkraftwerk-anker-solix-speicher.html,0,www.waz.de,"Während die Inflation steigt, sinkt der Preis für dieses Balkonkraftwerk","Kleines Kraftwerk macht mit erneuter Preisreduktion sein Quattro-Set mit Anker Solix Solarbank 3 E2700 Pro im Oktober noch attraktiver. Lesen Sie hier, was es kann und kostet.",https://img.sparknews.funkemedien.de/410139256/410139256_1759400248_v16_9_1600.jpeg,2025-10-02T10:19:00Z,,"Strom wird teurer wer gegensteuern will, setzt auf Eigenproduktion. Dieses Komplettset bietet alles, was es dafür braucht: vier starke Solarmodule, eine smarte Speicherlösung mit Notstromfunktion und… [+4991 chars]",,de,'Inflation'
https://steiermark.orf.at/stories/3323840/,https://steiermark.orf.at/stories/3323840/,0,steiermark.orf.at,Viele Unfälle könnten verhindert werden,"In etwa zwei Monaten starten die steirischen Skigebiete in die Wintersaison. Experten erinnern, dass sich Skifahrer gut vorbereiten sollten. Denn viele Unfälle seien auf mangelnde Fitness und schlechtes oder ungenügendes Material zurückzuführen.",https://ibs.orf.at/stm?image=https%3A%2F%2Foekastatic.orf.at%2Fmims%2F2023%2F46%2F14%2Fcrops%2Fw%3D1200%2Ch%3D627%2Cq%3D75%2F2006086_master_755914_37175_skifahren_sujet_c_orf_felix_novak_32.jpg%3Fs%3Da30efd3722e72c894d27669a734582a71e743e3f,2025-10-03T06:11:00Z,,"Über den Sommer wurden teilweise Millionenbeträge in die Infrastruktur der Skigebiete investiert mehr dazu auch in Liftkarten werden im heurigen Winter teurer (27.9.2025).
Aber nicht nur die Skigebi… [+3114 chars]",,de,'Winter'
https://www.sueddeutsche.de/reise/skifahren-oesterreich-skipass-preise-li.3319421,https://www.sueddeutsche.de/reise/skifahren-oesterreich-skipass-preise-li.3319421,0,www.sueddeutsche.de,Wintersport: Skipässe so teuer wie noch nie,Die Preise für Tagesskipässe in Österreich steigen stark und erreichen Rekorde von über 80 Euro. Experten warnen vor einem Rückgang der Skifahrerzahlen. Günstigere Angebote für Familien könnten die Situation entschärfen.,https://www.sueddeutsche.de/2025/10/02/c480da9c-d2c9-4773-8243-63064ddd0af8.jpg?q=60&fm=webp&width=1200&rect=0%2C211%2C4000%2C2250,2025-10-03T08:05:12Z,,"Kaum eine Teuerung scheint das Blut der Alpen-Fans so sehr in Wallung zu bringen wie jene für Schnitzel und Skiticket. Wobei auf das Schnitzel im Notfall verzichtet werden kann, auf keinen Fall aber … [+480 chars]",,de,'Winter'
https://www.diepresse.com/20158624/schichtwechsel-was-man-diesen-winter-darueber-traegt,https://www.diepresse.com/20158624/schichtwechsel-was-man-diesen-winter-darueber-traegt,0,www.diepresse.com,Schichtwechsel: Was man diesen Winter darüber trägt [premium],"Wer den idealen Mantel, die perfekte Jacke schon im Kasten hat, hat Glück. Für alle anderen kommt mit der kalten Jahreszeit die Suche nach dem richtigen Darüber. Die Trends von den Laufstegen liefern Shopping-Inspiration.",https://img.diepresse.com/public/incoming/cppp7s-1-min.png/alternates/DPR_SOCIAL_NACHRICHTEN/1-min.png,2025-10-03T08:09:23Z,,"Das Wichtigste vorneweg: Nein, Echtpelz ist nicht in Mode. Die Designer setzen auf hochwertige und teils aus Recyclingstoffen hergestellte Kunstfelle, um uns flauschig umhüllt durch den Winter zu bri… [+2814 chars]",,de,'Winter'
https://stadt-bremerhaven.de/apple-tv-die-schwestern-grimm-erster-trailer-zur-fantasy-abenteuerserie-ist-da/,https://stadt-bremerhaven.de/apple-tv-die-schwestern-grimm-erster-trailer-zur-fantasy-abenteuerserie-ist-da/,0,stadt-bremerhaven.de,Apple TV+ „Die Schwestern Grimm“: Trailer zur Fantasy-Abenteuerserie,"Apple hat neulich einen Trailer zur Fantasy-Abenteuerserie „Die Schwestern Grimm“ veröffentlicht. Die Serie basiert auf dem New-York-Times-Bestsellerreihe „Die Grimm Akten“ von Michael Buckley. Die englischen Stimmen sind unter anderem mit Ariel Winter, Leah …",https://stadt-bremerhaven.de/wp-content/uploads/2024/06/apple-tv__e7aqjl2rqzau_og.jpg,2025-10-03T10:40:08Z,,Apple hat neulich einen Trailer zur Fantasy-Abenteuerserie Die Schwestern Grimm veröffentlicht. Die Serie basiert auf dem New-York-Times-Bestsellerreihe Die Grimm Akten von Michael Buckley. Die engli… [+1412 chars],,de,'Winter'
https://www.urlaubspiraten.de/pauschalreisen/winterflucht-fuerteventura-gutes-wetter-kurze-flugzeit,https://www.urlaubspiraten.de/pauschalreisen/winterflucht-fuerteventura-gutes-wetter-kurze-flugzeit,0,www.urlaubspiraten.de,Winterflucht Fuerteventura: Gutes Wetter + kurze Flugzeit ,"Heiße Winterflucht-Deals für den anstehenden Winter im Anflug! Sommer war meh - und deshalb verstehen wir, wenn der Sonnendurst nach den letzten Monaten noch nicht gestillt ist. Ja, denn irgendwie haben es eher die Sommerklamotten geschafft im Schrank einzu…",https://image.urlaubspiraten.de/720/image/upload/v1655808551/mediavault_images/AdobeStock_322069975_fjxe7e.jpg,2025-10-03T13:00:00Z,,"Heiße Winterflucht-Deals für den anstehenden Winter im Anflug! 
Sommer war meh - und deshalb verstehen wir, wenn der Sonnendurst nach den letzten Monaten noch nicht gestillt ist. Ja, denn irgendwie … [+897 chars]",,de,'Winter'
https://www.teltarif.de/winterreifen-standardgroesse-ebay-deal/news/99950.html,https://www.teltarif.de/winterreifen-standardgroesse-ebay-deal/news/99950.html,0,www.teltarif.de,ADAC-Testsieger in Standardgröße: Jetzt mit Gutschein sparen,Ein Gutschein bei eBay verbilligt Winterreifen um 10 Prozent. Auch die Testsieger in Standardgröße gibt es hier günstiger.,https://www.teltarif.de/img/arch/2025/kw40/winterreifen-standardgroesse-ebay-deal-1og.jpg,2025-10-03T14:50:00Z,,"Pünkt­lich zum Beginn der Winter­reifen­saison ""von Oktober bis Ostern"" startet eBay einen neuen Gutschein­code. Mit REIFEN25REIFEN25 sinken die Preise um 10 Prozent oder 50 Euro - das bringt reihen­… [+5388 chars]",,de,'Winter'
