index,url,valid,domain,title,description,image,published,archive,content,quote,language,keyword
https://www.tagesspiegel.de/wirtschaft/nach-kritik-vom-macron-us-prasident-biden-verspricht-europaern-anderungen-am-anti-inflationspaket-8958127.html,https://www.tagesspiegel.de/wirtschaft/nach-kritik-vom-macron-us-prasident-biden-verspricht-europaern-anderungen-am-anti-inflationspaket-8958127.html,0,www.tagesspiegel.de,Nach Kritik vom Macron: US-Präsident Biden verspricht Europäern Änderungen am Anti-Inflationspaket,Insidern zufolge nannte Macron das US-Gesetz „super aggressiv“ gegenüber europäischen Unternehmen. Biden kündigte Nachbesserungen an.,https://www.tagesspiegel.de/internationales/images/topshot-us-france-diplomacy-politics-biden-macron/alternates/BASE_16_9_W1400/topshot-us-france-diplomacy-politics-biden-macron.jpeg,2022-12-02T07:59:56Z,https://web.archive.org/web/20221202091337/https://www.tagesspiegel.de/wirtschaft/nach-kritik-vom-macron-us-prasident-biden-verspricht-europaern-anderungen-am-anti-inflationspaket-8958127.html,"US-Präsident Joe Biden hat den Staatsbesuch des französischen Präsidenten Emmanuel Macron genutzt, um den Ärger der Europäer über das amerikanische Anti-Inflationspaket zu besänftigen. Wir können Änd… [+1356 chars]",,de,'Inflation'
https://www.tagesspiegel.de/berlin/der-fachkraftemangel-ist-eine-riesige-herausforderung-giffey-fordert-klimaaktivisten-zum-anpacken-statt-ankleben-auf-8959288.html,https://www.tagesspiegel.de/berlin/der-fachkraftemangel-ist-eine-riesige-herausforderung-giffey-fordert-klimaaktivisten-zum-anpacken-statt-ankleben-auf-8959288.html,0,www.tagesspiegel.de,„Der Fachkräftemangel ist eine riesige Herausforderung“ : Giffey fordert Klimaaktivisten zum „Anpacken statt Ankleben“ auf,"Geld für erneuerbare Energien sei da, doch etwa die Solarinstallateure fehlten, sagt Berlins Regierende – und wirbt bei der „Letzten Generation“ fürs Handwerk.",https://www.tagesspiegel.de/images/25-gewerkschaftstag-dbb-beamtenbund1/alternates/BASE_16_9_W1400/25-gewerkschaftstag-dbb-beamtenbund.jpeg,2022-12-02T11:02:41Z,https://web.archive.org/web/20221202114126/https://www.tagesspiegel.de/berlin/der-fachkraftemangel-ist-eine-riesige-herausforderung-giffey-fordert-klimaaktivisten-zum-anpacken-statt-ankleben-auf-8959288.html,"Berlins Regierende Bürgermeisterin Franziska Giffey hat Aktivisten der Gruppe Letzte Generation aufgerufen, beim Kampf gegen die Klimakrise mit handwerklicher Tatkraft mitzuhelfen. Anpacken statt ank… [+1074 chars]",,de,'Erneuerbare'
https://www.n-tv.de/wissen/Das-Ausland-baut-seine-Waelder-fuer-Deutschland-in-Plantagen-um-article23751690.html,https://www.n-tv.de/wissen/Das-Ausland-baut-seine-Waelder-fuer-Deutschland-in-Plantagen-um-article23751690.html,0,www.n-tv.de,"Schlimmer Boom der Holzheizungen: ""Das Ausland baut seine Wälder für Deutschland in Plantagen um""","Mehr als eine Million Haushalte in Deutschland heizen primär mit Holz. Denn das gilt nicht nur als gemütlich, sondern auch günstig, grün und nachhaltig. Angaben, denen Pierre Ibisch jedoch entschieden widerspricht. Der Biologe erklärt im ""Klima-Labor"", wie de…",https://bilder2.n-tv.de/img/incoming/crop23753037/4181324650-cImg_16_9-w1200/264565606.jpg,2022-12-02T15:21:29Z,https://web.archive.org/web/20221203064635/https://www.n-tv.de/wissen/Das-Ausland-baut-seine-Waelder-fuer-Deutschland-in-Plantagen-um-article23751690.html,"Rund 1,1 Millionen Haushalte in Deutschland nutzen Holz als primäre Energiequelle. Aus Angst vor steigenden Preisen für Gas und Heizöl haben vor allem in diesem Jahr nochmals viele Menschen bei Pelle… [+13059 chars]",,de,'Erneuerbare'
https://www.jungewelt.de/artikel/440000.arbeitskampf-tarifclinch-ergebnislos.html,https://www.jungewelt.de/artikel/440000.arbeitskampf-tarifclinch-ergebnislos.html,0,www.jungewelt.de,Arbeitskampf: Tarifclinch ergebnislos,Streikwoche beim Windenergiehersteller Vestas. Firmenbosse wollen nicht mit IG Metall verhandeln • Foto: Georg Wendt/dpa,https://www.jungewelt.de/img/1100/174569.jpg,2022-12-02T18:38:34Z,,"Im Tarifkonflikt beim Windenergiehersteller Vestas gibt es bislang keine Lösung. Am Freitag endete eine fünftägige Streikwoche, die am Donnerstag mit einer Kundgebung vor der Hamburger Deutschlandzen… [+3336 chars]",,de,'Windenergie'
https://www.focus.de/politik/ausland/zweitaegiger-aufenthalt-baerbock-reist-nach-indien-russland-und-energiewende-im-zentrum_id_180425917.html,https://www.focus.de/politik/ausland/zweitaegiger-aufenthalt-baerbock-reist-nach-indien-russland-und-energiewende-im-zentrum_id_180425917.html,0,www.focus.de,Zweitägiger Aufenthalt - Baerbock reist nach Indien - Russland und Energiewende im Zentrum,Außenministerin Annalena Baerbock (Grüne) reist an diesem Sonntag vor dem Hintergrund der weltweiten Folgen des russischen Angriffskriegs auf die Ukraine nach Indien.,https://p6.focus.de/img/politik/ausland/id_180415005/aussenministerin-annalena-baerbock-spricht-mit-journalisten-beim-treffen-der-nato-aussenminister..jpg?im=Crop%3D%280%2C170%2C2048%2C1024%29%3BResize%3D%281200%2C627%29&hash=5b0c9417b83e967e39602674c6a302331ec1af4c64df998950a6ae236619b76d,2022-12-03T03:50:38Z,,Außenministerin Annalena Baerbock (Grüne) reist an diesem Sonntag vor dem Hintergrund der weltweiten Folgen des russischen Angriffskriegs auf die Ukraine nach Indien. Annalena Baerbock (Grüne) starte… [+2005 chars],,de,'Energiewende'
