index,url,valid,domain,title,description,image,published,archive,content,quote,language,keyword
https://www.stern.de/gesellschaft/regional/mecklenburg-vorpommern/windkraft-ausbau--mehr-genehmigungen-fuer-windraeder-in-mv---noch-antragsstau-35483870.html,https://www.stern.de/gesellschaft/regional/mecklenburg-vorpommern/windkraft-ausbau--mehr-genehmigungen-fuer-windraeder-in-mv---noch-antragsstau-35483870.html,0,www.stern.de,Windkraft-Ausbau: Mehr Genehmigungen für Windräder in MV - Noch Antragsstau,"Die Nutzung der Windkraft soll die Energiewende in Deutschland vorantreiben. In MV hängen viele Projekte im Antragsstau. Doch es gibt Anzeichen dafür, dass sich das Tempo wieder erhöht.",https://image.stern.de/35483872/t/qE/v1/w1440/r1.7778/-/20--jjbfs4iyd4v41axs2048jpeg---fe29e9dbb8f1c761.jpg,2025-02-20T13:29:50Z,https://web.archive.org/web/20250222000934/https://www.stern.de/gesellschaft/regional/mecklenburg-vorpommern/windkraft-ausbau--mehr-genehmigungen-fuer-windraeder-in-mv---noch-antragsstau-35483870.html,"Kopiere den aktuellen Link
Zur Merkliste hinzufügen
Die Nutzung der Windkraft soll die Energiewende in Deutschland vorantreiben. In MV hängen viele Projekte im Antragsstau. Doch es gibt Anzeichen d… [+2138 chars]",,de,'Energiewende'
https://www.dw.com/de/solarausbau-in-europ%C3%A4ischen-l%C3%A4ndern-photovoltaik-subventionen-f%C3%B6rderung-hausdach-balkon-eigenheim/a-71676260,https://www.dw.com/de/solarausbau-in-europ%C3%A4ischen-l%C3%A4ndern-photovoltaik-subventionen-f%C3%B6rderung-hausdach-balkon-eigenheim/a-71676260,0,www.dw.com,Wie Europa seinen Solarboom finanziert,"Die EU hat ihre Solarkapazität in den letzten drei Jahren verdoppelt. Wie staatliche Förderprogramme das möglich gemacht haben, welche Subventionen noch verfügbar sind und was jetzt noch fehlt. Das Dach von Jesus Miguel Vera Lopez' Haus, im spanischen Marbell…",https://static.dw.com/image/68608000_6.jpg,2025-02-20T13:57:00Z,,"Das Dach von Jesus Miguel Vera Lopez' Haus, im spanischen Marbella an der Costa del Sol, ist heute mit Solarmodulen bedeckt. ""Ich habe sie installiert, um Stromkosten zu sparen wie alle anderen auch""… [+10013 chars]",,de,'Energiekrise'
https://www.tagesschau.de/inland/gesellschaft/spender-deutschland-bilanz-100.html,https://www.tagesschau.de/inland/gesellschaft/spender-deutschland-bilanz-100.html,0,www.tagesschau.de,Bilanz für 2024: Deutsche spenden wieder mehr,"Inflation und Rezession haben der Großzügigkeit in Deutschland keinen Abbruch getan: 2024 wurde sogar mehr gespendet als im Vorjahr, teilte der Spendenrat mit. Wofür die Menschen spenden, hat sich verändert.",https://images.tagesschau.de/image/d31037d1-4605-43f4-a93a-ee2109e14ec0/AAABjY4lDbY/AAABkZLhkrw/16x9-1280/spendendose-108.jpg,2025-02-20T13:57:39Z,,"Stand: 20.02.2025 14:57 Uhr
Inflation und Rezession haben der Großzügigkeit in Deutschland keinen Abbruch getan: 2024 wurde sogar mehr gespendet als im Vorjahr, teilte der Spendenrat mit. Wofür die … [+2975 chars]",,de,'Inflation'
https://www.tagesschau.de/wirtschaft/inflation-unterschiede-haushalte-100.html,https://www.tagesschau.de/wirtschaft/inflation-unterschiede-haushalte-100.html,0,www.tagesschau.de,Studie: Inflation trifft inzwischen Besserverdienende mehr,"Die Inflation trifft nicht alle Haushalte gleichermaßen. Nachdem lange Haushalte mit geringem und mittleren Einkommen die Teuerungen besonders merkten, trifft die nun etwas stärker Gutverdienende.",https://images.tagesschau.de/image/03f9ea74-4ce4-4b08-b939-044722032ad7/AAABlSNXbIU/AAABkZLhkrw/16x9-1280/konsum-198.jpg,2025-02-20T15:06:04Z,,"Stand: 20.02.2025 16:06 Uhr
Die Inflation trifft nicht alle Haushalte gleichermaßen. Nachdem lange Haushalte mit geringem und mittleren Einkommen die Teuerungen besonders merkten, trifft die nun etw… [+2836 chars]",,de,'Inflation'
https://www.diepresse.com/19388446/rechnungshof-will-wissen-was-die-energiewende-wirklich-kostet,https://www.diepresse.com/19388446/rechnungshof-will-wissen-was-die-energiewende-wirklich-kostet,0,www.diepresse.com,"Rechnungshof will wissen, was die Energiewende wirklich kostet",Der Rechnungshof kritisiert mangelnde Abstimmung mit den Bundesländern und fordert eine nachvollziehbare Schätzung zu den Kosten des Erneuerbaren-Ausbaus.,https://img.diepresse.com/public/incoming/m5xoye-GettyImages-1939503062.jpg/alternates/DPR_SOCIAL_NACHRICHTEN/GettyImages-1939503062.jpg,2025-02-21T10:56:11Z,https://web.archive.org/web/20250222101945/https://www.diepresse.com/19388446/rechnungshof-will-wissen-was-die-energiewende-wirklich-kostet,"Der Rechnungshof kritisiert mangelnde Abstimmung mit den Bundesländern und fordert eine nachvollziehbare Schätzung zu den Kosten des Erneuerbaren-Ausbaus. 
Der Rechnungshof (RH) kritisiert in seinem… [+4594 chars]",,de,'Erneuerbare'
https://www.stern.de/digital/tests/smarte-thermostate--so-einfach-sparen-sie-hunderte-euro-35476678.html,https://www.stern.de/digital/tests/smarte-thermostate--so-einfach-sparen-sie-hunderte-euro-35476678.html,0,www.stern.de,Heizen: Smarte Thermostate können Hunderte Euro sparen – aber eignen sie sich für jeden?,Im Warmen sitzen – oder lieber Geld sparen? Smarte Thermostate versprechen einen Kompromiss. Doch ist das wirklich praktikabel? Der stern hat es für Sie getestet.,https://image.stern.de/35478210/t/bI/v1/w1440/r1.7778/-/smarte-thermostate-im-test-tado-eve-7.jpg,2025-02-21T12:00:00Z,,"Kopiere den aktuellen Link
Zur Merkliste hinzufügen
Im Warmen sitzen oder lieber Geld sparen? Smarte Thermostate versprechen einen Kompromiss. Doch ist das wirklich praktikabel? Der stern hat es fü… [+11196 chars]",,de,'Heizen'
https://noe.orf.at/stories/3294192/,https://noe.orf.at/stories/3294192/,0,noe.orf.at,RH kritisiert Versäumnisse bei Energiewende,"Der Rechnungshof hat die Fortschritte der Energiewende in Österreich unter die Lupe genommen – und Versäumnisse gefunden. Sowohl im Klimaschutzministerium als auch in Ober- und Niederösterreich, die im Bereich des Photovoltaik-Ausbaus geprüft worden sind.",https://ibs.orf.at/noe?image=https%3A%2F%2Foekastatic.orf.at%2Fmims%2F2022%2F50%2F68%2Fcrops%2Fw%3D1200%2Ch%3D627%2Cq%3D75%2F1602838_master_587468_agri_pv_anlage_018_luk.jpg%3Fs%3D829beadc35a3382d23b71464f553dc71c16501e2,2025-02-21T17:41:02Z,,"Der Rechnungshof (RH) kritisiert in seinem aktuellen Bericht Flächen für Strom aus erneuerbaren Energieträgern, dass die österreichische Energiewende unzureichend vorbereitet sei. Fehlende Transparen… [+5601 chars]",,de,'Photovoltaik'
https://www.n-tv.de/wirtschaft/Energie-ist-fast-ein-Drittel-teurer-als-2021-article25581076.html,https://www.n-tv.de/wirtschaft/Energie-ist-fast-ein-Drittel-teurer-als-2021-article25581076.html,0,www.n-tv.de,Vor allem Gaspreise explodiert: Energie ist fast ein Drittel teurer als 2021,"Die Energiekrise trifft Deutschland mit Wucht und ist nicht vorbei. Noch immer zahlen Haushalte deutlich mehr als vor vier Jahren. Allerdings sind nicht alle Energieformen gleich stark betroffen, wie eine Auswertung zeigt. Eine Rückkehr zum Vorkriegsniveau is…",https://www.n-tv.de/img/incoming/crop25581082/2351328067-cImg_16_9-w1200/503195771.jpg,2025-02-22T06:22:39Z,,"Die Energiekrise trifft Deutschland mit Wucht und ist nicht vorbei. Noch immer zahlen Haushalte deutlich mehr als vor vier Jahren. Allerdings sind nicht alle Energieformen gleich stark betroffen, wie… [+2400 chars]",,de,'Heizen'
https://www.tagesschau.de/ausland/europa/nato-pipeline-ausbau-100.html,https://www.tagesschau.de/ausland/europa/nato-pipeline-ausbau-100.html,0,www.tagesschau.de,NATO plant Kerosin-Pipeline nach Osteuropa,Nach Informationen des Spiegel plant die NATO den Ausbau ihres Pipelinesystems nach Osteuropa. So soll im Fall eines möglichen russischen Angriffs die Treibstoffversorgung sichergestellt werden.,https://images.tagesschau.de/image/ecba1aba-a95b-44fa-8cf3-9ca9f0be158c/AAABlS3J2D0/AAABkZLhkrw/16x9-1280/pipeline-rohre-102.jpg,2025-02-22T13:12:37Z,http://archive.md/20250222145228/http://www.tagesschau.de/ausland/europa/nato-pipeline-ausbau-100.html,"Stand: 22.02.2025 14:12 Uhr
Nach Informationen des Spiegel plant die NATO den Ausbau ihres Pipelinesystems nach Osteuropa. So soll im Fall eines möglichen russischen Angriffs die Treibstoffversorgun… [+1655 chars]",,de,'Ausbau'
https://t3n.de/news/e-mobilitaet-us-behoerde-will-hunderte-ladestationen-abbauen-1674596/,https://t3n.de/news/e-mobilitaet-us-behoerde-will-hunderte-ladestationen-abbauen-1674596/,0,t3n.de,E-Mobilität: US-Behörde will Hunderte Ladestationen abbauen,"Ist das das Ende der Elektromobilität in den USA? Nachdem schon ein wichtiges Förderprogramm zum Ausbau der Infrastruktur gestoppt wurde, will die GSA jetzt auch bestehende E-Ladesäulen zurückbauen.
weiterlesen auf t3n.de",https://t3n.de/news/wp-content/uploads/2021/05/shutterstock-548313280.jpg,2025-02-22T20:32:49Z,,"Die General Services Administration (GSA), die für die Verwaltung der Gebäude und Fuhrparks der US-Regierung zuständig ist, will alle von ihr betriebenen Ladestationen für Elektroautos abschalten. La… [+2697 chars]",,de,'Ausbau'
https://t3n.de/news/die-top-technologien-zur-stromspeicherung-1673556/,https://t3n.de/news/die-top-technologien-zur-stromspeicherung-1673556/,0,t3n.de,"Batterien, Wasserstoff &amp; Co.: Die Top-Technologien zur Stromspeicherung",An windstillen Wintertagen werden derzeit Kohle- und Gaskraftwerke hochgefahren. In Zukunft aber sollen vermehrt andere übernehmen. Welche könnten das sein? Bei wenig Sonne und kaum Wind herrscht in Deutschland die Dunkelflaute. In diesem Winter gab es schon …,https://t3n.de/news/wp-content/uploads/2025/02/dunkelflaute-solar.jpg,2025-02-23T07:10:00Z,,"Bei wenig Sonne und kaum Wind herrscht in Deutschland die Dunkelflaute. In diesem Winter gab es schon mehrere dieser Zeiten, in denen Solaranlagen und Windräder saison- und wetterbedingt kaum Strom l… [+5823 chars]",,de,'Winter'
https://www.bild.de/leben-wissen/wohnen-living/heizkosten-sparen-wie-heizen-sie-am-effektivsten-677bd0d5a68e5554d05ad56d,https://www.bild.de/leben-wissen/wohnen-living/heizkosten-sparen-wie-heizen-sie-am-effektivsten-677bd0d5a68e5554d05ad56d,0,www.bild.de,Heizkosten sparen - Wie heizt man am effektivsten?,"Die Heizungen werden aufgedreht. Aber wie heizt man richtig? Wie Sie effektiv heizen, um Kosten zu sparen, erfahren Sie hier.","https://images.bild.de/677bd0d5a68e5554d05ad56d/c2b6699823b035a2e9fd9ec9bdb2d936,8f0dbd82?w=1280",2025-02-23T09:07:42Z,,"Die Temperaturen sinken wieder und bei den meisten laufen die Heizungen bereits auf Hochtouren.
Doch das kann schnell die Heizkosten in die Höhe treiben. Es gibt einige Tipps zum effektiven Heizen: … [+5309 chars]",,de,'Heizkosten'
https://www.zeit.de/politik/deutschland/2025-02/wahlthemen-junge-waehlerschaft-inflation-migration-ungleichheit,https://www.zeit.de/politik/deutschland/2025-02/wahlthemen-junge-waehlerschaft-inflation-migration-ungleichheit,0,www.zeit.de,"Wahlthemen der jungen Wählerschaft: ""Mich stört die Einfallslosigkeit der Parteien""","Bezahlbares Wohnen, Inflation, soziale Ungleichheit und Migrationsdebatte: Was bewegt junge Menschen kurz vor der Wahl?  Vier von ihnen erzählen.",https://img.zeit.de/politik/deutschland/2025-02/wahlthemen-junge-waehlerschaft-inflation-migration/wide__1300x731,2025-02-23T10:23:38Z,http://archive.md/20250223080353/https://www.zeit.de/politik/deutschland/2025-02/wahlthemen-junge-waehlerschaft-inflation-migration-ungleichheit,"Zu teure Wohnungen, zu teure Lebensmittel und die Sorge um den zukünftigen Lebensstandard, kurz, die Angst vor Wohlstandsverlust sind die zentralen Themen junger Wählerinnen und Wähler. Das ergab die… [+409 chars]",,de,'Inflation'
https://www.focus.de/finanzen/boerse/kabelhersteller-mit-weltmarktfuehrer-prysmian-profitieren-anleger-von-zwei-megatrends_id_260734715.html,https://www.focus.de/finanzen/boerse/kabelhersteller-mit-weltmarktfuehrer-prysmian-profitieren-anleger-von-zwei-megatrends_id_260734715.html,0,www.focus.de,Kabelhersteller - Mit Weltmarktführer Prysmian profitieren Anleger von zwei Megatrends,Der Name des Weltmarktführers für Hochleistungskabel aus Italien sagt nur wenigen etwas. Dabei ist die ehemalige Pirelli-Kabelsparte Prysmian zentral für die Energiewende und den digitalen Wandel.Von Focus Money-Autor Gerhard Bläske,https://p6.focus.de/img/fotos/id_260734667/prysmian.png?im=Crop%3D%280%2C106%2C500%2C250%29%3BResize%3D%281200%2C627%29&impolicy=perceptual&quality=mediumHigh&hash=2c42f6795e6175aedd5b8eaf912e57cee36bbf6e3a541384d83fd999036960c5,2025-02-23T14:04:36Z,,Der Name des Weltmarktführers für Hochleistungskabel aus Italien sagt nur wenigen etwas. Dabei ist die ehemalige Pirelli-Kabelsparte Prysmian zentral für die Energiewende und den digitalen Wandel.Ohn… [+5395 chars],,de,'Ausbau'
https://www.sueddeutsche.de/wirtschaft/energiepreise-deutschland-verivox-analyse-li.3207750,https://www.sueddeutsche.de/wirtschaft/energiepreise-deutschland-verivox-analyse-li.3207750,0,www.sueddeutsche.de,Auswertung: Energiepreise fast ein Drittel höher als 2021,"Haushalte müssen für Energie deutlich mehr zahlen als noch vor vier Jahren. Besonders teuer ist das Heizen, zeigt eine Auswertung des Vergleichsportals Verivox.",https://www.sueddeutsche.de/2025/02/16/7d7a3365-bc6a-4d5a-945c-66b65a08bf27.jpeg?q=60&fm=webp&width=1200&rect=0%2C157%2C3000%2C1687,2025-02-23T14:06:21Z,,"Haushalte müssen für Energie deutlich mehr zahlen als noch vor vier Jahren. Besonders teuer ist das Heizen, zeigt eine Auswertung des Vergleichsportals Verivox.Die Haushalte in Deutschland zahlen dre… [+2227 chars]",,de,'Heizkosten'
https://www.stern.de/wirtschaft/news/fachkraeftemangel--forscher--fehlende-fachkraefte-bremsen-die-energiewende-35492692.html,https://www.stern.de/wirtschaft/news/fachkraeftemangel--forscher--fehlende-fachkraefte-bremsen-die-energiewende-35492692.html,0,www.stern.de,Fachkräftemangel: Forscher: Fehlende Fachkräfte bremsen die Energiewende,"Vielen Menschen geht es bei der Energiewende zu langsam voran. Eine Studie zeigt, dass Firmen oft nicht genug Fachkräfte finden, um etwa Solaranlagen zu installieren. Experten warnen vor den Folgen.",https://image.stern.de/35492694/t/qo/v1/w1440/r1.7778/-/24--oynskqqj76v1axs2048jpeg---fc715c5821d01579.jpg,2025-02-24T03:00:42Z,,"Kopiere den aktuellen Link
Zur Merkliste hinzufügen
Vielen Menschen geht es bei der Energiewende zu langsam voran. Eine Studie zeigt, dass Firmen oft nicht genug Fachkräfte finden, um etwa Solaranl… [+1659 chars]",,de,'Energiewende'
https://www.zeit.de/news/2025-02/24/in-energiewende-berufen-fehlen-immer-mehr-fachleute,https://www.zeit.de/news/2025-02/24/in-energiewende-berufen-fehlen-immer-mehr-fachleute,0,www.zeit.de,Arbeitsmarkt: In Energiewende-Berufen fehlen immer mehr Fachleute,Hier finden Sie Informationen zu dem Thema „Arbeitsmarkt“. Lesen Sie jetzt „In Energiewende-Berufen fehlen immer mehr Fachleute“.,https://img.zeit.de/news/2025-02/24/in-energiewende-berufen-fehlen-immer-mehr-fachleute-image-group/wide__1300x731,2025-02-24T05:00:36Z,,"Die Fachkräftelücke in Deutschland hat sich im vergangenen Jahr zwar verringert. In einigen Berufen, die für die Energiewende besonders wichtig sind, fehlt jedoch immer häufiger qualifiziertes Fachpe… [+4411 chars]",,de,'Ausbau'
https://www.stern.de/wirtschaft/news/arbeitsmarkt--in-energiewende-berufen-fehlen-immer-mehr-fachleute-35492932.html,https://www.stern.de/wirtschaft/news/arbeitsmarkt--in-energiewende-berufen-fehlen-immer-mehr-fachleute-35492932.html,0,www.stern.de,Arbeitsmarkt: In Energiewende-Berufen fehlen immer mehr Fachleute,"Vielen Menschen geht es bei der Energiewende zu langsam voran. Eine Studie zeigt, dass Unternehmen nicht genug Fachkräfte finden, um etwa Solaranlagen zu installieren. Experten warnen vor den Folgen.",https://image.stern.de/35492934/t/C0/v1/w1440/r1.7778/-/24--nrfz6ya47kv5axs2048jpeg---da588933f5f12724.jpg,2025-02-24T05:00:36Z,,"Kopiere den aktuellen Link
Zur Merkliste hinzufügen
Vielen Menschen geht es bei der Energiewende zu langsam voran. Eine Studie zeigt, dass Unternehmen nicht genug Fachkräfte finden, um etwa Solaran… [+4626 chars]",,de,'Energiewende'
https://www.tagesspiegel.de/wirtschaft/arbeitsmarkt-in-energiewende-berufen-fehlen-immer-mehr-fachleute-13262353.html,https://www.tagesspiegel.de/wirtschaft/arbeitsmarkt-in-energiewende-berufen-fehlen-immer-mehr-fachleute-13262353.html,0,www.tagesspiegel.de,Arbeitsmarkt: In Energiewende-Berufen fehlen immer mehr Fachleute,"Vielen Menschen geht es bei der Energiewende zu langsam voran. Eine Studie zeigt, dass Unternehmen nicht genug Fachkräfte finden, um etwa Solaranlagen zu installieren. Experten warnen vor den Folgen.",https://www.tagesspiegel.de/images/13262350/alternates/BASE_16_9_W1400/1740373315000/solaranlage.jpeg,2025-02-24T05:01:56Z,,"Die Fachkräftelücke in Deutschland hat sich im vergangenen Jahr zwar verringert. In einigen Berufen, die für die Energiewende besonders wichtig sind, fehlt jedoch immer häufiger qualifiziertes Fachpe… [+5130 chars]",,de,'Ausbau'
https://futurezone.at/science/golfplaetze-bodenverbrauch-flaeche-solarenergie-windenergie-weltweit-studie/403014372,https://futurezone.at/science/golfplaetze-bodenverbrauch-flaeche-solarenergie-windenergie-weltweit-studie/403014372,0,futurezone.at,Es wird mehr Boden für Golf als für Solar- und Windenergie genutzt,"Eine Studie kommt zu dem Schluss, dass für die Ballsportart weltweit mehr Platz zur Verfügung steht als für die Energiewende.",https://image.futurezone.at/images/facebook/8936382/mk-s-whf1wtnmmlu-unsplash.jpg,2025-02-24T07:59:58Z,,"Eine Studie kommt zu dem Schluss, dass für die Ballsportart weltweit mehr Platz zur Verfügung steht als für die Energiewende.",,de,'Energiewende'
https://orf.at/stories/3385817/,https://orf.at/stories/3385817/,0,orf.at,"3,2 Prozent: Inflation steigt wieder",,https://orf.at/mojo/1_4_1/storyserver//news/common/images/og-fallback-news.png,2025-02-24T08:24:22Z,,"Im Jänner ist die Teuerungsrate wieder gestiegen. Sie lag bei 3,2 Prozent, der Verbraucherpreisindex (VPI) kletterte auf 126,4 Punkte, wie die Statistik Austria heute in einer Aussendung mitteilte.
… [+726 chars]",,de,'Preisanstieg'
https://www.diepresse.com/19395894/inflation-schnellte-im-jaenner-auf-32-prozent,https://www.diepresse.com/19395894/inflation-schnellte-im-jaenner-auf-32-prozent,0,www.diepresse.com,"Inflation schnellte im Jänner auf 3,2 Prozent","Ohne die Preisentwicklung bei Strom läge die Inflation bei 2,4 Prozent, heißt es von der Statistik Austria.",https://img.diepresse.com/public/incoming/nzetjz-kein-Titel/alternates/DPR_SOCIAL_NACHRICHTEN/kein%20Titel,2025-02-24T08:33:11Z,https://web.archive.org/web/20250224085927/https://www.diepresse.com/19395894/inflation-schnellte-im-jaenner-auf-32-prozent,"Ohne die Preisentwicklung bei Strom läge die Inflation bei 2,4 Prozent, heißt es von der Statistik Austria.
Der Wegfall der strompreisdämpfenden Maßnahmen hat die Inflation im Jänner stark nach oben… [+1068 chars]",,de,'Inflation'
https://www.n-tv.de/wirtschaft/So-viele-Elektriker-und-Schweisser-fehlen-fuer-Energiewende-article25584667.html,https://www.n-tv.de/wirtschaft/So-viele-Elektriker-und-Schweisser-fehlen-fuer-Energiewende-article25584667.html,0,www.n-tv.de,"Lücke für Netz, Wind und Solar: So viele Elektriker und Schweißer fehlen für Energiewende","Vielen Menschen geht es bei der Energiewende zu langsam voran. Eine Studie zeigt, dass Unternehmen nicht genug Fachkräfte finden, um Solaranlagen und Windräder zu installieren. Experten warnen vor den Folgen. Auch in anderen Branchen fehlen Fachleute.",https://www.n-tv.de/img/incoming/crop25584802/9041322942-cImg_16_9-w1200/108739219.jpg,2025-02-24T08:51:50Z,,"Vielen Menschen geht es bei der Energiewende zu langsam voran. Eine Studie zeigt, dass Unternehmen nicht genug Fachkräfte finden, um Solaranlagen und Windräder zu installieren. Experten warnen vor de… [+4611 chars]",,de,'Solar'
https://www.telepolis.de/features/Geothermie-2-0-Wie-Oel-Technologie-die-Energiewende-beschleunigt-10293130.html,https://www.telepolis.de/features/Geothermie-2-0-Wie-Oel-Technologie-die-Energiewende-beschleunigt-10293130.html,0,www.telepolis.de,Geothermie 2.0: Wie Öl-Technologie die Energiewende beschleunigt,Geothermie galt lange als Energiequelle mit begrenztem Potenzial. Neue Bohrtechniken aus der Ölindustrie könnten das nun ändern.,https://heise.cloudimg.io/bound/1200x1200/q85.png-lossy-85.webp-lossy-85.foil1/_www-heise-de_/imgs/18/4/8/0/6/9/3/2/geothermie_Zeichenfla__che_1-aa7cfbb2178f87f7-47b64a91a38c9a13.jpeg,2025-02-24T10:00:00Z,,"Geothermie galt lange als Energiequelle mit begrenztem Potenzial. Neue Bohrtechniken aus der Ölindustrie könnten das nun ändern.
Tief unter unseren Füßen schlummert ein gigantisches Energiepotenzial… [+3170 chars]",,de,'Energiewende'
https://www.focus.de/finanzen/boerse/auf-2-5-prozent-inflationsrate-in-der-eurozone-steigt-vierten-monat-in-folge_082f1a91-0976-44f5-8acd-919baaeb4bc7.html,https://www.focus.de/finanzen/boerse/auf-2-5-prozent-inflationsrate-in-der-eurozone-steigt-vierten-monat-in-folge_082f1a91-0976-44f5-8acd-919baaeb4bc7.html,0,www.focus.de,"Auf 2,5 Prozent - Inflationsrate in der Eurozone steigt vierten Monat in Folge","Die Inflation in der Eurozone ist im Januar den vierten Monat in Folge gestiegen. Die Verbraucherpreise legten um 2,5 Prozent im Vergleich zum entsprechenden Vorjahresmonat zu.",https://quadro.burda-forward.de/ctf/608b5209-b583-4426-94c8-f668ceffafa9.939809ce-98ce-4037-ae8a-f43fe720c3f2.jpg?im=RegionOfInterestCrop%3D%281200%2C630%29%2CregionOfInterest%3D%28526%2C235%29&hash=c58544528d8f6c666b55833a71286ac8c9a0f7d45bad7aff063ba52380871227,2025-02-24T10:45:00Z,https://web.archive.org/web/20250224114500/https://www.focus.de/finanzen/boerse/auf-2-5-prozent-inflationsrate-in-der-eurozone-steigt-vierten-monat-in-folge_082f1a91-0976-44f5-8acd-919baaeb4bc7.html,"Die Geldentwertung in der Eurozone steigt auf 2,5 Prozent, wie das Statistikamt Eurostat in Luxemburg nach einer zweiten Schätzung mitteilte. Damit wurde eine erste Schätzung wie von Volkswirten erwa… [+1266 chars]",,de,'Preisanstieg'
https://orf.at/stories/3385829/,https://orf.at/stories/3385829/,0,orf.at,"Inflation schnellte im Jänner auf 3,2 Prozent","Es ist absehbar gewesen: Der Wegfall der strompreisdämpfenden Maßnahmen der Regierung hat die Inflation im Jänner stark nach oben getrieben. Die Verbraucherpreise erhöhten sich im Jahresvergleich um 3,2 Prozent. Zum Vergleich: Im Dezember 2024 hatte sich die …",https://ibs.orf.at/news?image=https%3A%2F%2Fassets.orf.at%2Fmims%2F2025%2F09%2F39%2Fcrops%2Fw%3D1200%2Ch%3D630%2Cq%3D75%2F2532051_master_970239_inflation_jaenner_2025_hev.jpg%3Fs%3D6b84977cf7bad7d3a2687f14f63ffffa6e901b02,2025-02-24T11:03:11Z,,"Das Auslaufen der Strompreisbremse, der Anstieg der Netzentgelte bei Strom und Erdgas und die Anhebung von Erneuerbaren-Förderung und CO2-Steuer haben die Teuerung in Österreich zu Jahresbeginn 2025 … [+2208 chars]",,de,'Preisanstieg'
https://noe.orf.at/stories/3294484/,https://noe.orf.at/stories/3294484/,0,noe.orf.at,350 Millionen für erneuerbare Energien,Die Firma „ImWind“ mit Sitz in Pottenbrunn (Bezirk St. Pölten) investiert 350 Millionen Euro in Windkraft- und Photovoltaik-Anlagen. Die 14 Projekte entstehen fast alle in Österreich. Als „Leuchtturmprojekt“ gilt laut der Firma eine PV-Anlage in Gaweinstal (B…,https://ibs.orf.at/noe?image=https%3A%2F%2Foekastatic.orf.at%2Fmims%2F2025%2F09%2F84%2Fcrops%2Fw%3D1200%2Ch%3D627%2Cq%3D75%2F2532142_master_970284_350_millionen_euro_ausbauoffensive_imwind_kurbelt_heimische_wirtschaft_mit_14_wind-_und_pv-projekten_an_.jpg%3Fs%3Daccd13b81c59c958c790370055c01e4ebd510e73,2025-02-24T11:15:09Z,,Beim Projekt in Gaweinstal handelt es sich um eine sogenannte Agri Photovoltaik Anlage. Die Fläche wird also sowohl für Landwirtschaft als auch die Gewinnung von Sonnenenergie genutzt. Das zwischen d… [+1334 chars],,de,'Photovoltaik'
https://burgenland.orf.at/stories/3294474/,https://burgenland.orf.at/stories/3294474/,0,burgenland.orf.at,Größte Agri-PV-Anlage Europas ensteht,"In Tadten und Wallern (Bezirk Neusiedl am See) wird derzeit Europas größte sogenannte Agri-PV-Wind-Park Anlage. Auf einer Fläche von 115 Hektar wurden bereits 190.000 Photovoltaik-Paneele montiert, unter denen biologische Landwirtschaft betrieben werden soll.",https://ibs.orf.at/bgl?image=https%3A%2F%2Foekastatic.orf.at%2Fmims%2F2025%2F09%2F45%2Fcrops%2Fw%3D1200%2Ch%3D627%2Cq%3D75%2F2532070_master_970245_pv1.jpg%3Fs%3D54581b779e9f66c537472066f21959f899624c7c,2025-02-24T14:08:44Z,https://web.archive.org/web/20250224143643/https://burgenland.orf.at/stories/3294474/,"Einerseits werde auf einer gigantischen Fläche mit Sonnenlicht Strom erzeugt, andererseits werde unter den Photovoltaik-Panelen biologischer Landbau betrieben, sagt Stephan Sharma, Vorstandsvorsitzen… [+1412 chars]",,de,'Photovoltaik'
https://www.diepresse.com/19394119/hausverstand-und-haeuslbauen,https://www.diepresse.com/19394119/hausverstand-und-haeuslbauen,0,www.diepresse.com,Hausverstand und Häuslbauen [premium],Hausverstand der rechten Ideologen kann wenig mit Klimawandel oder Energiewende anfangen. Er steht auf Bodenversiegeln und uralte Wirtschaftskonzepte.,https://www.diepresse.com/assets_v2/images/diepresse_meinung.png,2025-02-24T14:14:15Z,,"Hausverstand der rechten Ideologen kann wenig mit Klimawandel oder Energiewende anfangen. Er steht auf Bodenversiegeln und uralte Wirtschaftskonzepte. 
Häufig wie nie zuvor taucht der Hausverstand a… [+1216 chars]",,de,'Energiewende'
