index,url,valid,domain,title,description,image,published,archive,content,quote,language,keyword
https://www.computerbase.de/news/netzpolitik/gutscheine-fuer-kunden-wie-sich-die-nachfrage-nach-glasfaseranschluessen-erhoehen-laesst.91429/,https://www.computerbase.de/news/netzpolitik/gutscheine-fuer-kunden-wie-sich-die-nachfrage-nach-glasfaseranschluessen-erhoehen-laesst.91429/,0,www.computerbase.de,Gutscheine für Kunden: Anreiz für höhere Nachfrage nach Glasfaser­anschlüssen,"Glasfaseranschlüsse haben Nachfrageprobleme. Obwohl der Ausbau vorankommt, wechseln (zu) wenige Haushalte auf die Infrastruktur. Branchenverbände wie der Breko und der VATM fordern daher ein Voucher-System, bei dem Glasfaserkunden im Prinzip Gutscheine erhalt…",https://pics.computerbase.de/1/1/6/1/2/5-37336af22758ea02/article-1280x720.3d4ce05f.jpg,2025-02-14T15:03:00Z,http://archive.md/20250215174453/https://www.computerbase.de/news/netzpolitik/gutscheine-fuer-kunden-wie-sich-die-nachfrage-nach-glasfaseranschluessen-erhoehen-laesst.91429/,"Glasfaseranschlüsse haben Nachfrageprobleme. Obwohl der Ausbau vorankommt, wechseln (zu) wenige Haushalte auf die Infrastruktur. Branchenverbände wie der Breko und der VATM fordern daher ein Voucher-… [+4412 chars]",,de,'Ausbau'
https://www.zeit.de/news/2025-02/14/woidke-zufrieden-mit-neuem-gesetz-zum-windenergieausbau,https://www.zeit.de/news/2025-02/14/woidke-zufrieden-mit-neuem-gesetz-zum-windenergieausbau,0,www.zeit.de,Windräder in Brandenburg: Woidke zufrieden mit neuem Gesetz zum Windenergieausbau,Hier finden Sie Informationen zu dem Thema „Windräder in Brandenburg“. Lesen Sie jetzt „Woidke zufrieden mit neuem Gesetz zum Windenergieausbau“.,https://img.zeit.de/news/2025-02/14/woidke-zufrieden-mit-neuem-gesetz-zum-windenergieausbau-image-group/wide__1300x731,2025-02-14T15:17:10Z,https://web.archive.org/web/20250215170427/https://www.zeit.de/news/2025-02/14/woidke-zufrieden-mit-neuem-gesetz-zum-windenergieausbau,"Brandenburgs Ministerpräsident Dietmar Woidke (SPD) hat sich erfreut über ein im Bundesrat verabschiedetes Gesetz zur Steuerung des Windenergieausbaus geäußert. «Das neue Gesetz soll dafür sorgen, da… [+1540 chars]",,de,'Ausbau'
https://www.tagesspiegel.de/berlin/berliner-wirtschaft/berliner-lassen-beim-energiesparen-nicht-locker-ukraine-krieg-und-energiekrise-haben-verhalten-verandert-13175956.html,https://www.tagesspiegel.de/berlin/berliner-wirtschaft/berliner-lassen-beim-energiesparen-nicht-locker-ukraine-krieg-und-energiekrise-haben-verhalten-verandert-13175956.html,0,www.tagesspiegel.de,Berliner lassen beim Energiesparen nicht locker: Ukraine-Krieg und Energiekrise haben Verhalten verändert,Nach der Invasion Russlands in die Ukraine explodierten die Energieprise. Viele Menschen drehten ihre Heizung niedriger und verzichteten aufs Vollbad. Eine Mehrheit tut das immer noch.,https://www.tagesspiegel.de/images/10852222/alternates/BASE_16_9_W1400/1701245130000/heizkosten-sparen-junge-frau-zu-hause-mit-muetze-und-handschuhen-berlin-deutschland-saving-h.jpeg,2025-02-14T15:19:47Z,,"Die Energiekrise nach dem Angriff Russlands auf die Ukraine ist weitgehend passé, aber die meisten Berliner versuchen weiter im Alltag Energie zu sparen. Das ist die Kernaussage einer repräsentativen… [+5628 chars]",,de,'Energiekrise'
https://www.bild.de/leben-wissen/kaelte-im-winter-bild-zeigt-ihnen-die-besten-tipps-und-tricks-67594473423348047ff9e479,https://www.bild.de/leben-wissen/kaelte-im-winter-bild-zeigt-ihnen-die-besten-tipps-und-tricks-67594473423348047ff9e479,0,www.bild.de,BILD verrät die besten Tipps - Was sollte man bei Kälte im Winter beachten?,"Was tun, wenn die Kälte einen richtig packt? Wie schützt man sich richtig vor dem Frost? BILD verrät Ihnen, was man bei Kälte im Winter beachten sollte.","https://images.bild.de/67594473423348047ff9e479/e266fe5b70d29693d0e00a6c582a2012,6f49a9fe?w=1280",2025-02-14T21:37:35Z,,"Der Winter ist endlich angekommen und bringt eisige Temperaturen mit sich.
Wer sich jetzt vor die Tür wagt, muss sich warm anziehen und auf die kalte Jahreszeit vorbereiten. Ob Schnee, Frost oder ei… [+6580 chars]",,de,'Winter'
https://www.zeit.de/news/2025-02/15/10-000-menschen-beim-winter-csd-in-berlin-erwartet,https://www.zeit.de/news/2025-02/15/10-000-menschen-beim-winter-csd-in-berlin-erwartet,0,www.zeit.de,"""Wähl Liebe"": 10.000 Menschen beim Winter-CSD in Berlin erwartet","Hier finden Sie Informationen zu dem Thema „""Wähl Liebe""“. Lesen Sie jetzt „10.000 Menschen beim Winter-CSD in Berlin erwartet“.",https://img.zeit.de/news/2025-02/15/10-000-menschen-beim-winter-csd-in-berlin-erwartet-image-group/wide__1300x731,2025-02-15T02:30:36Z,https://web.archive.org/web/20250222204944/https://www.zeit.de/news/2025-02/15/10-000-menschen-beim-winter-csd-in-berlin-erwartet,Kurz vor der Bundestagswahl wollen queere Menschen und Verbündete heute (11.55 Uhr) in Berlin für ihre Rechte demonstrieren und zur Teilnahme an der Wahl aufrufen. Erwartet werden rund 10.000 Teilneh… [+313 chars],,de,'Winter'
https://burgenland.orf.at/stories/3293266/,https://burgenland.orf.at/stories/3293266/,0,burgenland.orf.at,PV-Interesse trotz Unsicherheit weiter hoch,Der Wegfall des Mehrwertsteuer-Vorteils beim Kauf von Photovoltaikpanelen im Zuge der gescheiterten blau-schwarzen Regierungsverhandlungen hat auf dem PV-Markt für Unsicherheit gesorgt. Im Burgenland gibt es nun einen kleinen PV- Boom bei Privathaushalten.,https://ibs.orf.at/bgl?image=https%3A%2F%2Foekastatic.orf.at%2Fmims%2F2025%2F07%2F66%2Fcrops%2Fw%3D1200%2Ch%3D627%2Cq%3D75%2F2521047_master_965666_pv3.jpg%3Fs%3D3696756794f4a78c8fda9eefa46f46731136df1f,2025-02-15T04:05:00Z,https://web.archive.org/web/20250216043745/https://burgenland.orf.at/stories/3293266/,"Für Privathaushalte hat es in den vergangenen Jahren eine ganze Reihe an Fördermodellen gegeben. Darunter etwa die ÖMAG-Förderung, Landesförderungen oder eben die Mehrwertsteuer-Befreiung beim Panelk… [+1894 chars]",,de,'Photovoltaik'
https://www.n-tv.de/wirtschaft/Klima-Labor-mit-Veronika-Grimm-Wir-rechnen-uns-die-Kosten-der-Energiewende-schoen-article25560360.html,https://www.n-tv.de/wirtschaft/Klima-Labor-mit-Veronika-Grimm-Wir-rechnen-uns-die-Kosten-der-Energiewende-schoen-article25560360.html,0,www.n-tv.de,"Grimm für Strompreiszonen: ""Wir rechnen uns die Kosten der Energiewende schön""","Die deutschen Strompreise erregen die Gemüter. Auch Veronika Grimm hält sie für zu hoch. Im ""Klima-Labor"" von ntv verrät die Wirtschaftsweise genau, wo sie ansetzen würde: Unter anderem liebäugelt sie mit der Einführung von Strompreiszonen.",https://www.n-tv.de/img/incoming/crop25560751/6731325285-cImg_16_9-w1200/492740294.jpg,2025-02-15T07:44:31Z,https://web.archive.org/web/20250215074700/https://www.n-tv.de/wirtschaft/Klima-Labor-mit-Veronika-Grimm-Wir-rechnen-uns-die-Kosten-der-Energiewende-schoen-article25560360.html,"Die deutschen Strompreise erregen die Gemüter. Auch Veronika Grimm hält sie für zu hoch. Im ""Klima-Labor"" von ntv verrät die Wirtschaftsweise genau, wo sie ansetzen würde: bei der ""sprunghaften Polit… [+12318 chars]",,de,'Energiekrise'
https://www.zeit.de/news/2025-02/15/winter-zeigt-sich-zunehmend-freundlicher,https://www.zeit.de/news/2025-02/15/winter-zeigt-sich-zunehmend-freundlicher,0,www.zeit.de,Wetter: Winter zeigt sich zunehmend freundlicher,Hier finden Sie Informationen zu dem Thema „Wetter“. Lesen Sie jetzt „Winter zeigt sich zunehmend freundlicher“.,https://img.zeit.de/news/2025-02/15/winter-zeigt-sich-zunehmend-freundlicher-image-group/wide__1300x731,2025-02-15T10:15:49Z,,"Bei noch immer eisigen Temperaturen präsentiert sich der Winter in Berlin und Brandenburg zunehmend freundlicher. Auf den Straßen kann es aber gefährlich glatt werden, wie der Deutsche Wetterdienst i… [+793 chars]",,de,'Winter'
https://www.zeit.de/news/2025-02/15/waehl-liebe-tausende-demonstrieren-bei-winter-csd,https://www.zeit.de/news/2025-02/15/waehl-liebe-tausende-demonstrieren-bei-winter-csd,0,www.zeit.de,"Winter-CSD: ""Wähl Liebe"" - Tausende demonstrieren bei ""Winter-CSD""","Hier finden Sie Informationen zu dem Thema „Winter-CSD“. Lesen Sie jetzt „""Wähl Liebe"" - Tausende demonstrieren bei ""Winter-CSD""“.",https://img.zeit.de/news/2025-02/15/waehl-liebe-tausende-demonstrieren-bei-winter-csd-image-group/wide__1300x731,2025-02-15T15:52:59Z,https://web.archive.org/web/20250216024232/https://www.zeit.de/news/2025-02/15/waehl-liebe-tausende-demonstrieren-bei-winter-csd,Eine Woche vor der Bundestagswahl sind am Samstag Tausende Menschen für Toleranz und Demokratie in Niedersachsen auf die Straßen gegangen. In Osnabrück zogen unter dem Motto «Wähl Liebe» nach Angaben… [+1104 chars],,de,'Winter'
https://www.zeit.de/news/2025-02/15/waehl-liebe-tausende-bei-winter-csd-in-koeln,https://www.zeit.de/news/2025-02/15/waehl-liebe-tausende-bei-winter-csd-in-koeln,0,www.zeit.de,"Demonstration: ""Wähl Liebe"": Tausende bei Winter-CSD in Köln","Hier finden Sie Informationen zu dem Thema „Demonstration“. Lesen Sie jetzt „""Wähl Liebe"": Tausende bei Winter-CSD in Köln“.",https://img.zeit.de/news/2025-02/15/waehl-liebe-tausende-bei-winter-csd-in-koeln-image-group/wide__1300x731,2025-02-15T21:23:41Z,https://web.archive.org/web/20250216075832/https://www.zeit.de/news/2025-02/15/waehl-liebe-tausende-bei-winter-csd-in-koeln,Eine Woche vor der Bundestagswahl haben in Köln Tausende Menschen für queere Rechte und Demokratie demonstriert. In der Spitze hätten 10.000 Menschen an der Kundgebung unter dem Motto «Wähl Liebe» au… [+598 chars],,de,'Winter'
https://steiermark.orf.at/stories/3293240/,https://steiermark.orf.at/stories/3293240/,0,steiermark.orf.at,Kirchen setzen künftig auf Sonnenstrom,Steirische Pfarren sollen bis 2030 auf umweltfreundlichen Sonnenstrom umgestellt werden. Derzeit produzieren rund 40 Pfarren und kirchliche Einrichtungen eigenen Strom. Mit der Photovoltaik-Initiative will die Diözese die laufenden Kosten für die Kirchen verr…,https://ibs.orf.at/stm?image=https%3A%2F%2Foekastatic.orf.at%2Fmims%2F2025%2F07%2F80%2Fcrops%2Fw%3D1200%2Ch%3D627%2Cq%3D75%2F2520809_master_965580_photovoltaik_am_grazer_augustinum.jpg%3Fs%3D0544c7ae5be7fb010357f26d2881400d9760fdf2,2025-02-16T06:30:00Z,https://web.archive.org/web/20250216095134/https://steiermark.orf.at/stories/3293240/,"Der Großteil des Strombedarfs für die Kirchen soll künftig selbst hergestellt werden, auch Nachbarn sollen versorgt werden. Ein erstes Großprojekt ist beim Grazer Augustinum entstanden. Dort wurde ei… [+1571 chars]",,de,'Photovoltaik'
https://www.welt.de/politik/ausland/article255434592/Kaempfe-im-Kongo-Eine-Drohung-die-bis-nach-Europa-hallt.html,https://www.welt.de/politik/ausland/article255434592/Kaempfe-im-Kongo-Eine-Drohung-die-bis-nach-Europa-hallt.html,0,www.welt.de,"Eine Drohung, die bis nach Europa hallt","Kaum ein Land ist für die Energiewende so wichtig wie der Kongo, der riesige Rohstoffvorkommen besitzt. Der Vormarsch der M23-Rebellen wird daher auch in Europa mit Sorge verfolgt. Was plant Anführer Corneille Nangaa? Unserem Reporter gelang es als einer der …",https://img.welt.de/img/politik/ausland/mobile255436824/6747937627-ci16x9-w1200/Image-67af40ed5fdd2634aff911fd.jpg,2025-02-16T09:31:49Z,,"Kaum ein Land ist für die Energiewende so wichtig wie der Kongo, der riesige Rohstoffvorkommen besitzt. Der Vormarsch der M23-Rebellen wird daher auch in Europa mit Sorge verfolgt. Was plant Anführer… [+9863 chars]",,de,'Energiewende'
https://www.focus.de/finanzen/mega-anlage-aus-bawue-soll-jetzt-zum-held-der-energiewende-werden_08d1e170-d710-42d7-a8d9-3f4dd5e31678.html,https://www.focus.de/finanzen/mega-anlage-aus-bawue-soll-jetzt-zum-held-der-energiewende-werden_08d1e170-d710-42d7-a8d9-3f4dd5e31678.html,0,www.focus.de,Leistet mehr als 60 Windkrafträder - Neue Mega-Anlage aus BaWü soll jetzt zum „Held der Energiewende“ werden,"Was lange währt, wird endlich gut: Mit mehr als zwei Jahren Verspätung nimmt die EnBW ihre Gasturbine in Marbach (Kreis Ludwigsburg) in Betrieb. Sie dient der Netzstabilisierung.",https://quadro.burda-forward.de/ctf/cc320862-6675-4618-a748-12f9085d3bac.3026e78f-2141-4c22-abe8-bbb57a020dd7.jpg?im=RegionOfInterestCrop%3D%281200%2C630%29%2CregionOfInterest%3D%28683%2C292%29&hash=88b879e39303b03e5a030bbd2a84a27af489441a0de506e76ac67f7b4f3d4a42,2025-02-16T10:11:00Z,,Erleichterung ist spürbar an diesem Vormittag in der Halle der neuen EnBW-Netzstabilitätsanlage in Marbach. Die Beteiligten haben eine fast viereinhalbjährige Leidenszeit hinter sich. Nun endlich mit… [+4360 chars],,de,'Energiewende'
https://www.focus.de/finanzen/news/gasspeicher-leeren-sich-heute-schneller-als-in-den-jahren-zuvor-was-das-bedeutet_cbae2466-2a67-4c27-801c-ecc4b9f77ff0.html,https://www.focus.de/finanzen/news/gasspeicher-leeren-sich-heute-schneller-als-in-den-jahren-zuvor-was-das-bedeutet_cbae2466-2a67-4c27-801c-ecc4b9f77ff0.html,0,www.focus.de,Nur noch zu 47 Prozent voll - Gasspeicher leeren sich schneller als sonst - was das für Sie bald bedeutet,Die Vorräte in den deutschen Gasspeichern gehen diesen Winter schneller zur Neige als in den Jahren vor der Energiekrise. Nicht nur das kalte Wetter spielt da hinein. Besteht Grund zur Sorge?,https://quadro.burda-forward.de/ctf/4ef85990-5dde-4df6-9132-6b7d7dbe9d64.c422d28d-5cbf-4071-821e-745f39a1f676.jpeg?im=Resize%3D%281200%2C630%29&hash=78bd0a657d3d5f71b781caf3eec5aac78654236460a88bfad0d69435e07c4ac6,2025-02-16T14:46:00Z,,"Zu 46,97 Prozent waren die großen Erdgasspeicher in Deutschland am Abend des vergangenen Mittwochs noch gefüllt. Dass sie sich um diese Jahreszeit entleeren, ist normal, allerdings geschieht das dies… [+4912 chars]",,de,'Gasspeicher'
https://www.welt.de/sport/fussball/bundesliga/borussia-dortmund/article255451662/Dortmund-in-der-Krise-Rangnicks-fundamentale-Kritik-an-der-Fuehrung-des-BVB.html,https://www.welt.de/sport/fussball/bundesliga/borussia-dortmund/article255451662/Dortmund-in-der-Krise-Rangnicks-fundamentale-Kritik-an-der-Fuehrung-des-BVB.html,0,www.welt.de,Rangnicks fundamentale Kritik an der Führung des BVB,"Ralf Rangnick hätte in diesem Winter auch Trainer von Borussia Dortmund werden können. Er entscheidet sich anders. Aus gewichtigen Gründen, wie er nun verrät. Die Krise des Klubs hat für ihn einen langen Vorlauf.",https://img.welt.de/img/sport/fussball/bundesliga/borussia-dortmund/mobile255451836/5937938547-ci16x9-w1200/Image-67b1f983c330c33fea406df4.jpg,2025-02-16T16:35:42Z,,"Ralf Rangnick hätte in diesem Winter auch Trainer von Borussia Dortmund werden können. Er entscheidet sich anders. Aus gewichtigen Gründen, wie er nun verrät. Die Krise des Klubs hat für ihn einen la… [+3474 chars]",,de,'Winter'
https://www.stern.de/gesellschaft/regional/berlin-brandenburg/energiewende--uckermarkleitung-soll-stromnetz-staerken-35472296.html,https://www.stern.de/gesellschaft/regional/berlin-brandenburg/energiewende--uckermarkleitung-soll-stromnetz-staerken-35472296.html,0,www.stern.de,Energiewende: Uckermarkleitung soll Stromnetz stärken,Eine neue Stromleitung in der Uckermark soll offiziell in Betrieb genommen werden. Sie spielt eine Schlüsselrolle für die Energiewende in der Region.,https://image.stern.de/35472298/t/UU/v1/w1440/r1.7778/-/17--xhinme5gasv1axs2048jpeg---7d887b3877f19551.jpg,2025-02-17T02:30:36Z,,"Kopiere den aktuellen Link
Zur Merkliste hinzufügen
Eine neue Stromleitung in der Uckermark soll offiziell in Betrieb genommen werden. Sie spielt eine Schlüsselrolle für die Energiewende in der Reg… [+1295 chars]",,de,'Erneuerbare'
https://www.zeit.de/news/2025-02/17/uckermarkleitung-soll-stromnetz-staerken,https://www.zeit.de/news/2025-02/17/uckermarkleitung-soll-stromnetz-staerken,0,www.zeit.de,Energiewende: Uckermarkleitung soll Stromnetz stärken,Hier finden Sie Informationen zu dem Thema „Energiewende“. Lesen Sie jetzt „Uckermarkleitung soll Stromnetz stärken“.,https://img.zeit.de/news/2025-02/17/uckermarkleitung-soll-stromnetz-staerken-image-group/wide__1300x731,2025-02-17T02:30:36Z,,"Die sogenannte Uckermarkleitung soll in Betrieb genommen werden. Die für die Energiewende in Brandenburg wichtige 380-Kilovolt-Hochspannungsleitung zwischen Bertikow, Vierraden, Neuenhagen und Pasewa… [+1130 chars]",,de,'Energiewende'
https://www.tagesspiegel.de/berlin/energiewende-uckermarkleitung-soll-stromnetz-starken-13215532.html,https://www.tagesspiegel.de/berlin/energiewende-uckermarkleitung-soll-stromnetz-starken-13215532.html,0,www.tagesspiegel.de,Energiewende: Uckermarkleitung soll Stromnetz stärken,Eine neue Stromleitung in der Uckermark soll offiziell in Betrieb genommen werden. Sie spielt eine Schlüsselrolle für die Energiewende in der Region.,https://www.tagesspiegel.de/images/13215529/alternates/BASE_16_9_W1400/1739759537000/stromleitung.jpeg,2025-02-17T02:32:17Z,,"Die sogenannte Uckermarkleitung soll in Betrieb genommen werden. Die für die Energiewende in Brandenburg wichtige 380-Kilovolt-Hochspannungsleitung zwischen Bertikow, Vierraden, Neuenhagen und Pasewa… [+1855 chars]",,de,'Energiewende'
https://www.n-tv.de/ratgeber/Draussen-eiskalt-so-wird-es-drinnen-schnell-warm-article25563270.html,https://www.n-tv.de/ratgeber/Draussen-eiskalt-so-wird-es-drinnen-schnell-warm-article25563270.html,0,www.n-tv.de,Winterwetter und Heizkosten: Draußen eiskalt - so wird es drinnen schnell warm,"Brrr, ist das kalt. Wer nach einer längeren Abwesenheit nach Hause kommt, will sich natürlich auf eine warme Wohnung freuen. Gleichzeitig ist Heizen teuer. Was also tun?",https://www.n-tv.de/img/incoming/crop23244391/829132612-cImg_16_9-w1200/imago0152703901h.jpg,2025-02-17T08:59:19Z,,"Brrr, ist das kalt. Wer nach einer längeren Abwesenheit nach Hause kommt, will sich natürlich auf eine warme Wohnung freuen. Gleichzeitig ist Heizen teuer. Was also tun?
Tagsüber ist keiner zu Hause… [+3601 chars]",,de,'Heizen'
https://www.golem.de/sonstiges/zustimmung/auswahl.html?from=https://www.golem.de/news/nach-jahrelangem-zoegern-ministerium-zwingt-1-1-zum-ausbau-weisser-flecken-2502-193411.html&referer=https://t.co/4f5b0f0eaf,https://www.golem.de/sonstiges/zustimmung/auswahl.html?from=https://www.golem.de/news/nach-jahrelangem-zoegern-ministerium-zwingt-1-1-zum-ausbau-weisser-flecken-2502-193411.html&referer=https://t.co/4f5b0f0eaf,0,www.golem.de,Nach jahrelangem Zögern: Ministerium zwingt 1&1 zum Ausbau weißer Flecken,"United Internet muss sich an Ausbauzusagen halten, für die 1&1 Mobilfunk Zinszahlungen aus der 5G-Auktion spart. Das Bundesdigitalministerium wartet aber sonst weiter ab. (1&1, Mobilfunk)",,2025-02-17T12:15:01Z,,"Besuchen Sie Golem.de wie gewohnt mit Werbung und Tracking,
 indem Sie der Nutzung aller Cookies zustimmen.
 Details zum Tracking finden Sie im Privacy Center.
Skript wurde nicht geladen. Informat… [+607 chars]",,de,'Ausbau'
https://www.stern.de/politik/afd-beim-rtl--quadrell---die-energiemaerchenstunde-der-alice-weidel-35472894.html,https://www.stern.de/politik/afd-beim-rtl--quadrell---die-energiemaerchenstunde-der-alice-weidel-35472894.html,0,www.stern.de,TV-Quadrell: Wie Alice Weidel die Deutschen beim Thema Energiewende belügt,"Alice Weidel verbreitet im AfD-Wahlkampf hanebüchene Behauptungen zur nachhaltigen Stromversorgung – auch beim RTL-""Quadrell"" tat sie das. Höchste Zeit, dagegenzuhalten.",https://image.stern.de/35473634/t/g1/v2/w1440/r1.7778/-/alice-weidel-subvention-afd-kanzler-duell-energieversorgung-faktencheck-rtl.jpg,2025-02-17T14:04:00Z,,"Stern +stern+ zur BundestagswahlJetzt 8 statt 4 Wochen für nur 1  
Jetzt testen
Bereits registriert?Hier anmelden",,de,'Energiewende'
https://www.tagesschau.de/wirtschaft/konjunktur/bundesbank-trump-zoelle-100.html,https://www.tagesschau.de/wirtschaft/konjunktur/bundesbank-trump-zoelle-100.html,0,www.tagesschau.de,Bundesbank warnt vor Risiken durch Trumps Zollpolitik,Höhere Zölle der USA könnten Deutschland als Exportnation besonders hart treffen. Bundesbank-Präsident Nagel sieht auch ein mögliches Ansteigen der Inflation als Risiko.,https://images.tagesschau.de/image/8922dcf8-cb8b-4cdc-bad2-9fb5edec125d/AAABhnRxlmA/AAABkZLhkrw/16x9-1280/nagel-113.jpg,2025-02-17T15:57:17Z,,"Stand: 17.02.2025 16:57 Uhr
Höhere Zölle der USA könnten Deutschland als Exportnation besonders hart treffen. Bundesbank-Präsident Nagel sieht auch ein mögliches Ansteigen der Inflation als Risiko. … [+4081 chars]",,de,'Inflation'
https://www.zeit.de/video/2025-02/bundestagswahl-gelsenkirchen-spd-afd-wahlentscheidung,https://www.zeit.de/video/2025-02/bundestagswahl-gelsenkirchen-spd-afd-wahlentscheidung,0,www.zeit.de,Wahlentscheidung: Nicht mehr nur die SPD – Wie wählt Gelsenkirchen?,"Im Plan-D-Talkbus sprechen sechs Menschen im Ruhrgebiet über die Themen, die sie vor der Wahl bewegen: Migration, Inflation – und die hohe Zustimmung für die AfD.",https://img.zeit.de/gesellschaft/2025-02/plan-d-bustalk-gelsenkirchen/wide__1300x731,2025-02-17T18:59:57Z,http://archive.md/20250217192225/https://www.zeit.de/video/2025-02/bundestagswahl-gelsenkirchen-spd-afd-wahlentscheidung,"Dieser Beitrag beruht auf einer
Einsendung aus unserem Projekt Plan D. Hierfinden Sie das gesamte Verzeichnis
aller Lösungen und Probleme.
Die alte Arbeiter- und Bergbaustadt Gelsenkirchen hat sic… [+1664 chars]",,de,'Inflation'
https://www.nzz.ch/international/schluss-mit-der-ideologischen-energiewende-vier-vorschlaege-fuer-einen-klimapolitischen-neustart-ld.1870778,https://www.nzz.ch/international/schluss-mit-der-ideologischen-energiewende-vier-vorschlaege-fuer-einen-klimapolitischen-neustart-ld.1870778,0,www.nzz.ch,SERIE - Schluss mit der ideologischen Energiewende: vier Vorschläge für einen klimapolitischen Neustart,Deutschland hat sich mit seiner Energiepolitik verrannt. Es verzichtet als einziges mächtiges Industrieland auf die Atomkraft und will zugleich fünf Jahre vor der EU klimaneutral werden. Das muss scheitern.,"https://img.nzz.ch/2025/02/17/10813a10-704d-46a4-b84d-95c2cf9edfec.png?width=1200&height=674&fit=bounds&quality=75&auto=webp&crop=1801,1013,x0,y176&wmark=nzz",2025-02-18T04:30:00Z,http://archive.md/20250218062424/https://www.nzz.ch/international/schluss-mit-der-ideologischen-energiewende-vier-vorschlaege-fuer-einen-klimapolitischen-neustart-ld.1870778,"Früher wurde die Bundesrepublik bewundert. Heute ist das Land ein Sanierungsfall. Das kann sich ändern mit Reformen, die diesen Namen verdienen. Die NZZ macht Vorschläge in einer neuen Serie mit dem … [+10159 chars]",,de,'Energiekrise'
https://www.n-tv.de/wirtschaft/Russlands-Wirtschaftswunder-ist-am-Ende-article25569909.html,https://www.n-tv.de/wirtschaft/Russlands-Wirtschaftswunder-ist-am-Ende-article25569909.html,0,www.n-tv.de,"""Der Festtag geht zu Ende"": Russlands Wirtschaftswunder ist am Ende","Die russische Rüstungsindustrie boomt im Angriffskrieg gegen die Ukraine, das Bruttoinlandsprodukt wächst kräftig. Doch damit dürfte bald Schluss sein. Andere Branchen wie der Immobilien- oder Energiesektor schwächeln. Und die Inflation droht davonzugaloppier…",https://www.n-tv.de/img/incoming/crop25569923/005132943-cImg_16_9-w1200/501678857.jpg,2025-02-18T06:20:33Z,,"Seit drei Jahren führt Russland einen Angriffskrieg gegen die Ukraine. Der Westen hat versucht, mit Sanktionen gegen die russische Wirtschaft, Kremlchef Wladimir Putin dafür zu bestrafen. Lange Zeit … [+5821 chars]",,de,'Inflation'
https://www.zeit.de/wirtschaft/2025-02/armutsrisiko-gesunken-alleinerziehende-ostdeutschland-diw-studie,https://www.zeit.de/wirtschaft/2025-02/armutsrisiko-gesunken-alleinerziehende-ostdeutschland-diw-studie,0,www.zeit.de,"Armutsrisiko: Wohlstand für alle, tatsächlich","Trotz der hohen Inflation sind die Einkommen der Deutschen gestiegen. Das Armutsrisiko ist niedriger als vor zehn Jahren. Woran das liegt, zeigt eine Studie.",https://img.zeit.de/wirtschaft/2025-02/armutsrisiko-gesunken-alleinerziehende-ostdeutschland-diw-studie-2/wide__1300x731,2025-02-18T09:29:49Z,http://archive.md/20250218093431/https://www.zeit.de/wirtschaft/2025-02/armutsrisiko-gesunken-alleinerziehende-ostdeutschland-diw-studie,"Schließen
Artikelzusammenfassung
Eine Studie des DIW zeigt, dass das Armutsrisiko in Deutschland sinkt und der Niedriglohnsektor deutlich kleiner geworden ist. Trotz hoher Inflation stiegen die Bru… [+721 chars]",,de,'Inflation'
https://www.n-tv.de/politik/US-Energieminister-nennt-Klimaneutralitaet-finsteres-Ziel-article25570053.html,https://www.n-tv.de/politik/US-Energieminister-nennt-Klimaneutralitaet-finsteres-Ziel-article25570053.html,0,www.n-tv.de,"Ein Hoch auf Kohlenwasserstoffe?: US-Energieminister: Klimaneutralität ist ""finsteres Ziel""","Auch in der Klimaschutzpolitik setzt sich die Trump-Regierung klar von Europa ab. Zum Bemühen um weitgehende CO2-Reduzierungen sagt Energieminister Wright: ""Das ist keine Energiewende, sondern Wahnsinn.""",https://www.n-tv.de/img/incoming/crop25080336/9131321541-cImg_16_9-w1200/Die-weltweite-Olnachfrage-schwacht-sich-derzeit-ab.jpg,2025-02-18T10:09:02Z,https://web.archive.org/web/20250218104217/https://www.n-tv.de/politik/US-Energieminister-nennt-Klimaneutralitaet-finsteres-Ziel-article25570053.html,"Auch in der Klimaschutzpolitik setzt sich die Trump-Regierung klar von Europa ab. Zum Bemühen um weitgehende CO2-Reduzierungen sagt Energieminister Wright: ""Das ist keine Energiewende, sondern Wahnsi… [+1977 chars]",,de,'Energiewende'
