index,url,valid,domain,title,description,image,published,archive,content,quote,language,keyword
https://wien.orf.at/stories/3251211/,https://wien.orf.at/stories/3251211/,0,wien.orf.at,300 „intelligente“ Trafos in Wien installiert,"Ein wichtiger Baustein bei der Energiewende sind die Stromnetze. Sie müssen belastbarer werden, weil die erneuerbaren Energieträger, wie Wind und Sonne, Strom unstetiger erzeugen. Die Wiener Netze installieren deshalb aktuell „intelligente“ Trafostationen.",https://ibs.orf.at/wie?image=https%3A%2F%2Foekastatic.orf.at%2Fmims%2F2024%2F14%2F32%2Fcrops%2Fw%3D1200%2Ch%3D627%2Cq%3D75%2F2157645_master_816932_20240313_300_itra_c_manfred_tucherl_e5a4036.jpg%3Fs%3D6e5a9273c22fe1a550d01b5ec6b030cdc5794270,2024-04-01T03:00:00Z,,"Die Trafostationen sind fernsteuerbar. Damit haben sie im Notfall den Vorteil, dass Technikerinnen und Techniker nicht anrücken müssen, sondern den Schaden aus der Zentrale beheben können. Wenn es zu… [+906 chars]",,de,'Energiewende'
https://www.zeit.de/news/2024-04/01/wie-forscher-werkstoffe-fuer-die-energiewende-entwickeln,https://www.zeit.de/news/2024-04/01/wie-forscher-werkstoffe-fuer-die-energiewende-entwickeln,0,www.zeit.de,Lausitz: Wie Forscher Werkstoffe für die Energiewende entwickeln,Hier finden Sie Informationen zu dem Thema „Lausitz“. Lesen Sie jetzt „Wie Forscher Werkstoffe für die Energiewende entwickeln“.,https://img.zeit.de/news/2024-04/01/wie-forscher-werkstoffe-fuer-die-energiewende-entwickeln-image-group/wide__1300x731,2024-04-01T06:14:14Z,,"Damit die Energiewende gelingt, arbeiten Material- und Leichtbauforscher der Brandenburgischen-Technischen Universität Cottbus-Senftenberg (BTU) an gewichtsreduzierten Bauweisen der Zukunft. «Der Bed… [+4304 chars]",,de,'Energiewende'
https://www.faz.net/aktuell/wirtschaft/klima-nachhaltigkeit/vergleichsportal-heizsaison-fuer-kunden-viel-guenstiger-als-im-vorjahr-19623773.html,https://www.faz.net/aktuell/wirtschaft/klima-nachhaltigkeit/vergleichsportal-heizsaison-fuer-kunden-viel-guenstiger-als-im-vorjahr-19623773.html,0,www.faz.net,Heizsaison für Kunden viel günstiger als im Vorjahr,"Wer in diesen Tagen auf die jüngste Heizkostenabrechnung wartet, kann aufatmen: So teuer wie in der Wintersaison 2022/23 dürfte es nicht werden. Im Zehnjahresvergleich sieht das anders aus.",https://media0.faz.net/ppmedia/aktuell/wirtschaft/426386539/1.9192670/facebook_teaser/wer-in-diesen-tagen-auf-die.jpg,2024-04-01T08:54:01Z,,Die Heizkostenabrechnung für den vergangenen Winter fällt dank milder Temperaturen und gefallener Energiekosten für Kunden deutlich geringer als für die Heizsaison des Vorjahres. Zu diesem Ergebnis k… [+2432 chars],,de,'Winter'
https://www.telepolis.de/features/Ist-China-auch-beim-Unterhalt-der-Eisenbahn-Infrastruktur-weiter-als-Deutschland-9670283.html,https://www.telepolis.de/features/Ist-China-auch-beim-Unterhalt-der-Eisenbahn-Infrastruktur-weiter-als-Deutschland-9670283.html,0,www.telepolis.de,Ist China auch beim Unterhalt der Eisenbahn-Infrastruktur weiter als Deutschland?,"China überholt, deutsche Züge warten noch. Das liegt auch an Infrastruktur, bei deren Ausbau Deutschland nicht vorankommt. Wie China solche Probleme vermeidet.",https://heise.cloudimg.io/bound/1200x1200/q85.png-lossy-85.webp-lossy-85.foil1/_www-heise-de_/imgs/18/4/5/6/4/7/8/9/5bdf968633f7ee71.png,2024-04-01T10:00:00Z,,"China überholt, deutsche Züge warten noch. Das liegt auch an Infrastruktur, bei deren Ausbau Deutschland nicht vorankommt. Wie China solche Probleme vermeidet. 
Die deutsche Bahninfrastruktur wurde … [+3812 chars]",,de,'Ausbau'
https://www.zeit.de/politik/ausland/2024-04/recep-tayyip-erdogan-tuerkei-kommunalwahlen-opposition-akp,https://www.zeit.de/politik/ausland/2024-04/recep-tayyip-erdogan-tuerkei-kommunalwahlen-opposition-akp,0,www.zeit.de,Recep Tayyip Erdoğan: Der starke Mann sieht plötzlich so schwach aus,"Inflation und Überdruss: Die krachende Niederlage der AKP bei den türkischen Kommunalwahlen zeigt, dass dem Machtsystem von Präsident Erdoğan langsam die Kraft ausgeht.",https://img.zeit.de/politik/ausland/2024-04/recep-tayyip-erdogan-tuerkei-kommunalwahlen/wide__1300x731,2024-04-01T10:31:39Z,,"Als die Zahlen sich verfestigten und die Niederlage unübersehbar wurde, schalteten sie an der Istanbuler AKP-Zentrale kurzerhand die Übertragung der Wahlsendung ab. Die riesigen Leinwände, die vor de… [+370 chars]",,de,'Inflation'
https://www.tagesschau.de/wissen/klima/skifahren-deutschland-zukunft-100.html,https://www.tagesschau.de/wissen/klima/skifahren-deutschland-zukunft-100.html,0,www.tagesschau.de,War's das mit Skifahren in Deutschland?,"Der Winter war sehr warm, viele Skigebiete mussten den Betrieb früher als geplant einstellen. Hat Wintersport in Deutschland überhaupt noch eine Zukunft? Es kommt drauf an. Von Holger Schwesinger.",https://images.tagesschau.de/image/b413be8d-48b7-486c-92eb-f45316c7cdc8/AAABjpnArmg/AAABjcWen7M/16x9-1280/skifahren-114.jpg,2024-04-01T13:02:08Z,,"Stand: 01.04.2024 15:02 Uhr
Der Winter war sehr warm, viele Skigebiete mussten den Betrieb früher als geplant einstellen. Hat Wintersport in Deutschland überhaupt noch eine Zukunft? Es kommt drauf a… [+12618 chars]",,de,'Winter'
https://www.zeit.de/news/2024-04/01/habeck-mehrere-kohlekraftwerke-koennen-vom-netz,https://www.zeit.de/news/2024-04/01/habeck-mehrere-kohlekraftwerke-koennen-vom-netz,0,www.zeit.de,Energiewende: Habeck: Mehrere Kohlekraftwerke können vom Netz,Hier finden Sie Informationen zu dem Thema „Energiewende“. Lesen Sie jetzt „Habeck: Mehrere Kohlekraftwerke können vom Netz“.,https://img.zeit.de/news/2024-04/01/habeck-mehrere-kohlekraftwerke-koennen-vom-netz-image-group/wide__1300x731,2024-04-01T13:23:04Z,,Bundeswirtschaftsminister Robert Habeck hält die Energieversorgung in Deutschland für unabhängiger als vor der Krise und auch nach der Abschaltung mehrerer Kohlekraftwerke für gesichert. «Mehrere Koh… [+1917 chars],,de,'Energiewende'
https://noe.orf.at/stories/3250937/,https://noe.orf.at/stories/3250937/,0,noe.orf.at,Die letzte natürliche Huchenpopulation,"In der Pielach lebt der letzte sich selbst erhaltende Huchenbestand Niederösterreichs – noch. Denn mehrere Faktoren setzen dem großen Lachsfisch zu: Querbauten der Wasserkraft, regulierte Flüsse und der Klimawandel. Gezielten Maßnahmen könnten den Huchen rett…",https://ibs.orf.at/noe?image=https%3A%2F%2Foekastatic.orf.at%2Fmims%2F2024%2F14%2F37%2Fcrops%2Fw%3D1200%2Ch%3D627%2Cq%3D75%2F2157916_master_817037_whatsapp_image_2024-03-31_at_6.39.01_pm.jpeg%3Fs%3D2081fef2eccebd7640a995f7da370bcee3731d1f,2024-04-01T15:33:59Z,https://web.archive.org/web/20240402020017/https://noe.orf.at/stories/3250937/,Unterhalb der Spielberger Wehranlage in der Pielach bei Melk liegt einer der Lieblingsplätze der Huchen. Hier treffen sich die Fische zum Ablaichen in diesem Jahr zwei Wochen früher als üblich. Durch… [+4044 chars],,de,'Wasserkraft'
https://www.jungewelt.de/artikel/472435.energiepolitik-ökodesaster-offshoreparks.html,https://www.jungewelt.de/artikel/472435.energiepolitik-ökodesaster-offshoreparks.html,0,www.jungewelt.de,Energiepolitik: Ökodesaster Offshoreparks,Die Ampel beschließt eine Novelle des »Windenergie-auf-See-Gesetzes«. Damit soll der Ausbau von Offshoreanlagen vor der Nordseeküste forciert werden. Ökoverbände beklagen Verzicht auf Umweltstandards und Meeresschutz.,https://www.jungewelt.de/img/1100/193137.jpg,2024-04-01T17:40:54Z,,"Das Bundeskabinett hatte es eilig. Jedenfalls in seiner 95. Sitzung der Legislaturperiode am 27. März kurz vor Ostern und beschloss im Schnelldurchgang zahlreiche Vorhaben. Ohne Aussprache, wohlgemer… [+3771 chars]",,de,'Windenergie'
https://www.nzz.ch/wirtschaft/meyer-burger-kunden-wollen-chinas-solarmodule-sagt-grosser-schweizer-monteur-ld.1824147,https://www.nzz.ch/wirtschaft/meyer-burger-kunden-wollen-chinas-solarmodule-sagt-grosser-schweizer-monteur-ld.1824147,0,www.nzz.ch,"«Meyer Burger hat nichts falsch gemacht», sagt ein Solar-Monteur. Doch die Kunden wollen chinesische Panels – denn Preis und Leistung müssen passen","Es gibt nur eine Chance für das Überleben einer europäischen Solarmodul-Produktion, prophezeit Marc Preusche, der Chef einer der grössten Installationsfirmen der Schweiz.","https://img.nzz.ch/2023/04/05/7c389950-6862-46b8-ad60-7d9674714dda.jpeg?width=1200&height=674&fit=bound&quality=75&auto=webp&crop=7000,3932,x0,y366&wmark=nzz",2024-04-02T03:30:00Z,,"Die Qualitätsvorteile sind nicht gross genug, damit sich Schweizer Hausbesitzer europäische Solarzellen auf das Dach legen.
Der Rausch ist vorbei. 2022 und 2023 explodierte in der Schweiz die Nachfr… [+6533 chars]",,de,'Solar'
https://www.zeit.de/news/2024-04/02/weniger-unternehmen-wollen-preise-erhoehen,https://www.zeit.de/news/2024-04/02/weniger-unternehmen-wollen-preise-erhoehen,0,www.zeit.de,Inflation: Weniger Unternehmen wollen Preise erhöhen,Hier finden Sie Informationen zu dem Thema „Inflation“. Lesen Sie jetzt „Weniger Unternehmen wollen Preise erhöhen“.,https://img.zeit.de/news/2024-04/02/weniger-unternehmen-wollen-preise-erhoehen-image-group/wide__1300x731,2024-04-02T06:58:39Z,,"Das Ifo-Institut erwartet ein weiteres Sinken der Inflation. Sie sei «weiter auf dem Rückzug und dürfte im Sommer unter die Zwei-Prozent-Marke sinken», sagte der Konjunkturchef des Münchner Instituts… [+2321 chars]",,de,'Inflation'
https://www.zeit.de/news/2024-04/02/saar-inflationsrate-im-maerz-bei-2-7-prozent,https://www.zeit.de/news/2024-04/02/saar-inflationsrate-im-maerz-bei-2-7-prozent,0,www.zeit.de,"Preise: Saar-Inflationsrate im März bei 2,7 Prozent","Hier finden Sie Informationen zu dem Thema „Preise“. Lesen Sie jetzt „Saar-Inflationsrate im März bei 2,7 Prozent“.",https://img.zeit.de/news/2024-04/02/saar-inflationsrate-im-maerz-bei-2-7-prozent-image-group/wide__1300x731,2024-04-02T09:17:04Z,,"Angesichts sinkender Energiepreise hat sich die Inflationsrate im Saarland im März weiter abgeschwächt. Die Teuerungsrate lag gegenüber dem Vorjahresmonat bei 2,7 Prozent, teilte das Statistische Lan… [+1620 chars]",,de,'Inflation'
https://www.faz.net/aktuell/wirtschaft/auto-verkehr/reifenwechsel-auf-sommerreifen-was-autofahrer-nun-beachten-muessen-17953343.html,https://www.faz.net/aktuell/wirtschaft/auto-verkehr/reifenwechsel-auf-sommerreifen-was-autofahrer-nun-beachten-muessen-17953343.html,0,www.faz.net,Reifenwechsel: Sommerreifen erst bei Temperaturen ab sieben Grad aufziehen,"An Ostern ist es für die meisten Autofahrer wieder Zeit, von Winter- auf Sommerreifen zu wechseln – doch die Faustregel „von Oktober bis Ostern“ ist mit Vorsicht zu genießen. Das muss man beachten.",https://media1.faz.net/ppmedia/aktuell/wirtschaft/3389478309/1.9618191/facebook_teaser/die-faustregel-besagt-dass.jpg,2024-04-02T09:20:26Z,,"Wann genau sollten Sommerreifen aufgezogen werden?
Einen allgemein vorgeschriebenen Zeitpunkt für den Reifenwechsel gibt es in Deutschland nicht. Der Gesetzgeber schreibt lediglich vor, dass die Aus… [+2920 chars]",,de,'Winter'
https://www.zeit.de/news/2024-04/02/inflation-im-suedwesten-schwaecht-sich-weiter-ab,https://www.zeit.de/news/2024-04/02/inflation-im-suedwesten-schwaecht-sich-weiter-ab,0,www.zeit.de,Preise: Inflation im Südwesten schwächt sich weiter ab,Hier finden Sie Informationen zu dem Thema „Preise“. Lesen Sie jetzt „Inflation im Südwesten schwächt sich weiter ab“.,https://img.zeit.de/news/2024-04/02/inflation-im-suedwesten-schwaecht-sich-weiter-ab-image-group/wide__1300x731,2024-04-02T10:45:09Z,,"Die Inflation in Baden-Württemberg ist erneut zurückgegangen. Die Verbraucherpreise lagen im März um 2,3 Prozent über dem Niveau des Vorjahresmonats, wie das Statistische Landesamt am Dienstag anhand… [+1195 chars]",,de,'Inflation'
https://www.faz.net/aktuell/wirtschaft/mehr-wirtschaft/inflation-rate-in-deutschland-naehert-sich-der-ezb-zielmarke-19625822.html,https://www.faz.net/aktuell/wirtschaft/mehr-wirtschaft/inflation-rate-in-deutschland-naehert-sich-der-ezb-zielmarke-19625822.html,0,www.faz.net,"Laut statistischem Bundesamt: Inflation in Deutschland sinkt im März auf 2,2 Prozent","Die EZB strebt eine Rückkehr zu einer Inflationsrate von 2,0 Prozent an. In Deutschland bewegt sich die Teuerungsrate weiter in diese Richtung. Laut dem Münchner Ifo-Institut könnte sie im Sommer unter diese Marke sinken.",https://media1.faz.net/ppmedia/aktuell/wirtschaft/2216937367/1.9625843/facebook_teaser/lebensmittelpreise-steigen-nur.jpg,2024-04-02T12:02:23Z,,"Billigere Energie und Nahrungsmittel haben die Inflation in Deutschland im März auf den tiefsten Stand seit fast drei Jahren gedrückt. Die Verbraucherpreise stiegen nur noch um 2,2 Prozent zum Vorjah… [+1655 chars]",,de,'Inflation'
https://www.zeit.de/news/2024-04/02/inflation-verliert-weiter-an-tempo,https://www.zeit.de/news/2024-04/02/inflation-verliert-weiter-an-tempo,0,www.zeit.de,Preise: Inflation verliert weiter an Tempo,Hier finden Sie Informationen zu dem Thema „Preise“. Lesen Sie jetzt „Inflation verliert weiter an Tempo“.,https://img.zeit.de/administratives/sharing/fallback-image/wide__1300x731,2024-04-02T12:02:49Z,,"Die Inflation in Deutschland hat sich im März weiter abgeschwächt. Die Verbraucherpreise lagen um 2,2 Prozent über dem Niveau des Vorjahresmonats - nach 2,5 Prozent im Februar, wie das Statistische B… [+108 chars]",,de,'Inflation'
https://www.welt.de/wirtschaft/article250838204/Statistisches-Bundesamt-Inflation-in-Deutschland-sinkt-im-Maerz-auf-2-2-Prozent.html,https://www.welt.de/wirtschaft/article250838204/Statistisches-Bundesamt-Inflation-in-Deutschland-sinkt-im-Maerz-auf-2-2-Prozent.html,0,www.welt.de,"Inflation in Deutschland sinkt im März auf 2,2 Prozent","Im Vergleich zum Vorjahresmonat sind die Verbraucherpreise nur noch um 2,2 Prozent gestiegen. Vor allem günstigere Energie und geringere Preise für Lebensmittel sorgten für den „niedrigsten Wert seit April 2021“, wie aus vorläufigen Daten des Statistischen Bu…",https://img.welt.de/img/wirtschaft/mobile250838342/7351355307-ci16x9-w1200/Einkauf-im-Supermarkt.jpg,2024-04-02T12:04:02Z,,"Billigere Energie und Nahrungsmittel haben die Inflation in Deutschland im März auf den tiefsten Stand seit fast drei Jahren gedrückt. Die Verbraucherpreise stiegen nur noch um 2,2 Prozent zum Vorjah… [+1648 chars]",,de,'Inflation'
https://www.tagesschau.de/wirtschaft/konjunktur/inflation-maerz-100.html,https://www.tagesschau.de/wirtschaft/konjunktur/inflation-maerz-100.html,0,www.tagesschau.de,Inflation verliert weiter an Tempo,"Die Inflation in Deutschland ist auf den niedrigsten Stand seit fast drei Jahren gefallen. Vor allem dank sinkender Energiepreise lag die Teuerungsrate im März bei 2,2 Prozent.",https://images.tagesschau.de/image/f01eda95-3b63-4b03-a3e2-10b1dde19685/AAABjp58AHE/AAABjcWen7M/16x9-1280/konsum-166.jpg,2024-04-02T12:24:56Z,,"Stand: 02.04.2024 14:24 Uhr
Die Inflation in Deutschland ist auf den niedrigsten Stand seit fast drei Jahren gefallen. Vor allem dank sinkender Energiepreise lag die Teuerungsrate im März bei 2,2 Pr… [+2481 chars]",,de,'Inflation'
https://www.welt.de/wirtschaft/video250839612/Verbraucherpreise-Inflation-schwaecht-sich-ab-Der-niedrigste-Wert-seit-drei-Jahren.html,https://www.welt.de/wirtschaft/video250839612/Verbraucherpreise-Inflation-schwaecht-sich-ab-Der-niedrigste-Wert-seit-drei-Jahren.html,0,www.welt.de,Inflation schwächt sich ab – Der niedrigste Wert seit drei Jahren,"Die Inflation hat sich weiter abgeschwächt. Die Verbraucherpreise stiegen im vergangenen Monat um 2,2 Prozent im Vorjahresvergleich, wie das Statistische Bundesamt am Dienstag mitteilte. Das ist demnach der niedrigste Wert seit drei Jahren.",https://img.welt.de/img/incoming/mobile250839648/7271356557-ci16x9-w1200/Inflation.jpg,2024-04-02T13:25:18Z,,"Die WELT als ePaper: Die vollständige Ausgabe steht Ihnen bereits am Vorabend zur Verfügung so sind Sie immer hochaktuell informiert. Weitere Informationen: http://epaper.welt.de 
 Der Kurz-Link die… [+49 chars]",,de,'Inflation'
https://www.faz.net/aktuell/wirtschaft/elektroautos-weniger-beliebt-der-preisabsturz-des-batterierohstoffs-lithium-19618230.html,https://www.faz.net/aktuell/wirtschaft/elektroautos-weniger-beliebt-der-preisabsturz-des-batterierohstoffs-lithium-19618230.html,0,www.faz.net,Elektroautos weniger beliebt: Der Lithium-Crash,Das Batteriemetall galt als das weiße Gold der Elektromobilität. Jetzt sind E-Autos nicht so beliebt wie gedacht und der Lithiumpreis ist abgestürzt. Das bringt die ganze Energiewende durcheinander.,https://media0.faz.net/ppmedia/aktuell/feuilleton/67520413/1.9618228/facebook_teaser/lithium-gewinnung-in-der.jpg,2024-04-02T13:45:07Z,,"Es war im Juli 2022, und Elon Musk hatte für sein Publikum einen Ratschlag, wie man reich wird. Er könne nur dringend dazu raten, in die Verarbeitung von Lithium zu investieren, sagte der Tesla-Chef … [+2872 chars]",,de,'Energiewende'
https://www.faz.net/podcasts/f-a-z-podcast-fruehdenker/wahldesaster-fuer-erdogan-folgt-der-naechste-inflationsschock-faz-fruehdenker-19627176.html,https://www.faz.net/podcasts/f-a-z-podcast-fruehdenker/wahldesaster-fuer-erdogan-folgt-der-naechste-inflationsschock-faz-fruehdenker-19627176.html,0,www.faz.net,F.A.Z. Frühdenker: Folgt nach Erdoğans Wahldesaster der nächste Inflationsschock?,"Die NATO-Außenminister treffen sich in Brüssel, die Ampel ringt wieder um die Kindergrundsicherung und Bayer Leverkusen hat das Finale im DFB-Pokal vor Augen. Der F.A.Z.-Newsletter.",https://media0.faz.net/ppmedia/aktuell/politik/3087327267/1.9627250/facebook_teaser_fplus/anhaenger-der-republikanischen.jpg,2024-04-03T04:06:52Z,,"Das Wichtigste am Mittwoch: 
1. NATO-Außenminister beraten in Brüssel2. Netanjahu spricht von tragischem Zwischenfall3. Ampel ringt wieder um Kindergrundsicherung4. Bekommt die Türkei die Inflation … [+608 chars]",,de,'Inflation'
https://www.welt.de/wirtschaft/plus250832920/Schwimmende-Plattformen-Diese-Windrad-Idee-soll-Europas-Energiewende-ermoeglichen.html,https://www.welt.de/wirtschaft/plus250832920/Schwimmende-Plattformen-Diese-Windrad-Idee-soll-Europas-Energiewende-ermoeglichen.html,0,www.welt.de,Diese Windrad-Idee soll Europas Energiewende ermöglichen,"Klassische Offshore-Windräder sind im Meeresgrund verankert. Sie liefern bereits bis zu 20 Prozent des europäischen Strombedarfs. Allerdings stößt der Ausbau an Grenzen. Nun planen viele Staaten schwimmende Windparks, die schnell völlig neue Möglichkeiten erö…",https://img.welt.de/img/wirtschaft/mobile250834608/8031352717-ci16x9-w1200-fnov-fpotl-fpi157750653/Provence-Grand-Large-Pilot-Project-Port-de-Bouc.jpg,2024-04-03T07:06:59Z,,"Die WELT als ePaper: Die vollständige Ausgabe steht Ihnen bereits am Vorabend zur Verfügung so sind Sie immer hochaktuell informiert. Weitere Informationen: http://epaper.welt.de 
 Der Kurz-Link die… [+49 chars]",,de,'Ausbau'
https://www.diepresse.com/18330861/ebrd-chefoekonomin-erneuerbare-werden-gebraucht-um-in-der-industrieproduktion-wettbewerbsfaehig-zu-bleiben,https://www.diepresse.com/18330861/ebrd-chefoekonomin-erneuerbare-werden-gebraucht-um-in-der-industrieproduktion-wettbewerbsfaehig-zu-bleiben,0,www.diepresse.com,"EBRD-Chefökonomin: „Erneuerbare werden gebraucht, um in der Industrieproduktion wettbewerbsfähig zu bleiben“ [premium]","Die Abkehr westlicher Firmen von China sei eine große Chance für Länder in Osteuropa, sagt Beata Javorcik, Chefökonomin der Europäischen Bank für Wiederaufbau und Entwicklung (EBRD). Die Verfügbarkeit von erneuerbaren Energieträgern werde dabei eine große Rol…",https://img.diepresse.com/public/incoming/go908e-Beata-K.-Smarzynska-Javorcik-Grand-Ferdinand-Akos-Burg-Februar-2024/alternates/DPR_SOCIAL_MAGAZIN_PAID/Beata%20K.%20Smarzynska%20Javorcik%20Grand%20Ferdinand%20Akos%20Burg%20Februar%202024,2024-04-03T09:21:00Z,,"Die Abkehr westlicher Firmen von China sei eine große Chance für Länder in Osteuropa, sagt Beata Javorcik, Chefökonomin der Europäischen Bank für Wiederaufbau und Entwicklung (EBRD). Die Verfügbarkei… [+1018 chars]",,de,'Erneuerbare'
https://www.tagesschau.de/wirtschaft/verbraucher/inflation-eurozone-teuerung-100.html,https://www.tagesschau.de/wirtschaft/verbraucher/inflation-eurozone-teuerung-100.html,0,www.tagesschau.de,Die Teuerung in der Eurozone ist rückläufig,In Europa ist die Inflation auf dem Rückzug. Der März-Wert lag unter den Erwartungen der Experten. Vor allem bei Lebensmitteln hat sich der Preisansteig verlangsamt. Auch in Deutschland ist die Inflation gesunken.,https://images.tagesschau.de/image/d741ba12-6ae4-451d-aafc-70e71a0c645e/AAABjY56bl0/AAABjcWen7M/16x9-1280/kunden-supermarkt-100.jpg,2024-04-03T10:14:28Z,,"Stand: 03.04.2024 12:14 Uhr
In Europa ist die Inflation auf dem Rückzug. Der März-Wert lag unter den Erwartungen der Experten. Vor allem bei Lebensmitteln hat sich der Preisansteig verlangsamt. Auch… [+2680 chars]",,de,'Preisanstieg'
https://www.welt.de/wirtschaft/video250852840/Teuerung-Inflation-in-der-Euro-Zone-faellt-auf-2-4-Prozent.html,https://www.welt.de/wirtschaft/video250852840/Teuerung-Inflation-in-der-Euro-Zone-faellt-auf-2-4-Prozent.html,0,www.welt.de,"Inflation in der Euro-Zone fällt auf 2,4 Prozent","Die Inflation in der Eurozone hat sich im März stärker als erwartet auf 2,4 Prozent abgeschwächt. Der Preisanstieg im Jahresvergleich fiel 0,2 Prozentpunkte weniger stark aus als im Februar, wie das EU-Statistikamt Eurostat mitteilte. Für Deutschland gab Euro…",https://img.welt.de/img/bildergalerien/mobile250852722/3501356507-ci16x9-w1200/Einkauf-im-Supermarkt.jpg,2024-04-03T10:24:47Z,,"Die WELT als ePaper: Die vollständige Ausgabe steht Ihnen bereits am Vorabend zur Verfügung so sind Sie immer hochaktuell informiert. Weitere Informationen: http://epaper.welt.de 
 Der Kurz-Link die… [+49 chars]",,de,'Preisanstieg'
https://www.focus.de/finanzen/news/maerz-daten-inflation-in-der-eurozone-faellt-auf-2-4-prozent_id_259819541.html,https://www.focus.de/finanzen/news/maerz-daten-inflation-in-der-eurozone-faellt-auf-2-4-prozent_id_259819541.html,0,www.focus.de,"März-Daten - Inflation in der Eurozone fällt auf 2,4 Prozent","Die Inflation in der Eurozone hat sich im März stärker als erwartet abgeschwächt. Sie erreicht 2,4 Prozent.",https://p6.focus.de/img/fotos/id_259819514/supermarktkasse.jpg?im=Crop%3D%280%2C112%2C2048%2C1024%29%3BResize%3D%281200%2C627%29&impolicy=perceptual&quality=mediumHigh&hash=aea744d607f15a67764cf495d573d1f4caa734ae84cda6be102b002ef78e4ea1,2024-04-03T10:30:16Z,,"Die Inflation in der Eurozone hat sich im März stärker als erwartet abgeschwächt. Sie erreicht 2,4 Prozent.Die Inflation in der Eurozone sank im März auf überraschend niedrige 2,4 Prozent. Der Preisa… [+1302 chars]",,de,'Inflation'
https://www.zeit.de/news/2024-04/03/inflation-in-der-eurozone-schwaecht-sich-deutlich-ab,https://www.zeit.de/news/2024-04/03/inflation-in-der-eurozone-schwaecht-sich-deutlich-ab,0,www.zeit.de,Teuerung: Inflation in der Eurozone schwächt sich deutlich ab,Hier finden Sie Informationen zu dem Thema „Teuerung“. Lesen Sie jetzt „Inflation in der Eurozone schwächt sich deutlich ab“.,https://img.zeit.de/news/2024-04/03/inflation-in-der-eurozone-schwaecht-sich-deutlich-ab-image-group/wide__1300x731,2024-04-03T11:07:11Z,,"Die Inflation in der Eurozone hat sich im März stärker als erwartet abgeschwächt. Die Verbraucherpreise stiegen um 2,4 Prozent im Vergleich zum entsprechenden Vorjahresmonat, wie das Statistikamt Eur… [+2658 chars]",,de,'Inflation'
https://www.zeit.de/wirtschaft/2024-04/eurostat-inflation-eurozone-preisentwicklung-ezb,https://www.zeit.de/wirtschaft/2024-04/eurostat-inflation-eurozone-preisentwicklung-ezb,0,www.zeit.de,Eurostat: Inflation in der Eurozone schwächt sich weiter ab,"In der Eurozone sinkt die Inflation auf 2,4 Prozent. Damit nähert sich die Preisentwicklung weiter dem Zwei-Prozent-Ziel der EZB an.",https://img.zeit.de/wirtschaft/2024-04/inflation-eurozone/wide__1300x731,2024-04-03T11:35:28Z,,"Die Inflation in der Eurozone hat sich im März stärker als erwartet abgeschwächt. Die Verbraucherpreise stiegen um 2,4 Prozent im Vergleich zum Vorjahresmonat, wie das Statistikamt Eurostat nach eine… [+3406 chars]",,de,'Inflation'
https://www.bild.de/bild-plus/geld/wirtschaft/wirtschaft/angestellte-rentner-pensionaere-wen-die-inflation-am-staerksten-trifft-87739852.bild.html,https://www.bild.de/bild-plus/geld/wirtschaft/wirtschaft/angestellte-rentner-pensionaere-wen-die-inflation-am-staerksten-trifft-87739852.bild.html,0,www.bild.de,Haushalte im Vergleich - Wen die Inflation am stärksten trifft,"Teuer-Schock bei Heizen, Lebensmitteln, Benzin! Das Institut der deutschen Wirtschaft hat ermittelt, wen es wie stark erwischt hat.","https://images.bild.de/660d1589d3df1c408f7f44bb/27e626ce843a30e2e2d7c690cef90669,af26207a?w=1280",2024-04-03T19:14:06Z,,"In den vergangen beiden Jahren kannten die Preise nur eine Richtung: nach oben. Teuer-Schock! Die allgemeine Inflation kletterte 2022 auf 6,9 Prozent. Rekord seit Wiedervereinigung! 2023 waren es 5,9… [+170 chars]",,de,'Inflation'
https://taz.de/Energiewende-bedroht-Schimpansen/!6002430/,https://taz.de/Energiewende-bedroht-Schimpansen/!6002430/,0,taz.de,Energiewende bedroht Schimpansen: Gefahr durch Bergbau,"Kupfer, Lithium, Kobalt und Seltene Erden: Der Bergbau in Afrika boomt – und gefährdet mehr als ein Drittel der Menschenaffen auf dem Kontinent.",https://taz.de/picture/6923509/948/19391907-1.jpeg,2024-04-04T07:02:00Z,,"Kupfer, Lithium, Kobalt und Seltene Erden: Der Bergbau in Afrika boomt und gefährdet mehr als ein Drittel der Menschenaffen auf dem Kontinent.
Die Bedrohung dieser 180.000 Schimpansen, Bonobos und G… [+2231 chars]",,de,'Energiewende'
